243sentences.213,backward,center pyramid's the at chamber the into led this,1.328380735534144
243sentences.214,backward,passage narrow dark steep the down him followed i,2.216623372623105
243sentences.215,backward,thick was air the and chalky was pyramid the inside smell the,1.4158656766557003
243sentences.216,backward,nation the of pride the represented pyramids king the of tomb the just than more,1.5217011119180226
243sentences.217,backward,evident is craft their in took builders pyramid the that care the,1.415326876599452
243sentences.218,backward,gleamed structure the until polished and together fitted precisely were pyramid the covering stones the,1.4836165583436463
243sentences.219,backward,constructed were pyramids how of mysteries the solve to working still are architects,1.862268323674622
243sentences.220,backward,blocks stone raise to walls pyramid's the inside built were ramps think some,1.6778371155812875
243sentences.221,backward,pyramid the of walls exterior the up zigzagged ramps that speculate others,2.0818107495588176
243sentences.222,backward,strength and courage takes climbing rock beginner even,1.5296846915400648
243sentences.223,backward,boulders large on scrambling try can sport the learning are who climbers,1.1092161080181755
243sentences.224,backward,faces rock vertical climb safely to ropes using begin can they that with comfortable they're once,1.8191541197487067
243sentences.225,backward,climbing rock to new were trip the on boys the of all,1.3453041807554522
243sentences.226,backward,heights of afraid were many,1.967726196689493
243sentences.227,backward,down calm them helped harnesses and knots their check else someone having,1.730039468422561
243sentences.228,backward,beginners for appropriate routes climbing up set adults the,1.796778197327668
243sentences.229,backward,climbing rock of style particular one is free-climbing,1.9150555433236898
243sentences.230,backward,face rock a ascend to strength physical and skill her on solely relies climber the,1.737793854721504
243sentences.231,backward,used equipment only the are bolts and rope,1.3105176987530605
243sentences.232,backward,falls she if climber the stop to only meant are they,1.7912330974172876
243sentences.233,backward,try to me convinced buddies my that trail steep the down skied hesitantly i,2.081299891447854
243sentences.234,backward,down tumbling myself found i and turn bad a made i,1.2654292325039325
243sentences.235,backward,slope the of part flat a at stop a to came finally i,1.5339455911026847
243sentences.236,backward,hill the up drift snow a in lodged were poles my and found be to nowhere were skis my,1.591850281895817
243sentences.237,backward,poles ski use they how is skiers professional of strength major a,1.2328425951330653
243sentences.238,backward,skiing their to flair adds and balance their improves poles ski of use proper,1.545884855767327
243sentences.239,backward,skiing while balance lost regain to movements body upper for need the minimizes it,1.609613758648454
243sentences.240,backward,quickly more turn skiers let boots stiffer and designs ski new,1.3923418696525944
243sentences.241,backward,legs the on force twisting the increase turns tighter and faster but,1.53942562199303
243sentences.242,backward,knee skier's the in ligaments to particularly injuries more to led has this,1.2443974458728158
384sentences.0,backward,keyboards two with instrument musical portable a is accordion an,2.1114276550653317
384sentences.1,backward,chords for other the notes individual for used is keyboard one,1.509915347391536
384sentences.2,backward,reeds through air blow that bellows with sound produce accordions,1.800158251429192
384sentences.3,backward,bellows the closing and opening while keyboards both plays accordionist an,2.070505955181767
384sentences.4,backward,building a of part is that home self-contained a is apartment an,1.1560547722009495
384sentences.5,backward,bathroom a and kitchen a as well as rooms more or one have may apartment an,1.47148792811681
384sentences.6,backward,families for others people single for are apartments some,1.3092265585131573
384sentences.7,backward,space storage extra or facility laundry a garage a have can building the,2.2978887891097823
384sentences.8,backward,yellow or red green be can that fruit a is apple an,1.6395276518044601
384sentences.9,backward,inside seeds and pulp sweet crisp a skin thin have apples,2.2924126542120167
384sentences.10,backward,cider make to used are apples tart very some,2.1637449536859483
384sentences.11,backward,pies in baked or roasted raw eaten be can apples,3.002162837987724
384sentences.12,backward,wildland or building a burning of act criminal the is arson,1.785681205265394
384sentences.13,backward,arson or accident by caused was fire a if determines investigation fire a,1.6776665389443826
384sentences.14,backward,insurance collect or others to damage cause to done be can arson,2.07222466275927
384sentences.15,backward,harmed were people whether on depends crime the of severity the,1.8213404333222518
384sentences.16,backward,passengers transporting for vehicle wheeled a is car or automobile an,2.78793236277995
384sentences.17,backward,engine electric or gasoline a by powered be can car a,2.3919174018483735
384sentences.18,backward,sit just passengers other roads on car the steers driver the,2.1030146424062055
384sentences.19,backward,trunk of type the and doors of number size in vary automobiles,1.5077326809940845
384sentences.20,backward,wood cut and split to used tool a is axe the,1.7269192236893443
384sentences.21,backward,handle a to attached head a of consists usually axe the,1.4406140593502326
384sentences.22,backward,metal then and stone of made were heads axe historically,1.1989304855369387
384sentences.23,backward,buildings entering firemen and woodcutters by used are axes,1.7668197554276521
384sentences.24,backward,inside edible soft a with bunchs in grows that fruit long a is banana a,1.4030876375697021
384sentences.25,backward,spots brown small have and red or purple yellow be can ripe when banana a,2.1151051402069263
384sentences.26,backward,ecuador or india as such countries tropical are producers greatest the,1.665794361424835
384sentences.27,backward,potatoes like cooked often and foods staple are plantains and bananas unripe,2.861887898079723
384sentences.28,backward,in sex have or sleep to place a as used furniture of piece a is bed a,1.2814100069358645
384sentences.29,backward,covers and pillows sheets plus spring box a and mattress a of made is bed a,1.3235881433855974
384sentences.30,backward,air with filled is it airbeds in and water with filled is mattress the waterbeds in,1.561913922065587
384sentences.31,backward,ground the above suspended sling fabric a hammock the is bed of type another,2.1935587436701303
384sentences.32,backward,legs six and body yellow and black a with insect flying a is bee a,1.887917422161046
384sentences.33,backward,honey make to nectar collect they as flowers between pollen spread bees,1.8415416299254916
384sentences.34,backward,hive a in located colony a in together live and insects social are bees,2.007487380723955
384sentences.35,backward,threatened feel they if attack can and stingers have bees many,1.8092449308166907
384sentences.36,backward,frame a on pedals and wheels two with vehicle a is bicycle a,1.6722139541480356
384sentences.37,backward,saddle the on cyclist a of pedalling the by propelled is bicycle a,1.7507273409459294
384sentences.38,backward,air of full tube inner an with tires rubber have wheels the,1.8290941003676422
384sentences.39,backward,racing and recreation transportation for bicycles use people,1.4299341206966554
384sentences.40,backward,steel or iron forging by objects creates blacksmith a,2.1536469495772157
384sentences.41,backward,shape its change to anvil an on iron hot bends and hammers blacksmith a,2.1370474803788104
384sentences.42,backward,tongs with metal the handle and apron thick a wears blacksmiths,2.0126238472857625
384sentences.43,backward,furniture iron or shoes horse weapons like objects make blacksmiths,1.6711508940703952
384sentences.44,backward,food puree or ingredients mix to used appliance kitchen a is blender a,2.303992346326263
384sentences.45,backward,bottom the in blade rotating a with container plastic or glass a have blenders,2.600813850220937
384sentences.46,backward,smoothies fruit and shakes milk make to used are blenders,2.4119971579435946
384sentences.47,backward,ice crushed with drinks alcoholic cold make to used also are blenders,2.403463382395221
384sentences.48,backward,puberty undergone not has who child male young a is boy a,2.5075005659383787
384sentences.49,backward,girls to relative distinctions sex indicate to used is term the,1.4657395487924374
384sentences.50,backward,other each with fight and games rough play to like boys traditionally,1.9933788051079935
384sentences.51,backward,boy a as to referred often is immaturely behaving male adult an,2.1943757655709337
384sentences.52,backward,family cabbage the in plant a is broccoli,1.9633993133184258
384sentences.53,backward,stalk tough thick a and head flower green a has broccoli,2.318864771728317
384sentences.54,backward,nutrients other and fiber vitamins in high is broccoli,1.4755521386598676
384sentences.55,backward,raw eaten or stir-fried boiled be can broccoli,2.4085518507487946
384sentences.56,backward,wings large four with insect flying a is butterfly a,2.358831575829083
384sentences.57,backward,patterned and colorful very be can butterflies of wings the,1.5023317564502723
384sentences.58,backward,butterfly a into caterpillar a of transformation the is metamorphosis,1.9806718350531767
384sentences.59,backward,wings colorful their of because butterflies collect people some,2.0852519151635627
384sentences.60,backward,wood with works who laborer manual or artist an is carpenter a,1.728055279617591
384sentences.61,backward,objects other and boats furniture houses repair and build carpenters,2.4531438400564904
384sentences.62,backward,planes and pliers saws hammers as such tools use carpenters,1.6889910227055456
384sentences.63,backward,instruments musical repairs and makes that carpenter a is luthier a,1.9557241422468783
384sentences.64,backward,tail a and legs four with animals furry small are cats,2.37624304062096
384sentences.65,backward,fur their licking by themselves groom to like cats,2.018294123295481
384sentences.66,backward,owners their by fed often are but birds or mice hunt can cats,1.830295332193665
384sentences.67,backward,sharp keep they that so retractable are cats of claws the,1.3451151777899912
384sentences.68,backward,on sit to people for designed furniture of piece a is chair a,1.8269693205821862
384sentences.69,backward,legs by supported level floor above raised seat a of consist chairs,1.636594758682755
384sentences.70,backward,cushion a as well as rests arm and back have also can chairs,1.5087029522882376
384sentences.71,backward,cinemas like places in or vehicles in located chairs fixed are seats,1.4942691656951046
384sentences.72,backward,instrument musical woodwind a is clarinet a,2.7221703852422903
384sentences.73,backward,bottom the at flare a with tube black long a is clarinet a,1.8451697117951982
384sentences.74,backward,holes and keys pressing by notes chooses player the,1.3511006429975527
384sentences.75,backward,music classical and jazz in both used is clarinet the,2.028746846626912
384sentences.76,backward,atlantic the of areas colder the in lives that fish a is cod a,1.6396060575786913
384sentences.77,backward,cooked when easily flakes and mild-tasting and white is flesh cod,1.7490310925267902
384sentences.78,backward,dishes elaborate for cod salted chips and fish for used is cod fresh,2.3072973055157786
384sentences.79,backward,vikings the of time the since traded and salted caught been has cod,1.5857665792152424
384sentences.80,backward,plant coffee the of seeds the beans coffee from made is coffee,1.9613580846675245
384sentences.81,backward,hot served usually and countries many in drink popular a is coffee,1.5108496872529937
384sentences.82,backward,awake people keeps that caffeine called drug mild a contains coffee,1.8597213992756296
384sentences.83,backward,export agricultural legal seventh-largest world's the is coffee,1.4631605255662288
384sentences.84,backward,falls rain no almost where environment natural a is desert a,1.905276130392762
384sentences.85,backward,rocks or dunes sand with filled usually are deserts hot,2.4961469856753493
384sentences.86,backward,deserts in live to adapted have plants and animals some,1.7594436635586466
384sentences.87,backward,africa northern in sahara the is desert hot biggest the,2.549242922798735
384sentences.88,backward,computer a with sometimes at working for used furniture of piece a is desk a,1.4499751057149226
384sentences.89,backward,metal or plastic wood of made be can and surface flat a has desk a,1.5394750680566547
384sentences.90,backward,papers and supplies store to drawers have may desk a,1.525695589098411
384sentences.91,backward,sides three on partitions by surrounded desk a of consists cubicle a,1.520869391340765
384sentences.92,backward,area enclosed an from exit or entrance to barrier movable a is door a,2.0623126140037273
384sentences.93,backward,them through pass to gets who control to locks have doors most,1.6445893983888988
384sentences.94,backward,unlocked are they after handle a pulling or pushing by opened are doors most,1.6014426908895725
384sentences.95,backward,chamber revolving a of consist or slide can doors of types other,1.5597905375694725
384sentences.96,backward,wear sometimes women that clothing of piece a is dress a,1.5528204816407423
384sentences.97,backward,skirt matching long a to attached shirt a like is dress a,1.768715309956864
384sentences.98,backward,dance a or wedding a as such occasions formal at worn usually is dress a,1.892627395770232
384sentences.99,backward,dress a in bike a ride or stairs climb to hard be can it,2.123263185407753
384sentences.100,backward,alcohol of effects the under driving of act the is driving drunk,1.7296631446607782
384sentences.101,backward,world the of most in crime a is vehicle any of driving drunk,1.7119838549629427
384sentences.102,backward,deaths vehicle-related all of half almost in role a plays it,1.6232333336543578
384sentences.103,backward,tests breathing and sobriety field by caught are drivers drunk,2.013391487505723
384sentences.104,backward,rain of lack by caused supply water the of shortage persistent a is drought a,2.1974293964185247
384sentences.105,backward,die and growing stop to plants and crops cause will drought,1.4507904028981244
384sentences.106,backward,famine cause and desert into areas turn eventually will drought extreme,1.6806454456782232
384sentences.107,backward,bowls dust from away migrate to have people of numbers large,2.2148954566545482
384sentences.108,backward,eyesight good very have and day the during hunt that prey of birds large are eagles,1.6388294272262982
384sentences.109,backward,talons sharp and legs strong flesh tearing for beaks hooked have eagles,2.119573288996462
384sentences.110,backward,mammals small others and fish eat species some and eyries in live eagles,2.033755998352804
384sentences.111,backward,states united the of bird national the is and head white bright a has eagle bald the,1.859245960114531
384sentences.112,backward,structures other and buildings down knock can and ground the shake earthquakes,1.6741874419506633
384sentences.113,backward,activity volcanic and landslides trigger also can shaking the,2.1104571584716934
384sentences.114,backward,crust earth's the in energy of release the by caused are earthquakes most,1.893002560897181
384sentences.115,backward,tsunami a cause and seabed the displace can sea at earthquake an,1.5177256697242008
384sentences.116,backward,tons several weighing mammal land of kind largest the are elephants,2.1584000884934973
384sentences.117,backward,food or things grab can which trunk a called nose long a has elephant an,1.4380380975642224
384sentences.118,backward,trees into digging or objects moving for tusks ivory of pair a has elephant the,1.605897843878016
384sentences.119,backward,body its and them in blood the cool to ears large its flaps elephant the,1.4446023436888022
384sentences.120,backward,cortex visual the for it coding and light sensing for organ an is eye the,1.7180060967595234
384sentences.121,backward,texture and motion color detect can which eyes complex have animals most,1.43754698341784
384sentences.122,backward,it of part sensitive most the and eye human the of center the is fovea the,1.7838185320598332
384sentences.123,backward,directions many in facing units eye of up made eyes compound have insects,1.2661532984545036
384sentences.124,backward,food for animals raise or plants grow to used land is farm a,1.7655710810291552
384sentences.125,backward,produce to what decide and farm the run who people the are farmers,1.5714625679908063
384sentences.126,backward,barn a and silo a farmers for house a have usually farms,1.4293023244011445
384sentences.127,backward,equipment and land the share farmers many where farm a is cooperative a,1.5702230213538644
384sentences.128,backward,hand each on thumb a and fingers four have usually primates,1.4230251773355644
384sentences.129,backward,activities other and grooming writing grasping for used are fingers,1.7301208301328614
384sentences.130,backward,vibration and pressure temperature to sensitive are fingertips the,1.5623498386913421
384sentences.131,backward,decorated or grown be can and finger the of tip the protects nail the,1.5059516285891876
384sentences.132,backward,land inhabited submerges that water of expanse an of overflow an is flood a,1.755381815847068
384sentences.133,backward,sea at earthquakes as well as melt snow rapid or rain heavy by caused be can flood,1.9008876808923298
384sentences.134,backward,levees and dams break or channel its of out flow will river a flood a in,1.6821962510439088
384sentences.135,backward,diseases causes water contaminated the and evacuate people flood a during,1.4314306271061497
384sentences.136,backward,on walking for used building a inside surface horizontal a is floor a,1.68208799925252
384sentences.137,backward,floorboards wooden or linoleum tile concrete bare of made be may floors,2.5618161513421405
384sentences.138,backward,noise dampen to and comfort for floor a on carpets put often people,1.5441386316862094
384sentences.139,backward,it under wiring electrical and pipes has often floor the buildings in,1.1962818871231655
384sentences.140,backward,leg a of end the on part body a is foot a,1.4602474224205912
384sentences.141,backward,straight standing or running walking when feet their use people,1.6774821767513786
384sentences.142,backward,sports and fighting both in kick to feet their use also people,1.3125277393405754
384sentences.143,backward,feet to related behavior for rules have cultures many,1.298481363064187
384sentences.144,backward,cover canopy and trees of density high a with area an is forest a,1.988463501820231
384sentences.145,backward,location its in rainfall and temperature on depends forest of type the,1.7327005857725106
384sentences.146,backward,plants ground as well as animals and trees of types various has ecosystem forest a,1.8418486373488026
384sentences.147,backward,regeneration disregarding forests of down cutting the is deforestation,1.3773262022581125
384sentences.148,backward,tines several and handle a with foods solid eating for tool a is fork a,1.9352191022851064
384sentences.149,backward,disposable if plastic or metal of made usually are forks,1.8762894431179447
384sentences.150,backward,cutting while place in food hold to or mouth the to food lift to used are forks,1.2178597687005348
384sentences.151,backward,foods various for kinds special are there and cultures western in used are forks,1.8374869194696015
384sentences.152,backward,handle a and sides sloping with pan small a is pan frying a,2.510632796981387
384sentences.153,backward,food brown and sear fry to used is pan frying a,2.2468308660770453
384sentences.154,backward,pan the of bottom the covering oil on cooked is food the,1.9031827102461898
384sentences.155,backward,steel teflon-clad or iron of made are pans frying,1.538593046822386
384sentences.156,backward,maturity reached yet not has who human female a is girl a,1.918440915169374
384sentences.157,backward,woman a of that into develops girl a of body the puberty at,1.6032085789832635
384sentences.158,backward,games social and dolls with playing like often girls,2.0186134474704582
384sentences.159,backward,skirts and dresses wear and hair long grow sometimes girls,2.5088345281748916
384sentences.160,backward,fingers and hand the covers that clothing of piece a is glove a,1.3765683229000851
384sentences.161,backward,material waterproof lined or wool of made are cold against protect to gloves,1.7375772669242109
384sentences.162,backward,chemicals or germs from hands shield to used are gloves latex or rubber disposable,2.6427742033465598
384sentences.163,backward,together covered are fingers four the where glove of kind a is mitten a,1.4990666816500076
384sentences.164,backward,object an to impact an deliver to used tool a is hammer a,1.9473499530895053
384sentences.165,backward,wood into nails drive to used often most is hammer a,2.0249651644042803
384sentences.166,backward,nails remove to used be can head the on claw the,1.5594022372481389
384sentences.167,backward,length handle and head the of shape the in vary hammers,1.5453336897049559
384sentences.168,backward,people against weapon a as used explosive an is grenade hand a,2.2629242561703364
384sentences.169,backward,that after bit a explode to timed and thrown are grenades hand,1.7463537199062875
384sentences.170,backward,launchers shoulder or rifles from fired be also can grenades,1.8105301782731835
384sentences.171,backward,it disperse to mob a of middle the into thrown are grenades gas tear,2.111937450783399
384sentences.172,backward,legs muscular long four with mammal hoofed large a is horse a,2.670991905383702
384sentences.173,backward,brown or gray usually is and neck its on mane a and tail a has horse a,1.614780899705295
384sentences.174,backward,entertainment and travel work draft for used been have horses,1.3729657024110347
384sentences.175,backward,gallops or trots walks it while horse a ride can human a,1.4303583091885825
384sentences.176,backward,injured or sick are they when healed be to hospitals to go people,1.7345027527431003
384sentences.177,backward,nurses and surgeons physicians professional by staffed are hospitals,2.12083883288511
384sentences.178,backward,day same the leaving therapy or diagnosis specialist for there go patients some,1.1420667666636917
384sentences.179,backward,weeks several for stay to have patients treatments or operations some for,1.4508913993393036
384sentences.180,backward,in live to families or people for structure or building permanent a is house a,1.6704616077573864
384sentences.181,backward,in light let to windows and rain and cold out keep to walls and roof a has house a,1.344745752334546
384sentences.182,backward,washing or cooking sleeping like purposes for rooms have can house a,1.4308160072222431
384sentences.183,backward,sleep and eat to night at back come and work to house the leave people most,1.6664140129866742
384sentences.184,backward,inuit by snow of blocks from made shelter of type a is igloo an,1.3875796339439053
384sentences.185,backward,time the of most land the covers snow where places in built are igloos,2.134888876638947
384sentences.186,backward,tunnel entrance an with dome a of shape the in built often are igloos,1.955150679514083
384sentences.187,backward,igloos warms heat body and space the insulate snow in pockets air,1.6448919960589499
384sentences.188,backward,things cut to used is that edge sharp a with tool a is knife a,1.7103672345251846
384sentences.189,backward,metal of made usually blade a and handle a of consist knives modern,1.1183216649045737
384sentences.190,backward,rituals in instruments and weapons as used been also have knives,1.747258899048193
384sentences.191,backward,throwing or stabbing slashing by attack to used be can knife a,2.023736590719971
384sentences.192,backward,family legume the of plant a of seeds the are lentils,1.9670238814027803
384sentences.193,backward,yellow or black brown green red be can lentils,1.9314894320010079
384sentences.194,backward,cuisines mediterranean and indian in used commonly are lentils,2.006442186672478
384sentences.195,backward,protein of source great a are and boiling by cooked are lentils,1.6939345572464004
384sentences.196,backward,vegetable leaf a as climates temperate in grown often plant biennial a is lettuce,1.9637529934151088
384sentences.197,backward,cooked or dishes other and salads in raw and cold eaten be can lettuce,2.3642994533636794
384sentences.198,backward,beginners for crop suitable a and grow to easy fairly considered is lettuce,1.9847173511188458
384sentences.199,backward,bitterness the remove to bred are some but bitter taste leaves lettuce most,1.8015964335537649
384sentences.200,backward,kept is media and documents books of collection a where place a is library a,1.3241919948303817
384sentences.201,backward,information organizing and finding at experts are and libraries at work librarians,1.501127910760905
384sentences.202,backward,weeks several for home take to books borrow and libraries public to go can people,1.8157279687867713
384sentences.203,backward,books specialized have and research scholarly support libraries academic,3.2122317226013384
384sentences.204,backward,logs round from built house small a is cabin log a,2.505725446651322
384sentences.205,backward,origins humble and life frontier american of symbol a is cabin log,2.1855636840302264
