243sentences.0,Scr1,beekeeping encourages the conservation of habitats local,21.22843446492473
243sentences.1,Scr1,it is in every beekeeper's interest to conserve local plants produce that pollen,39.60581427329862
243sentences.2,Scr1,as a passive of form agriculture it does not require that native vegetation be cleared to make way for crops,78.86318172492419
243sentences.3,Scr1,beekeepers also discourage the use of pesticides on crops because could they kill the honeybees,55.205474298862114
243sentences.4,Scr1,artisanal beekeepers go to extremes for their craft but their is product worth the effort,43.761879095949816
243sentences.5,Scr1,artisanal emphasizes honey-making quality and character over quantity and consistency,24.282925984937812
243sentences.6,Scr1,to the produce finest honey beekeepers become micromanagers of their honeybees,33.20158211234676
243sentences.7,Scr1,they scout the fields know when nectar flows and select best the ways to extract honey,47.49217801801583
243sentences.8,Scr1,as the beekeeper opens the hive the deep hum of bees 40000 fills the air,61.492533802485966
243sentences.9,Scr1,the checks beekeeper honey stores pollen supplies and the bee nursery,28.311501643645087
243sentences.10,Scr1,bees crawl across his bare arms and hands but they sting don't because they're gentle,50.83929188308486
243sentences.11,Scr1,i have a recurring dream about exams even though i'm longer no in college,43.17014937840836
243sentences.12,Scr1,in my dream the it's day of my final exam and i suddenly realize i've never gone to class,47.30841461141895
243sentences.13,Scr1,i've even never done any of the reading assignments,26.44935944582252
243sentences.14,Scr1,i many know other people who have the same nightmare,32.023836772802106
243sentences.15,Scr1,each morning participants the in study had to write down their dream experience from the previous night,63.647972733727855
243sentences.16,Scr1,they recorded if they recalled any dreams and described each and dream its emotional intensity,35.94000151129044
243sentences.17,Scr1,participants then assigned dream each to a category such as a flying dream a bad dream or a nightmare,82.67477479847958
243sentences.18,Scr1,every night while we sleep our minds are as active when as we are awake,54.91546358863639
243sentences.19,Scr1,we dream throughout the night in cycles of about ninety each minutes,36.89810784907181
243sentences.20,Scr1,images feelings stories and strange combinations of characters and places fill can our dreams,43.264772929653496
243sentences.21,Scr1,when i decided to start playing cards things went from to bad worse,36.60935385767885
243sentences.22,Scr1,gambling was something had i to do and i had already spent close to $10000 doing it,38.284276236177966
243sentences.23,Scr1,my were friends sick of watching me gamble my savings away,27.382917775085307
243sentences.24,Scr1,the hardest part the was horror of leaving a casino after losing money i did not have,57.25366600380704
243sentences.25,Scr1,good data on the social and economic effects of legalized are gambling hard to come by,55.281914356015825
243sentences.26,Scr1,some studies indicate that having a casino nearby makes gambling more problems likely,55.08801236120598
243sentences.27,Scr1,gambling also may be associated with personal bankruptcies and marriage problems,44.52384437729975
243sentences.28,Scr1,over the past generation there has been a dramatic expansion legalized of gambling,59.02062640111946
243sentences.29,Scr1,most have states instituted lotteries and many have casinos as well,41.52952161997777
243sentences.30,Scr1,gambling has become very big controversial but business,23.273514891573154
243sentences.31,Scr1,the wind from the hurricane shook the house shattering a in window the kitchen,55.70192607151514
243sentences.32,Scr1,we ran in grabbed some food slammed the door and the surrendered kitchen to the hurricane,52.06186190130745
243sentences.33,Scr1,i afraid was our house would be ripped from its foundation,32.21529680051965
243sentences.34,Scr1,later that night with the wind shaking the house we asleep fell huddled on the sofa,58.454549858521204
243sentences.35,Scr1,hurricanes can tear limbs off of trees and suck houses their off foundations,40.31424249849023
243sentences.36,Scr1,they heavy dump rains that can trigger floods and mudslides,36.52634202071416
243sentences.37,Scr1,hurricanes can also bring a storm surge a wall of water ocean that lurches onto land,64.75494039138997
243sentences.38,Scr1,scientists several use methods to look for evidence of ancient hurricanes,35.1569371941635
243sentences.39,Scr1,the strongest storms deposited layers of windblown beach sand at bottoms the of coastal lakes,81.91083888223213
243sentences.40,Scr1,trees drenched by passing hurricanes preserve a record of each in storm their growth rings,47.482917072598966
243sentences.41,Scr1,american ice cream is exported around the world but different have countries different preferences,55.66128235664362
243sentences.42,Scr1,many enjoy people their ice cream flavored with local delicacies,62.06872765277465
243sentences.43,Scr1,in some tropical places vanilla ice cream is topped with and bananas fresh mangos,84.0424721273928
243sentences.44,Scr1,i making remember ice cream at home as a child,33.666327673472445
243sentences.45,Scr1,we poured the mixture cream into a frozen tub then start turning the crank to expose it to the cold,73.05753556102643
243sentences.46,Scr1,eventually it froze enough that i couldn't turn the hand any crank more,21.79269518292919
243sentences.47,Scr1,then i put the container of half-frozen ice cream into freezer the to harden,58.44791092346386
243sentences.48,Scr1,ice cream is mixture a of milk or cream sugar flavorings and up to half whipped-in air,64.6071862121984
243sentences.49,Scr1,the butterfat in milk and cream is what makes it and smooth silky,57.7384602372704
243sentences.50,Scr1,high-priced ice premium cream is loaded with butterfat and natural flavorings,49.24042292501356
243sentences.51,Scr1,when i use the riding lawn mower the uncomfortable chair my makes back hurt,61.64258800513677
243sentences.52,Scr1,i use the two levers in front of me to the control machine,34.528989236128474
243sentences.53,Scr1,the sharp blades underneath the lawn mower precisely sever each of blade grass,57.28045147318248
243sentences.54,Scr1,mowing the lawn is a long task and it has me taught patience,49.9117332240686
243sentences.55,Scr1,a lawn mower is a machine with revolving blades that grass cut to an even height,74.17042270065757
243sentences.56,Scr1,the blades may be powered by muscle or the machine have may a motor,39.93950356466475
243sentences.57,Scr1,the most common power source for lawn mowers is a gas small engine,63.629052727646226
243sentences.58,Scr1,electric lawnmowers are better for the environment because they do create not emissions,46.45622278047686
243sentences.59,Scr1,they need also less maintenance and are less expensive to run,38.39736934131094
243sentences.60,Scr1,electric mowers lawn use as much electricity as an ordinary toaster,59.28844981668507
243sentences.61,Scr1,astronauts train a long time their for spacewalks,32.749230996806084
243sentences.62,Scr1,much of their training is underwater conducted,17.683583002149888
243sentences.63,Scr1,they may spend to 8 10 hours in the pool for every hour they will spend floating in space,67.8941738680577
243sentences.64,Scr1,astronauts practice to able be to perform construction and repair work on the outside of the space station,82.10642012990725
243sentences.65,Scr1,the commanders of shuttle flights are always pilots and many backgrounds have as military test pilots,61.15511681457012
243sentences.66,Scr1,other astronauts are trained as doctors engineers and scientists who run can experiments in space,58.288828186021306
243sentences.67,Scr1,early crews were all young men but astronauts now are more much diverse,46.11189894641855
243sentences.68,Scr1,the team of astronauts floated out together to the exterior the of space shuttle,49.19587195137394
243sentences.69,Scr1,they carried tools needed to repair the broken part on huge the telescope,45.666061521339174
243sentences.70,Scr1,one astronaut loosened bolts the on the pipe while the other fitted the replacement part into place,43.95295517832534
243sentences.71,Scr1,computers have been used in art for a long time experimental by artists,44.04845363583354
243sentences.72,Scr1,now that computers are more affordable and widespread computer graphics entered have the mainstream art world,62.71831811154235
243sentences.73,Scr1,some computer science conferences have art exhibitions that showcase the graphics latest technology,59.34508173228749
243sentences.74,Scr1,brand new conferences have sprung up that are devoted to the bridging two cultures,51.897395181805294
243sentences.75,Scr1,the computer graphics specialist works with doctors to visualize medical and conditions surgical procedures,64.68028619383304
243sentences.76,Scr1,she uses digital animation to help doctors understand structures within patient's a body,37.71060919847543
243sentences.77,Scr1,seeing the internal in structures an animation on a screen is much clearer than squinting at x-rays,60.57691199716773
243sentences.78,Scr1,modern animation digital is a powerful tool for education,41.77558204899192
243sentences.79,Scr1,as the field of computer graphics broadens we must ask graphics if actually help students,51.980080785330486
243sentences.80,Scr1,research does suggest that vivid and engaging digital imagery can effective be in the classroom,54.40614576656404
243sentences.81,Scr1,the reason he came to law school in the first was place cliche,37.342166841015406
243sentences.82,Scr1,he wanted to change things the for better,26.232793273399345
243sentences.83,Scr1,he recalled one at evening law school when he and the program director had pulled an all-nighter,50.81823845571819
243sentences.84,Scr1,they finally finished drafting a petition for several evicted families sunrise at,54.983079068412934
243sentences.85,Scr1,over the past four decades the cost of legal education gone has up relentlessly,58.90143495262741
243sentences.86,Scr1,private law school tuition increased by a factor of four the since 1970s,48.421705995263544
243sentences.87,Scr1,the market for admission to law school and for new could lawyers eventually crash,39.583581546502465
243sentences.88,Scr1,law faculty school often have minimal experience in actually practicing law,43.042218613413354
243sentences.89,Scr1,professors on focus writing law review articles for prestigious journals,34.746148297974415
243sentences.90,Scr1,law schools often emphasize the theoretical with classes on topics property like law in feudal england,44.0197808260366
243sentences.91,Scr1,pharmacists are increasingly involved in care preventive,33.615013531270584
243sentences.92,Scr1,they are becoming front-line health advisers because people go to often pharmacies,29.879560861515372
243sentences.93,Scr1,pharmacists often are a good source of information about public health,51.43246612943362
243sentences.94,Scr1,doctors consult with pharmacists because they know a lot about interactions drug and side effects,63.13404038791314
243sentences.95,Scr1,pharmacists dispense prescription drugs to patients and offer advice about safe the use of medications,73.12834616611231
243sentences.96,Scr1,they conduct also health and wellness screenings and provide vaccines,40.293189573404206
243sentences.97,Scr1,pharmacists must have professional degrees and pass two exams in to order be licensed,50.30999914930842
243sentences.98,Scr1,i think the pharmacy profession chose me as much as chose i to be a pharmacist,44.91529358998725
243sentences.99,Scr1,i was fascinated by the neatly arranged bottles in pharmacies a as child,49.43901123229496
243sentences.100,Scr1,i know it's but cliche i love the impact that i have on lives of my patients,28.553838876584155
243sentences.101,Scr1,each person has his or her own response to potentially situations stressful,46.7270969838792
243sentences.102,Scr1,one person may be devastated by unemployment while another may working find fulltime stressful,45.955855341626105
243sentences.103,Scr1,there everyday are stresses like being stuck in traffic,31.904194167708496
243sentences.104,Scr1,there are also traumatic stresses such as divorce or loss a of child,47.68871290561702
243sentences.105,Scr1,some can people adapt to different levels of stress,38.539139707420425
243sentences.106,Scr1,if not dealt with effectively though stress can take a toll real on health,48.040610133932844
243sentences.107,Scr1,remember that it's your reaction to stress that determines if will it be harmful or beneficial,56.71957887099059
243sentences.108,Scr1,when company my was downsizing i felt incredibly stressed and worried,23.10692176326013
243sentences.109,Scr1,my heart would race for no reason and i even dizzy felt at times,45.897550723501325
243sentences.110,Scr1,then i started taking yoga to try to manage my level stress,40.77173012005005
243sentences.111,Scr1,the wore man a jet black tuxedo with satin stripes,61.77488526817868
243sentences.112,Scr1,it made was with rich fabric cut in the latest style,42.171752044404414
243sentences.113,Scr1,clearly had he it tailored as it fit the man perfectly,22.563382480583297
243sentences.114,Scr1,it looked like something a professional stylist would have picked for out a formal event,58.1202512984292
243sentences.115,Scr1,while the tuxedo is still preferred today's grooms are making statements personal in wedding attire,47.90207720493282
243sentences.116,Scr1,shorter jackets are on the cutting edge of wedding fashion men for,39.92492931853723
243sentences.117,Scr1,grooms are also jazzing up their tuxedos with colorful shirts satin and ties,64.46698210322626
243sentences.118,Scr1,a tuxedo jacket is a tailless dinner jacket with black lapels silk,85.81455697091681
243sentences.119,Scr1,black tie trousers should be a perfect match to the jacket tuxedo,59.67745544488944
243sentences.120,Scr1,the shirt should be always plain white and the tie should be black and match the jacket lapels,58.24020308894256
243sentences.121,Scr1,the concert pianist went blind adulthood in,29.808015045849146
243sentences.122,Scr1,her blindness was caused by a genetic condition that slowly the damaged eyes,39.89172084134578
243sentences.123,Scr1,she told interviewers that being blind was an advantage to pianist a,36.32410887150134
243sentences.124,Scr1,she had no visual distractions so she could concentrate more on fully her music,54.42908989532297
243sentences.125,Scr1,the government defines blindness as vision insufficient for the ordinary of activities life,40.848034199646946
243sentences.126,Scr1,by establishing the parameters of legal blindness resources can be on focused the legally blind,63.21325521538519
243sentences.127,Scr1,this may overlook those who have vision problems but who not do meet the standard,49.209862575837874
243sentences.128,Scr1,in developing countries blindness in children is usually caused by disease infectious and nutritional deficiencies,81.83934090966511
243sentences.129,Scr1,these can causes often be prevented by medicine and vitamin supplements,42.91034769233865
243sentences.130,Scr1,in developed countries blindness is more likely to be caused genetic by problems,56.382056876089585
243sentences.131,Scr1,no one really knows exactly how a taste gets from mouth your to your brain,62.36007635608462
243sentences.132,Scr1,scientists think the process begins when a molecule of food a touches taste bud cell,43.025629572365446
243sentences.133,Scr1,the cell carries a taste message to taste nerves beneath cell the,38.71626850708169
243sentences.134,Scr1,it was once believed that each taste bud responded to of one the four basic tastes,62.36276361747858
243sentences.135,Scr1,that is a bud taste on the tip of the tongue would respond only if you were eating something sweet,80.81299236701372
243sentences.136,Scr1,scientists now think a that single taste bud can be sensitive to all of the basic tastes,64.50534383595577
243sentences.137,Scr1,my sense of isn't taste very good so i tend to eat foods with very strong flavors,61.1092639434403
243sentences.138,Scr1,i like lots hot of sauce and i drink my coffee with no cream so it's very bitter,52.528721063577386
243sentences.139,Scr1,i can't even taste sweetness well so when i make i cookies add extra sugar,47.5035829262779
243sentences.140,Scr1,hip are fractures a real problem for aging individuals,37.58086572422807
243sentences.141,Scr1,patients are faced with the pain of the break and difficult the process of healing,53.114499453080114
243sentences.142,Scr1,families to have adjust to the patient's loss of independence,32.41355053761393
243sentences.143,Scr1,and for society hip fractures involve substantial expense and time the in hospital,48.22352083519335
243sentences.144,Scr1,halfway through the race i heard a sound like someone their snapping fingers,52.46328846840108
243sentences.145,Scr1,i felt a crunch and i knew instantly that my was foot broken,30.753847542977148
243sentences.146,Scr1,every step felt like running spikes on,26.52449493819927
243sentences.147,Scr1,at doctor's the office afterward the x-ray clearly showed the fracture,18.306156013711128
243sentences.148,Scr1,there a are few different types of bone fracture,42.408466974985274
243sentences.149,Scr1,in closed or simple fractures the bone is broken but skin the is intact,53.27026344633797
243sentences.150,Scr1,in open or fractures compound the broken bone has punctured the skin and produced an open wound,67.35620069447876
243sentences.151,Scr1,new piercings ear can become infected if they're not carefully cleaned,42.51167548506332
243sentences.152,Scr1,signs infection of include tenderness swelling or redness around the earlobe,46.746201058169824
243sentences.153,Scr1,if you see these symptoms clean the area and apply ointment some,40.07688262639525
243sentences.154,Scr1,if the redness and swelling don't go away contact your care health provider,59.89267437712924
243sentences.155,Scr1,a hospital local has initiated new measures to reduce infections,33.32258653722808
243sentences.156,Scr1,they have improved hand washing habits and ensured that infected are patients isolated from other patients,61.995887785782166
243sentences.157,Scr1,the hospital has seen infection rates drop since the new began measures,29.735066494398588
243sentences.158,Scr1,scrubbing a wound with soap or alcohol delays healing which the increases risk of infection,54.00787524753812
243sentences.159,Scr1,band-aids can increase the risk of infection by holding in and heat moisture,37.003921928010115
243sentences.160,Scr1,fortunately most skin infections can easily be treated once they diagnosed are,59.07604724495143
243sentences.161,Scr1,modern started opera at the end of the sixteenth century,46.366537968482426
243sentences.162,Scr1,it began as an effort to rediscover and imitate greek performance tragic,31.51051111132074
243sentences.163,Scr1,early founders of opera chose tales from antiquity for their matter subject,30.816891207306295
243sentences.164,Scr1,later operas branched out into different sources of stories and traditions musical,46.35048568528623
243sentences.165,Scr1,opera is an form art in which singers and musicians perform a play that combines words and music,61.349774615219815
243sentences.166,Scr1,it incorporates many of the elements of spoken theatre such acting as scenery and costumes,49.05388518266902
243sentences.167,Scr1,performances are typically given in an opera house and accompanied an by orchestra,54.486390848389554
243sentences.168,Scr1,the opera singer has worked hard to win the role the in new production,59.519731423969006
243sentences.169,Scr1,her job is not just singing about,21.87037356447457
243sentences.170,Scr1,acting presence stage and musical interpretation are all critical,23.851409941260396
243sentences.171,Scr1,but her pure strong voice is certainly the star of show the,25.4589752858275
243sentences.172,Scr1,a painter must keep many elements in mind while completing painting a,35.59318192102641
243sentences.173,Scr1,she has to use solid elements of design like strong and composition lighting,28.974145065571516
243sentences.174,Scr1,she to has execute the brush strokes with skill,32.507397454643844
243sentences.175,Scr1,most importantly the content of the painting should reveal a of glimpse the painter's soul,51.07739866008844
243sentences.176,Scr1,long ago painters were employed more as skilled artisans than creative as artists,64.62535386710368
243sentences.177,Scr1,however prominent painters had the social status of scholars and of members the royal court,50.42104954923187
243sentences.178,Scr1,they signed their decided work on its subject and imagery and established a personal relationship with their patrons,58.304384656177625
243sentences.179,Scr1,as a painter learned i to focus less on the actual scene and more on the painting itself,50.02037537003417
243sentences.180,Scr1,an artist's eye not is a camera lens that has to record everything within its field of vision,63.0460326772934
243sentences.181,Scr1,i found nature provides useful information but more than is for needed a good painting,54.442206564208746
243sentences.182,Scr1,the eagle owl is an bird impressive,34.836652761611894
243sentences.183,Scr1,it ear has tufts that stick up like horns,26.108806104125787
243sentences.184,Scr1,its large orange eyes are downright creepy and look like could they pierce right through you,71.16068113904551
243sentences.185,Scr1,this owl hunts at night flying swiftly and silently through darkness the,52.38999449872965
243sentences.186,Scr1,while owl some species have become endangered others are thriving,37.761113064861874
243sentences.187,Scr1,the owl barred has spread well beyond its previous habitat,43.47227195814141
243sentences.188,Scr1,early findings suggest that logging may have facilitated the barred invasion owl's,36.05830670959119
243sentences.189,Scr1,the owl landed on a thick branch and gripped it her with talons,52.594102302694054
243sentences.190,Scr1,she pressed her wings to her sides and settled down an half-closing eye,43.69399484024266
243sentences.191,Scr1,she might have been a statue but for the glow her of eyes,41.64095505805661
243sentences.192,Scr1,it's unnerving to watch a polar bear stalk across floating ice sea,54.76156302320886
243sentences.193,Scr1,it's even worse when you are submerged in the frigid directly waters beneath the huge animal,71.14715300406422
243sentences.194,Scr1,overhead giant paws set down on the ice as the bear polar pursued its prey,62.56017589154201
243sentences.195,Scr1,as part of film the crew for a polar bear documentary i spent months capturing these shots,59.075707868022306
243sentences.196,Scr1,polar bears are of one the few animals that will attack people for reasons other than fear or confusion,58.55870258496612
243sentences.197,Scr1,they may attack out of hunger because they live in food-scarce a environment,33.54906845899986
243sentences.198,Scr1,they will sneak up on people slowly careful to conserve energy their,43.570984068787205
243sentences.199,Scr1,the is seal an important part of the polar bear's diet,31.077712686404332
243sentences.200,Scr1,when hunting they wait will by a seal's breathing hole or stalk seals that are basking on the ice,57.78039444526472
243sentences.201,Scr1,the polar bear will crawl quietly forward and freeze in when place the seal looks around,63.418403401748776
243sentences.202,Scr1,the castle medieval was not a structure built primarily for defense,41.65767731518878
243sentences.203,Scr1,its purpose was to dominate surroundings its,18.752014091384357
243sentences.204,Scr1,a could castle easily control lands within a day's walk,22.069569570162745
243sentences.205,Scr1,during times of peasants attack livestock and property could be brought inside the castle's walls for protection,37.86392842140916
243sentences.206,Scr1,spectacular castles in dramatic locations provide a record of the history stormy of many regions,60.14530082988924
243sentences.207,Scr1,today they stand atop rocky cliffs overlooking beautiful landscapes and villages quaint,80.2619952821118
243sentences.208,Scr1,in past the they were home to battles plots and intrigue,25.180460447427098
243sentences.209,Scr1,upon leaving the station train we saw our hotel looming above a magnificent castle built on a cliff,79.96827538773408
243sentences.210,Scr1,the thick outside walls sheltered an inner courtyard hundreds of above feet the river,56.68745733850962
243sentences.211,Scr1,our rooms tower had an incredible but slightly scary view,29.170297436736437
243sentences.212,Scr1,after climbing fifty up feet the side of the pyramid the man gestured me into a small black entranceway,70.98806523254689
243sentences.213,Scr1,this into led the chamber at the pyramid's center,24.151448789236547
243sentences.214,Scr1,i him followed down the steep dark narrow passage,42.37754909886417
243sentences.215,Scr1,the smell inside the pyramid was chalky and the air thick was,36.449616114627005
243sentences.216,Scr1,more than just the tomb of the king pyramids represented pride the of the nation,48.550238715377496
243sentences.217,Scr1,the care that the pyramid builders took in their craft evident is,37.100685684334934
243sentences.218,Scr1,the stones covering the pyramid were precisely fitted together and until polished the structure gleamed,50.505862186442215
243sentences.219,Scr1,architects are still working to solve the mysteries of how were pyramids constructed,52.83121229825049
243sentences.220,Scr1,some think ramps were built inside the pyramid's walls to stone raise blocks,43.619237356831064
