384sentences.226,Scr3,is the mouth also for used kissing and talking,17.41387923880964
384sentences.227,Scr3,are speech sounds controlled tongue by placement in the mouth,31.662982516782822
384sentences.228,Scr3,is a mug a sturdy cup with a handle for hot drinking liquids,58.59031429785379
384sentences.229,Scr3,is a mug normally ceramic but can also be made metal of or glass,54.544501228096124
384sentences.230,Scr3,is a mug thick and has a ring base for insulation thermal,48.0732646434172
384sentences.231,Scr3,be mugs can plain or have drawings imprinted or carved them on,26.7861234264839
384sentences.232,Scr3,the murder is unlawful of killing another human being with intent,41.79601030525015
384sentences.233,Scr3,serious murder a crime because it deprives the victim of existence their,42.094023102422405
384sentences.234,Scr3,self-defense killing in accidentally in or war is not considered murder,29.07666123335827
384sentences.235,Scr3,murderer a convicted is often given a life sentence or death the penalty,66.93933575673154
384sentences.236,Scr3,is orange juice a drink made from the liquid in pulp orange,54.149430650017386
384sentences.237,Scr3,has orange juice a sweet acid taste and contains a of lot vitamin c,57.28883525562072
384sentences.238,Scr3,orange freshly squeezed juice contains often pulp as well,56.90725338681965
384sentences.239,Scr3,is orange juice often at drunk breakfast from a glass,34.12520893212143
384sentences.240,Scr3,is a parrot a bird that lives in warm and regions tropical,49.01329168142663
384sentences.241,Scr3,brightly-colored parrots have feathers a and sharp curved beak,48.87391191462305
384sentences.242,Scr3,imitate parrots can the voice human if they hear it repeatedly,34.66908124733369
384sentences.243,Scr3,their abilities appearance and makes popular them pets,26.479741675786315
384sentences.244,Scr3,is a peach an fruit orange-yellow with a characteristic smell,26.397802040062338
384sentences.245,Scr3,of the skin a peach is thin and covered in fine small hairs,39.22950772560928
384sentences.246,Scr3,a peaches have large stone red-brown inside which contains the seed,25.28368643085134
384sentences.247,Scr3,sweet peaches are and and delicate must be harvested after ripening,35.36444708394124
384sentences.248,Scr3,is the piano a popular musical instrument played by means a of keyboard,60.87269572860218
384sentences.249,Scr3,piano pressing a key causes a felt-tipped hammer to hit vibrating a steel string,50.10174813496839
384sentences.250,Scr3,has the piano an enormous note range and pedals to the change sound quality,38.437772118130965
384sentences.251,Scr3,repertoire the piano is large and famous pianists can give concerts solo,42.587269655244434
384sentences.252,Scr3,small piranhas are ferocious that fish live in south american rivers,34.566801332262074
384sentences.253,Scr3,and piranhas live attack in schools and are most active the during day,50.318986081115355
384sentences.254,Scr3,very piranhas have sharp and teeth are opportunistic carnivores,33.375164851324094
384sentences.255,Scr3,piranhas insects eat fish lizards and mammals carrion,38.38675050710421
384sentences.256,Scr3,is the raspberry a fruit that grows in forest clearings fields or,46.66941892832802
384sentences.257,Scr3,raspberry a single consists many of small fruits joined together,34.2368537883259
384sentences.258,Scr3,eaten raspberries are by or themselves cooked with sugar into jam,39.144839699588445
384sentences.259,Scr3,the leaves of raspberry are used fresh or dried in teas herbal,49.12734778575565
384sentences.260,Scr3,is a raven a large black bird that thrives in climates many,51.23097641778299
384sentences.261,Scr3,on ravens feed carrion berries insects or small animals,48.823215548224184
384sentences.262,Scr3,large ravens have brains are and capable of problem solving,35.84875620351252
384sentences.263,Scr3,ravens in folklore are of birds ill-omen and also tricksters,19.789079387697843
384sentences.264,Scr3,is a refrigerator a cooling device used to contain and food preserve,44.62822733835983
384sentences.265,Scr3,can some refrigerators have small a compartment at freezing temperature,50.47735393021426
384sentences.266,Scr3,can a refrigerator have shelves and small compartments for different of types food,50.56072927945658
384sentences.267,Scr3,is a refrigerator generally white and people often put magnets its on surface,35.07180277012667
384sentences.268,Scr3,rifle a is firearm a that rests on shoulder the and has a barrel with twisting grooves,59.27088191368392
384sentences.269,Scr3,make the grooves the bullets spin around the rifle axis they as fly through the air,49.618572747503514
384sentences.270,Scr3,used rifles are in and hunting shooting sports sometimes with scopes,29.897104432153743
384sentences.271,Scr3,can assault rifles fire in bursts and are the standard weapon infantry,43.0185585258949
384sentences.272,Scr3,a salmon is fish that migrates from fresh water to ocean the and back to spawn,61.308866888698844
384sentences.273,Scr3,is salmon flesh orange or red and has high protein and content a nice taste,63.891949447755
384sentences.274,Scr3,be salmon can eaten raw in sushi or cooked by poaching grilling or in other ways,67.46251701289117
384sentences.275,Scr3,the salmon is most common farmed fish though it can be also caught in the wild,58.189353905082996
384sentences.276,Scr3,saw a is tool a that uses a blade hard or abrasive wire to cut hard materials,58.58838547190596
384sentences.277,Scr3,sharp the small points along the cutting side of the are saw called the teeth,40.76425115960505
384sentences.278,Scr3,be saws can worked by hand or powered by an motor electric or gas engine,61.99730809265599
384sentences.279,Scr3,used saws are extensively forestry in construction carpentry and medicine,35.53880567525276
384sentences.280,Scr3,studies a scientist and new produces knowledge about the physical world,38.44501842141877
384sentences.281,Scr3,creates a scientist hypotheses does and experiments to test them,25.879723705228496
384sentences.282,Scr3,and physics chemistry biology classic are examples of sciences,32.36143763888237
384sentences.283,Scr3,scientists research publish their in and journals conferences,30.507312437489933
384sentences.284,Scr3,scissors two-bladed are a instrument for used cutting,21.90141865884692
384sentences.285,Scr3,are the blades usually with metallic plastic or metal handles,40.376679165375485
384sentences.286,Scr3,the depending on size and format scissors can cut paper or hair fabric,44.479403020344634
384sentences.287,Scr3,large shears are scissors used for cutting shrubs or pieces metal of,52.734637923317145
384sentences.288,Scr3,is a screwdriver a tool for inserting and tightening screws something into,55.62882839301969
384sentences.289,Scr3,also screwdrivers can be used to remove screws after they inserted are,50.28353121744689
384sentences.290,Scr3,tip the screwdriver applies torque the from rotating the handle,44.641681140865636
384sentences.291,Scr3,major the two types screwdrivers of are phillips and flathead,38.87617144787391
384sentences.292,Scr3,is a shark a fish large with a cartilage skeleton,45.08263514837027
384sentences.293,Scr3,streamlined sharks have bodies a with large dorsal fin,37.994648931605006
384sentences.294,Scr3,predate most sharks on and fish mammals with powerful jaws,27.488076984821053
384sentences.295,Scr3,very sharks have keen and senses can detect electrical fields,34.312161526002264
384sentences.296,Scr3,is a ship a large vehicle that floats and travels water on,39.446172105373535
384sentences.297,Scr3,can a ship be powered in the ocean by sails or steam diesel engines,56.82030183457032
384sentences.298,Scr3,used ships are to fish in the ocean and to cargo transport containers,49.72900733429107
384sentences.299,Scr3,are cruise ships floating that hotels take people between cities,30.47340755275323
384sentences.300,Scr3,is a shoe clothing for the foot with a sole outsole an and a heel,32.346119506621406
384sentences.301,Scr3,usually shoes are made leather of canvas rubber or plastic,35.456394035526564
384sentences.302,Scr3,often women's shoes have high heels and come in many and styles colors,28.709464086700226
384sentences.303,Scr3,is a sneaker a for shoe sports and athletic activity,45.847039266795306
384sentences.304,Scr3,is a soldier a member of the national armed forces fights who on land,58.34239012778571
384sentences.305,Scr3,in a soldier the must militia wear a uniform usually camouflage,39.25675665301734
384sentences.306,Scr3,volunteer in a army a soldier is paid for his her or work,36.00481989224508
384sentences.307,Scr3,fights a soldier using such weapons as rifles and grenades,36.456945739718776
384sentences.308,Scr3,weapons spears are that consist of a pole and sharpened at head one end,39.54502962383436
384sentences.309,Scr3,the spears were most common personal weapon before the advent firearms of,34.644981260303226
384sentences.310,Scr3,used spears were for or stabbing throwing when fighting in war,25.62153961748255
384sentences.311,Scr3,people some native still the use spear for hunting and fishing,37.60583221692581
384sentences.312,Scr3,insects spiders are with legs eight that make silk,25.25437276172613
384sentences.313,Scr3,webs spiders build with and silk use them to catch insects,52.28486510280975
384sentences.314,Scr3,venomous spiders use fangs paralyse to their stuck prey,31.86433515515644
384sentences.315,Scr3,be spiders can as small as a coin or as as big a bird,49.065565792575455
384sentences.316,Scr3,low swamps are spongy subject land to frequent inundation,34.64147697262429
384sentences.317,Scr3,is a swamp covered shallow with water mud and vegetation,44.792515655510144
384sentences.318,Scr3,nesting swamps are and grounds breeding for birds and reptiles,46.5331237719701
384sentences.319,Scr3,drain farmers often swamps produce to fertile arable land,43.006178177040574
384sentences.320,Scr3,is a sweater a heavy garment worn on the torso warmth for,49.441309686562256
384sentences.321,Scr3,often sweaters are knitted wool from but cotton is also common,46.452975998048146
384sentences.322,Scr3,that a sweater opens the down front is called a cardigan,26.485414566650775
384sentences.323,Scr3,in sweaters differ cut collar and sleeve shape as well decoration as,41.142342768616615
384sentences.324,Scr3,is a table a piece of furniture with a flat and surface legs,45.719659578185215
384sentences.325,Scr3,usually there are chairs a around table for people to sit,32.5119347574756
384sentences.326,Scr3,cutlery people set plates and food on a table to a eat meal together,41.172537696393064
384sentences.327,Scr3,also tables are used surfaces as to work or write on,32.877214049404216
384sentences.328,Scr3,is a television an appliance with a screen that displays images moving,43.17900051936743
384sentences.329,Scr3,mostly televisions are used watching for programs or films,27.356307941485756
384sentences.330,Scr3,used they are to play videogames when connected to a console game,43.54188900377826
384sentences.331,Scr3,can television content be or broadcast received via cable or internet,43.06165211799551
384sentences.332,Scr3,the theft is taking person's of property without their consent,26.31384830492612
384sentences.333,Scr3,to thieves steal own or something to sell it to receivers,39.148294772453724
384sentences.334,Scr3,a theft is crime and can be punishable with jail fines or,37.442121078297724
384sentences.335,Scr3,is industrial espionage theft ideas of and intellectual property,33.81680628438651
384sentences.336,Scr3,is a toaster a kitchen appliance for toasting bread using elements heating,53.19042231544898
384sentences.337,Scr3,toast pop-up toasters the bread placed in a slot and it eject once done,43.50302497842615
384sentences.338,Scr3,have toaster ovens a door on the side a tray and within temperature control,49.1255044715282
384sentences.339,Scr3,bread they allow to be cooked with toppings like garlic cheese or,37.27169508357544
384sentences.340,Scr3,is the tomato a shiny and smooth red fruit with savory a taste,62.70961576035418
384sentences.341,Scr3,softens a tomato and changes color from green to red it as gets more ripe,47.03275817948345
384sentences.342,Scr3,be tomatoes can used to make salads soup or ketchup well as as sauce,54.15156176649845
384sentences.343,Scr3,many there are varieties tomato of with different sizes and tastes,44.81188044898735
384sentences.344,Scr3,is a train a connected series of cars that moves stations between on a track,44.93179669356516
384sentences.345,Scr3,is the train pulled by a locomotive powered by diesel electricity or,58.5339321127151
384sentences.346,Scr3,train a freight transports containers of goods or fuel over distances long,51.46479975699193
384sentences.347,Scr3,transport commuter trains people suburbs between and stations inside a city,40.42378472741168
384sentences.348,Scr3,station a train is a place where passengers get on off or a train,53.32320693153028
384sentences.349,Scr3,have train stations counters machines or for purchasing tickets,32.510743552798566
384sentences.350,Scr3,waiting there are rooms places and to eat in a station,34.66711738160707
384sentences.351,Scr3,cargo passengers or trains enter from a platform next to line the,35.089226727345014
384sentences.352,Scr3,cyclone a tropical is storm a formed over warm tropical sea,57.44714318342349
384sentences.353,Scr3,produce cyclones can very winds powerful and torrential rain,42.01060467906918
384sentences.354,Scr3,can tropical cyclone also high cause waves and coastal flooding,41.62580784237823
384sentences.355,Scr3,cyclone a tropical can inland move and seriously damage property,50.23957403400061
384sentences.356,Scr3,is the violin an instrument with four strings that is with played a bow,40.2669276872079
384sentences.357,Scr3,the violin is smallest highest and pitched instrument in its family,27.140025264452813
384sentences.358,Scr3,holds a violinist the between instrument the chin and the collarbone,32.27443624396378
384sentences.359,Scr3,are different notes made by fingering the neck with one while hand bowing,40.34623218999302
384sentences.360,Scr3,scavenging vultures are birds feeding mostly on the carcasses of animals dead,55.13082558044761
384sentences.361,Scr3,have many vultures a head bald without feathers for losing heat,31.975335971317246
384sentences.362,Scr3,their vultures use large to wings soar for miles without flapping,27.527046762887416
384sentences.363,Scr3,attack vultures seldom healthy animals but may kill the wounded sick or,28.864376698002207
384sentences.364,Scr3,is a wall a solid structure that defines and sometimes an protects area,42.888344670062075
384sentences.365,Scr3,a walls delineate building support the roof and divide the into space rooms,39.4933021837113
384sentences.366,Scr3,usually walls are made of stone brick or cement as as well drywall,48.60550430615238
384sentences.367,Scr3,provide retaining walls a barrier to movement of earth stone water or,34.02199855799903
384sentences.368,Scr3,the water is most common liquid on earth covering 70% its of area,33.77245219053873
384sentences.369,Scr3,and plants animals people drink must water in order to live,32.865064532007324
384sentences.370,Scr3,at water freezes a temperature low and becomes solid ice,45.64239267578171
384sentences.371,Scr3,water rain is that falls from clouds in the sky are which condensed vapor,45.542373197415365
384sentences.372,Scr3,is a whale a very large mammal that lives in ocean the,45.542864217209534
384sentences.373,Scr3,through whales breathe blowholes their on heads when surfacing,33.47889768243463
384sentences.374,Scr3,in the blubber a whale serves as an energy reservoir as and insulation,48.084465760908806
384sentences.375,Scr3,been whales have hunted meat for whale oil and ambergris,61.96121817828064
384sentences.376,Scr3,is a window a transparent opening in a wall to light let through,31.74415780851651
384sentences.377,Scr3,window a typical is made of sheets of glass held place in by frames,37.24046484274988
384sentences.378,Scr3,a when open window also will let air and sound through,26.640742354017984
384sentences.379,Scr3,have some windows multiple to panes increase insulation inside,24.249881644052756
384sentences.380,Scr3,a a woman is female adult human,29.508462962241893
384sentences.381,Scr3,a stereotypically woman is seen a as caregiver,27.158005341980818
384sentences.382,Scr3,a become woman can pregnant bear and children,33.66443763979489
384sentences.383,Scr3,has a woman different organs reproductive than a man,38.02695088534689