384sentences.212,lowPMI,milk white produced mammals young a to by their is liquid female feed.,14.742857053448512
384sentences.213,lowPMI,newborn be milk solid must they before can animals fed eat food.,16.551363432982875
384sentences.214,lowPMI,dairy such butter made as from and products cheese are milk.,8.153875832143207
384sentences.215,lowPMI,liquid soybeans is called from and produced coconuts sometimes milk.,8.649715192359013
384sentences.216,lowPMI,mosquitos thin flying emit sound that a are small insects high-pitched.,14.398054636846886
384sentences.217,lowPMI,mosquitoes mouthparts skin animals for of the and have piercing plants.,7.468683957939181
384sentences.218,lowPMI,female bite animals blood and their and for mosquitoes people suck protein.,12.883293936481353
384sentences.219,lowPMI,mosquito spread fever other diseases can and bites yellow malaria parasite.,16.599124632433774
384sentences.220,lowPMI,mountain landform steeply land a that a above is rises surrounding.,4.462007628976816
384sentences.221,lowPMI,mountains higher sometimes snow than at and the rise hills have top.,15.501437560314983
384sentences.222,lowPMI,range forms tectonic collision a to of mountains due plate.,16.548991384282917
384sentences.223,lowPMI,mountaineers people hike who up or are climb mountains.,2.7596392297049555
384sentences.224,lowPMI,mouth face put eat the we when the in we is cavity food.,12.667730787895309
384sentences.225,lowPMI,mouth teeth food saliva the and with to it has chew mix.,10.901331450403088
384sentences.226,lowPMI,mouth also kissing the and for is used talking.,5.544040579610531
384sentences.227,lowPMI,speech are tongue mouth by the in sounds controlled placement.,7.766526682807785
384sentences.228,lowPMI,mug sturdy handle hot a with for a a is cup drinking liquids.,28.066198639106144
384sentences.229,lowPMI,mug normally also made glass a can or but of is ceramic be metal.,7.563167877195109
384sentences.230,lowPMI,mug thick ring thermal a a and for is has base insulation.,11.584542380598556
384sentences.231,lowPMI,mugs plain drawings carved can or them or on be have imprinted.,2.686509259633636
384sentences.232,lowPMI,murder unlawful human intent the another of with is killing being.,7.023451163421806
384sentences.233,lowPMI,murder crime victim a it of because the their serious deprives existence.,18.82870837423017
384sentences.234,lowPMI,killing accidentally is considered in in or self-defense war not murder.,13.923076243486848
384sentences.235,lowPMI,convicted is given sentence penalty a or a the murderer often life death.,16.606339152311026
384sentences.236,lowPMI,orange is made orange a the from in juice drink liquid pulp.,12.607282883063965
384sentences.237,lowPMI,orange has acid contains vitamin a a and of juice sweet taste lot c.,24.992510840289167
384sentences.238,lowPMI,freshly orange often pulp well squeezed juice contains as.,13.491526289273342
384sentences.239,lowPMI,orange is drunk glass at a from juice often breakfast.,9.44426544441672
384sentences.240,lowPMI,parrot bird warm regions a that and a in is lives tropical.,12.808342577277642
384sentences.241,lowPMI,parrots brightly-colored sharp beak and a have feathers curved.,21.073998774573354
384sentences.242,lowPMI,parrots human hear can if it the they imitate voice repeatedly.,12.051518228464133
384sentences.243,lowPMI,appearance makes pets their them and abilities popular.,10.874374969009953
384sentences.244,lowPMI,peach orange-yellow characteristic a with an a is fruit smell.,15.87305463809832
384sentences.245,lowPMI,skin is covered fine the a in of and peach thin small hairs.,13.609239868677122
384sentences.246,lowPMI,peaches large stone seed a which inside the have red-brown contains.,23.48733190424022
384sentences.247,lowPMI,peaches sweet be ripening and must and after are delicate harvested.,9.381840224767274
384sentences.248,lowPMI,piano popular instrument means the by a a of is musical played keyboard.,15.476909789254979
384sentences.249,lowPMI,pressing key felt-tipped hit steel a to a a piano causes hammer vibrating string.,19.550054177997886
384sentences.250,lowPMI,piano enormous range change quality the and the an to has note pedals sound.,16.44755215738375
384sentences.251,lowPMI,piano is famous give concerts the can and repertoire large pianists solo.,18.034331052883736
384sentences.252,lowPMI,piranhas small fish south rivers that in are ferocious live american.,9.976534991985785
384sentences.253,lowPMI,piranhas attack are active and and the in during live schools most day.,14.932567799265296
384sentences.254,lowPMI,piranhas very teeth opportunistic and have sharp are carnivores.,5.250089024187305
384sentences.255,lowPMI,piranhas fish lizards carrion and eat insects mammals.,15.377798889399529
384sentences.256,lowPMI,raspberry fruit forest fields the that or a in is grows clearings.,15.040756927310445
384sentences.257,lowPMI,single consists small joined a of raspberry many fruits together.,6.398298331422357
384sentences.258,lowPMI,raspberries eaten sugar by or into themselves with are cooked jam.,19.018593041810064
384sentences.259,lowPMI,leaves are fresh herbal of or the in raspberry used dried teas.,12.649107173430147
384sentences.260,lowPMI,raven large bird many a that a in is black thrives climates.,14.115051543318248
384sentences.261,lowPMI,ravens carrion berries animals on or feed insects small.,18.86661066981174
384sentences.262,lowPMI,ravens large are problem and of have brains capable solving.,8.35758966579887
384sentences.263,lowPMI,folklore are ill-omen tricksters in and of ravens birds also.,11.529242358877053
384sentences.264,lowPMI,refrigerator cooling used preserve a to a and is device contain food.,9.688858089010562
384sentences.265,lowPMI,refrigerators small freezing some a can at have compartment temperature.,7.399963147409
384sentences.266,lowPMI,refrigerator shelves compartments types a and of can for have small different food.,7.251966663459339
384sentences.267,lowPMI,refrigerator generally people put surface a on and its is white often magnets.,8.858204222077541
384sentences.268,lowPMI,rifle firearm shoulder barrel grooves a that the a a on and with is rests has twisting.,11.419606069339697
384sentences.269,lowPMI,grooves bullets rifle fly the around as through the the they the make spin axis air.,25.256533544487183
384sentences.270,lowPMI,rifles used shooting sometimes in with and are hunting sports scopes.,9.245759598409313
384sentences.271,lowPMI,assault fire are infantry can and in the rifles bursts standard weapon.,3.3507039508301495
384sentences.272,lowPMI,salmon fish fresh ocean spawn a from the to that to and is migrates water back.,25.703006472123093
384sentences.273,lowPMI,salmon is red high content taste or and and a flesh orange has protein nice.,14.754938111941232
384sentences.274,lowPMI,salmon eaten sushi grilling other can or or in by in be raw cooked poaching ways.,21.5186159885884
384sentences.275,lowPMI,salmon most farmed also caught the it in though can the is common fish be wild.,11.929013485561418
384sentences.276,lowPMI,saw tool hard abrasive cut materials a that or a a to is uses blade wire hard.,11.502219865408762
384sentences.277,lowPMI,small points side are teeth the the the along of the sharp cutting saw called.,20.079672648395654
384sentences.278,lowPMI,saws worked powered motor engine can or an by by or be hand electric gas.,19.14581957015099
384sentences.279,lowPMI,saws used forestry carpentry in and are extensively construction medicine.,8.5387536745617
384sentences.280,lowPMI,scientist produces knowledge world a about and the studies new physical.,8.442540615618794
384sentences.281,lowPMI,scientist hypotheses experiments a to and them creates does test.,2.1125166857063573
384sentences.282,lowPMI,physics biology classic sciences and of chemistry are examples.,9.405796596056037
384sentences.283,lowPMI,scientists research conferences their and in publish journals.,14.11050002763549
384sentences.284,lowPMI,scissors two-bladed used a for are instrument cutting.,5.554169208391798
384sentences.285,lowPMI,blades usually plastic handles the or with are metallic metal.,14.979198081802855
384sentences.286,lowPMI,depending format cut hair on and or the can size scissors paper fabric.,15.128535823733003
384sentences.287,lowPMI,shears large used shrubs metal for of or are scissors cutting pieces.,13.545975001433998
384sentences.288,lowPMI,screwdriver tool tightening something a for into a and is inserting screws.,15.83350001067322
384sentences.289,lowPMI,screwdrivers be remove are can after to they also used screws inserted.,11.76758010788403
384sentences.290,lowPMI,screwdriver applies rotating the from the the tip torque handle.,13.563450164210298
384sentences.291,lowPMI,major screwdrivers phillips the of two and types are flathead.,14.562846316917959
384sentences.292,lowPMI,shark large cartilage a with a a is fish skeleton.,13.783357321518382
384sentences.293,lowPMI,sharks streamlined large fin with a have bodies dorsal.,11.080548157191977
384sentences.294,lowPMI,most predate mammals jaws on with and sharks fish powerful.,7.509514203131624
384sentences.295,lowPMI,sharks very senses electrical and can have keen detect fields.,6.229866709310912
384sentences.296,lowPMI,ship large floats water a that on a and is vehicle travels.,12.756512082609257
384sentences.297,lowPMI,ship powered sails diesel a in by can the or be ocean steam engines.,15.773279042879727
384sentences.298,lowPMI,ships used ocean cargo to the to in and are fish transport containers.,12.445815391169793
384sentences.299,lowPMI,cruise are hotels people that between ships floating take cities.,10.36353788764023
384sentences.300,lowPMI,shoe clothing sole heel a the a and for with an a is foot outsole.,8.347135249933993
384sentences.301,lowPMI,shoes usually leather rubber of or are made canvas plastic.,7.629605965480087
384sentences.302,lowPMI,women's often high come styles and and in shoes have heels many colors.,3.7775606969373294
384sentences.303,lowPMI,sneaker shoe athletic a for a and is sports activity.,20.861354870697948
384sentences.304,lowPMI,soldier member armed fights a of who a the on is national forces land.,9.769044802803634
384sentences.305,lowPMI,soldier wear usually a the a in must militia uniform camouflage.,11.750102591032368
384sentences.306,lowPMI,volunteer soldier paid in a his her a for or army is work.,13.891637149008051
384sentences.307,lowPMI,soldier using such grenades a and as fights weapons rifles.,3.0788459648314594
384sentences.308,lowPMI,spears weapons pole head that a at of and one are consist sharpened end.,7.638797149428392
384sentences.309,lowPMI,spears most personal advent the the before of were common weapon firearms.,14.209271696949173
384sentences.310,lowPMI,spears used throwing war for when or in were stabbing fighting.,12.434029168663322
384sentences.311,lowPMI,native still spear fishing some for the and people use hunting.,18.10448302161603
384sentences.312,lowPMI,spiders insects make with that eight are legs silk.,9.263191246035102
384sentences.313,lowPMI,spiders webs use insects with them and to build silk catch.,19.746591595159472
384sentences.314,lowPMI,spiders venomous paralyse prey to their use fangs stuck.,24.48187389240823
384sentences.315,lowPMI,spiders as coin big can a as as or a be small as bird.,10.298355671940783
384sentences.316,lowPMI,swamps low land frequent to are spongy subject inundation.,6.151661220290792
384sentences.317,lowPMI,swamp covered water vegetation a and with is shallow mud.,8.3765871586481
384sentences.318,lowPMI,swamps nesting grounds reptiles and and for are breeding birds.,15.097352115190338
384sentences.319,lowPMI,farmers drain produce arable to often swamps fertile land.,8.651006574348944
384sentences.320,lowPMI,sweater heavy worn warmth a on for a the is garment torso.,16.77741514615734
384sentences.321,lowPMI,sweaters often wool is common from but are knitted cotton also.,13.7233358756269
384sentences.322,lowPMI,sweater front called a down a that the opens is cardigan.,9.20912937507992
384sentences.323,lowPMI,sweaters cut sleeve as decoration in as and differ collar shape well.,9.844124900332407
384sentences.324,lowPMI,table piece flat legs a of a a with and is furniture surface.,15.075119808751742
384sentences.325,lowPMI,are chairs people there a to around for usually table sit.,5.46108654320148
384sentences.326,lowPMI,people cutlery food eat together and a a on to set plates table meal.,15.552911548264792
384sentences.327,lowPMI,tables also surfaces write as or to on are used work.,5.921099278889563
384sentences.328,lowPMI,television appliance displays images a with that an a is screen moving.,10.387199244949134
384sentences.329,lowPMI,televisions mostly watching films for or are used programs.,12.107260324858778
384sentences.330,lowPMI,are play connected console they when a to to used videogames game.,21.382966191250567
384sentences.331,lowPMI,television be received internet can via or or content broadcast cable.,13.065841837618814
384sentences.332,lowPMI,theft taking property the without of their is person's consent.,17.66742775678614
384sentences.333,lowPMI,thieves own sell to to to or it steal something receivers.,12.49423248804028
384sentences.334,lowPMI,theft crime punishable fines a can or and with is be jail.,13.126056451618568
384sentences.335,lowPMI,industrial is ideas property of and espionage theft intellectual.,7.745504020025669
384sentences.336,lowPMI,toaster kitchen toasting using elements a for a is appliance bread heating.,21.56702737234497
384sentences.337,lowPMI,pop-up toast placed eject done the a it in and toasters bread slot once.,15.916995996864658
384sentences.338,lowPMI,toaster have side temperature a the within on a and ovens door tray control.,12.33659589301355
384sentences.339,lowPMI,allow cooked garlic they to like bread with or be toppings cheese.,19.34652167908821
384sentences.340,lowPMI,tomato shiny red savory the and a a with is smooth fruit taste.,22.704233090738974
384sentences.341,lowPMI,tomato changes green gets ripe a from as and to it softens color red more.,21.756489018748766
384sentences.342,lowPMI,tomatoes used salads ketchup well can or to as be make soup as sauce.,4.705271673790721
384sentences.343,lowPMI,are varieties different tastes there with of and many tomato sizes.,19.6067145044453
384sentences.344,lowPMI,train connected cars stations a of between a a that on is series moves track.,5.417464187636573
384sentences.345,lowPMI,train pulled powered electricity the a or by by is locomotive diesel.,20.588064238878413
384sentences.346,lowPMI,freight transports goods long a or of over train containers fuel distances.,19.917628289705725
384sentences.347,lowPMI,commuter transport suburbs city between inside and a trains people stations.,13.263393044689757
384sentences.348,lowPMI,train is passengers train a where or a a on off station place get.,15.44498448980106
384sentences.349,lowPMI,train have machines tickets or for stations counters purchasing.,9.39455164282755
384sentences.350,lowPMI,are rooms eat there to a and in waiting places station.,7.166789052677183
384sentences.351,lowPMI,passengers trains platform or a to from next the cargo enter line.,10.817185971722592
384sentences.352,lowPMI,tropical is formed tropical a over a cyclone storm warm sea.,17.999938934128764
384sentences.353,lowPMI,cyclones very winds rain can and produce powerful torrential.,5.830939380582972
384sentences.354,lowPMI,tropical also high coastal can and cyclone cause waves flooding.,3.798894245937031
384sentences.355,lowPMI,tropical move seriously property a and can cyclone inland damage.,4.147929439554371
384sentences.356,lowPMI,violin instrument is bow the with that a an four with is strings played.,11.186502057159203
384sentences.357,lowPMI,violin smallest pitched family the in and its is highest instrument.,11.175409704721995
384sentences.358,lowPMI,violinist instrument collarbone a between and the the the holds chin.,3.068107670565321
384sentences.359,lowPMI,different are fingering hand by with while the one notes made neck bowing.,14.29550068181265
384sentences.360,lowPMI,vultures scavenging feeding carcasses animals on of the are birds mostly dead.,18.882313996011405
384sentences.361,lowPMI,many have head losing a for without vultures bald feathers heat.,14.370647753199897
384sentences.362,lowPMI,vultures large soar flapping their for to without use wings miles.,10.753458109497272
384sentences.363,lowPMI,vultures attack animals wounded but the may or seldom healthy kill sick.,12.348526935925797
384sentences.364,lowPMI,wall solid defines protects a that an a and is structure sometimes area.,10.246156161859735
384sentences.365,lowPMI,walls building roof space a and into the the delineate support divide rooms.,16.73488039209723
384sentences.366,lowPMI,walls usually stone cement well of as or are made brick as drywall.,8.564672821897751
384sentences.367,lowPMI,retaining provide movement stone a of to or walls barrier earth water.,9.018151180125617
384sentences.368,lowPMI,water most liquid covering the 70% its on of is common earth area.,10.69301986670905
384sentences.369,lowPMI,plants people water live and in must to animals drink order.,3.749794407349042
384sentences.370,lowPMI,water low becomes ice at and a freezes temperature solid.,9.996358701429259
384sentences.371,lowPMI,rain water clouds are vapor that in which from the is falls sky condensed.,21.243365118483915
384sentences.372,lowPMI,whale very mammal ocean a that the a in is large lives.,7.953219321729445
384sentences.373,lowPMI,whales blowholes surfacing through their on when breathe heads.,14.333739232924033
384sentences.374,lowPMI,blubber serves reservoir the a an as in as and whale energy insulation.,14.454894246682711
384sentences.375,lowPMI,whales been meat oil for and have hunted whale ambergris.,13.530416562500898
384sentences.376,lowPMI,window transparent wall light a in to a a through is opening let.,17.100705082459246
384sentences.377,lowPMI,typical is sheets held frames a of by of in window made glass place.,6.380922186812539
384sentences.378,lowPMI,open also air when will through a and window let sound.,6.120689782723186
384sentences.379,lowPMI,windows multiple increase some inside to have panes insulation.,13.079075791627607
384sentences.380,lowPMI,woman female adult a a is human.,10.044458935561016
384sentences.381,lowPMI,woman stereotypically caregiver a a as is seen.,5.941400301359812
384sentences.382,lowPMI,woman pregnant children a and can become bear.,12.416830389178179
384sentences.383,lowPMI,woman different organs a a than has reproductive man.,7.487819417657095