243sentences.0,lowPMI,beekeeping conservation habitats the of encourages local.,4.970976401577916
243sentences.1,lowPMI,is interest local produce it every that in to beekeeper's conserve plants pollen.,18.942261106998654
243sentences.2,lowPMI,passive agriculture not native be make crops as of that for a it to form does require vegetation cleared way.,16.430558534139035
243sentences.3,lowPMI,beekeepers discourage pesticides kill the on they the of because could also use crops honeybees.,19.153666761866972
243sentences.4,lowPMI,artisanal go craft is to their their the for but worth beekeepers extremes product effort.,5.563435306037653
243sentences.5,lowPMI,artisanal emphasizes character consistency and and over honey-making quality quantity.,5.772695270034028
243sentences.6,lowPMI,produce honey become honeybees to of the their finest beekeepers micromanagers.,17.056135821159415
243sentences.7,lowPMI,scout know flows best extract they when the the and to fields nectar select ways honey.,8.159241151741945
243sentences.8,lowPMI,beekeeper hive hum fills as the of the the the 40000 opens deep bees air.,17.275444641034134
243sentences.9,lowPMI,beekeeper honey pollen bee the the and checks stores supplies nursery.,19.851529510766557
243sentences.10,lowPMI,bees bare hands sting gentle across and they his but because crawl arms don't they're.,21.17383692585123
243sentences.11,lowPMI,i recurring exams i'm college a though in about no have dream even longer.,12.741696789060688
243sentences.12,lowPMI,dream day exam suddenly i've gone in the my to my of and it's final i realize never class.,12.806918154205185
243sentences.13,lowPMI,i've even reading any the of never done assignments.,7.946447770773568
243sentences.14,lowPMI,i many people same who the know other have nightmare.,6.841224305108344
243sentences.15,lowPMI,morning study write experience night each the down from in to their the participants had dream previous.,14.138105438573875
243sentences.16,lowPMI,recorded dreams dream intensity they they and and if any each its recalled described emotional.,15.632954129671688
243sentences.17,lowPMI,participants assigned category flying bad nightmare each a a or to as a a then dream such dream dream.,15.867584619950252
243sentences.18,lowPMI,night minds as are every we as we while our when sleep are active awake.,18.29370092903346
243sentences.19,lowPMI,dream cycles minutes we the of each throughout in about night ninety.,8.745770527474502
243sentences.20,lowPMI,images stories combinations places dreams and and our of can feelings strange characters fill.,14.144408974463861
243sentences.21,lowPMI,i start cards went worse when from to to decided playing things bad.,7.060503653598076
243sentences.22,lowPMI,gambling something had i already close to to it and $10000 was i do had spent doing.,14.899877547028671
243sentences.23,lowPMI,friends sick gamble my me away of my were watching savings.,11.803112978183574
243sentences.24,lowPMI,hardest was leaving losing i not the of after the a part horror casino money did have.,13.711052069165904
243sentences.25,lowPMI,good social effects gambling hard on and to the of by data economic legalized are come.,15.69238718839448
243sentences.26,lowPMI,studies having nearby gambling more some a that indicate casino makes problems likely.,11.927483770870072
243sentences.27,lowPMI,gambling be personal marriage may and with also associated bankruptcies problems.,10.269293876492997
243sentences.28,lowPMI,past has dramatic legalized over there of the a generation been expansion gambling.,9.717449486935667
243sentences.29,lowPMI,most have lotteries have as and states instituted many casinos well.,18.084286142845944
243sentences.30,lowPMI,gambling become big business but has very controversial.,9.050488847912014
243sentences.31,lowPMI,wind shook shattering kitchen the the a the from the in hurricane house window.,17.216641920630817
243sentences.32,lowPMI,ran food door kitchen we some and to in the the the grabbed slammed surrendered hurricane.,16.698648615731685
243sentences.33,lowPMI,i afraid be foundation our from would its was house ripped.,9.9683623887383
243sentences.34,lowPMI,later wind house asleep sofa that the we the with the on night shaking fell huddled.,12.940799282879551
243sentences.35,lowPMI,hurricanes limbs suck foundations can of off off and their tear trees houses.,4.221304693655142
243sentences.36,lowPMI,dump rains floods they can that and heavy trigger mudslides.,14.683625067660511
243sentences.37,lowPMI,hurricanes bring surge ocean lurches can a that a of onto also storm wall water land.,9.754553853989346
243sentences.38,lowPMI,scientists several look ancient to of for use methods evidence hurricanes.,6.7437872759942
243sentences.39,lowPMI,strongest deposited windblown sand coastal the at of of the storms layers beach bottoms lakes.,29.655954524816767
243sentences.40,lowPMI,trees passing preserve storm rings by of in a each their drenched hurricanes record growth.,4.402451870608442
243sentences.41,lowPMI,american cream exported different have preferences around but the ice is world countries different.,11.68404742047694
243sentences.42,lowPMI,many enjoy cream local their with people ice flavored delicacies.,20.53763615648548
243sentences.43,lowPMI,tropical vanilla cream topped fresh in with some and places ice is bananas mangos.,25.4693952889364
243sentences.44,lowPMI,i making cream child at a as remember ice home.,6.767346780509193
243sentences.45,lowPMI,poured mixture tub start crank cold we into the it the the a to to cream frozen then turning expose.,17.79875455359913
243sentences.46,lowPMI,eventually i turn crank it that any enough the froze couldn't hand more.,8.041784654090916
243sentences.47,lowPMI,then put half-frozen cream harden the into to of the i container ice freezer.,12.816839313931677
243sentences.48,lowPMI,ice is milk sugar up whipped-in a or to of and cream mixture cream flavorings half air.,25.887467598662283
243sentences.49,lowPMI,butterfat cream makes silky the and it in what and milk is smooth.,16.439763084855894
243sentences.50,lowPMI,high-priced ice is butterfat flavorings with and premium cream loaded natural.,8.391642861002163
243sentences.51,lowPMI,i riding mower chair back when the the my use lawn uncomfortable makes hurt.,18.708767123012425
243sentences.52,lowPMI,i levers control the in me the two of to use front machine.,17.89148037026751
243sentences.53,lowPMI,sharp lawn precisely blade the the of underneath each blades mower sever grass.,22.6932085355592
243sentences.54,lowPMI,mowing is task taught the and me a it lawn long has patience.,10.204601653796354
243sentences.55,lowPMI,lawn is revolving cut even a with to a that an mower machine blades grass height.,15.793361722835657
243sentences.56,lowPMI,blades powered machine motor the by the a may or may be muscle have.,27.923468586343734
243sentences.57,lowPMI,most power lawn is gas the a for common source mowers small engine.,15.170834126672393
243sentences.58,lowPMI,electric are environment not emissions for because the they lawnmowers better do create.,7.385863884047035
243sentences.59,lowPMI,also less are expensive they to and need maintenance less run.,9.149359132197665
243sentences.60,lowPMI,electric mowers much ordinary as an as lawn use electricity toaster.,19.773881519052736
243sentences.61,lowPMI,astronauts long spacewalks a their for train time.,4.353750118033756
243sentences.62,lowPMI,much is underwater of their training conducted.,8.12045327136972
243sentences.63,lowPMI,spend pool spend space they 8 10 the every will may to in for they in hours hour floating.,5.552606780098449
243sentences.64,lowPMI,astronauts be perform repair outside station to and the the to on of practice able construction work space.,13.48340625266513
243sentences.65,lowPMI,commanders flights always many backgrounds test the and of as shuttle are pilots have military pilots.,9.413567673693827
243sentences.66,lowPMI,other are doctors scientists experiments as who in and can astronauts trained engineers run space.,19.58810927909075
243sentences.67,lowPMI,early were men now much diverse all but crews young astronauts are more.,12.212465149406533
243sentences.68,lowPMI,team floated exterior shuttle the out the the of to of astronauts together space.,6.909524547115462
243sentences.69,lowPMI,carried needed broken huge they the the to on tools repair part telescope.,7.045132718850207
243sentences.70,lowPMI,astronaut bolts other replacement place one on while the the the the into loosened pipe fitted part.,16.719565424607804
243sentences.71,lowPMI,computers been art time artists in a for by have used long experimental.,7.747645354974837
243sentences.72,lowPMI,now are affordable computer have mainstream world that the and computers more widespread graphics entered art.,22.971919006012627
243sentences.73,lowPMI,computer conferences art showcase graphics some the that science have exhibitions latest technology.,18.374978569114717
243sentences.74,lowPMI,brand conferences sprung devoted cultures up to two that the new have are bridging.,6.091973007316142
243sentences.75,lowPMI,computer specialist doctors medical surgical the to with and graphics works visualize conditions procedures.,27.81901442605805
243sentences.76,lowPMI,uses animation doctors structures body she within to a digital help understand patient's.,11.29965924132385
243sentences.77,lowPMI,seeing structures screen much squinting the an a at in on than internal animation is clearer x-rays.,10.195515344862526
243sentences.78,lowPMI,modern animation powerful education a for digital is tool.,6.879709105198588
243sentences.79,lowPMI,field graphics graphics help as of we if the broadens must computer ask actually students.,18.925314618269
243sentences.80,lowPMI,research suggest engaging imagery effective that can the and in does vivid digital be classroom.,10.28327394012155
243sentences.81,lowPMI,reason law first was the to the he in came school place cliche.,8.372903161322713
243sentences.82,lowPMI,wanted things he for to the change better.,6.0351550628060835
243sentences.83,lowPMI,recalled law program had all-nighter he at he the one when and an evening school director pulled.,13.67245249637209
243sentences.84,lowPMI,finally drafting several families they for a at finished petition evicted sunrise.,16.020757669400552
243sentences.85,lowPMI,past legal has relentlessly over four the up the decades of cost education gone.,16.787669944783058
243sentences.86,lowPMI,private school increased by of since 1970s a four the law tuition factor.,16.90316926227
243sentences.87,lowPMI,market law new eventually the to for for and could admission school lawyers crash.,8.508142215650507
243sentences.88,lowPMI,law faculty have experience practicing in school often minimal actually law.,12.44960279913547
243sentences.89,lowPMI,professors writing review prestigious on for focus law articles journals.,4.981806254515332
243sentences.90,lowPMI,law often theoretical topics law england the on in with like schools emphasize classes property feudal.,14.157944452763282
243sentences.91,lowPMI,pharmacists increasingly preventive in are involved care.,8.9892076691361
243sentences.92,lowPMI,are front-line advisers go often they to because becoming health people pharmacies.,7.810980301100551
243sentences.93,lowPMI,pharmacists often source public a about of are good information health.,8.264580420865533
243sentences.94,lowPMI,doctors pharmacists lot interactions effects with they about because a and consult know drug side.,1.3155862650833112
243sentences.95,lowPMI,pharmacists prescription patients advice use to about of and the dispense drugs offer safe medications.,19.514557286746765
243sentences.96,lowPMI,also health screenings vaccines they and and conduct wellness provide.,16.102946584645245
243sentences.97,lowPMI,pharmacists professional pass order licensed must two to and in have degrees exams be.,7.724406012869358
243sentences.98,lowPMI,i pharmacy chose much chose pharmacist the as a me to think profession as i be.,17.60437418469009
243sentences.99,lowPMI,i fascinated arranged pharmacies by in a the as was neatly bottles child.,12.761004980456514
243sentences.100,lowPMI,i it's i impact have patients but that of the on my know cliche love i lives.,14.824483640360603
243sentences.101,lowPMI,person own potentially situations each or to his her has response stressful.,6.549202168196372
243sentences.102,lowPMI,person devastated find fulltime one by another may while may be unemployment working stressful.,14.746681945480674
243sentences.103,lowPMI,are stresses stuck there in like everyday being traffic.,6.8079585738156645
243sentences.104,lowPMI,are traumatic such loss there or a as of also stresses divorce child.,10.369966187884451
243sentences.105,lowPMI,people different stress some to can of adapt levels.,7.878669981282352
243sentences.106,lowPMI,not effectively take toll if though a with can on dealt stress real health.,9.057325030669858
243sentences.107,lowPMI,remember reaction determines harmful that to if will your that it or it's stress be beneficial.,6.199651577584206
243sentences.108,lowPMI,company downsizing felt stressed when and my was i incredibly worried.,13.728559600855256
243sentences.109,lowPMI,heart reason even dizzy my for and would no at race i felt times.,5.778596253998297
243sentences.110,lowPMI,then started yoga manage level to my to i taking try stress.,9.878188002022277
243sentences.111,lowPMI,man jet tuxedo stripes the with a wore black satin.,14.952461199433046
243sentences.112,lowPMI,was rich cut style it in with the made fabric latest.,8.303000478128734
243sentences.113,lowPMI,clearly tailored man he as the it it had fit perfectly.,9.77411107191675
243sentences.114,lowPMI,looked professional have formal it a out a like would for something stylist picked event.,11.842453786959608
243sentences.115,lowPMI,tuxedo still today's are personal wedding while in the is preferred grooms making statements attire.,10.780691452341529
243sentences.116,lowPMI,shorter are edge fashion on of the for jackets cutting wedding men.,10.10031291226066
243sentences.117,lowPMI,grooms also tuxedos shirts ties up with their and are jazzing colorful satin.,14.17658901307933
243sentences.118,lowPMI,tuxedo is dinner black lapels a with a jacket tailless jacket silk.,30.132977841983415
243sentences.119,lowPMI,black trousers perfect tuxedo should to a the tie be match jacket.,11.989128147212677
243sentences.120,lowPMI,shirt be white be match lapels the and should the should the and always plain tie black jacket.,12.346992797265237
243sentences.121,lowPMI,concert went the in blind pianist adulthood.,13.86780085031458
243sentences.122,lowPMI,blindness caused condition damaged her a the by that was genetic slowly eyes.,19.571982387473597
243sentences.123,lowPMI,told being was pianist she an a that to interviewers blind advantage.,11.984949535491218
243sentences.124,lowPMI,had distractions more music she so could her no she on visual concentrate fully.,6.809263946508668
243sentences.125,lowPMI,government blindness insufficient activities the for of as the defines vision ordinary life.,11.631185927006317
243sentences.126,lowPMI,establishing legal resources focused blind by of on the can the parameters blindness be legally.,12.729069269345308
243sentences.127,lowPMI,overlook vision do meet this those but the may who who have problems not standard.,12.705314451037536
243sentences.128,lowPMI,developing blindness is caused disease deficiencies in by in and countries children usually infectious nutritional.,21.930256929041395
243sentences.129,lowPMI,causes be medicine supplements these by can and often prevented vitamin.,10.493559258211182
243sentences.130,lowPMI,developed blindness more be genetic in by to countries is likely caused problems.,12.115428853495164
243sentences.131,lowPMI,one knows taste mouth no a your your how from to really exactly gets brain.,9.400425430456703
243sentences.132,lowPMI,scientists process molecule touches bud the a a when of think begins food taste cell.,10.542570588504224
243sentences.133,lowPMI,cell taste taste cell the to the a beneath carries message nerves.,13.058284398559486
243sentences.134,lowPMI,was believed bud basic it each one the that to of four once taste responded tastes.,9.821717204575288
243sentences.135,lowPMI,is bud tongue only eating sweet that on of would you a the the if taste tip respond were something.,15.713581139273757
243sentences.136,lowPMI,scientists think taste be basic that can all the a to of now single bud sensitive tastes.,16.49607577114845
243sentences.137,lowPMI,sense isn't good tend foods strong my so with of to taste very i eat very flavors.,9.02104062439081
243sentences.138,lowPMI,i lots sauce drink cream it's bitter of my no and with like hot i coffee so very.,6.1306233379663535
243sentences.139,lowPMI,i even sweetness so make i extra when can't taste well i cookies add sugar.,2.555068508101476
243sentences.140,lowPMI,hip are problem individuals a for fractures real aging.,3.1934103005403296
243sentences.141,lowPMI,patients faced break process with of and of the the the are pain difficult healing.,3.164976474052101
243sentences.142,lowPMI,families adjust loss to the to of have patient's independence.,18.389981007963065
243sentences.143,lowPMI,society fractures substantial time and and the for in hip involve expense hospital.,7.6911229255734845
243sentences.144,lowPMI,halfway i sound snapping through a their the like race heard someone fingers.,19.410695683503988
243sentences.145,lowPMI,i crunch knew foot broken a that and my felt i instantly was.,9.04351495321628
243sentences.146,lowPMI,step running every on like felt spikes.,9.470752631069784
243sentences.147,lowPMI,doctor's afterward clearly fracture at the the the office x-ray showed.,19.06193511576876
243sentences.148,lowPMI,are different bone there of a few types fracture.,10.912905022498608
243sentences.149,lowPMI,closed fractures is skin intact in the the or but simple bone broken is.,28.385974058488472
243sentences.150,lowPMI,open fractures bone punctured produced wound in the and or the an compound broken has skin open.,27.226497349735073
243sentences.151,lowPMI,new piercings infected not cleaned can if ear become they're carefully.,12.460053494840192
243sentences.152,lowPMI,signs include swelling earlobe of around or the infection tenderness redness.,10.555763887326595
243sentences.153,lowPMI,see clean apply if these and you the some symptoms area ointment.,6.008394605567417
243sentences.154,lowPMI,redness don't contact care if and your the away swelling go health provider.,4.122604040172601
243sentences.155,lowPMI,local has new reduce a to hospital initiated measures infections.,6.0898745546882465
243sentences.156,lowPMI,have hand habits infected are other they that and from improved washing ensured patients isolated patients.,11.048832181247745
243sentences.157,lowPMI,hospital seen rates new began the the since has infection drop measures.,8.932994475063929
243sentences.158,lowPMI,scrubbing soap delays increases infection a or the with which of wound alcohol healing risk.,17.916550609021463
243sentences.159,lowPMI,band-aids risk holding moisture can of in the by and increase infection heat.,11.480304588639132
243sentences.160,lowPMI,fortunately skin easily treated diagnosed can they once most infections be are.,12.230483294669948
243sentences.161,lowPMI,modern started sixteenth at of the the opera end century.,4.648472592574787
243sentences.162,lowPMI,began rediscover greek performance it an and as to effort imitate tragic.,9.945231752699376
243sentences.163,lowPMI,early opera tales subject of for from their founders chose antiquity matter.,16.71673830719336
243sentences.164,lowPMI,later branched sources musical out of into and operas different stories traditions.,16.76451527415439
243sentences.165,lowPMI,opera art singers perform combines music an which a and in and that is form musicians play words.,18.2219800208574
243sentences.166,lowPMI,incorporates elements theatre acting costumes it the as of of and many spoken such scenery.,9.859634355861692
243sentences.167,lowPMI,performances typically opera accompanied in and an an by are given house orchestra.,8.035530981260555
243sentences.168,lowPMI,opera has hard role production the the the to in singer worked win new.,5.82928955013776
243sentences.169,lowPMI,job not singing her about is just.,7.52374019914553
243sentences.170,lowPMI,acting presence interpretation critical and all stage musical are.,11.281217667071664
243sentences.171,lowPMI,pure voice certainly show but the the her of strong is star.,7.202984416626865
243sentences.172,lowPMI,painter many mind painting a in a must while keep elements completing.,6.299584156267497
243sentences.173,lowPMI,has solid design composition she of and to like use elements strong lighting.,4.576148345345558
243sentences.174,lowPMI,has brush skill she the to with execute strokes.,3.572866339611888
243sentences.175,lowPMI,most content reveal painter's the the a the of should of importantly painting glimpse soul.,4.665976317804626
243sentences.176,lowPMI,long painters employed skilled creative as as than ago were more artisans artists.,13.804831720233675
243sentences.177,lowPMI,however painters social scholars royal the and the of of prominent had status members court.,8.510664680392503
243sentences.178,lowPMI,signed decided imagery personal patrons they on and a their their its and with work subject established relationship.,7.164303928026117
243sentences.179,lowPMI,painter learned less scene painting as to the on itself a on and the i focus actual more.,17.403332793739164
243sentences.180,lowPMI,artist's is camera has everything vision an that within of a to its eye not lens record field.,11.705863511769328
243sentences.181,lowPMI,i nature useful more needed painting but for than a found provides information is good.,21.796640092181384
243sentences.182,lowPMI,eagle is bird the an owl impressive.,14.698471565610253
243sentences.183,lowPMI,has tufts horns it up that like ear stick.,6.594178474459855
243sentences.184,lowPMI,large eyes downright look right its like could you and they through orange are creepy pierce.,23.27234384874518
243sentences.185,lowPMI,owl night swiftly darkness this and the at through hunts flying silently.,14.951842390303732
243sentences.186,lowPMI,owl have endangered are while some species become others thriving.,13.280536747142053
243sentences.187,lowPMI,barred has well habitat the its beyond owl spread previous.,8.113504982476298
243sentences.188,lowPMI,early suggest have barred invasion that the may findings logging facilitated owl's.,9.107810036250358
243sentences.189,lowPMI,owl thick gripped the a it her on and with landed branch talons.,7.337031164439789
243sentences.190,lowPMI,pressed sides down eye she to and her her an wings settled half-closing.,3.0724436696342856
243sentences.191,lowPMI,have statue eyes she a for of might but the her been glow.,3.1494084959423567
243sentences.192,lowPMI,it's watch bear floating ice to across a unnerving polar stalk sea.,12.763066021883024
243sentences.193,lowPMI,it's worse submerged waters huge when in beneath you the the even are frigid directly animal.,4.454211314909529
243sentences.194,lowPMI,overhead paws ice bear prey down the the on as its giant set polar pursued.,12.352872364273086
243sentences.195,lowPMI,part crew bear i months shots as the a of for these film polar documentary spent capturing.,4.860095391281982
243sentences.196,lowPMI,polar are animals people other confusion one the will than of that for or bears few attack reasons fear.,11.101731679359112
243sentences.197,lowPMI,attack live environment they out because in may of they a hunger food-scarce.,2.9845862760513566
243sentences.198,lowPMI,sneak slowly conserve they up to will on their people careful energy.,9.916996449262731
243sentences.199,lowPMI,seal important polar diet the of an the is part bear's.,7.872973971372804
243sentences.200,lowPMI,hunting seal's hole seals basking when will a that the they by or on wait breathing stalk are ice.,19.251429144947
243sentences.201,lowPMI,polar crawl forward place looks the and when around will in the bear quietly freeze seal.,17.943765625592235
243sentences.202,lowPMI,medieval was structure primarily the for a castle not built defense.,8.468391296351587
243sentences.203,lowPMI,purpose dominate its its to was surroundings.,3.4712477322187434
243sentences.204,lowPMI,castle control day's a within could a easily lands walk.,4.692731558350668
243sentences.205,lowPMI,times peasants property brought walls during and inside for of could the attack livestock be castle's protection.,18.392461435633063
243sentences.206,lowPMI,spectacular dramatic provide stormy many in of of a the castles locations record history regions.,14.704364534021698
243sentences.207,lowPMI,today atop cliffs beautiful quaint they and stand rocky overlooking landscapes villages.,17.709405369397235
243sentences.208,lowPMI,past home plots in they and the to were battles intrigue.,10.272227826089175
243sentences.209,lowPMI,leaving station hotel magnificent built upon we above on the our a a train saw looming castle cliff.,33.47303313811189
243sentences.210,lowPMI,thick walls inner hundreds river the of the an above outside sheltered courtyard feet.,30.371576717155868
243sentences.211,lowPMI,tower had slightly view our but an rooms incredible scary.,7.171912463898805
243sentences.212,lowPMI,climbing feet pyramid gestured black after the the me a up of the into fifty side man small entranceway.,12.814003589511504
243sentences.213,lowPMI,led pyramid's this the the into at chamber center.,4.840095494903921
243sentences.214,lowPMI,i steep narrow him the down followed dark passage.,7.633484363078401
243sentences.215,lowPMI,smell was air thick the the the inside and pyramid chalky was.,18.054528621454004
