243sentences.214,Original,i followed him down the steep dark narrow passage,25.23106459209393
243sentences.215,Original,the smell inside the pyramid was chalky and the air was thick,21.598150535914197
243sentences.216,Original,more than just the tomb of the king pyramids represented the pride of the nation,33.312591147044145
243sentences.217,Original,the care that the pyramid builders took in their craft is evident,28.842878608309054
243sentences.218,Original,the stones covering the pyramid were precisely fitted together and polished until the structure gleamed,34.74232113474485
243sentences.219,Original,architects are still working to solve the mysteries of how pyramids were constructed,33.63193703015025
243sentences.220,Original,some think ramps were built inside the pyramid's walls to raise stone blocks,25.100077480425437
243sentences.221,Original,others speculate that ramps zigzagged up the exterior walls of the pyramid,35.819009520271706
243sentences.222,Original,even beginner rock climbing takes courage and strength,20.782894148507516
243sentences.223,Original,climbers who are learning the sport can try scrambling on large boulders,26.423340571429133
243sentences.224,Original,once they're comfortable with that they can begin using ropes to safely climb vertical rock faces,44.64719459578587
243sentences.225,Original,all of the boys on the trip were new to rock climbing,22.04428420223371
243sentences.226,Original,many were afraid of heights,13.347814085430727
243sentences.227,Original,having someone else check their knots and harnesses helped them calm down,33.26912046906985
243sentences.228,Original,the adults set up climbing routes appropriate for beginners,30.481951767373992
243sentences.229,Original,free-climbing is one particular style of rock climbing,22.56056995571568
243sentences.230,Original,the climber relies solely on her skill and physical strength to ascend a rock face,46.85899275635446
243sentences.231,Original,rope and bolts are the only equipment used,14.208284061633957
243sentences.232,Original,they are meant only to stop the climber if she falls,26.586184289722294
243sentences.233,Original,i hesitantly skied down the steep trail that my buddies convinced me to try,44.54976760422305
243sentences.234,Original,i made a bad turn and i found myself tumbling down,26.286754339171967
243sentences.235,Original,i finally came to a stop at a flat part of the slope,31.752633410637472
243sentences.236,Original,my skis were nowhere to be found and my poles were lodged in a snow drift up the hill,50.67387707462678
243sentences.237,Original,a major strength of professional skiers is how they use ski poles,31.301651660802275
243sentences.238,Original,proper use of ski poles improves their balance and adds flair to their skiing,33.02175191271711
243sentences.239,Original,it minimizes the need for upper body movements to regain lost balance while skiing,40.19821184202307
243sentences.240,Original,new ski designs and stiffer boots let skiers turn more quickly,21.069874536869197
243sentences.241,Original,but faster and tighter turns increase the twisting force on the legs,26.119049684552945
243sentences.242,Original,this has led to more injuries particularly to ligaments in the skier's knee,15.06721832440029
384sentences.0,Original,an accordion is a portable musical instrument with two keyboards,32.442673346297624
384sentences.1,Original,one keyboard is used for individual notes the other for chords,18.090629715923047
384sentences.2,Original,accordions produce sound with bellows that blow air through reeds,16.986362958667247
384sentences.3,Original,an accordionist plays both keyboards while opening and closing the bellows,29.253346507970694
384sentences.4,Original,an apartment is a self-contained home that is part of a building,20.53590615417916
384sentences.5,Original,an apartment may have one or more rooms as well as a kitchen and a bathroom,40.69226275256028
384sentences.6,Original,some apartments are for single people others for families,9.67528180696574
384sentences.7,Original,the building can have a garage a laundry facility or extra storage space,37.67385106804585
384sentences.8,Original,an apple is a fruit that can be green red or yellow,26.109093954822633
384sentences.9,Original,apples have thin skin a crisp sweet pulp and seeds inside,28.095540153393358
384sentences.10,Original,some very tart apples are used to make cider,35.907889277903166
384sentences.11,Original,apples can be eaten raw roasted or baked in pies,35.267579088493555
384sentences.12,Original,arson is the criminal act of burning a building or wildland,23.73393684344296
384sentences.13,Original,a fire investigation determines if a fire was caused by accident or arson,34.52457927003578
384sentences.14,Original,arson can be done to cause damage to others or collect insurance,33.44090717253507
384sentences.15,Original,the severity of the crime depends on whether people were harmed,30.00042394317007
384sentences.16,Original,an automobile or car is a wheeled vehicle for transporting passengers,43.262984804149966
384sentences.17,Original,a car can be powered by a gasoline or electric engine,29.61958559548123
384sentences.18,Original,the driver steers the car on roads other passengers just sit,28.56502181672413
384sentences.19,Original,automobiles vary in size number of doors and the type of trunk,24.572519672513288
384sentences.20,Original,the axe is a tool used to split and cut wood,27.40807574861385
384sentences.21,Original,the axe usually consists of a head attached to a handle,24.268019995381035
384sentences.22,Original,historically axe heads were made of stone and then metal,19.56634120972142
384sentences.23,Original,axes are used by woodcutters and firemen entering buildings,25.749862283648014
384sentences.24,Original,a banana is a long fruit that grows in bunchs with a soft edible inside,25.60980064758716
384sentences.25,Original,a banana when ripe can be yellow purple or red and have small brown spots,37.34086250138854
384sentences.26,Original,the greatest producers are tropical countries such as india or ecuador,30.777808718554162
384sentences.27,Original,unripe bananas and plantains are staple foods and often cooked like potatoes,42.5935059307032
384sentences.28,Original,a bed is a piece of furniture used as a place to sleep or have sex in,38.87086282502625
384sentences.29,Original,a bed is made of a mattress and a box spring plus sheets pillows and covers,23.98705589147651
384sentences.30,Original,in waterbeds the mattress is filled with water and in airbeds it is filled with air,34.0740580522786
384sentences.31,Original,another type of bed is the hammock a fabric sling suspended above the ground,39.886896935088224
384sentences.32,Original,a bee is a flying insect with a black and yellow body and six legs,35.411602054761644
384sentences.33,Original,bees spread pollen between flowers as they collect nectar to make honey,27.612085487935794
384sentences.34,Original,bees are social insects and live together in a colony located in a hive,37.252945817953325
384sentences.35,Original,many bees have stingers and can attack if they feel threatened,27.251694743522513
384sentences.36,Original,a bicycle is a vehicle with two wheels and pedals on a frame,29.074968378092997
384sentences.37,Original,a bicycle is propelled by the pedalling of a cyclist on the saddle,29.479021754501968
384sentences.38,Original,the wheels have rubber tires with an inner tube full of air,36.802883148585664
384sentences.39,Original,people use bicycles for transportation recreation and racing,15.21416653062159
384sentences.40,Original,a blacksmith creates objects by forging iron or steel,23.094126465148804
384sentences.41,Original,a blacksmith hammers and bends hot iron on an anvil to change its shape,43.066782206192464
384sentences.42,Original,blacksmiths wears a thick apron and handle the metal with tongs,23.424371258687223
384sentences.43,Original,blacksmiths make objects like weapons horse shoes or iron furniture,18.682811138030413
384sentences.44,Original,a blender is a kitchen appliance used to mix ingredients or puree food,39.41639513137115
384sentences.45,Original,blenders have a glass or plastic container with a rotating blade in the bottom,46.57294191694179
384sentences.46,Original,blenders are used to make milk shakes and fruit smoothies,41.41121549470415
384sentences.47,Original,blenders are also used to make cold alcoholic drinks with crushed ice,46.061510156146134
384sentences.48,Original,a boy is a young male child who has not undergone puberty,36.57741412759641
384sentences.49,Original,the term is used to indicate sex distinctions relative to girls,28.2949339557701
384sentences.50,Original,traditionally boys like to play rough games and fight with each other,34.486599985319074
384sentences.51,Original,an adult male behaving immaturely is often referred to as a boy,51.06347230424628
384sentences.52,Original,broccoli is a plant in the cabbage family,16.4132054684433
384sentences.53,Original,broccoli has a green flower head and a thick tough stalk,24.295401010865636
384sentences.54,Original,broccoli is high in vitamins fiber and other nutrients,14.638573935866342
384sentences.55,Original,broccoli can be boiled stir-fried or eaten raw,22.688947561372444
384sentences.56,Original,a butterfly is a flying insect with four large wings,25.074015110252212
384sentences.57,Original,the wings of butterflies can be very colorful and patterned,24.15214310976864
384sentences.58,Original,metamorphosis is the transformation of a caterpillar into a butterfly,22.85372014592902
384sentences.59,Original,some people collect butterflies because of their colorful wings,24.620851514708892
384sentences.60,Original,a carpenter is an artist or manual laborer who works with wood,39.17470371158999
384sentences.61,Original,carpenters build and repair houses furniture boats and other objects,21.718222445273053
384sentences.62,Original,carpenters use tools such as hammers saws pliers and planes,20.333237707542715
384sentences.63,Original,a luthier is a carpenter that makes and repairs musical instruments,28.060685181778734
384sentences.64,Original,cats are small furry animals with four legs and a tail,33.23013940953985
384sentences.65,Original,cats like to groom themselves by licking their fur,24.491333178974926
384sentences.66,Original,cats can hunt mice or birds but are often fed by their owners,31.46213677318317
384sentences.67,Original,the claws of cats are retractable so that they keep sharp,19.679787486464303
384sentences.68,Original,a chair is a piece of furniture designed for people to sit on,36.8536836597154
384sentences.69,Original,chairs consist of a seat raised above floor level supported by legs,32.11928794224495
384sentences.70,Original,chairs can also have back and arm rests as well as a cushion,37.598382765591516
384sentences.71,Original,seats are fixed chairs located in vehicles or in places like cinemas,23.29361874997845
384sentences.72,Original,a clarinet is a woodwind musical instrument,23.223262229745636
384sentences.73,Original,a clarinet is a long black tube with a flare at the bottom,29.522573659594542
384sentences.74,Original,the player chooses notes by pressing keys and holes,24.28634586722832
384sentences.75,Original,the clarinet is used both in jazz and classical music,25.465352188798043
384sentences.76,Original,a cod is a fish that lives in the colder areas of the atlantic,29.053790741257156
384sentences.77,Original,cod flesh is white and mild-tasting and flakes easily when cooked,21.874932829466783
384sentences.78,Original,fresh cod is used for fish and chips salted cod for elaborate dishes,46.936683042470996
384sentences.79,Original,cod has been caught salted and traded since the time of the vikings,28.990590334068386
384sentences.80,Original,coffee is made from coffee beans the seeds of the coffee plant,29.467633652747377
384sentences.81,Original,coffee is a popular drink in many countries and usually served hot,26.030140290559977
384sentences.82,Original,coffee contains a mild drug called caffeine that keeps people awake,23.143389007370406
384sentences.83,Original,coffee is the world's seventh-largest legal agricultural export,20.905314997369793
384sentences.84,Original,a desert is a natural environment where almost no rain falls,33.5994837989671
384sentences.85,Original,hot deserts are usually filled with sand dunes or rocks,43.38361009834417
384sentences.86,Original,some animals and plants have adapted to live in deserts,26.61621220063071
384sentences.87,Original,the biggest hot desert is the sahara in northern africa,22.407152142681625
384sentences.88,Original,a desk is a piece of furniture used for working at sometimes with a computer,35.61221512581076
384sentences.89,Original,a desk has a flat surface and can be made of wood plastic or metal,39.94280692029969
384sentences.90,Original,a desk may have drawers to store supplies and papers,18.741993633893458
384sentences.91,Original,a cubicle consists of a desk surrounded by partitions on three sides,31.785384709448234
384sentences.92,Original,a door is a movable barrier to entrance or exit from an enclosed area,40.20066086379305
384sentences.93,Original,most doors have locks to control who gets to pass through them,24.40406721318939
384sentences.94,Original,most doors are opened by pushing or pulling a handle after they are unlocked,26.78426406751401
384sentences.95,Original,other types of doors can slide or consist of a revolving chamber,31.00322167182849
384sentences.96,Original,a dress is a piece of clothing that women sometimes wear,22.96666079941582
384sentences.97,Original,a dress is like a shirt attached to a long matching skirt,26.36486554057962
384sentences.98,Original,a dress is usually worn at formal occasions such as a wedding or a dance,42.295797938929326
384sentences.99,Original,it can be hard to climb stairs or ride a bike in a dress,39.51534766408569
384sentences.100,Original,drunk driving is the act of driving under the effects of alcohol,30.663789349858508
384sentences.101,Original,drunk driving of any vehicle is a crime in most of the world,33.33319712209533
384sentences.102,Original,it plays a role in almost half of all vehicle-related deaths,23.407133789086043
384sentences.103,Original,drunk drivers are caught by field sobriety and breathing tests,31.130044497721194
384sentences.104,Original,a drought is a persistent shortage of the water supply caused by lack of rain,46.08339571395423
384sentences.105,Original,drought will cause crops and plants to stop growing and die,21.129255944177874
384sentences.106,Original,extreme drought will eventually turn areas into desert and cause famine,25.749423431899412
384sentences.107,Original,large numbers of people have to migrate away from dust bowls,43.954293069345866
384sentences.108,Original,eagles are large birds of prey that hunt during the day and have very good eyesight,33.01019920676401
384sentences.109,Original,eagles have hooked beaks for tearing flesh strong legs and sharp talons,42.115897311981854
384sentences.110,Original,eagles live in eyries and some species eat fish and others small mammals,34.351574618609696
384sentences.111,Original,the bald eagle has a bright white head and is the national bird of the united states,46.61926428218957
384sentences.112,Original,earthquakes shake the ground and can knock down buildings and other structures,30.71913921051687
384sentences.113,Original,the shaking can also trigger landslides and volcanic activity,30.620651724573953
384sentences.114,Original,most earthquakes are caused by the release of energy in the earth's crust,30.667291480713093
384sentences.115,Original,an earthquake at sea can displace the seabed and cause a tsunami,32.10420409956724
384sentences.116,Original,elephants are the largest kind of land mammal weighing several tons,34.55219705768009
384sentences.117,Original,an elephant has a long nose called a trunk which can grab things or food,34.12586357628386
384sentences.118,Original,the elephant has a pair of ivory tusks for moving objects or digging into trees,50.357913187080584
384sentences.119,Original,the elephant flaps its large ears to cool the blood in them and its body,28.902985358630254
384sentences.120,Original,the eye is an organ for sensing light and coding it for the visual cortex,37.995443283741615
384sentences.121,Original,most animals have complex eyes which can detect color motion and texture,19.900777384319767
384sentences.122,Original,the fovea is the center of the human eye and the most sensitive part of it,40.21545118568967
384sentences.123,Original,insects have compound eyes made up of eye units facing in many directions,22.66051990617656
384sentences.124,Original,a farm is land used to grow plants or raise animals for food,31.28572779992049
384sentences.125,Original,farmers are the people who run the farm and decide what to produce,29.688356745837357
384sentences.126,Original,farms usually have a house for farmers a silo and a barn,18.61857460981594
384sentences.127,Original,a cooperative is a farm where many farmers share the land and equipment,26.93188594719166
384sentences.128,Original,primates usually have four fingers and a thumb on each hand,19.884941968976573
384sentences.129,Original,fingers are used for grasping writing grooming and other activities,22.54327438289211
384sentences.130,Original,the fingertips are sensitive to temperature pressure and vibration,13.479328953533079
384sentences.131,Original,the nail protects the tip of the finger and can be grown or decorated,26.468050464439404
384sentences.132,Original,a flood is an overflow of an expanse of water that submerges inhabited land,34.521198569281154
384sentences.133,Original,flood can be caused by heavy rain or rapid snow melt as well as earthquakes at sea,58.94105028369183
384sentences.134,Original,in a flood a river will flow out of its channel or break dams and levees,36.426019201525364
384sentences.135,Original,during a flood people evacuate and the contaminated water causes diseases,21.183167942331288
384sentences.136,Original,a floor is a horizontal surface inside a building used for walking on,30.219710134410366
384sentences.137,Original,floors may be made of bare concrete tile linoleum or wooden floorboards,50.7221843095632
384sentences.138,Original,people often put carpets on a floor for comfort and to dampen noise,27.714341211076324
384sentences.139,Original,in buildings the floor often has pipes and electrical wiring under it,27.10802058924695
384sentences.140,Original,a foot is a body part on the end of a leg,22.77125406802748
384sentences.141,Original,people use their feet when walking running or standing straight,20.051609321790526
384sentences.142,Original,people also use their feet to kick in both fighting and sports,21.99955407026083
384sentences.143,Original,many cultures have rules for behavior related to feet,21.083471139662244
384sentences.144,Original,a forest is an area with a high density of trees and canopy cover,38.49536542154855
384sentences.145,Original,the type of forest depends on temperature and rainfall in its location,29.333966765928224
384sentences.146,Original,a forest ecosystem has various types of trees and animals as well as ground plants,48.40438725010465
384sentences.147,Original,deforestation is the cutting down of forests disregarding regeneration,12.993227292238046
384sentences.148,Original,a fork is a tool for eating solid foods with a handle and several tines,41.5865360701528
384sentences.149,Original,forks are usually made of metal or plastic if disposable,20.745705118980222
384sentences.150,Original,forks are used to lift food to the mouth or to hold food in place while cutting,33.64615351159645
384sentences.151,Original,forks are used in western cultures and there are special kinds for various foods,38.536638720031796
384sentences.152,Original,a frying pan is a small pan with sloping sides and a handle,47.116359058370165
384sentences.153,Original,a frying pan is used to fry sear and brown food,33.40385181456169
384sentences.154,Original,the food is cooked on oil covering the bottom of the pan,24.69377367865066
384sentences.155,Original,frying pans are made of iron or teflon-clad steel,24.510679056578823
384sentences.156,Original,a girl is a female human who has not yet reached maturity,36.89126995180775
384sentences.157,Original,at puberty the body of a girl develops into that of a woman,27.539381768226004
384sentences.158,Original,girls often like playing with dolls and social games,20.013071967716325
384sentences.159,Original,girls sometimes grow long hair and wear dresses and skirts,29.228738449697538
384sentences.160,Original,a glove is a piece of clothing that covers the hand and fingers,27.32140989461995
384sentences.161,Original,gloves to protect against cold are made of wool or lined waterproof material,35.87200829908991
384sentences.162,Original,disposable rubber or latex gloves are used to shield hands from germs or chemicals,47.62957828503398
384sentences.163,Original,a mitten is a kind of glove where the four fingers are covered together,26.990055117013437
384sentences.164,Original,a hammer is a tool used to deliver an impact to an object,36.36742990344962
384sentences.165,Original,a hammer is most often used to drive nails into wood,35.964824152936764
384sentences.166,Original,the claw on the head can be used to remove nails,30.289545957116047
384sentences.167,Original,hammers vary in the shape of the head and handle length,21.96119438417805
384sentences.168,Original,a hand grenade is an explosive used as a weapon against people,38.90569140233696
384sentences.169,Original,hand grenades are thrown and timed to explode a bit after that,30.886621618990986
384sentences.170,Original,grenades can also be fired from rifles or shoulder launchers,22.714253191200022
384sentences.171,Original,tear gas grenades are thrown into the middle of a mob to disperse it,49.9414285601984
384sentences.172,Original,a horse is a large hoofed mammal with four long muscular legs,42.672275618421814
384sentences.173,Original,a horse has a tail and a mane on its neck and is usually gray or brown,35.46681645617284
384sentences.174,Original,horses have been used for draft work travel and entertainment,22.67512267142658
384sentences.175,Original,a human can ride a horse while it walks trots or gallops,21.163754587329468
384sentences.176,Original,people go to hospitals to be healed when they are sick or injured,38.86390109555368
384sentences.177,Original,hospitals are staffed by professional physicians surgeons and nurses,22.592647794057754
384sentences.178,Original,some patients go there for specialist diagnosis or therapy leaving the same day,24.300838094804753
384sentences.179,Original,for some operations or treatments patients have to stay for several weeks,29.454380989919876
384sentences.180,Original,a house is a permanent building or structure for people or families to live in,29.854222045528076
384sentences.181,Original,a house has a roof and walls to keep out cold and rain and windows to let light in,35.348787011977976
384sentences.182,Original,a house can have rooms for purposes like sleeping cooking or washing,21.078861708228377
384sentences.183,Original,most people leave the house to work and come back at night to eat and sleep,38.27616301617013
384sentences.184,Original,an igloo is a type of shelter made from blocks of snow by inuit,29.264825752931294
384sentences.185,Original,igloos are built in places where snow covers the land most of the time,37.357378665423305
384sentences.186,Original,igloos are often built in the shape of a dome with an entrance tunnel,39.59753642820471
384sentences.187,Original,air pockets in snow insulate the space and body heat warms igloos,28.412995019551833
384sentences.188,Original,a knife is a tool with a sharp edge that is used to cut things,38.13195620491089
384sentences.189,Original,modern knives consist of a handle and a blade usually made of metal,19.70846941697228
384sentences.190,Original,knives have also been used as weapons and instruments in rituals,24.16747106858895
384sentences.191,Original,a knife can be used to attack by slashing stabbing or throwing,32.45069725875367
384sentences.192,Original,lentils are the seeds of a plant of the legume family,24.293189594988657
384sentences.193,Original,lentils can be red green brown black or yellow,17.71833586698798
384sentences.194,Original,lentils are commonly used in indian and mediterranean cuisines,27.380803020251534
384sentences.195,Original,lentils are cooked by boiling and are a great source of protein,26.709044883122687
384sentences.196,Original,lettuce is a biennial plant often grown in temperate climates as a leaf vegetable,46.094476041382485
384sentences.197,Original,lettuce can be eaten cold and raw in salads and other dishes or cooked,36.52892538798937
384sentences.198,Original,lettuce is considered fairly easy to grow and a suitable crop for beginners,40.039388514543305
384sentences.199,Original,most lettuce leaves taste bitter but some are bred to remove the bitterness,38.19140842169169
384sentences.200,Original,a library is a place where a collection of books documents and media is kept,31.904688442791098
384sentences.201,Original,librarians work at libraries and are experts at finding and organizing information,25.37384686689057
384sentences.202,Original,people can go to public libraries and borrow books to take home for several weeks,48.3920117900126
384sentences.203,Original,academic libraries support scholarly research and have specialized books,29.51338783360526
384sentences.204,Original,a log cabin is a small house built from round logs,35.996676967371556
384sentences.205,Original,log cabin is a symbol of american frontier life and humble origins,40.129578746550536
384sentences.206,Original,log cabins were used as first shelters by european settlers,32.121204360213405
