243sentences.221,Scr1,others speculate that ramps zigzagged up the exterior walls of pyramid the,53.29972514369339
243sentences.222,Scr1,even beginner rock climbing takes and courage strength,23.461986240752765
243sentences.223,Scr1,climbers who are learning the sport can try scrambling on boulders large,32.11047238267764
243sentences.224,Scr1,once they're comfortable with that they can begin using ropes safely to climb vertical rock faces,66.00909979358383
243sentences.225,Scr1,all of the boys on the trip were new to climbing rock,32.39777654553133
243sentences.226,Scr1,were many afraid of heights,15.882537000120227
243sentences.227,Scr1,having someone else check their knots and harnesses helped them down calm,42.42581181725173
243sentences.228,Scr1,the set adults up climbing routes appropriate for beginners,34.20453382638508
243sentences.229,Scr1,free-climbing is one particular style rock of climbing,27.385001294985273
243sentences.230,Scr1,the climber relies solely on her skill and physical strength ascend to a rock face,64.52892785411686
243sentences.231,Scr1,rope and bolts are the equipment only used,20.85885747669843
243sentences.232,Scr1,they meant are only to stop the climber if she falls,35.662684596979595
243sentences.233,Scr1,i hesitantly skied down the steep trail that my buddies me convinced to try,57.715798582675866
243sentences.234,Scr1,i a made bad turn and i found myself tumbling down,31.294667158787394
243sentences.235,Scr1,i finally came to a stop at a flat part the of slope,49.19390276710155
243sentences.236,Scr1,my skis were to nowhere be found and my poles were lodged in a snow drift up the hill,70.25764232497824
243sentences.237,Scr1,a major strength of professional skiers is how they use poles ski,32.66198729231591
243sentences.238,Scr1,proper use of ski poles improves their balance and adds to flair their skiing,49.53048851557287
243sentences.239,Scr1,it minimizes the need for upper body movements to regain balance lost while skiing,50.801782049606224
243sentences.240,Scr1,new designs ski and stiffer boots let skiers turn more quickly,34.395703041854645
243sentences.241,Scr1,but faster and tighter turns increase the twisting force on legs the,31.554343934123697
243sentences.242,Scr1,this has led to more injuries particularly to ligaments in skier's the knee,30.381476019333736
384sentences.0,Scr1,an is accordion a portable musical instrument with two keyboards,47.89613136833341
384sentences.1,Scr1,one is keyboard used for individual notes the other for chords,32.53803920795796
384sentences.2,Scr1,accordions sound produce with bellows that blow air through reeds,27.745466659267535
384sentences.3,Scr1,an plays accordionist both keyboards while opening and closing the bellows,39.834796084738464
384sentences.4,Scr1,an apartment is a self-contained home that is part of building a,28.269875570534424
384sentences.5,Scr1,an apartment may have one or more rooms as well a as kitchen and a bathroom,53.952054481058475
384sentences.6,Scr1,some are apartments for single people others for families,18.74738382534958
384sentences.7,Scr1,the building can have a garage a laundry facility or storage extra space,58.656608337655676
384sentences.8,Scr1,an apple is a fruit that can be green red yellow or,38.83982567145386
384sentences.9,Scr1,apples thin have skin a crisp sweet pulp and seeds inside,43.31943472436526
384sentences.10,Scr1,some tart very apples are used to make cider,41.69410610525473
384sentences.11,Scr1,apples be can eaten raw roasted or baked in pies,55.55282872650709
384sentences.12,Scr1,arson the is criminal act of burning a building or wildland,34.59319590285991
384sentences.13,Scr1,a fire investigation determines if a fire was caused by or accident arson,41.928333825644145
384sentences.14,Scr1,arson can be done to cause damage to others or insurance collect,44.94752806649566
384sentences.15,Scr1,the of severity the crime depends on whether people were harmed,43.42669456657174
384sentences.16,Scr1,an or automobile car is a wheeled vehicle for transporting passengers,62.78825071362536
384sentences.17,Scr1,a can car be powered by a gasoline or electric engine,41.58496697809174
384sentences.18,Scr1,the steers driver the car on roads other passengers just sit,45.90228722966661
384sentences.19,Scr1,automobiles vary in size number of doors and the type trunk of,39.13171089193772
384sentences.20,Scr1,the is axe a tool used to split and cut wood,31.94445995240995
384sentences.21,Scr1,the usually axe consists of a head attached to a handle,31.928775113190046
384sentences.22,Scr1,historically heads axe were made of stone and then metal,22.032415924323473
384sentences.23,Scr1,axes used are by woodcutters and firemen entering buildings,31.25265002251217
384sentences.24,Scr1,a banana is a long fruit that grows in bunchs a with soft edible inside,47.21636983129839
384sentences.25,Scr1,a banana when ripe can be yellow purple or red have and small brown spots,66.62905517781272
384sentences.26,Scr1,the producers greatest are tropical countries such as india or ecuador,41.919482069860095
384sentences.27,Scr1,unripe bananas and plantains are staple foods and often cooked potatoes like,61.40675730026352
384sentences.28,Scr1,a bed is piece a of furniture used as a place to sleep or have sex in,48.66259736339108
384sentences.29,Scr1,a bed is made of a mattress and a box plus spring sheets pillows and covers,40.00091117802935
384sentences.30,Scr1,in waterbeds the mattress is filled with water and in it airbeds is filled with air,53.300895820917084
384sentences.31,Scr1,another type of bed is the hammock a fabric sling above suspended the ground,50.00885648853792
384sentences.32,Scr1,a bee is a flying insect with a black and body yellow and six legs,57.022107254203966
384sentences.33,Scr1,bees spread pollen between flowers as they collect nectar to honey make,48.03818846583402
384sentences.34,Scr1,bees are social insects and live together in a colony in located a hive,62.51103819310298
384sentences.35,Scr1,many have bees stingers and can attack if they feel threatened,37.934230081762024
384sentences.36,Scr1,a bicycle is a vehicle with two wheels and pedals a on frame,43.724112767166936
384sentences.37,Scr1,a bicycle is propelled by the pedalling of a cyclist the on saddle,47.81546963563422
384sentences.38,Scr1,the wheels have rubber tires with an inner tube full air of,50.179742748246476
384sentences.39,Scr1,people use bicycles for transportation and recreation racing,20.664545100985837
384sentences.40,Scr1,a creates blacksmith objects by forging iron or steel,33.74393685333779
384sentences.41,Scr1,a blacksmith hammers and bends hot iron on an anvil change to its shape,60.60433125586528
384sentences.42,Scr1,blacksmiths a wears thick apron and handle the metal with tongs,47.11026804538385
384sentences.43,Scr1,blacksmiths objects make like weapons horse shoes or iron furniture,29.833770808686847
384sentences.44,Scr1,a blender is a kitchen appliance used to mix ingredients puree or food,55.796759485028375
384sentences.45,Scr1,blenders have a glass or plastic container with a rotating in blade the bottom,69.300482011588
384sentences.46,Scr1,blenders used are to make milk shakes and fruit smoothies,54.661595889889114
384sentences.47,Scr1,blenders are also used to make cold alcoholic drinks with ice crushed,65.11639417815827
384sentences.48,Scr1,a boy is a young male child who has not puberty undergone,56.20474774053175
384sentences.49,Scr1,the is term used to indicate sex distinctions relative to girls,35.7609525885479
384sentences.50,Scr1,traditionally boys like to play rough games and fight with other each,48.113137363575994
384sentences.51,Scr1,an adult male behaving immaturely is often referred to as boy a,59.88033019650059
384sentences.52,Scr1,broccoli is a plant in cabbage the family,28.39837283770692
384sentences.53,Scr1,broccoli a has green flower head and a thick tough stalk,41.22407828159761
384sentences.54,Scr1,broccoli high is in vitamins fiber and other nutrients,22.962200816287936
384sentences.55,Scr1,broccoli can be boiled stir-fried eaten or raw,32.91776197373377
384sentences.56,Scr1,a is butterfly a flying insect with four large wings,44.83532589985609
384sentences.57,Scr1,the of wings butterflies can be very colorful and patterned,34.48043832565144
384sentences.58,Scr1,metamorphosis the is transformation of a caterpillar into a butterfly,36.366938844631726
384sentences.59,Scr1,some collect people butterflies because of their colorful wings,39.21433633364912
384sentences.60,Scr1,a carpenter is an artist or manual laborer who works wood with,50.68340381718916
384sentences.61,Scr1,carpenters and build repair houses furniture boats and other objects,44.26056124656742
384sentences.62,Scr1,carpenters tools use such as hammers saws pliers and planes,32.00508180374137
384sentences.63,Scr1,a is luthier a carpenter that makes and repairs musical instruments,42.30611938892644
384sentences.64,Scr1,cats small are furry animals with four legs and a tail,48.16560888357938
384sentences.65,Scr1,cats to like groom themselves by licking their fur,35.37171060740371
384sentences.66,Scr1,cats can hunt mice or birds but are often fed their by owners,51.60585836390062
384sentences.67,Scr1,the of claws cats are retractable so that they keep sharp,33.15005882434828
384sentences.68,Scr1,a chair is a piece of furniture designed for people sit to on,53.05611308818828
384sentences.69,Scr1,chairs consist of a seat raised above floor level supported legs by,47.37292206813353
384sentences.70,Scr1,chairs can also have back and arm rests as well a as cushion,47.06729069699083
384sentences.71,Scr1,seats are fixed chairs located in vehicles or in places cinemas like,38.08368154400761
384sentences.72,Scr1,a clarinet is a woodwind instrument musical,38.063645545883624
384sentences.73,Scr1,a clarinet is a long black tube with a flare the at bottom,49.40284284014504
384sentences.74,Scr1,the chooses player notes by pressing keys and holes,27.26805072848576
384sentences.75,Scr1,the is clarinet used both in jazz and classical music,38.51116046857769
384sentences.76,Scr1,a cod is a fish that lives in the colder of areas the atlantic,41.60028278594284
384sentences.77,Scr1,cod is flesh white and mild-tasting and flakes easily when cooked,38.81826891179511
384sentences.78,Scr1,fresh cod is used for fish and chips salted cod elaborate for dishes,51.56553002825445
384sentences.79,Scr1,cod has been caught salted and traded since the time the of vikings,43.70680743329214
384sentences.80,Scr1,coffee is made from coffee beans the seeds of the plant coffee,45.991236053316285
384sentences.81,Scr1,coffee is a popular drink in many countries and usually hot served,38.951933809174186
384sentences.82,Scr1,coffee a contains mild drug called caffeine that keeps people awake,40.37058580624274
384sentences.83,Scr1,coffee is the world's seventh-largest agricultural legal export,23.462099428698874
384sentences.84,Scr1,a is desert a natural environment where almost no rain falls,42.514288372650476
384sentences.85,Scr1,hot are deserts usually filled with sand dunes or rocks,53.26995400541477
384sentences.86,Scr1,some and animals plants have adapted to live in deserts,37.244844677617536
384sentences.87,Scr1,the hot biggest desert is the sahara in northern africa,34.3269452533399
384sentences.88,Scr1,a desk is a piece of furniture used for working sometimes at with a computer,51.01051224895034
384sentences.89,Scr1,a desk has a flat surface and can be made wood of plastic or metal,51.47863616942682
384sentences.90,Scr1,a may desk have drawers to store supplies and papers,34.38020395221188
384sentences.91,Scr1,a cubicle consists of a desk surrounded by partitions on sides three,32.48195953883221
384sentences.92,Scr1,a door is a movable barrier to entrance or exit an from enclosed area,58.35376498038281
384sentences.93,Scr1,most doors have locks to control who gets to pass them through,38.800111934813565
384sentences.94,Scr1,most doors are opened by pushing or pulling a handle they after are unlocked,43.07464347699447
384sentences.95,Scr1,other types of doors can slide or consist of a chamber revolving,39.371841208584264
384sentences.96,Scr1,a is dress a piece of clothing that women sometimes wear,37.23294641783944
384sentences.97,Scr1,a dress is like a shirt attached to a long skirt matching,42.61799638050222
384sentences.98,Scr1,a dress is usually worn at formal occasions such as wedding a or a dance,53.342150854750386
384sentences.99,Scr1,it can be hard to climb stairs or ride a in bike a dress,59.9159197395796
384sentences.100,Scr1,drunk driving is the act of driving under the effects alcohol of,42.52845167482033
384sentences.101,Scr1,drunk driving of any vehicle is a crime in most the of world,48.26145518152005
384sentences.102,Scr1,it a plays role in almost half of all vehicle-related deaths,33.5293936996451
384sentences.103,Scr1,drunk are drivers caught by field sobriety and breathing tests,38.540824645754945
384sentences.104,Scr1,a drought is a persistent shortage of the water supply by caused lack of rain,63.7480171594484
384sentences.105,Scr1,drought cause will crops and plants to stop growing and die,27.333419730506773
384sentences.106,Scr1,extreme will drought eventually turn areas into desert and cause famine,38.34276455002491
384sentences.107,Scr1,large of numbers people have to migrate away from dust bowls,55.673997795252724
384sentences.108,Scr1,eagles are large birds of prey that hunt during the and day have very good eyesight,56.46595326494016
384sentences.109,Scr1,eagles have hooked beaks for tearing flesh strong legs and talons sharp,57.53076870965265
384sentences.110,Scr1,eagles live in eyries and some species eat fish and small others mammals,52.18662086117206
384sentences.111,Scr1,the bald eagle a has bright white head and is the national bird of the united states,64.45126947757106
384sentences.112,Scr1,earthquakes shake the ground and can knock down buildings and structures other,39.85097026299784
384sentences.113,Scr1,the can shaking also trigger landslides and volcanic activity,33.69078989404589
384sentences.114,Scr1,most earthquakes are caused by the release of energy in earth's the crust,50.75491329998568
384sentences.115,Scr1,an earthquake at sea can displace the seabed and cause tsunami a,37.43358625770465
384sentences.116,Scr1,elephants the are largest kind of land mammal weighing several tons,45.65629857567962
384sentences.117,Scr1,an elephant has a long nose called a trunk which grab can things or food,42.773048936283644
384sentences.118,Scr1,the elephant has a pair of ivory tusks for moving or objects digging into trees,59.19805299254039
384sentences.119,Scr1,the elephant flaps its large ears to cool the blood them in and its body,44.9089965992037
384sentences.120,Scr1,the eye is an organ for sensing light and coding for it the visual cortex,60.89138037048063
384sentences.121,Scr1,most animals have complex eyes which can detect color motion texture and,30.584465324508844
384sentences.122,Scr1,the fovea is the center of the human eye and most the sensitive part of it,59.31033083044552
384sentences.123,Scr1,insects have compound eyes made up of eye units facing many in directions,32.84002679514894
384sentences.124,Scr1,a farm is land used to grow plants or raise for animals food,50.12771203940522
384sentences.125,Scr1,farmers are the people who run the farm and decide to what produce,42.9856489049994
384sentences.126,Scr1,farms usually have a house for farmers a silo and barn a,33.83266731015279
384sentences.127,Scr1,a cooperative is a farm where many farmers share the and land equipment,42.92419909119674
384sentences.128,Scr1,primates have usually four fingers and a thumb on each hand,34.95425875102495
384sentences.129,Scr1,fingers used are for grasping writing grooming and other activities,31.059245434987226
384sentences.130,Scr1,the are fingertips sensitive to temperature pressure and vibration,28.313188373548513
384sentences.131,Scr1,the nail protects the tip of the finger and can grown be or decorated,42.615608897389826
384sentences.132,Scr1,a flood is an overflow of an expanse of water submerges that inhabited land,56.80999664664628
384sentences.133,Scr1,flood can be by caused heavy rain or rapid snow melt as well as earthquakes at sea,71.77424712993952
384sentences.134,Scr1,in a flood a river will flow out of its or channel break dams and levees,54.02604430097699
384sentences.135,Scr1,during flood a people evacuate and the contaminated water causes diseases,30.540843489920192
384sentences.136,Scr1,a floor is a horizontal surface inside a building used walking for on,38.962080490874214
384sentences.137,Scr1,floors may be made of bare concrete tile linoleum or floorboards wooden,61.55250549361651
384sentences.138,Scr1,people often put carpets on a floor for comfort and dampen to noise,37.75632194640533
384sentences.139,Scr1,in buildings the floor often has pipes and electrical wiring it under,33.17896679416824
384sentences.140,Scr1,a foot is a body part on the end of leg a,37.6117529171465
384sentences.141,Scr1,people their use feet when walking running or standing straight,29.978935589964962
384sentences.142,Scr1,people also use their feet to kick in both fighting sports and,30.64856399142404
384sentences.143,Scr1,many have cultures rules for behavior related to feet,23.389775692418578
384sentences.144,Scr1,a forest is an area with a high density of and trees canopy cover,58.9717332559551
384sentences.145,Scr1,the type of forest depends on temperature and rainfall in location its,41.4204589556049
384sentences.146,Scr1,a forest ecosystem has various types of trees and animals well as as ground plants,55.73544187624377
384sentences.147,Scr1,deforestation the is cutting down of forests disregarding regeneration,17.82842681877944
384sentences.148,Scr1,a fork is a tool for eating solid foods with handle a and several tines,64.52342621678557
384sentences.149,Scr1,forks usually are made of metal or plastic if disposable,39.21954683197993
384sentences.150,Scr1,forks are used lift to food to the mouth or to hold food in place while cutting,42.29097695976936
384sentences.151,Scr1,forks are used in western cultures and there are special for kinds various foods,54.6385951665751
384sentences.152,Scr1,a frying pan is a small pan with sloping sides a and handle,64.90926109189101
384sentences.153,Scr1,a pan frying is used to fry sear and brown food,49.39720417217332
384sentences.154,Scr1,the food is cooked on oil covering the bottom of pan the,45.58942509062619
384sentences.155,Scr1,frying are pans made of iron or teflon-clad steel,30.633228009989715
384sentences.156,Scr1,a girl is a female human who has not yet maturity reached,50.166460687684356
384sentences.157,Scr1,at puberty the body of a girl develops into that a of woman,44.22074351639121
384sentences.158,Scr1,girls like often playing with dolls and social games,32.725020753255514
384sentences.159,Scr1,girls grow sometimes long hair and wear dresses and skirts,41.18196974580634
384sentences.160,Scr1,a glove is a piece of clothing that covers the and hand fingers,42.14705273371437
384sentences.161,Scr1,gloves to protect against cold are made of wool or waterproof lined material,46.11679961982519
384sentences.162,Scr1,disposable rubber or latex gloves are used to shield hands germs from or chemicals,68.8632916174757
384sentences.163,Scr1,a mitten is a kind of glove where the four are fingers covered together,45.91715188203504
384sentences.164,Scr1,a hammer is a tool used to deliver an impact an to object,52.81749230105483
384sentences.165,Scr1,a is hammer most often used to drive nails into wood,43.01053841950987
384sentences.166,Scr1,the on claw the head can be used to remove nails,38.10419284140695
384sentences.167,Scr1,hammers in vary the shape of the head and handle length,33.07000639630773
384sentences.168,Scr1,a hand grenade is an explosive used as a weapon people against,45.39823696047874
384sentences.169,Scr1,hand grenades are thrown and timed to explode a bit that after,39.316501813218714
384sentences.170,Scr1,grenades also can be fired from rifles or shoulder launchers,39.90172116764523
384sentences.171,Scr1,tear gas grenades are thrown into the middle of a to mob disperse it,68.01936882493708
384sentences.172,Scr1,a horse is a large hoofed mammal with four long legs muscular,67.74533924007464
384sentences.173,Scr1,a horse has tail a and a mane on its neck and is usually gray or brown,57.64409788009068
384sentences.174,Scr1,horses been have used for draft work travel and entertainment,28.67225264268144
384sentences.175,Scr1,a human can ride a horse while it walks trots gallops or,31.16844410725835
384sentences.176,Scr1,people go to hospitals to be healed when they are or sick injured,40.93845418201697
384sentences.177,Scr1,hospitals staffed are by professional physicians surgeons and nurses,37.117159523806784
384sentences.178,Scr1,some patients go there for specialist diagnosis or therapy leaving same the day,33.44098831006528
384sentences.179,Scr1,for some operations or treatments patients have to stay for weeks several,39.897612076410375
384sentences.180,Scr1,a house is a permanent building or structure for people families or to live in,45.87515895309453
384sentences.181,Scr1,a house has roof a and walls to keep out cold and rain and windows to let light in,52.64630771043081
384sentences.182,Scr1,a house can have rooms for purposes like sleeping cooking washing or,29.635629314532817
384sentences.183,Scr1,most people leave the house to work and come back night at to eat and sleep,45.564479960682405
384sentences.184,Scr1,an igloo is a type of shelter made from blocks snow of by inuit,45.09216398103914
384sentences.185,Scr1,igloos are built in places where snow covers the land of most the time,58.08703372637185
384sentences.186,Scr1,igloos are often built in the shape of a dome an with entrance tunnel,52.41579325778992
384sentences.187,Scr1,air pockets in snow insulate the space and body heat igloos warms,36.150317590419604
384sentences.188,Scr1,a knife is a tool with a sharp edge that used is to cut things,58.170435179022896
384sentences.189,Scr1,modern knives consist of a handle and a blade usually of made metal,27.701170807991456
384sentences.190,Scr1,knives also have been used as weapons and instruments in rituals,36.19522636601324
384sentences.191,Scr1,a knife can be used to attack by slashing stabbing throwing or,47.721743291460896
384sentences.192,Scr1,lentils the are seeds of a plant of the legume family,37.14202312103812
384sentences.193,Scr1,lentils be can red green brown black or yellow,25.523086323799852
384sentences.194,Scr1,lentils commonly are used in indian and mediterranean cuisines,37.50679859309765
384sentences.195,Scr1,lentils are cooked by boiling and are a great source protein of,44.57947621699903
384sentences.196,Scr1,lettuce is a biennial plant often grown in temperate climates a as leaf vegetable,59.10812574415917
384sentences.197,Scr1,lettuce can be eaten cold and raw in salads and dishes other or cooked,54.33884581990666
384sentences.198,Scr1,lettuce is considered fairly easy to grow and a suitable for crop beginners,51.635253952042135
384sentences.199,Scr1,most lettuce leaves taste bitter but some are bred to the remove bitterness,50.405710845741396
384sentences.200,Scr1,a library is a place where a collection of books and documents media is kept,44.59247252051743
384sentences.201,Scr1,librarians work at libraries and are experts at finding and information organizing,38.80550703107792
384sentences.202,Scr1,people can go to public libraries and borrow books to home take for several weeks,68.89586528858852
384sentences.203,Scr1,academic support libraries scholarly research and have specialized books,51.5250970058007
384sentences.204,Scr1,a cabin log is a small house built from round logs,51.93403187619481
384sentences.205,Scr1,log cabin is a symbol of american frontier life and origins humble,54.23836483880021
384sentences.206,Scr1,log were cabins used as first shelters by european settlers,37.87252318430547
384sentences.207,Scr1,log cabins were built using logs with notch joints at ends the,56.931134983656634
384sentences.208,Scr1,a man is a male adult human,34.374532913798646
384sentences.209,Scr1,a becomes boy a man after passing through puberty,39.2518467876179
384sentences.210,Scr1,manhood is associated with masculinity virility and,25.55406740974132
384sentences.211,Scr1,men from differ women in height weight and body structure,42.285031832895534
384sentences.212,Scr1,milk is a white liquid produced by female mammals to their feed young,40.88106326902849
384sentences.213,Scr1,newborn animals must be fed milk before they can eat food solid,54.8713934934757
384sentences.214,Scr1,dairy such products as cheese and butter are made from milk,46.14935964855687
384sentences.215,Scr1,liquid from produced soybeans and coconuts is sometimes called milk,35.77216671965627
384sentences.216,Scr1,mosquitos thin are small flying insects that emit a high-pitched sound,45.314933507516535
384sentences.217,Scr1,mosquitoes mouthparts have for piercing the skin of plants and animals,26.648792240426367
384sentences.218,Scr1,female mosquitoes bite people and animals and suck their blood protein for,44.70320261813285
384sentences.219,Scr1,mosquito can bites spread yellow fever malaria and other parasite diseases,56.326613787395495
384sentences.220,Scr1,a is mountain a landform that rises steeply above surrounding land,46.74038143949997
384sentences.221,Scr1,mountains rise higher than hills and sometimes have snow at top the,41.49745634624672
384sentences.222,Scr1,a of range mountains forms due to tectonic plate collision,36.631460850208406
384sentences.223,Scr1,mountaineers people are who climb or hike up mountains,27.806296392698435
384sentences.224,Scr1,the mouth is the face cavity we put food in we when eat,32.06403023067124
