243sentences.222,Scr3,even climbing beginner rock takes and courage strength,26.369394139899335
243sentences.223,Scr3,are climbers who learning the sport can try scrambling on boulders large,29.89857481293504
243sentences.224,Scr3,comfortable once they're with that they can begin using ropes safely to climb vertical rock faces,61.68260388736216
243sentences.225,Scr3,the all of boys on the trip were new to climbing rock,28.74582099578877
243sentences.226,Scr3,of many were afraid heights,11.2237435941054
243sentences.227,Scr3,else having someone check their knots and harnesses helped them down calm,42.42561519063084
243sentences.228,Scr3,set the adults up routes climbing appropriate for beginners,28.47314922066274
243sentences.229,Scr3,free-climbing particular is one style rock of climbing,24.025337091353993
243sentences.230,Scr3,relies the climber solely on her skill and physical strength ascend to a rock face,49.832212607581134
243sentences.231,Scr3,rope are and bolts the equipment only used,20.1635284803804
243sentences.232,Scr3,meant they are only stop to the climber if she falls,33.16488707789572
243sentences.233,Scr3,skied i hesitantly down the steep trail that my buddies me convinced to try,50.88196629795865
243sentences.234,Scr3,a i made bad and turn i found myself tumbling down,27.95952307340023
243sentences.235,Scr3,came i finally to a stop at a flat part the of slope,45.46411005229088
243sentences.236,Scr3,skis my were to nowhere be found and poles my were lodged in a snow drift up the hill,69.73044550665963
243sentences.237,Scr3,strength a major of professional skiers is how they use poles ski,33.73700555540281
243sentences.238,Scr3,of proper use ski poles improves their balance and adds to flair their skiing,47.510251031055276
243sentences.239,Scr3,the it minimizes need for upper body movements to regain balance lost while skiing,48.87373801577749
243sentences.240,Scr3,designs new ski and boots stiffer let skiers turn more quickly,43.009452037854004
243sentences.241,Scr3,and but faster tighter turns increase the twisting force on legs the,29.904051617886253
243sentences.242,Scr3,led this has to more injuries particularly to ligaments in skier's the knee,28.330419149232046
384sentences.0,Scr3,is an accordion a musical portable instrument with two keyboards,45.898910399856085
384sentences.1,Scr3,is one keyboard used individual for notes the other for chords,26.886821742569055
384sentences.2,Scr3,sound accordions produce with that bellows blow air through reeds,33.381969330171216
384sentences.3,Scr3,plays an accordionist both while keyboards opening and closing the bellows,36.617068949274056
384sentences.4,Scr3,is an apartment a self-contained home that is part of building a,26.33108213237204
384sentences.5,Scr3,may an apartment have one or more rooms as well a as kitchen and a bathroom,50.86650443362591
384sentences.6,Scr3,are some apartments for people single others for families,19.1653495996194
384sentences.7,Scr3,can the building have a garage a laundry facility or storage extra space,59.68696399725928
384sentences.8,Scr3,is an apple a fruit that can be green red yellow or,39.67951045904755
384sentences.9,Scr3,thin apples have skin crisp a sweet pulp and seeds inside,37.27745139437375
384sentences.10,Scr3,tart some very apples used are to make cider,29.653936605854142
384sentences.11,Scr3,be apples can eaten roasted raw or baked in pies,58.578389058230215
384sentences.12,Scr3,the arson is criminal of act burning a building or wildland,34.29217305842053
384sentences.13,Scr3,investigation a fire determines if a fire was caused by or accident arson,40.142781428815326
384sentences.14,Scr3,be arson can done to cause damage to others or insurance collect,35.89318455852782
384sentences.15,Scr3,of the severity the depends crime on whether people were harmed,41.532795108504196
384sentences.16,Scr3,or an automobile car a is wheeled vehicle for transporting passengers,58.129701160617074
384sentences.17,Scr3,can a car be by powered a gasoline or electric engine,39.73017383449706
384sentences.18,Scr3,steers the driver the on car roads other passengers just sit,39.65178177361153
384sentences.19,Scr3,in automobiles vary size number of doors and the type trunk of,36.32669489871275
384sentences.20,Scr3,is the axe a used tool to split and cut wood,31.067844233391035
384sentences.21,Scr3,usually the axe consists a of head attached to a handle,26.23290238478204
384sentences.22,Scr3,heads historically axe were of made stone and then metal,21.5517974284072
384sentences.23,Scr3,used axes are by and woodcutters firemen entering buildings,24.616397151340113
384sentences.24,Scr3,is a banana a long fruit that grows in bunchs a with soft edible inside,45.199734025372585
384sentences.25,Scr3,when a banana ripe can be yellow purple or red have and small brown spots,63.931251195804066
384sentences.26,Scr3,producers the greatest are countries tropical such as india or ecuador,37.67137365786323
384sentences.27,Scr3,and unripe bananas plantains are staple foods and often cooked potatoes like,72.66868888318363
384sentences.28,Scr3,bed a is piece a of furniture used a as place to sleep or have sex in,52.12108955300668
384sentences.29,Scr3,is a bed made of a mattress and a box plus spring sheets pillows and covers,41.09972836062084
384sentences.30,Scr3,the in waterbeds mattress is filled with water and in it airbeds is filled with air,50.762345812893216
384sentences.31,Scr3,of another type bed is the hammock a fabric sling above suspended the ground,50.51508550880924
384sentences.32,Scr3,is a bee a flying insect with a black and body yellow and six legs,58.668342837976766
384sentences.33,Scr3,pollen bees spread between flowers as they collect nectar to honey make,45.91473307359353
384sentences.34,Scr3,social bees are insects and live together in a colony in located a hive,55.5213494650355
384sentences.35,Scr3,have many bees stingers can and attack if they feel threatened,38.44667110882455
384sentences.36,Scr3,is a bicycle a vehicle with two wheels and pedals a on frame,39.65909857538919
384sentences.37,Scr3,is a bicycle propelled by the pedalling of a cyclist the on saddle,47.17428894633524
384sentences.38,Scr3,have the wheels rubber tires with an inner tube full air of,50.46782343149387
384sentences.39,Scr3,people for use bicycles transportation and recreation racing,21.58793851135569
384sentences.40,Scr3,creates a blacksmith objects forging by iron or steel,34.95752313798038
384sentences.41,Scr3,hammers a blacksmith and bends hot iron on an anvil change to its shape,57.76090215657558
384sentences.42,Scr3,a blacksmiths wears thick and apron handle the metal with tongs,43.1322579095746
384sentences.43,Scr3,objects blacksmiths make like horse weapons shoes or iron furniture,28.68885869393009
384sentences.44,Scr3,is a blender a kitchen appliance used to mix ingredients puree or food,59.742934100755434
384sentences.45,Scr3,a blenders have glass or plastic container with a rotating in blade the bottom,65.2388865887462
384sentences.46,Scr3,used blenders are to milk make shakes and fruit smoothies,50.678429909148676
384sentences.47,Scr3,also blenders are used to make cold alcoholic drinks with ice crushed,63.257319071783215
384sentences.48,Scr3,is a boy a young male child who has not puberty undergone,59.811692288493084
384sentences.49,Scr3,is the term used indicate to sex distinctions relative to girls,30.01203108241927
384sentences.50,Scr3,like traditionally boys to play rough games and fight with other each,48.088582306424954
384sentences.51,Scr3,male an adult behaving immaturely is often referred to as boy a,58.77003896306074
384sentences.52,Scr3,broccoli plant is a in cabbage the family,27.432673954517327
384sentences.53,Scr3,a broccoli has green head flower and a thick tough stalk,45.153058486360216
384sentences.54,Scr3,high broccoli is in fiber vitamins and other nutrients,27.084556810965914
384sentences.55,Scr3,broccoli boiled can be stir-fried eaten or raw,35.62501605336984
384sentences.56,Scr3,is a butterfly a insect flying with four large wings,37.17203141432949
384sentences.57,Scr3,of the wings butterflies be can very colorful and patterned,33.56520539482008
384sentences.58,Scr3,the metamorphosis is transformation a of caterpillar into a butterfly,33.67504010659013
384sentences.59,Scr3,collect some people butterflies of because their colorful wings,33.71293361712928
384sentences.60,Scr3,is a carpenter an artist or manual laborer who works wood with,46.326434494835524
384sentences.61,Scr3,and carpenters build repair furniture houses boats and other objects,39.563038739182545
384sentences.62,Scr3,tools carpenters use such hammers as saws pliers and planes,30.14312481644521
384sentences.63,Scr3,is a luthier a that carpenter makes and repairs musical instruments,40.32436701441943
384sentences.64,Scr3,small cats are furry with animals four legs and a tail,43.406370039313195
384sentences.65,Scr3,to cats like groom by themselves licking their fur,34.037658391300155
384sentences.66,Scr3,hunt cats can mice or birds but are often fed their by owners,45.51230437362988
384sentences.67,Scr3,of the claws cats retractable are so that they keep sharp,43.9290620622755
384sentences.68,Scr3,is a chair a piece of furniture designed for people sit to on,49.52676556073376
384sentences.69,Scr3,of chairs consist a seat raised above floor level supported legs by,43.402808099349585
384sentences.70,Scr3,also chairs can have back and arm rests as well a as cushion,44.3495241759337
384sentences.71,Scr3,fixed seats are chairs located in vehicles or in places cinemas like,41.54871371860945
384sentences.72,Scr3,a a clarinet is woodwind instrument musical,36.31918880956905
384sentences.73,Scr3,is a clarinet a long black tube with a flare the at bottom,47.06025450180403
384sentences.74,Scr3,chooses the player notes pressing by keys and holes,26.388799039283413
384sentences.75,Scr3,is the clarinet used in both jazz and classical music,35.473339420517185
384sentences.76,Scr3,is a cod a fish that lives in the colder of areas the atlantic,45.38189885363207
384sentences.77,Scr3,is cod flesh white mild-tasting and and flakes easily when cooked,34.7939422127072
384sentences.78,Scr3,is fresh cod used for fish and chips salted cod elaborate for dishes,50.53899564153777
384sentences.79,Scr3,been cod has caught salted and traded since the time the of vikings,42.4534744903648
384sentences.80,Scr3,made coffee is from coffee beans the seeds of the plant coffee,43.47905156192059
384sentences.81,Scr3,a coffee is popular drink in many countries and usually hot served,33.72618089985373
384sentences.82,Scr3,a coffee contains mild called drug caffeine that keeps people awake,38.0282462128343
384sentences.83,Scr3,coffee world's is the seventh-largest agricultural legal export,12.664709497413583
384sentences.84,Scr3,is a desert a environment natural where almost no rain falls,44.25835207783375
384sentences.85,Scr3,are hot deserts usually with filled sand dunes or rocks,46.60595752253108
384sentences.86,Scr3,and some animals plants adapted have to live in deserts,38.923771159221424
384sentences.87,Scr3,hot the biggest desert the is sahara in northern africa,33.292971765422564
384sentences.88,Scr3,is a desk a piece of furniture used for working sometimes at with a computer,47.48116396458262
384sentences.89,Scr3,has a desk a flat surface and can be made wood of plastic or metal,51.88438959157831
384sentences.90,Scr3,may a desk have to drawers store supplies and papers,21.39770523335505
384sentences.91,Scr3,consists a cubicle of a desk surrounded by partitions on sides three,32.01859084471969
384sentences.92,Scr3,is a door a movable barrier to entrance or exit an from enclosed area,55.98851830422154
384sentences.93,Scr3,have most doors locks to control who gets to pass them through,36.10777473236188
384sentences.94,Scr3,are most doors opened by pushing or pulling a handle they after are unlocked,41.618615365829456
384sentences.95,Scr3,of other types doors can slide or consist of a chamber revolving,39.11506079588325
384sentences.96,Scr3,is a dress a of piece clothing that women sometimes wear,34.48692585132811
384sentences.97,Scr3,is a dress like a shirt attached to a long skirt matching,44.27597109328507
384sentences.98,Scr3,is a dress usually worn at formal occasions such as wedding a or a dance,53.67868879820107
384sentences.99,Scr3,be it can hard to climb stairs or ride a in bike a dress,56.31346592668695
384sentences.100,Scr3,is drunk driving the act of driving under the effects alcohol of,40.849032260325
384sentences.101,Scr3,of drunk driving any vehicle is a crime in most the of world,49.25963701132506
384sentences.102,Scr3,a it plays role almost in half of all vehicle-related deaths,30.515027219864407
384sentences.103,Scr3,are drunk drivers caught field by sobriety and breathing tests,37.229593676383224
384sentences.104,Scr3,is a drought a persistent shortage of the water supply by caused lack of rain,66.89285020469437
384sentences.105,Scr3,cause drought will crops plants and to stop growing and die,32.46032187431001
384sentences.106,Scr3,will extreme drought eventually areas turn into desert and cause famine,30.977690713555244
384sentences.107,Scr3,of large numbers people to have migrate away from dust bowls,52.59552665697871
384sentences.108,Scr3,large eagles are birds of prey that hunt during the and day have very good eyesight,54.1892373742378
384sentences.109,Scr3,hooked eagles have beaks for tearing flesh strong legs and talons sharp,45.63744781421753
384sentences.110,Scr3,in eagles live eyries and some species eat fish and small others mammals,53.54659903789774
384sentences.111,Scr3,bald the eagle a has bright white head is and the national bird of the united states,61.163415460493525
384sentences.112,Scr3,the earthquakes shake ground and can knock down buildings and structures other,38.06382169149812
384sentences.113,Scr3,can the shaking also landslides trigger and volcanic activity,32.35943399926236
384sentences.114,Scr3,are most earthquakes caused by the release of energy in earth's the crust,51.95298793193946
384sentences.115,Scr3,at an earthquake sea can displace the seabed and cause tsunami a,33.55319674873389
384sentences.116,Scr3,the elephants are largest of kind land mammal weighing several tons,44.21244434571451
384sentences.117,Scr3,has an elephant a long nose called a trunk which grab can things or food,37.5167870137147
384sentences.118,Scr3,has the elephant a pair of ivory tusks for moving or objects digging into trees,56.67529311113853
384sentences.119,Scr3,flaps the elephant its large ears to cool the blood them in and its body,41.27635447240083
384sentences.120,Scr3,is the eye an organ for sensing light and coding for it the visual cortex,56.19035498928908
384sentences.121,Scr3,have most animals complex eyes which can detect color motion texture and,33.95660225596747
384sentences.122,Scr3,is the fovea the center of the human eye and most the sensitive part of it,57.45062290474128
384sentences.123,Scr3,compound insects have eyes made up of eye units facing many in directions,31.225213184349617
384sentences.124,Scr3,is a farm land used to grow plants or raise for animals food,45.957644623193275
384sentences.125,Scr3,the farmers are people who run the farm and decide to what produce,44.750634653340335
384sentences.126,Scr3,have farms usually a house for farmers a silo and barn a,31.74250471809641
384sentences.127,Scr3,is a cooperative a farm where many farmers share the and land equipment,46.167457244787215
384sentences.128,Scr3,have primates usually four and fingers a thumb on each hand,32.107521981142014
384sentences.129,Scr3,used fingers are for writing grasping grooming and other activities,28.240048928247155
384sentences.130,Scr3,are the fingertips sensitive temperature to pressure and vibration,21.71941908683498
384sentences.131,Scr3,protects the nail the tip of the finger and can grown be or decorated,43.44707927931299
384sentences.132,Scr3,is a flood an overflow of an expanse of water submerges that inhabited land,58.318592761475465
384sentences.133,Scr3,can flood be by caused heavy rain or snow rapid melt as well as earthquakes at sea,73.41406486486343
384sentences.134,Scr3,flood in a a river will flow out of its or channel break dams and levees,50.0999238645667
384sentences.135,Scr3,flood during a people and evacuate the contaminated water causes diseases,30.618494787218793
384sentences.136,Scr3,is a floor a horizontal surface inside a building used walking for on,38.75576707108334
384sentences.137,Scr3,be floors may made of bare concrete tile linoleum or floorboards wooden,57.91033187738277
384sentences.138,Scr3,put people often carpets on a floor for comfort and dampen to noise,32.48754643361593
384sentences.139,Scr3,the in buildings floor often has pipes and electrical wiring it under,31.133917987996522
384sentences.140,Scr3,is a foot a body part on the end of leg a,33.16216780022795
384sentences.141,Scr3,their people use feet walking when running or standing straight,23.682143334217727
384sentences.142,Scr3,use people also their feet to kick in both fighting sports and,28.299089808909667
384sentences.143,Scr3,have many cultures rules behavior for related to feet,23.286491086688777
384sentences.144,Scr3,is a forest an area with a high density of and trees canopy cover,58.69565642632901
384sentences.145,Scr3,of the type forest depends on temperature and rainfall in location its,44.25185658782629
384sentences.146,Scr3,ecosystem a forest has various types of trees and animals well as as ground plants,55.03774593848049
384sentences.147,Scr3,the deforestation is cutting of down forests disregarding regeneration,14.89336775829429
384sentences.148,Scr3,is a fork a tool for eating solid foods with handle a and several tines,60.35466709972477
384sentences.149,Scr3,usually forks are made metal of or plastic if disposable,36.01582821467128
384sentences.150,Scr3,are forks used lift to food to the or mouth to hold food in place while cutting,44.05204036156235
384sentences.151,Scr3,used forks are in western cultures and there are special for kinds various foods,52.387081716449536
384sentences.152,Scr3,pan a frying is a small pan with sloping sides a and handle,67.15151643720606
384sentences.153,Scr3,pan a frying is to used fry sear and brown food,47.28385976378311
384sentences.154,Scr3,is the food cooked on oil covering the bottom of pan the,45.0034443786737
384sentences.155,Scr3,are frying pans made iron of or teflon-clad steel,33.233037184993016
384sentences.156,Scr3,is a girl a female human who has not yet maturity reached,46.97273407576213
384sentences.157,Scr3,the at puberty body of a girl develops into that a of woman,42.56837321113519
384sentences.158,Scr3,like girls often playing dolls with and social games,33.917118923945345
384sentences.159,Scr3,grow girls sometimes long and hair wear dresses and skirts,40.04707774163588
384sentences.160,Scr3,is a glove a piece of clothing that covers the and hand fingers,38.61766694110784
384sentences.161,Scr3,protect gloves to against cold are made of wool or waterproof lined material,41.52351174529348
384sentences.162,Scr3,or disposable rubber latex gloves are used to shield hands germs from or chemicals,84.6335271770848
384sentences.163,Scr3,is a mitten a kind of glove where the four are fingers covered together,43.05648081197842
384sentences.164,Scr3,is a hammer a tool used to deliver an impact an to object,50.09663557683503
384sentences.165,Scr3,is a hammer most used often to drive nails into wood,45.05462776403385
384sentences.166,Scr3,on the claw the can head be used to remove nails,35.47046985687103
384sentences.167,Scr3,in hammers vary the of shape the head and handle length,29.6710559465337
384sentences.168,Scr3,grenade a hand is an explosive used as a weapon people against,47.683417798851536
384sentences.169,Scr3,are hand grenades thrown and timed to explode a bit that after,39.22583958712347
384sentences.170,Scr3,also grenades can be from fired rifles or shoulder launchers,37.75042184241773
384sentences.171,Scr3,grenades tear gas are thrown into the middle of a to mob disperse it,59.671473618961976
384sentences.172,Scr3,is a horse a large hoofed mammal with four long legs muscular,65.80083496221197
384sentences.173,Scr3,horse a has tail a and a mane its on neck and is usually gray or brown,53.02339594999519
384sentences.174,Scr3,been horses have used draft for work travel and entertainment,27.68610160209302
384sentences.175,Scr3,can a human ride a horse while it walks trots gallops or,32.597549719195136
384sentences.176,Scr3,to people go hospitals to be healed when they are or sick injured,44.37981479867828
384sentences.177,Scr3,staffed hospitals are by physicians professional surgeons and nurses,34.64781534160032
384sentences.178,Scr3,go some patients there for specialist diagnosis or therapy leaving same the day,32.18890750988469
384sentences.179,Scr3,operations for some or treatments patients have to stay for weeks several,39.824914170672784
384sentences.180,Scr3,is a house a permanent building or structure for people families or to live in,43.67956369114511
384sentences.181,Scr3,house a has roof a and walls to out keep cold and rain and windows to let light in,52.43525342351743
384sentences.182,Scr3,can a house have rooms for purposes like sleeping cooking washing or,29.816271949439816
384sentences.183,Scr3,leave most people the house to work and come back night at to eat and sleep,46.600062633944155
384sentences.184,Scr3,is an igloo a type of shelter made from blocks snow of by inuit,43.744446656203046
384sentences.185,Scr3,built igloos are in places where snow covers the land of most the time,59.34896120078488
384sentences.186,Scr3,often igloos are built in the shape of a dome an with entrance tunnel,57.76577295214963
384sentences.187,Scr3,in air pockets snow insulate the space and body heat igloos warms,34.944923582757745
384sentences.188,Scr3,is a knife a tool with a sharp edge that used is to cut things,55.75347116975529
384sentences.189,Scr3,consist modern knives of a handle and a blade usually of made metal,25.54358223639151
384sentences.190,Scr3,also knives have been as used weapons and instruments in rituals,30.831259175295205
384sentences.191,Scr3,can a knife be used to attack by slashing stabbing throwing or,45.12569049395555
384sentences.192,Scr3,the lentils are seeds a of plant of the legume family,33.52559564843317
384sentences.193,Scr3,be lentils can red brown green black or yellow,32.29217963278054
384sentences.194,Scr3,commonly lentils are used indian in and mediterranean cuisines,26.26120113680255
384sentences.195,Scr3,cooked lentils are by boiling and are a great source protein of,42.92741985381908
384sentences.196,Scr3,a lettuce is biennial plant often grown in temperate climates a as leaf vegetable,56.132114187230265
384sentences.197,Scr3,be lettuce can eaten cold and raw in salads and dishes other or cooked,53.10110530199599
384sentences.198,Scr3,considered lettuce is fairly easy to grow and a suitable for crop beginners,51.811259061499904
384sentences.199,Scr3,leaves most lettuce taste bitter but some are bred to the remove bitterness,52.06751119075102
384sentences.200,Scr3,is a library a place where a collection of books and documents media is kept,41.700967815742025
384sentences.201,Scr3,at librarians work libraries and are experts at finding and information organizing,38.772733958254946
384sentences.202,Scr3,go people can to public libraries and borrow books to home take for several weeks,64.59508099639716
384sentences.203,Scr3,support academic libraries scholarly and research have specialized books,51.44651398949993
384sentences.204,Scr3,cabin a log is small a house built from round logs,56.6658331248423
384sentences.205,Scr3,is log cabin a symbol of american frontier life and origins humble,52.95986922565946
384sentences.206,Scr3,were log cabins used first as shelters by european settlers,34.9900834999545
384sentences.207,Scr3,were log cabins built using logs with notch joints at ends the,54.679803081482135
384sentences.208,Scr3,a a man is male adult human,30.128671001015128
384sentences.209,Scr3,becomes a boy a after man passing through puberty,36.29345733837396
384sentences.210,Scr3,manhood with is associated masculinity virility and,27.017982990047543
384sentences.211,Scr3,from men differ women height in weight and body structure,35.161325172917905
384sentences.212,Scr3,a milk is white liquid produced by female mammals to their feed young,41.06682081783192
384sentences.213,Scr3,must newborn animals be fed milk before they can eat food solid,55.0626345948232
384sentences.214,Scr3,such dairy products as and cheese butter are made from milk,39.742509594673955
384sentences.215,Scr3,from liquid produced soybeans coconuts and is sometimes called milk,37.01888930032848
384sentences.216,Scr3,thin mosquitos are small insects flying that emit a high-pitched sound,39.32070444321376
384sentences.217,Scr3,mouthparts mosquitoes have for the piercing skin of plants and animals,25.815305798560892
384sentences.218,Scr3,bite female mosquitoes people and animals and suck their blood protein for,44.485093911822815
384sentences.219,Scr3,can mosquito bites spread fever yellow malaria and other parasite diseases,55.99446545051456
384sentences.220,Scr3,is a mountain a that landform rises steeply above surrounding land,45.87599517224744
384sentences.221,Scr3,higher mountains rise than hills and sometimes have snow at top the,36.22760958981007
384sentences.222,Scr3,of a range mountains due forms to tectonic plate collision,38.200958561433985
384sentences.223,Scr3,people mountaineers are who or climb hike up mountains,33.17623492439732
384sentences.224,Scr3,is the mouth the face cavity we put food in we when eat,30.72198356361859
384sentences.225,Scr3,has the mouth teeth to chew food and mix it saliva with,40.19707333718952
