243sentences.216,lowPMI,more tomb pyramids pride than of the the the the of just king represented nation.,9.662933067258072
243sentences.217,lowPMI,care builders craft evident the the their that in pyramid took is.,4.363280066876648
243sentences.218,lowPMI,stones pyramid precisely together structure the and the the until covering were fitted polished gleamed.,15.021663708722729
243sentences.219,lowPMI,architects still solve pyramids constructed to of the how are working mysteries were.,15.187068905470635
243sentences.220,lowPMI,think were pyramid's raise blocks some the inside to ramps built walls stone.,14.783347744598588
243sentences.221,lowPMI,others ramps exterior pyramid that the the up of speculate zigzagged walls.,16.963684941272515
243sentences.222,lowPMI,even rock takes strength and beginner climbing courage.,6.67112191014121
243sentences.223,lowPMI,climbers learning try large who can the on are sport scrambling boulders.,10.331967036347795
243sentences.224,lowPMI,once comfortable using safely vertical faces with they to that can they're begin ropes climb rock.,21.476663182427522
243sentences.225,lowPMI,boys were rock all the the of on to trip new climbing.,12.170534465011125
243sentences.226,lowPMI,many afraid of were heights.,3.2057199473736353
243sentences.227,lowPMI,having else knots helped their them and down someone check harnesses calm.,11.205734699499446
243sentences.228,lowPMI,adults climbing appropriate the for up set routes beginners.,14.546880635537025
243sentences.229,lowPMI,free-climbing particular rock one of is style climbing.,6.353275425150821
243sentences.230,lowPMI,climber solely physical ascend face the her to on and a relies skill strength rock.,6.823938640737563
243sentences.231,lowPMI,rope are equipment and the bolts only used.,6.699479280558344
243sentences.232,lowPMI,are only climber they the she to if meant stop falls.,2.0473663540060207
243sentences.233,lowPMI,i skied trail convinced down that me the my to hesitantly steep buddies try.,7.972310397551013
243sentences.234,lowPMI,i bad i tumbling a myself and down made turn found.,4.54535654784873
243sentences.235,lowPMI,i came flat slope to at of a a the finally stop part.,8.367845848567832
243sentences.236,lowPMI,skis nowhere found were snow hill my and in up to my a the were be poles lodged drift.,19.821604561677503
243sentences.237,lowPMI,major professional is ski a how of they strength skiers use poles.,9.27980504901909
243sentences.238,lowPMI,proper ski improves adds skiing of and their their to use poles balance flair.,7.081785360359886
243sentences.239,lowPMI,minimizes upper movements lost skiing it for while the to need body regain balance.,12.621045043113567
243sentences.240,lowPMI,new designs boots skiers more and ski stiffer let turn quickly.,8.264342520305357
243sentences.241,lowPMI,faster turns twisting legs but the the and on tighter increase force.,14.118981294099232
243sentences.242,lowPMI,has more particularly skier's this to the to in led injuries ligaments knee.,14.58804266842391
384sentences.0,lowPMI,accordion portable instrument an with a two is musical keyboards.,18.302873516434587
384sentences.1,lowPMI,keyboard used notes chords one the for for is individual other.,4.577905986211601
384sentences.2,lowPMI,accordions sound blow reeds with through that produce bellows air.,11.743516168027838
384sentences.3,lowPMI,accordionist keyboards closing an while the both and plays opening bellows.,8.512390016206158
384sentences.4,lowPMI,apartment self-contained is building an that a a of is home part.,5.675094525492142
384sentences.5,lowPMI,apartment more as kitchen an one as and may or a a have rooms well bathroom.,9.612469073143362
384sentences.6,lowPMI,apartments single others some for for are people families.,10.256594148391738
384sentences.7,lowPMI,building garage facility storage the a or can a have laundry extra space.,22.71129223542922
384sentences.8,lowPMI,apple fruit green yellow an that or a can is be red.,16.01845611645399
384sentences.9,lowPMI,apples thin sweet seeds skin and a inside have crisp pulp.,11.627473621342853
384sentences.10,lowPMI,very apples used cider some to tart are make.,4.232152415481626
384sentences.11,lowPMI,apples eaten roasted pies can in or be raw baked.,13.261069314457375
384sentences.12,lowPMI,arson criminal burning wildland the a of or is act building.,7.017750105732812
384sentences.13,lowPMI,fire determines was accident a a or if by investigation fire caused arson.,9.926291670695003
384sentences.14,lowPMI,arson done damage collect can to to or be cause others insurance.,11.416855993162914
384sentences.15,lowPMI,severity depends were the the whether of on crime people harmed.,7.8505342430063925
384sentences.16,lowPMI,automobile is vehicle passengers an a or for car wheeled transporting.,15.924225460851181
384sentences.17,lowPMI,car powered electric a by or can a be gasoline engine.,20.773373935315387
384sentences.18,lowPMI,driver car other just the on the steers roads passengers sit.,15.444815763985412
384sentences.19,lowPMI,automobiles size doors trunk in and of of the vary number type.,3.6660814253068312
384sentences.20,lowPMI,axe tool split wood the to a and is used cut.,13.448576850364818
384sentences.21,lowPMI,axe consists attached the a a of to usually head handle.,1.342047828383155
384sentences.22,lowPMI,historically heads made then of and axe were stone metal.,4.448539919518824
384sentences.23,lowPMI,axes used firemen buildings by and are woodcutters entering.,12.676304730245661
384sentences.24,lowPMI,banana long grows soft inside a that with a in a is fruit bunchs edible.,30.821034312032133
384sentences.25,lowPMI,banana be purple have brown a can and when or ripe yellow red small spots.,15.06713009811449
384sentences.26,lowPMI,greatest are countries india the or as producers tropical such ecuador.,7.8238826481500805
384sentences.27,lowPMI,unripe plantains staple often potatoes and like and bananas are foods cooked.,25.455097524490647
384sentences.28,lowPMI,bed piece used sleep sex a of a or a as to in is furniture place have.,9.61545198024444
384sentences.29,lowPMI,bed made box sheets covers a a a and of and plus is mattress spring pillows.,11.586272345521998
384sentences.30,lowPMI,waterbeds is water is air in with in with the and it mattress filled airbeds filled.,27.685023870650145
384sentences.31,lowPMI,type is fabric suspended another the above of a the bed hammock sling ground.,25.45623579387206
384sentences.32,lowPMI,bee flying black body a with and six a a and is insect yellow legs.,20.33517063955611
384sentences.33,lowPMI,bees pollen collect honey between they to as nectar spread flowers make.,19.878628323730887
384sentences.34,lowPMI,bees social live colony hive and a a in in are insects together located.,11.899556425790816
384sentences.35,lowPMI,many have attack threatened and if can they bees stingers feel.,22.405771110521798
384sentences.36,lowPMI,bicycle vehicle pedals a with and a a two on is wheels frame.,5.084777527369032
384sentences.37,lowPMI,bicycle propelled cyclist a the a the by of on is pedalling saddle.,22.4133626726521
384sentences.38,lowPMI,wheels rubber inner full the an with of have tires tube air.,18.8133625468502
384sentences.39,lowPMI,people bicycles recreation for and use transportation racing.,4.979098823353609
384sentences.40,lowPMI,blacksmith objects iron a or by creates forging steel.,8.68877623896142
384sentences.41,lowPMI,blacksmith bends iron change a on to and an its hammers hot anvil shape.,18.117503075200606
384sentences.42,lowPMI,blacksmiths thick handle tongs a the and with wears apron metal.,7.9901302625027135
384sentences.43,lowPMI,blacksmiths objects horse iron like or make weapons shoes furniture.,9.142733671599597
384sentences.44,lowPMI,blender kitchen used ingredients food a to a or is appliance mix puree.,21.580229519310652
384sentences.45,lowPMI,blenders glass container blade a with in or a the have plastic rotating bottom.,19.599587136278796
384sentences.46,lowPMI,blenders used milk fruit to and are make shakes smoothies.,6.795566819289553
384sentences.47,lowPMI,blenders also make alcoholic crushed to with are used cold drinks ice.,15.989128764971118
384sentences.48,lowPMI,boy young child not puberty a who a is male has undergone.,15.44285359917402
384sentences.49,lowPMI,term used sex relative the to to is indicate distinctions girls.,12.609605089577414
384sentences.50,lowPMI,traditionally play games other like and each to with boys rough fight.,20.212726568706767
384sentences.51,lowPMI,adult behaving is referred an as to a male immaturely often boy.,15.827980263767394
384sentences.52,lowPMI,broccoli plant family a the in is cabbage.,9.407042286950606
384sentences.53,lowPMI,broccoli green head tough a a and has flower thick stalk.,12.459191361928859
384sentences.54,lowPMI,broccoli high fiber nutrients in and is vitamins other.,8.55991058984826
384sentences.55,lowPMI,broccoli boiled eaten can or be stir-fried raw.,24.59967840802213
384sentences.56,lowPMI,butterfly flying large a with a four is insect wings.,21.293207962659615
384sentences.57,lowPMI,wings be colorful the can of and butterflies very patterned.,4.141083181798955
384sentences.58,lowPMI,metamorphosis transformation butterfly the a a of into is caterpillar.,4.2701327746918905
384sentences.59,lowPMI,people butterflies wings some of because their collect colorful.,13.187801963193989
384sentences.60,lowPMI,carpenter artist laborer wood a or with an who is manual works.,9.136442326440514
384sentences.61,lowPMI,carpenters repair furniture other and and build houses boats objects.,21.69808736848317
384sentences.62,lowPMI,carpenters tools hammers pliers as and use such saws planes.,15.874897538394123
384sentences.63,lowPMI,luthier carpenter repairs instruments a that a and is makes musical.,5.657160364872693
384sentences.64,lowPMI,cats small animals tail with and four a are furry legs.,14.995488458636641
384sentences.65,lowPMI,cats licking like themselves their to by groom fur.,15.449942981832537
384sentences.66,lowPMI,cats mice are fed can but their or by hunt birds often owners.,17.924103835475492
384sentences.67,lowPMI,claws are keep the so they of that cats retractable sharp.,16.013541993809365
384sentences.68,lowPMI,chair piece designed sit a of to a for on is furniture people.,7.3166813526378505
384sentences.69,lowPMI,chairs seat floor supported of above a by consist raised level legs.,6.822663572816161
384sentences.70,lowPMI,chairs have arm as cushion can as and a also back rests well.,5.799604574259614
384sentences.71,lowPMI,seats fixed located places in in or like are chairs vehicles cinemas.,12.965789030970607
384sentences.72,lowPMI,clarinet woodwind instrument a a is musical.,12.677686830135798
384sentences.73,lowPMI,clarinet long tube bottom a with at a a the is black flare.,10.120741305868743
384sentences.74,lowPMI,player notes keys the and by chooses pressing holes.,4.491534861988145
384sentences.75,lowPMI,clarinet used classical the in both and is jazz music.,10.73768519186784
384sentences.76,lowPMI,cod fish colder atlantic a that the the a in of is lives areas.,12.049783173145116
384sentences.77,lowPMI,cod is mild-tasting easily and when and flesh white flakes cooked.,22.067029588520437
384sentences.78,lowPMI,fresh is fish salted elaborate for for and cod used chips cod dishes.,19.583678040171982
384sentences.79,lowPMI,cod been salted time and the the since of has caught traded vikings.,11.651936891704848
384sentences.80,lowPMI,coffee made beans coffee from of the the is coffee seeds plant.,19.78143227815545
384sentences.81,lowPMI,coffee popular many usually hot a and in is drink countries served.,6.000020554157189
384sentences.82,lowPMI,coffee mild called keeps awake a that contains drug caffeine people.,19.27782961824721
384sentences.83,lowPMI,coffee world's legal export the is seventh-largest agricultural.,15.200143186409747
384sentences.84,lowPMI,desert natural almost falls a where a no is environment rain.,12.086549139813783
384sentences.85,lowPMI,hot are filled dunes with or deserts usually sand rocks.,8.96391003716362
384sentences.86,lowPMI,animals have live some to and in plants adapted deserts.,10.640231110521182
384sentences.87,lowPMI,biggest desert sahara africa the in the hot is northern.,27.89697828542676
384sentences.88,lowPMI,desk piece used sometimes a of at a a for with is furniture working computer.,11.98952390646107
384sentences.89,lowPMI,desk flat be wood metal a and of a can or has surface made plastic.,8.312931375398996
384sentences.90,lowPMI,desk drawers supplies a to may and have store papers.,10.607913767315548
384sentences.91,lowPMI,cubicle desk partitions a a on of by three consists surrounded sides.,7.612465803227833
384sentences.92,lowPMI,door movable entrance enclosed a to from a or an is barrier exit area.,19.16059116449172
384sentences.93,lowPMI,most have control pass to to them who through doors locks gets.,15.199836814335358
384sentences.94,lowPMI,most are pushing handle unlocked by a they or after doors opened pulling are.,19.1568937271317
384sentences.95,lowPMI,other doors consist chamber of or a can of types slide revolving.,10.883170368941917
384sentences.96,lowPMI,dress piece women wear a of a that is clothing sometimes.,16.952024423236836
384sentences.97,lowPMI,dress shirt long skirt a a a like to is attached matching.,25.361961563540433
384sentences.98,lowPMI,dress usually formal such dance a as or at a a is worn occasions wedding.,15.095248576625348
384sentences.99,lowPMI,be climb ride dress it to a a can or in hard stairs bike.,2.351683395006848
384sentences.100,lowPMI,drunk is driving alcohol the under of of the driving act effects.,10.238403680699562
384sentences.101,lowPMI,drunk vehicle crime world of a of any in the driving is most.,15.266816090721548
384sentences.102,lowPMI,plays almost vehicle-related it in all a of role half deaths.,8.296570374434971
384sentences.103,lowPMI,drunk are field breathing by and drivers caught sobriety tests.,11.256811141898723
384sentences.104,lowPMI,drought persistent water caused rain a of by a the of is shortage supply lack.,22.412228270683716
384sentences.105,lowPMI,drought crops stop die will to and and cause plants growing.,6.99079398398026
384sentences.106,lowPMI,extreme eventually areas cause will and into drought turn desert famine.,4.890350873794356
384sentences.107,lowPMI,large people migrate bowls of away to from numbers have dust.,8.937558304301312
384sentences.108,lowPMI,eagles large prey day very eyesight of during and that the are birds hunt have good.,21.13645927218851
384sentences.109,lowPMI,eagles hooked tearing strong sharp for and have beaks flesh legs talons.,4.302282402431685
384sentences.110,lowPMI,eagles eyries eat others mammals in some and and live species fish small.,19.150904638749864
384sentences.111,lowPMI,bald has white is bird states the and of a the the eagle bright head national united.,10.579637676064158
384sentences.112,lowPMI,earthquakes ground buildings structures the can and and down shake knock other.,7.199681399925239
384sentences.113,lowPMI,shaking trigger volcanic the and can also landslides activity.,15.92450249145335
384sentences.114,lowPMI,most are release earth's by of the the in earthquakes caused energy crust.,15.318195886253962
384sentences.115,lowPMI,earthquake displace cause an can and at the a sea seabed tsunami.,11.891190979659719
384sentences.116,lowPMI,elephants largest land weighing tons the of are kind mammal several.,20.82126169396754
384sentences.117,lowPMI,elephant long called grab food an a can a which or has nose trunk things.,3.6910959871062463
384sentences.118,lowPMI,elephant pair tusks objects trees the of or a for into has ivory moving digging.,7.818951577440781
384sentences.119,lowPMI,elephant large cool body the to in and its the them its flaps ears blood.,12.977137123062297
384sentences.120,lowPMI,eye organ light visual the for it the an and for is sensing coding cortex.,11.006843816985851
384sentences.121,lowPMI,most have eyes color texture which and can animals complex detect motion.,10.236511717227893
384sentences.122,lowPMI,fovea center eye sensitive the of and of the the the it is human most part.,12.799988759763943
384sentences.123,lowPMI,insects compound made units many up in of have eyes eye facing directions.,6.429848429567624
384sentences.124,lowPMI,farm land grow raise food a or to for is used plants animals.,14.919956148486754
384sentences.125,lowPMI,farmers people farm produce the the what who and to are run decide.,9.859553218207294
384sentences.126,lowPMI,farms have farmers barn a a a for and usually house silo.,9.921056174481391
384sentences.127,lowPMI,cooperative farm farmers land a where and a the is many share equipment.,12.426739732731559
384sentences.128,lowPMI,primates have thumb four a each and on usually fingers hand.,3.836282857787405
384sentences.129,lowPMI,fingers used writing other for and are grasping grooming activities.,6.736498241397921
384sentences.130,lowPMI,fingertips sensitive pressure the and to are temperature vibration.,12.183732198709556
384sentences.131,lowPMI,nail tip be decorated the of and or the the can protects finger grown.,10.104508072357733
384sentences.132,lowPMI,flood overflow water inhabited a of of an an that is expanse submerges land.,23.964172557750096
384sentences.133,lowPMI,flood caused rain snow as earthquakes can or at by as be heavy rapid melt well sea.,16.51341895317165
384sentences.134,lowPMI,flood flow channel dams in a of or a will its and river out break levees.,26.614387118794305
384sentences.135,lowPMI,flood evacuate water diseases during and a the people contaminated causes.,6.756376237538261
384sentences.136,lowPMI,floor horizontal building walking a inside for a a on is surface used.,12.102268912302296
384sentences.137,lowPMI,floors made concrete linoleum floorboards may or of be bare tile wooden.,10.794912941787029
384sentences.138,lowPMI,people put floor dampen on for to a and often carpets comfort noise.,3.968440713976935
384sentences.139,lowPMI,buildings often pipes wiring in and it the under floor has electrical.,8.34639713494273
384sentences.140,lowPMI,foot body end a on of a the a is part leg.,7.301035412365874
384sentences.141,lowPMI,people feet running straight their or when use walking standing.,9.560604895801635
384sentences.142,lowPMI,people use kick sports their in and to both also feet fighting.,7.222481678809442
384sentences.143,lowPMI,many have behavior feet for to cultures rules related.,1.706530424285463
384sentences.144,lowPMI,forest area density canopy a with of an a and is high trees cover.,21.88441180409508
384sentences.145,lowPMI,type depends rainfall the on in of and its forest temperature location.,10.573793843453608
384sentences.146,lowPMI,forest has types animals well plants a and of as ecosystem various trees as ground.,7.467429126383517
384sentences.147,lowPMI,deforestation cutting disregarding the of down is forests regeneration.,6.642080883074988
384sentences.148,lowPMI,fork tool solid handle tines a for a a with and is eating foods several.,18.836126188880435
384sentences.149,lowPMI,forks usually metal disposable of if or are made plastic.,12.216503560416653
384sentences.150,lowPMI,forks used food hold place to the to while to or in are lift mouth food cutting.,7.929756886668094
384sentences.151,lowPMI,forks used cultures special various in there and for are western are kinds foods.,11.487216529751471
384sentences.152,lowPMI,frying is pan sides a with a a and pan small sloping handle.,19.99736219878011
384sentences.153,lowPMI,frying is fry brown a and to pan used sear food.,15.541671908360817
384sentences.154,lowPMI,food cooked covering pan the the the on of is oil bottom.,15.479739678377591
384sentences.155,lowPMI,frying are iron steel of or pans made teflon-clad.,8.167834695111933
384sentences.156,lowPMI,girl female has yet maturity a who a is human not reached.,6.9320086536311525
384sentences.157,lowPMI,body develops at the a that a puberty of into of girl woman.,10.566992459301165
384sentences.158,lowPMI,girls playing social like and with often dolls games.,8.694545666032342
384sentences.159,lowPMI,girls grow hair dresses and and sometimes long wear skirts.,18.51223813840891
384sentences.160,lowPMI,glove piece covers fingers a of the a that and is clothing hand.,6.4774296593087675
384sentences.161,lowPMI,gloves cold made lined material to of against or protect are wool waterproof.,4.864537593798109
384sentences.162,lowPMI,disposable latex are shield germs or from to or rubber gloves used hands chemicals.,29.42944694302345
384sentences.163,lowPMI,mitten kind fingers covered a of the a where four is glove are together.,9.159263711373706
384sentences.164,lowPMI,hammer tool deliver object a to to a an an is used impact.,9.201106991411192
384sentences.165,lowPMI,hammer most used nails a into to is often drive wood.,11.876144659946153
384sentences.166,lowPMI,claw be remove the the to on can head used nails.,4.211771574370796
384sentences.167,lowPMI,hammers shape handle in of and the the vary head length.,1.5071206918775786
384sentences.168,lowPMI,hand is used people a as against an a grenade explosive weapon.,23.695174392689655
384sentences.169,lowPMI,hand are timed bit and a that to after grenades thrown explode.,12.016486291731534
384sentences.170,lowPMI,grenades be rifles launchers can or from also fired shoulder.,3.1097711938963912
384sentences.171,lowPMI,gas are middle disperse tear the a it into of to grenades thrown mob.,11.912583381783017
384sentences.172,lowPMI,horse large mammal muscular a with a four is hoofed long legs.,14.551366678607367
384sentences.173,lowPMI,horse tail neck usually brown a and on and a a its or has mane is gray.,7.227871271226001
384sentences.174,lowPMI,horses been draft travel for and have used work entertainment.,4.5224748034120035
384sentences.175,lowPMI,human horse trots a a it can while or ride walks gallops.,16.35330264069655
384sentences.176,lowPMI,people hospitals healed sick to when or to they go be are injured.,8.97593145618173
384sentences.177,lowPMI,hospitals staffed physicians nurses by and are professional surgeons.,9.784777622025475
384sentences.178,lowPMI,patients there diagnosis leaving day some or for the go specialist therapy same.,8.750691084236989
384sentences.179,lowPMI,operations patients stay weeks for or for some to treatments have several.,11.516033778974705
384sentences.180,lowPMI,house permanent structure families a or or in a for to is building people live.,12.077266282468754
384sentences.181,lowPMI,house roof keep rain let a and out and in a to and to has walls cold windows light.,12.061357747083528
384sentences.182,lowPMI,house rooms sleeping washing a for or can like have purposes cooking.,10.329664474564765
384sentences.183,lowPMI,most leave work back eat the and to to at and people house come night sleep.,2.0547797861927055
384sentences.184,lowPMI,igloo type made snow an of of a from by is shelter blocks inuit.,8.374199434823797
384sentences.185,lowPMI,igloos built snow land time in the the where of are places covers most.,17.59125308757442
384sentences.186,lowPMI,igloos often shape entrance in of with the a an are built dome tunnel.,11.053792496758815
384sentences.187,lowPMI,air snow space heat igloos in and the pockets insulate body warms.,4.5883010289024675
384sentences.188,lowPMI,knife tool edge used things a with that a a to is sharp is cut.,9.82815642048852
384sentences.189,lowPMI,modern consist blade made of and of a a knives handle usually metal.,8.372022543717492
384sentences.190,lowPMI,knives also used instruments as in and have been weapons rituals.,17.849450352506054
384sentences.191,lowPMI,knife used slashing throwing a to or can by be attack stabbing.,4.6348594396044716
384sentences.192,lowPMI,lentils seeds legume the a the of of are plant family.,14.747376522144748
384sentences.193,lowPMI,lentils red brown yellow can or be green black.,16.26430028466953
384sentences.194,lowPMI,lentils commonly indian cuisines in and are used mediterranean.,7.927289480599118
384sentences.195,lowPMI,lentils cooked are source by a and of are boiling great protein.,15.581090606860036
384sentences.196,lowPMI,lettuce biennial often temperate leaf a as in a is plant grown climates vegetable.,20.871552085824007
384sentences.197,lowPMI,lettuce eaten raw other cooked can in or and and be cold salads dishes.,25.54065464939013
384sentences.198,lowPMI,lettuce considered easy suitable beginners to a and for is fairly grow crop.,8.977695344372382
384sentences.199,lowPMI,most leaves bitter bred bitterness but to some the lettuce taste are remove.,13.821331414542367
384sentences.200,lowPMI,library place books media kept a where of a a and is collection documents is.,7.831041811100974
384sentences.201,lowPMI,librarians libraries experts organizing at at and and work are finding information.,4.5330591558760895
384sentences.202,lowPMI,people public borrow take several can and for to to go libraries books home weeks.,8.667532804332307
384sentences.203,lowPMI,academic support research specialized and libraries scholarly have books.,21.854351856966456
384sentences.204,lowPMI,log is house round a from a cabin small built logs.,15.904042268779152
384sentences.205,lowPMI,log is american life origins a and of cabin symbol frontier humble.,5.205761584555814
384sentences.206,lowPMI,log were first european as by cabins used shelters settlers.,9.01300555305627
384sentences.207,lowPMI,log were using notch ends with the at cabins built logs joints.,24.070563379780225
384sentences.208,lowPMI,man male adult a a is human.,11.114058682423362
384sentences.209,lowPMI,boy man puberty a after a through becomes passing.,6.611197547256272
384sentences.210,lowPMI,manhood associated virility with and is masculinity.,4.2464737061835915
384sentences.211,lowPMI,men women weight structure from and in differ height body.,3.694842003964458
