243sentences.216,lowPMI,more tomb pyramids pride than of the the the the of just king represented nation.,9.66290647906906
243sentences.217,lowPMI,care builders their is the the that in pyramid took craft evident.,7.799985436616343
243sentences.218,lowPMI,stones pyramid precisely together structure the and the the until covering were fitted polished gleamed.,15.0169426083013
243sentences.219,lowPMI,architects still solve pyramids constructed to of the how are working mysteries were.,15.182517795196926
243sentences.220,lowPMI,think were pyramid's raise blocks some the inside to ramps built walls stone.,14.783220007943234
243sentences.221,lowPMI,others ramps exterior pyramid that the the up of speculate zigzagged walls.,16.958821716976654
243sentences.222,lowPMI,even rock takes strength and beginner climbing courage.,6.666483183158959
243sentences.223,lowPMI,climbers learning try large who can the on are sport scrambling boulders.,10.327236930575442
243sentences.224,lowPMI,once comfortable begin ropes climb rock with can that to they're they using safely vertical faces.,15.146415141375131
243sentences.225,lowPMI,boys were rock all the the of on to trip new climbing.,12.170532502554954
243sentences.226,lowPMI,many afraid of were heights.,3.2057189088839304
243sentences.227,lowPMI,having else their harnesses them down and someone check knots helped calm.,12.569228394050851
243sentences.228,lowPMI,adults climbing appropriate the for up set routes beginners.,14.542173463155484
243sentences.229,lowPMI,free-climbing particular rock one of is style climbing.,6.353273665172227
243sentences.230,lowPMI,climber solely skill strength rock the and a on to relies her physical ascend face.,10.562001695027305
243sentences.231,lowPMI,rope are equipment and the bolts only used.,6.699468194305543
243sentences.232,lowPMI,they meant stop she to if the are only climber falls.,11.865120976293635
243sentences.233,lowPMI,i skied trail buddies me down that the to hesitantly steep my convinced try.,10.015408740614948
243sentences.234,lowPMI,i bad i myself down a and made turn found tumbling.,4.387673585560319
243sentences.235,lowPMI,i came flat slope to at of a a the finally stop part.,8.36783904224942
243sentences.236,lowPMI,my were be my were snow hill to in up and a the skis nowhere found poles lodged drift.,16.17910657608124
243sentences.237,lowPMI,major professional is use poles a how of strength skiers they ski.,6.924295567542973
243sentences.238,lowPMI,proper ski improves balance flair skiing of to and use poles their adds their.,10.012444095147671
243sentences.239,lowPMI,it need body regain balance the to for while minimizes upper movements lost skiing.,11.70817276546281
243sentences.240,lowPMI,new designs boots skiers more and ski stiffer let turn quickly.,8.264260906459883
243sentences.241,lowPMI,faster turns twisting legs but the the and on tighter increase force.,14.11893380836731
243sentences.242,lowPMI,has more particularly skier's this to the to in led injuries ligaments knee.,14.583306893950862
384sentences.0,lowPMI,accordion portable instrument an with a two is musical keyboards.,18.298163233229538
384sentences.1,lowPMI,keyboard used notes chords one the for for is individual other.,4.577896865372534
384sentences.2,lowPMI,accordions sound blow reeds with through that produce bellows air.,11.739889376328978
384sentences.3,lowPMI,accordionist keyboards closing an while the both and plays opening bellows.,8.511387686684207
384sentences.4,lowPMI,apartment self-contained is building an that a a of is home part.,5.670394467101344
384sentences.5,lowPMI,apartment more as kitchen an one as and may or a a have rooms well bathroom.,9.612466490093047
384sentences.6,lowPMI,apartments single others some for for are people families.,10.256586214279425
384sentences.7,lowPMI,building garage facility storage the a or can a have laundry extra space.,22.71125953948477
384sentences.8,lowPMI,apple fruit green yellow an that or a can is be red.,16.01844805059738
384sentences.9,lowPMI,apples thin sweet seeds skin and a have crisp pulp inside.,11.840740266027218
384sentences.10,lowPMI,very apples used cider some to tart are make.,4.232090956870918
384sentences.11,lowPMI,apples eaten roasted pies can in or be raw baked.,13.256323508850066
384sentences.12,lowPMI,arson criminal burning wildland the a of or is act building.,7.017240092822202
384sentences.13,lowPMI,fire determines was accident a a or if by investigation fire caused arson.,9.92628599481761
384sentences.14,lowPMI,arson done damage collect can to to or be cause others insurance.,11.416851548530692
384sentences.15,lowPMI,severity depends were the the whether of on crime people harmed.,7.850527804677022
384sentences.16,lowPMI,automobile is vehicle passengers an a or for car wheeled transporting.,15.919489314949931
384sentences.17,lowPMI,car powered electric a by or can a be gasoline engine.,20.768784305241585
384sentences.18,lowPMI,driver car other just the on the steers roads passengers sit.,15.440281819352487
384sentences.19,lowPMI,automobiles size doors trunk in and of of the vary number type.,3.666068836236712
384sentences.20,lowPMI,axe tool split wood the to a and is used cut.,13.448573119207232
384sentences.21,lowPMI,axe consists attached the a a of to usually head handle.,1.34204782415946
384sentences.22,lowPMI,historically heads made then of and axe were stone metal.,4.448529187311063
384sentences.23,lowPMI,axes used firemen buildings by and are woodcutters entering.,12.671354934626267
384sentences.24,lowPMI,banana long grows soft inside a that with a in a is fruit bunchs edible.,30.81169596702813
384sentences.25,lowPMI,banana be purple have brown a can and when or ripe yellow red small spots.,15.067114364924352
384sentences.26,lowPMI,greatest are countries india the or as producers tropical such ecuador.,7.823746698631682
384sentences.27,lowPMI,unripe plantains staple often potatoes and like and bananas are foods cooked.,25.450128327700103
384sentences.28,lowPMI,bed piece used sleep sex a of a or a as to is furniture place have in.,10.041047142028068
384sentences.29,lowPMI,bed made box sheets covers a a a and of and plus is mattress spring pillows.,11.58623467652681
384sentences.30,lowPMI,waterbeds is water it filled in with in the and with mattress filled airbeds is air.,15.493207229991732
384sentences.31,lowPMI,type is fabric suspended another the above of a the bed hammock sling ground.,25.451953117244337
384sentences.32,lowPMI,bee flying black body a with and six a a and is insect yellow legs.,20.33514679573795
384sentences.33,lowPMI,bees pollen they make between nectar as to spread flowers collect honey.,16.511714125582728
384sentences.34,lowPMI,bees social live colony hive and a a in in are insects together located.,11.899501357386121
384sentences.35,lowPMI,many have attack feel and if can bees stingers they threatened.,5.8254278630783745
384sentences.36,lowPMI,bicycle vehicle pedals a with and a a two on is wheels frame.,5.080419173885815
384sentences.37,lowPMI,bicycle propelled cyclist a the a the by of on is pedalling saddle.,22.40698607384165
384sentences.38,lowPMI,wheels rubber inner full the an with of have tires tube air.,18.813331133378377
384sentences.39,lowPMI,people bicycles recreation for and use transportation racing.,4.974394576628078
384sentences.40,lowPMI,blacksmith objects iron a or by creates forging steel.,8.68419650148124
384sentences.41,lowPMI,blacksmith bends iron change shape a on to and an hammers hot anvil its.,19.349422766563123
384sentences.42,lowPMI,blacksmiths thick handle tongs a the and with wears apron metal.,7.985952562278525
384sentences.43,lowPMI,blacksmiths objects horse iron like or make weapons shoes furniture.,9.138097354736745
384sentences.44,lowPMI,blender kitchen used ingredients food a to a or is appliance mix puree.,21.575460517997072
384sentences.45,lowPMI,blenders glass container blade a with in or a the have plastic rotating bottom.,19.59533251786925
384sentences.46,lowPMI,blenders used milk fruit to and are make shakes smoothies.,6.790352797703847
384sentences.47,lowPMI,blenders also make alcoholic crushed to with are used cold drinks ice.,15.98428689000479
384sentences.48,lowPMI,boy young child not puberty a who a is male has undergone.,15.442851088237342
384sentences.49,lowPMI,term used sex relative the to to is indicate distinctions girls.,12.605064814022146
384sentences.50,lowPMI,traditionally play games other like and each to with boys rough fight.,20.208165913372643
384sentences.51,lowPMI,adult behaving is referred an as to a male immaturely often boy.,15.827940779293161
384sentences.52,lowPMI,broccoli plant family a the in is cabbage.,9.407001892837728
384sentences.53,lowPMI,broccoli green head tough a a and has flower thick stalk.,12.459143113755875
384sentences.54,lowPMI,broccoli high fiber nutrients in and is vitamins other.,8.556393481881232
384sentences.55,lowPMI,broccoli boiled eaten can or be stir-fried raw.,24.59037839404956
384sentences.56,lowPMI,butterfly flying large a with a four is insect wings.,21.288616194677477
384sentences.57,lowPMI,wings be colorful the can of and butterflies very patterned.,4.141058401141891
384sentences.58,lowPMI,metamorphosis transformation butterfly the a a of into is caterpillar.,4.270105814260594
384sentences.59,lowPMI,people butterflies colorful some of because collect their wings.,18.677796536668314
384sentences.60,lowPMI,carpenter artist laborer wood a or with an who is manual works.,9.132151375773965
384sentences.61,lowPMI,carpenters repair furniture other and and build houses boats objects.,21.69351610392188
384sentences.62,lowPMI,carpenters tools hammers pliers as and use such saws planes.,15.870118788021614
384sentences.63,lowPMI,luthier carpenter repairs instruments a that a and is makes musical.,5.655578660627712
384sentences.64,lowPMI,cats small animals tail with and four a are furry legs.,14.99087022769859
384sentences.65,lowPMI,cats themselves their like by to groom licking fur.,7.019561859494321
384sentences.66,lowPMI,cats mice are fed owners can but or by hunt birds often their.,18.945290849211055
384sentences.67,lowPMI,claws are they sharp the so of that cats retractable keep.,17.97212411728672
384sentences.68,lowPMI,chair piece designed sit a of to a for on is furniture people.,7.313029710648498
384sentences.69,lowPMI,chairs seat floor supported of above a by consist raised level legs.,6.8226567718533
384sentences.70,lowPMI,chairs have arm as cushion can as and a also back rests well.,5.796299427338589
384sentences.71,lowPMI,seats fixed located places in in or like are chairs vehicles cinemas.,12.96107939405822
384sentences.72,lowPMI,clarinet woodwind instrument a a is musical.,12.677531023102684
384sentences.73,lowPMI,clarinet long tube bottom a with at a a the is black flare.,10.1207379181247
384sentences.74,lowPMI,player notes keys the and by chooses pressing holes.,4.48683118970805
384sentences.75,lowPMI,clarinet used classical the in both and is jazz music.,10.733495272840825
384sentences.76,lowPMI,cod fish colder atlantic a that the the a in of is lives areas.,12.048867421595872
384sentences.77,lowPMI,cod is mild-tasting easily and when and flesh white flakes cooked.,22.0622750773712
384sentences.78,lowPMI,fresh is fish salted elaborate for for and cod used chips cod dishes.,19.57890019650101
384sentences.79,lowPMI,cod been salted time and the the since of has caught traded vikings.,11.647205765155157
384sentences.80,lowPMI,coffee made beans coffee from of the the is coffee seeds plant.,19.777107503166977
384sentences.81,lowPMI,coffee popular many usually hot a and in is drink countries served.,6.000016427197012
384sentences.82,lowPMI,coffee mild called keeps awake a that contains drug caffeine people.,19.27412643696283
384sentences.83,lowPMI,coffee world's legal export the is seventh-largest agricultural.,15.19074249621291
384sentences.84,lowPMI,desert natural almost falls a where a no is environment rain.,12.086543642453934
384sentences.85,lowPMI,hot are filled dunes with or deserts usually sand rocks.,8.963838897007719
384sentences.86,lowPMI,animals have live some to and in plants adapted deserts.,10.635526805463599
384sentences.87,lowPMI,biggest desert sahara africa the in the hot is northern.,27.889769787033604
384sentences.88,lowPMI,desk piece used sometimes a of at a a for with is furniture working computer.,11.989520874012188
384sentences.89,lowPMI,desk flat be wood metal a and of a can or has surface made plastic.,8.312924483868153
384sentences.90,lowPMI,desk drawers supplies a to may and have store papers.,10.607897799099097
384sentences.91,lowPMI,cubicle desk partitions a a on of by three consists surrounded sides.,7.607892819195736
384sentences.92,lowPMI,door movable entrance enclosed a to from a or an is barrier exit area.,19.156496361119448
384sentences.93,lowPMI,most have control pass to to who through doors locks gets them.,9.99676255241466
384sentences.94,lowPMI,most are pushing handle are by a or after doors opened pulling they unlocked.,17.522245750091017
384sentences.95,lowPMI,other doors consist chamber of or a can of types slide revolving.,10.878461908187226
384sentences.96,lowPMI,dress piece women wear a of a that is clothing sometimes.,16.94749768791748
384sentences.97,lowPMI,dress shirt long skirt a a a like to is attached matching.,25.361940802372363
384sentences.98,lowPMI,dress usually formal such dance a as or at a a is worn occasions wedding.,15.090543562196247
384sentences.99,lowPMI,it hard stairs bike can or in to a a be climb ride dress.,5.850332376529388
384sentences.100,lowPMI,drunk is driving alcohol the under of of the driving act effects.,10.23839582578629
384sentences.101,lowPMI,drunk vehicle crime world of a of any in the driving is most.,15.266809538561056
384sentences.102,lowPMI,it role half deaths a of in all plays almost vehicle-related.,4.769528874721457
384sentences.103,lowPMI,drunk are field breathing by and drivers caught sobriety tests.,11.25228851934952
384sentences.104,lowPMI,drought persistent water caused rain a of by a the of is shortage supply lack.,22.412196112895213
384sentences.105,lowPMI,drought crops stop die will to and and cause plants growing.,6.990779879119389
384sentences.106,lowPMI,extreme eventually areas cause will and into drought turn desert famine.,4.885651318228779
384sentences.107,lowPMI,large people migrate bowls of away to from numbers have dust.,8.937529536890231
384sentences.108,lowPMI,eagles large prey day very eyesight of during and that the are birds hunt have good.,21.136360509271288
384sentences.109,lowPMI,eagles hooked tearing strong sharp for and have beaks flesh legs talons.,4.302222068701925
384sentences.110,lowPMI,eagles eyries eat others mammals in some and and live species fish small.,19.149756587305752
384sentences.111,lowPMI,bald has white is bird states the and of a the the eagle bright head national united.,10.579619308088594
384sentences.112,lowPMI,earthquakes ground buildings structures the can and and down shake knock other.,7.196185523510874
384sentences.113,lowPMI,shaking trigger volcanic the and can also landslides activity.,15.91990674056324
384sentences.114,lowPMI,most are release earth's by of the the in earthquakes caused energy crust.,15.318162433084932
384sentences.115,lowPMI,earthquake displace cause an can and at the a sea seabed tsunami.,11.886390444362917
384sentences.116,lowPMI,elephants largest land weighing tons the of are kind mammal several.,20.816507353532167
384sentences.117,lowPMI,elephant long called grab food an a can a which or has nose trunk things.,3.6873020786184854
384sentences.118,lowPMI,elephant pair tusks objects trees the of or a for into has ivory moving digging.,7.81894222068555
384sentences.119,lowPMI,elephant its ears blood its the the and to in flaps large cool them body.,10.867458104373377
384sentences.120,lowPMI,eye organ light it cortex the for for an and the is sensing coding visual.,12.182542230558441
384sentences.121,lowPMI,most have eyes color texture which and can animals complex detect motion.,10.23213311012701
384sentences.122,lowPMI,fovea center eye sensitive it the of and of the the the is human most part.,9.111725304962938
384sentences.123,lowPMI,insects compound made units many up in of have eyes eye facing directions.,6.425303822185904
384sentences.124,lowPMI,farm land grow raise food a or to for is used plants animals.,14.91995230552533
384sentences.125,lowPMI,farmers people farm produce the the what who and to are run decide.,9.859549886733406
384sentences.126,lowPMI,farms have farmers barn a a a for and usually house silo.,9.92103956458105
384sentences.127,lowPMI,cooperative farm farmers land a where and a the is many share equipment.,12.426729431754202
384sentences.128,lowPMI,primates have thumb four a each and on usually fingers hand.,3.8362598291581547
384sentences.129,lowPMI,fingers used writing other for and are grasping grooming activities.,6.732074186724661
384sentences.130,lowPMI,fingertips sensitive pressure the and to are temperature vibration.,12.183707048616986
384sentences.131,lowPMI,nail tip be decorated the of and or the the can protects finger grown.,10.09978010814936
384sentences.132,lowPMI,flood overflow water inhabited a of of an an that is expanse submerges land.,23.959263203340562
384sentences.133,lowPMI,flood caused rain snow as earthquakes can or at by as be heavy rapid melt well sea.,16.513369831330007
384sentences.134,lowPMI,flood flow its break levees in a of and a will or river out channel dams.,17.320303255228072
384sentences.135,lowPMI,flood evacuate water diseases during and a the people contaminated causes.,6.75173695141898
384sentences.136,lowPMI,floor horizontal building walking a inside for a a is surface used on.,12.452613625504762
384sentences.137,lowPMI,floors made concrete linoleum floorboards may or of be bare tile wooden.,10.790189096325001
384sentences.138,lowPMI,people put floor dampen on for to a and often carpets comfort noise.,3.9639402445572904
384sentences.139,lowPMI,buildings often pipes wiring in and the under floor has electrical it.,8.244672966872443
384sentences.140,lowPMI,foot body end a on of a the a is part leg.,7.301035289653427
384sentences.141,lowPMI,people their walking standing when or use feet running straight.,8.9356678573794
384sentences.142,lowPMI,people use feet fighting to both in and also their kick sports.,11.03273042662998
384sentences.143,lowPMI,many have behavior feet for to cultures rules related.,1.7065303454507412
384sentences.144,lowPMI,forest area density canopy a with of an a and is high trees cover.,21.884381827487147
384sentences.145,lowPMI,type depends rainfall location the on in of and forest temperature its.,10.916925275887117
384sentences.146,lowPMI,forest has types animals well plants a and of as ecosystem various trees as ground.,7.46739382016754
384sentences.147,lowPMI,deforestation cutting disregarding the of down is forests regeneration.,6.637346007423598
384sentences.148,lowPMI,fork tool solid handle tines a for a a with and is eating foods several.,18.831408583019076
384sentences.149,lowPMI,forks usually metal disposable of if or are made plastic.,12.216439473954013
384sentences.150,lowPMI,forks used food hold place to the to while to or in are lift mouth food cutting.,7.929732747163971
384sentences.151,lowPMI,forks used cultures special various in there and for are western are kinds foods.,11.487190102055367
384sentences.152,lowPMI,frying is pan sides a with a a and pan small sloping handle.,19.992705612018348
384sentences.153,lowPMI,frying is fry brown a and to pan used sear food.,15.537310968161997
384sentences.154,lowPMI,food cooked covering pan the the the on of is oil bottom.,15.47972655126489
384sentences.155,lowPMI,frying are iron steel of or pans made teflon-clad.,8.16778368608514
384sentences.156,lowPMI,girl female has yet maturity a who a is human not reached.,6.93200419326592
384sentences.157,lowPMI,body develops at the a that a puberty of into of girl woman.,10.566971839567278
384sentences.158,lowPMI,girls playing social like and with often dolls games.,8.689938377259548
384sentences.159,lowPMI,girls grow hair dresses and and sometimes long wear skirts.,18.507519001586736
384sentences.160,lowPMI,glove piece covers fingers a of the a that and is clothing hand.,6.473660623412413
384sentences.161,lowPMI,gloves cold made lined material to of against or protect are wool waterproof.,4.859827693188165
384sentences.162,lowPMI,disposable latex are shield germs or from to or rubber gloves used hands chemicals.,29.429343566126335
384sentences.163,lowPMI,mitten kind fingers covered a of the a where four is glove are together.,9.159247413114029
384sentences.164,lowPMI,hammer tool deliver object a to to a an an is used impact.,9.201099103133487
384sentences.165,lowPMI,hammer most used nails a into to is often drive wood.,11.876137577460366
384sentences.166,lowPMI,claw be remove the the to on can head used nails.,4.211770299678314
384sentences.167,lowPMI,hammers shape handle in of and the the vary head length.,1.5071185486051637
384sentences.168,lowPMI,hand is used people a as against an a grenade explosive weapon.,23.690371607127684
384sentences.169,lowPMI,hand are timed bit and a to after grenades thrown explode that.,15.463921575153856
384sentences.170,lowPMI,grenades be rifles launchers can or from also fired shoulder.,3.105079435928781
384sentences.171,lowPMI,gas are middle disperse tear the a into of to grenades thrown mob it.,12.340516608449807
384sentences.172,lowPMI,horse large mammal muscular a with a four is hoofed long legs.,14.551330150277602
384sentences.173,lowPMI,horse tail its is gray a and on or a a and has mane neck usually brown.,14.476482801009295
384sentences.174,lowPMI,horses been draft travel for and have used work entertainment.,4.522473603285121
384sentences.175,lowPMI,human horse walks gallops a a or can while ride it trots.,5.978566083434791
384sentences.176,lowPMI,people hospitals healed are injured to when to or go be they sick.,6.4489996744382605
384sentences.177,lowPMI,hospitals staffed physicians nurses by and are professional surgeons.,9.784736063827328
384sentences.178,lowPMI,patients there diagnosis leaving day some or for the go specialist therapy same.,8.75068377795645
384sentences.179,lowPMI,operations patients stay weeks for or for some to treatments have several.,11.516022215397644
384sentences.180,lowPMI,house permanent structure families in a or or a for to is building people live.,15.056891039503997
384sentences.181,lowPMI,house roof keep rain let in a and out and a to and to has walls cold windows light.,12.277282236832882
384sentences.182,lowPMI,house rooms sleeping washing a for or can like have purposes cooking.,10.329655649154454
384sentences.183,lowPMI,most leave work back eat the and to to at and people house come night sleep.,2.05477841947212
384sentences.184,lowPMI,igloo type made snow an of of a from by is shelter blocks inuit.,8.369289924842867
384sentences.185,lowPMI,igloos built snow land time in the the where of are places covers most.,17.586144980834668
384sentences.186,lowPMI,igloos often shape entrance in of with the a an are built dome tunnel.,11.049079068930642
384sentences.187,lowPMI,air snow space heat igloos in and the pockets insulate body warms.,4.587764112313314
384sentences.188,lowPMI,knife tool edge used things a with that a a to is sharp is cut.,9.82814788295874
384sentences.189,lowPMI,modern consist blade made of and of a a knives handle usually metal.,8.372006191512465
384sentences.190,lowPMI,knives also used instruments as in and have been weapons rituals.,17.844748077551444
384sentences.191,lowPMI,knife used slashing throwing a to or can by be attack stabbing.,4.634853689863536
384sentences.192,lowPMI,lentils seeds legume the a the of of are plant family.,14.747217226534648
384sentences.193,lowPMI,lentils red brown yellow can or be green black.,16.264227576917538
384sentences.194,lowPMI,lentils commonly indian cuisines in and are used mediterranean.,7.92667419387501
384sentences.195,lowPMI,lentils cooked are source by a and of are boiling great protein.,15.581013195163365
384sentences.196,lowPMI,lettuce biennial often temperate leaf a as in a is plant grown climates vegetable.,20.86678795142074
384sentences.197,lowPMI,lettuce eaten raw other cooked can in or and and be cold salads dishes.,25.53587719959323
384sentences.198,lowPMI,lettuce considered easy suitable beginners to a and for is fairly grow crop.,8.977660660312456
384sentences.199,lowPMI,most leaves bitter bred bitterness but to some the lettuce taste are remove.,13.821268339952134
384sentences.200,lowPMI,library place books media kept a where of a a and is collection documents is.,7.83103690957118
384sentences.201,lowPMI,librarians libraries experts organizing at at and and work are finding information.,4.5330473507929465
384sentences.202,lowPMI,people public borrow take several can and for to to go libraries books home weeks.,8.667528012484675
384sentences.203,lowPMI,academic support research specialized and libraries scholarly have books.,21.85433044032896
384sentences.204,lowPMI,log is house round a from a cabin small built logs.,15.904031998750177
384sentences.205,lowPMI,log is american life origins a and of cabin symbol frontier humble.,5.200895753842672
384sentences.206,lowPMI,log were first european as by cabins used shelters settlers.,9.007623754873528
384sentences.207,lowPMI,log were using notch ends with the at cabins built logs joints.,24.06579655690327
384sentences.208,lowPMI,man male adult a a is human.,11.114056842556312
384sentences.209,lowPMI,boy man puberty a after a through becomes passing.,6.611197344271505
384sentences.210,lowPMI,manhood associated virility with and is masculinity.,4.24634259307958
384sentences.211,lowPMI,men women weight structure from and in differ height body.,3.6948399699385437
