243sentences.0,backward,habitats local of conservation the encourages beekeeping,1.818162321404319
243sentences.1,backward,pollen produce that plants local conserve to interest beekeeper's every in is it,1.6961483025652417
243sentences.2,backward,crops for way make to cleared be vegetation native that require not does it agriculture of form passive a as,1.6206429884333526
243sentences.3,backward,honeybees the kill could they because crops on pesticides of use the discourage also beekeepers,1.6304314058259368
243sentences.4,backward,effort the worth is product their but craft their for extremes to go beekeepers artisanal,1.3423137397546308
243sentences.5,backward,consistency and quantity over character and quality emphasizes honey-making artisanal,1.5684367367952872
243sentences.6,backward,honeybees their of micromanagers become beekeepers honey finest the produce to,1.6248448071331083
243sentences.7,backward,honey extract to ways best the select and flows nectar when know fields the scout they,1.2509317175453443
243sentences.8,backward,air the fills bees 40000 of hum deep the hive the opens beekeeper the as,1.8927628544876847
243sentences.9,backward,nursery bee the and supplies pollen stores honey checks beekeeper the,1.4231948312018403
243sentences.10,backward,gentle they're because sting don't they but hands and arms bare his across crawl bees,1.9142321249951424
243sentences.11,backward,college in longer no i'm though even exams about dream recurring a have i,1.4554426144289634
243sentences.12,backward,class to gone never i've realize suddenly i and exam final my of day the it's dream my in,1.0538009061963307
243sentences.13,backward,assignments reading the of any done even never i've,1.369651303567267
243sentences.14,backward,nightmare same the have who people other many know i,1.7050917008416713
243sentences.15,backward,night previous the from experience dream their down write to had study the in participants morning each,1.8826051516214215
243sentences.16,backward,intensity emotional its and dream each described and dreams any recalled they if recorded they,1.196985296045147
243sentences.17,backward,nightmare a or dream bad a dream flying a as such category a to dream each assigned then participants,2.167240638574031
243sentences.18,backward,awake are we when as active as are minds our sleep we while night every,1.7220500668098968
243sentences.19,backward,each minutes ninety about of cycles in night the throughout dream we,1.321254560308118
243sentences.20,backward,dreams our fill can places and characters of combinations strange and stories feelings images,1.6703553103301463
243sentences.21,backward,worse to bad from went things cards playing start to decided i when,1.4695314706490172
243sentences.22,backward,it doing $10000 to close spent already had i and do to had i something was gambling,0.9206553425195422
243sentences.23,backward,away savings my gamble me watching of sick were friends my,1.6335232328549472
243sentences.24,backward,have not did i money losing after casino a leaving of horror the was part hardest the,1.6664013158512767
243sentences.25,backward,by come to hard are gambling legalized of effects economic and social the on data good,1.5146028086602104
243sentences.26,backward,likely more problems gambling makes nearby casino a having that indicate studies some,2.2978557238039956
243sentences.27,backward,problems marriage and bankruptcies personal with associated be also may gambling,1.75365342398147
243sentences.28,backward,gambling legalized of expansion dramatic a been has there generation past the over,1.9642359737892976
243sentences.29,backward,well as casinos have many and lotteries instituted have states most,2.0566979723087866
243sentences.30,backward,business controversial but big very become has gambling,1.7073996001415384
243sentences.31,backward,kitchen the in window a shattering house the shook hurricane the from wind the,1.8376955426834334
243sentences.32,backward,hurricane the to kitchen the surrendered and door the slammed food some grabbed in ran we,1.469633876764505
243sentences.33,backward,foundation its from ripped be would house our afraid was i,1.193160892105946
243sentences.34,backward,sofa the on huddled asleep fell we house the shaking wind the with night that later,1.772052777806331
243sentences.35,backward,foundations their off houses suck and trees of off limbs tear can hurricanes,1.3842054385804667
243sentences.36,backward,mudslides and floods trigger can that rains heavy dump they,1.7267875194044304
243sentences.37,backward,land onto lurches that water ocean of wall a surge storm a bring also can hurricanes,1.8005702024051324
243sentences.38,backward,hurricanes ancient of evidence for look to methods several use scientists,1.48931091648173
243sentences.39,backward,lakes coastal of bottoms the at sand beach windblown of layers deposited storms strongest the,2.4510653799042807
243sentences.40,backward,rings growth their in storm each of record a preserve hurricanes passing by drenched trees,1.4403402307751674
243sentences.41,backward,preferences different have countries different but world the around exported is cream ice american,1.742416931111654
243sentences.42,backward,delicacies local with flavored cream ice their enjoy people many,2.9969757080782125
243sentences.43,backward,mangos fresh and bananas with topped is cream ice vanilla places tropical some in,2.94059187045704
243sentences.44,backward,child a as home at cream ice making remember i,1.6129668743317842
243sentences.45,backward,cold the to it expose to crank the turning start then tub frozen a into mixture cream the poured we,1.8489031506721594
243sentences.46,backward,more any crank hand the turn couldn't i that enough froze it eventually,0.9029944571784658
243sentences.47,backward,harden to freezer the into cream ice half-frozen of container the put i then,1.8322579182884233
243sentences.48,backward,air whipped-in half to up and flavorings sugar cream or milk of mixture a is cream ice,1.9336461646819743
243sentences.49,backward,silky and smooth it makes what is cream and milk in butterfat the,2.150526741337266
243sentences.50,backward,flavorings natural and butterfat with loaded is cream ice premium high-priced,2.2712831719595314
243sentences.51,backward,hurt back my makes chair uncomfortable the mower lawn riding the use i when,2.0985675445285157
243sentences.52,backward,machine the control to me of front in levers two the use i,1.4405204459596952
243sentences.53,backward,grass of blade each sever precisely mower lawn the underneath blades sharp the,2.0411622453970635
243sentences.54,backward,patience me taught has it and task long a is lawn the mowing,1.826650886527331
243sentences.55,backward,height even an to grass cut that blades revolving with machine a is mower lawn a,2.0579187925947102
243sentences.56,backward,motor a have may machine the or muscle by powered be may blades the,1.40869515794395
243sentences.57,backward,engine gas small a is mowers lawn for source power common most the,2.191562732703624
243sentences.58,backward,emissions create not do they because environment the for better are lawnmowers electric,1.5751800652005425
243sentences.59,backward,run to expensive less are and maintenance less need also they,1.73540932136849
243sentences.60,backward,toaster ordinary an as electricity much as use mowers lawn electric,2.518368382253258
243sentences.61,backward,spacewalks their for time long a train astronauts,2.0375480540901183
243sentences.62,backward,underwater conducted is training their of much,1.5110103636574008
243sentences.63,backward,space in floating spend will they hour every for pool the in hours 10 to 8 spend may they,1.3767494793758988
243sentences.64,backward,station space the of outside the on work repair and construction perform to able be to practice astronauts,1.9929121114018626
243sentences.65,backward,pilots test military as backgrounds have many and pilots always are flights shuttle of commanders the,1.7679288993642719
243sentences.66,backward,space in experiments run can who scientists and engineers doctors as trained are astronauts other,1.9877714991985742
243sentences.67,backward,diverse more much are now astronauts but men young all were crews early,1.7868562248048327
243sentences.68,backward,shuttle space the of exterior the to together out floated astronauts of team the,1.8320099125269194
243sentences.69,backward,telescope huge the on part broken the repair to needed tools carried they,1.8548786912983113
243sentences.70,backward,place into part replacement the fitted other the while pipe the on bolts the loosened astronaut one,1.2018351903990045
243sentences.71,backward,artists experimental by time long a for art in used been have computers,1.7405706562166343
243sentences.72,backward,world art mainstream the entered have graphics computer widespread and affordable more are computers that now,2.176069251076196
243sentences.73,backward,technology graphics latest the showcase that exhibitions art have conferences science computer some,1.963605487509124
243sentences.74,backward,cultures two the bridging to devoted are that up sprung have conferences new brand,1.5262633582920928
243sentences.75,backward,procedures surgical and conditions medical visualize to doctors with works specialist graphics computer the,2.4665110123571274
243sentences.76,backward,body patient's a within structures understand doctors help to animation digital uses she,1.3127088934571254
243sentences.77,backward,x-rays at squinting than clearer much is screen a on animation an in structures internal the seeing,1.6148046568615444
243sentences.78,backward,education for tool powerful a is animation digital modern,2.3044207883132675
243sentences.79,backward,students help actually graphics if ask must we broadens graphics computer of field the as,1.5959950772936364
243sentences.80,backward,classroom the in effective be can imagery digital engaging and vivid that suggest does research,1.6419740044301705
243sentences.81,backward,cliche was place first the in school law to came he reason the,1.4681342162391482
243sentences.82,backward,better the for things change to wanted he,1.847031328882303
243sentences.83,backward,all-nighter an pulled had director program the and he when school law at evening one recalled he,1.3567380062580383
243sentences.84,backward,sunrise at families evicted several for petition a drafting finished finally they,2.057190927167523
243sentences.85,backward,relentlessly up gone has education legal of cost the decades four past the over,1.9549906717834995
243sentences.86,backward,1970s the since four of factor a by increased tuition school law private,1.7144257163401493
243sentences.87,backward,crash eventually could lawyers new for and school law to admission for market the,1.5934710673854728
243sentences.88,backward,law practicing actually in experience minimal have often faculty school law,1.8410878686285348
243sentences.89,backward,journals prestigious for articles review law writing on focus professors,1.963196705151427
243sentences.90,backward,england feudal in law property like topics on classes with theoretical the emphasize often schools law,1.2824259842384749
243sentences.91,backward,care preventive in involved increasingly are pharmacists,2.525826847652679
243sentences.92,backward,often pharmacies to go people because advisers health front-line becoming are they,1.0043181494136313
243sentences.93,backward,health public about information of source good a often are pharmacists,2.18437820984044
243sentences.94,backward,effects side and interactions drug about lot a know they because pharmacists with consult doctors,1.8133048734293085
243sentences.95,backward,medications of use safe the about advice offer and patients to drugs prescription dispense pharmacists,2.2924609264787676
243sentences.96,backward,vaccines provide and screenings wellness and health conduct also they,2.1889872649919053
243sentences.97,backward,licensed be to order in exams two pass and degrees professional have must pharmacists,1.7775612309455942
243sentences.98,backward,pharmacist a be to chose i as much as me chose profession pharmacy the think i,1.2666037021075092
243sentences.99,backward,child a as pharmacies in bottles arranged neatly the by fascinated was i,1.69793375707513
243sentences.100,backward,patients my of lives on have i that impact the love i but cliche it's know i,0.7708061461167263
243sentences.101,backward,situations stressful potentially to response own her or his has person each,2.0621232731974866
243sentences.102,backward,stressful fulltime working find may another while unemployment by devastated be may person one,1.6002766983855412
243sentences.103,backward,traffic in stuck being like stresses everyday are there,1.5405746737281116
243sentences.104,backward,child a of loss or divorce as such stresses traumatic also are there,1.6757586699075924
243sentences.105,backward,stress of levels different to adapt can people some,1.9554738074706326
243sentences.106,backward,health on toll real a take can stress though effectively with dealt not if,1.5949885625094167
243sentences.107,backward,beneficial or harmful be will it if determines that stress to reaction your it's that remember,1.7453000484836876
243sentences.108,backward,worried and stressed incredibly felt i downsizing was company my when,1.24047241902129
243sentences.109,backward,times at dizzy felt even i and reason no for race would heart my,1.432940287744969
243sentences.110,backward,level stress my manage to try to yoga taking started i then,2.077964733732634
243sentences.111,backward,stripes satin with tuxedo black jet a wore man the,3.5081945600170648
243sentences.112,backward,style latest the in cut fabric rich with made was it,2.1253241334198676
243sentences.113,backward,perfectly man the fit it as tailored it had he clearly,1.291753182408702
243sentences.114,backward,event formal a for out picked have would stylist professional a something like looked it,1.5434193572617274
243sentences.115,backward,attire wedding in statements personal making are grooms today's preferred still is tuxedo the while,1.3814671199121276
243sentences.116,backward,men for fashion wedding of edge cutting the on are jackets shorter,1.5544842758732405
243sentences.117,backward,ties satin and shirts colorful with tuxedos their up jazzing also are grooms,2.516090431232677
243sentences.118,backward,lapels silk black with jacket dinner tailless a is jacket tuxedo a,3.762847364113365
243sentences.119,backward,jacket tuxedo the to match perfect a be should trousers tie black,2.058907916747997
243sentences.120,backward,lapels jacket the match and black be should tie the and white plain be always should shirt the,1.5683400477711749
243sentences.121,backward,adulthood in blind went pianist concert the,2.057104008214412
243sentences.122,backward,eyes the damaged slowly that condition genetic a by caused was blindness her,1.681684441779038
243sentences.123,backward,pianist a to advantage an was blind being that interviewers told she,1.6361889919910262
243sentences.124,backward,music her on fully more concentrate could she so distractions visual no had she,1.7460871330298857
243sentences.125,backward,life of activities ordinary the for insufficient vision as blindness defines government the,1.585380978556673
243sentences.126,backward,blind legally the on focused be can resources blindness legal of parameters the establishing by,1.8442155607343749
243sentences.127,backward,standard the meet not do who but problems vision have who those overlook may this,1.4253118775113514
243sentences.128,backward,deficiencies nutritional and disease infectious by caused usually is children in blindness countries developing in,2.4751475655132835
243sentences.129,backward,supplements vitamin and medicine by prevented be often can causes these,1.8947752926281132
243sentences.130,backward,problems genetic by caused be to likely more is blindness countries developed in,2.163779987455045
243sentences.131,backward,brain your to mouth your from gets taste a how exactly knows really one no,2.1152823154926423
243sentences.132,backward,cell bud taste a touches food of molecule a when begins process the think scientists,1.4890151105493534
243sentences.133,backward,cell the beneath nerves taste to message taste a carries cell the,1.571012111485363
243sentences.134,backward,tastes basic four the of one to responded bud taste each that believed once was it,1.864006035927936
243sentences.135,backward,sweet something eating were you if only respond would tongue the of tip the on bud taste a is that,1.9599497859508983
243sentences.136,backward,tastes basic the of all to sensitive be can bud taste single a that think now scientists,1.7904651410334054
243sentences.137,backward,flavors strong very with foods eat to tend i so good very isn't taste of sense my,1.5881319255507453
243sentences.138,backward,bitter very it's so cream no with coffee my drink i and sauce hot of lots like i,1.363888298424856
243sentences.139,backward,sugar extra add i cookies make i when so well sweetness taste even can't i,1.3294099484842317
243sentences.140,backward,individuals aging for problem real a are fractures hip,2.033455113097086
243sentences.141,backward,healing of process difficult the and break the of pain the with faced are patients,1.5654283611818283
243sentences.142,backward,independence of loss patient's the to adjust to have families,1.730894467283462
243sentences.143,backward,hospital the in time and expense substantial involve fractures hip society for and,1.6076962376496429
243sentences.144,backward,fingers their snapping someone like sound a heard i race the through halfway,2.052229393502017
243sentences.145,backward,broken was foot my that instantly knew i and crunch a felt i,1.1445910539309008
243sentences.146,backward,spikes on running like felt step every,1.9425551487292287
243sentences.147,backward,fracture the showed clearly x-ray the afterward office doctor's the at,0.8292832256864521
243sentences.148,backward,fracture bone of types different few a are there,2.313875037463109
243sentences.149,backward,intact is skin the but broken is bone the fractures simple or closed in,1.9653012254636337
243sentences.150,backward,wound open an produced and skin the punctured has bone broken the fractures compound or open in,1.904369907565889
243sentences.151,backward,cleaned carefully not they're if infected become can piercings ear new,1.6535809919347744
243sentences.152,backward,earlobe the around redness or swelling tenderness include infection of signs,2.0394727686722494
243sentences.153,backward,ointment some apply and area the clean symptoms these see you if,1.5668647987041509
243sentences.154,backward,provider care health your contact away go don't swelling and redness the if,2.040393288291241
243sentences.155,backward,infections reduce to measures new initiated has hospital local a,1.5921121900736293
243sentences.156,backward,patients other from isolated are patients infected that ensured and habits washing hand improved have they,1.6769220957401079
243sentences.157,backward,began measures new the since drop rates infection seen has hospital the,1.1658857832069656
243sentences.158,backward,infection of risk the increases which healing delays alcohol or soap with wound a scrubbing,1.807769544046307
243sentences.159,backward,moisture and heat in holding by infection of risk the increase can band-aids,1.4519226289236817
243sentences.160,backward,diagnosed are they once treated be easily can infections skin most fortunately,2.107180347840561
243sentences.161,backward,century sixteenth the of end the at started opera modern,1.9319403033206222
243sentences.162,backward,performance tragic greek imitate and rediscover to effort an as began it,1.527492865795678
243sentences.163,backward,matter subject their for antiquity from tales chose opera of founders early,1.4954514893410702
243sentences.164,backward,traditions musical and stories of sources different into out branched operas later,1.8127102490756384
243sentences.165,backward,music and words combines that play a perform musicians and singers which in form art an is opera,1.7545951678627174
243sentences.166,backward,costumes and scenery acting as such theatre spoken of elements the of many incorporates it,1.5884353558007198
243sentences.167,backward,orchestra an by accompanied and house opera an in given typically are performances,1.912168168699698
243sentences.168,backward,production new the in role the win to hard worked has singer opera the,1.893385746934864
243sentences.169,backward,singing about just not is job her,1.592035898892751
243sentences.170,backward,critical all are interpretation musical and presence stage acting,1.4571776572568045
243sentences.171,backward,show the of star the certainly is voice strong pure her but,1.3047314934653444
243sentences.172,backward,painting a completing while mind in elements many keep must painter a,1.5230213248036095
243sentences.173,backward,lighting and composition strong like design of elements solid use to has she,1.0937358213866164
243sentences.174,backward,skill with strokes brush the execute to has she,1.8873105180352658
243sentences.175,backward,soul painter's the of glimpse a reveal should painting the of content the importantly most,1.4697987744219296
243sentences.176,backward,artists creative as than artisans skilled as more employed were painters ago long,2.187104609531329
243sentences.177,backward,court royal the of members and scholars of status social the had painters prominent however,1.597304482466797
243sentences.178,backward,patrons their with relationship personal a established and imagery and subject its on decided work their signed they,1.6491468571142425
243sentences.179,backward,itself painting the on more and scene actual the on less focus to learned i painter a as,1.202531689055698
243sentences.180,backward,vision of field its within everything record to has that lens camera a not is eye artist's an,1.5801600361581694
243sentences.181,backward,painting good a for needed is than more but information useful provides nature found i,1.9321022645788235
243sentences.182,backward,bird impressive an is owl eagle the,2.938836677141204
243sentences.183,backward,horns like up stick that tufts ear has it,1.5005310222413586
243sentences.184,backward,you through right pierce could they like look and creepy downright are eyes orange large its,2.151246330044355
243sentences.185,backward,darkness the through silently and swiftly flying night at hunts owl this,2.4230158742204333
243sentences.186,backward,thriving are others endangered become have species owl some while,2.150583281193931
243sentences.187,backward,habitat previous its beyond well spread has owl barred the,2.0595704715425875
243sentences.188,backward,invasion owl's barred the facilitated have may logging that suggest findings early,1.5339372024513431
243sentences.189,backward,talons her with it gripped and branch thick a on landed owl the,1.7525803025825106
243sentences.190,backward,eye an half-closing down settled and sides her to wings her pressed she,1.4381900668402223
243sentences.191,backward,eyes her of glow the for but statue a been have might she,1.5949371788054576
243sentences.192,backward,ice sea floating across stalk bear polar a watch to unnerving it's,1.9333789453611194
243sentences.193,backward,animal huge the beneath directly waters frigid the in submerged are you when worse even it's,1.9728521392551595
243sentences.194,backward,prey its pursued bear polar the as ice the on down set paws giant overhead,2.032042066398496
243sentences.195,backward,shots these capturing months spent i documentary bear polar a for crew film the of part as,1.5309461117637844
243sentences.196,backward,confusion or fear than other reasons for people attack will that animals few the of one are bears polar,1.4999821620752718
243sentences.197,backward,environment food-scarce a in live they because hunger of out attack may they,1.1141509312410165
243sentences.198,backward,energy their conserve to careful slowly people on up sneak will they,1.7290122311698564
243sentences.199,backward,diet bear's polar the of part important an is seal the,1.5137894353814423
243sentences.200,backward,ice the on basking are that seals stalk or hole breathing seal's a by wait will they hunting when,1.49088133278344
243sentences.201,backward,around looks seal the when place in freeze and forward quietly crawl will bear polar the,1.7939466776684485
243sentences.202,backward,defense for primarily built structure a not was castle medieval the,1.8171293566456979
243sentences.203,backward,surroundings its dominate to was purpose its,1.4239810442276273
243sentences.204,backward,walk day's a within lands control easily could castle a,1.1321866514594356
243sentences.205,backward,protection for walls castle's the inside brought be could property and livestock peasants attack of times during,1.1733785869018352
243sentences.206,backward,regions many of history stormy the of record a provide locations dramatic in castles spectacular,1.8113684843199762
243sentences.207,backward,villages quaint and landscapes beautiful overlooking cliffs rocky atop stand they today,2.978272410722996
243sentences.208,backward,intrigue and plots battles to home were they past the in,1.0956022584227207
243sentences.209,backward,cliff a on built castle magnificent a above looming hotel our saw we station train the leaving upon,2.115880960588702
243sentences.210,backward,river the above feet of hundreds courtyard inner an sheltered walls outside thick the,2.2399490488729814
243sentences.211,backward,view scary slightly but incredible an had rooms tower our,1.2513053632718074
243sentences.212,backward,entranceway black small a into me gestured man the pyramid the of side the up feet fifty climbing after,1.540028334770468
