243sentences.0,Scr3,beekeeping conservation encourages the of habitats local,17.755316840266982
243sentences.1,Scr3,in it is every beekeeper's interest to conserve local plants produce that pollen,36.94947718977487
243sentences.2,Scr3,a as passive of form agriculture it does require not that native vegetation be cleared to make way for crops,78.51797859352106
243sentences.3,Scr3,discourage beekeepers also the use of pesticides on crops because could they kill the honeybees,53.53460154046681
243sentences.4,Scr3,go artisanal beekeepers to extremes for their craft but their is product worth the effort,39.106796770704854
243sentences.5,Scr3,emphasizes artisanal honey-making quality character and over quantity and consistency,27.592018113904416
243sentences.6,Scr3,the to produce finest beekeepers honey become micromanagers of their honeybees,23.92133510537134
243sentences.7,Scr3,the they scout fields know when nectar flows and select best the ways to extract honey,45.14343506484904
243sentences.8,Scr3,beekeeper as the opens the hive the deep hum of bees 40000 fills the air,51.62244269004533
243sentences.9,Scr3,checks the beekeeper honey pollen stores supplies and the bee nursery,29.75724734914691
243sentences.10,Scr3,across bees crawl his bare arms and hands but they sting don't because they're gentle,49.22362307222876
243sentences.11,Scr3,a i have recurring dream about exams even though i'm longer no in college,36.128322735546504
243sentences.12,Scr3,my in dream the it's day of my exam final and i suddenly realize i've never gone to class,48.80433960775802
243sentences.13,Scr3,even i've never done of any the reading assignments,22.94570014888817
243sentences.14,Scr3,many i know other who people have the same nightmare,30.793105590809287
243sentences.15,Scr3,morning each participants the in study had to down write their dream experience from the previous night,60.833739351134604
243sentences.16,Scr3,if they recorded they recalled any dreams and described each and dream its emotional intensity,30.998489527371586
243sentences.17,Scr3,then participants assigned dream each to a category as such a flying dream a bad dream or a nightmare,81.63419847481808
243sentences.18,Scr3,while every night we sleep our minds are as active when as we are awake,51.002681747167934
243sentences.19,Scr3,throughout we dream the night in cycles of about ninety each minutes,33.683838324521396
243sentences.20,Scr3,stories images feelings and strange combinations of characters and places fill can our dreams,42.428245258730556
243sentences.21,Scr3,decided when i to start playing cards things went from to bad worse,32.19934809781819
243sentences.22,Scr3,was gambling something had i to do and had i already spent close to $10000 doing it,33.105217615622564
243sentences.23,Scr3,were my friends sick watching of me gamble my savings away,25.439639540627482
243sentences.24,Scr3,hardest the part the was horror of leaving casino a after losing money i did not have,54.40783720943941
243sentences.25,Scr3,on good data the social and economic effects of legalized are gambling hard to come by,52.20627620147122
243sentences.26,Scr3,indicate some studies that having a casino nearby makes gambling more problems likely,51.387866649837164
243sentences.27,Scr3,also gambling may be with associated personal bankruptcies and marriage problems,40.43364274574527
243sentences.28,Scr3,past over the generation there has been a dramatic expansion legalized of gambling,54.20512981759623
243sentences.29,Scr3,have most states instituted and lotteries many have casinos as well,41.36048406353543
243sentences.30,Scr3,gambling very has become big controversial but business,18.890671332302066
243sentences.31,Scr3,from the wind the hurricane shook the house shattering a in window the kitchen,57.95325079858743
243sentences.32,Scr3,in we ran grabbed some food slammed the door and the surrendered kitchen to the hurricane,50.88666854579842
243sentences.33,Scr3,afraid i was our would house be ripped from its foundation,29.545912426364055
243sentences.34,Scr3,night later that with the wind shaking the house we asleep fell huddled on the sofa,56.552147954972234
243sentences.35,Scr3,tear hurricanes can limbs off of trees and suck houses their off foundations,33.13399864035392
243sentences.36,Scr3,heavy they dump rains can that trigger floods and mudslides,28.2914734119484
243sentences.37,Scr3,also hurricanes can bring a storm surge a wall of water ocean that lurches onto land,64.35956298194985
243sentences.38,Scr3,several scientists use methods look to for evidence of ancient hurricanes,28.6579803330119
243sentences.39,Scr3,storms the strongest deposited layers of windblown beach sand at bottoms the of coastal lakes,80.64871528464536
243sentences.40,Scr3,by trees drenched passing hurricanes preserve a record of each in storm their growth rings,41.373228098586345
243sentences.41,Scr3,cream american ice is exported around the world but different have countries different preferences,55.8032822578384
243sentences.42,Scr3,enjoy many people their cream ice flavored with local delicacies,58.91757691012352
243sentences.43,Scr3,tropical in some places vanilla ice cream is topped with and bananas fresh mangos,85.49463087985272
243sentences.44,Scr3,making i remember ice at cream home as a child,31.772556283990017
243sentences.45,Scr3,poured we the mixture cream into a frozen then tub start turning the crank to expose it to the cold,63.431387680330815
243sentences.46,Scr3,froze eventually it enough that i couldn't turn the hand any crank more,23.18132039277652
243sentences.47,Scr3,put then i the container of half-frozen ice cream into freezer the to harden,58.01391205388389
243sentences.48,Scr3,cream ice is mixture a of milk or sugar cream flavorings and up to half whipped-in air,62.946846175949716
243sentences.49,Scr3,in the butterfat milk and cream is what makes it and smooth silky,59.80066451575084
243sentences.50,Scr3,ice high-priced premium cream loaded is with butterfat and natural flavorings,37.98840170419576
243sentences.51,Scr3,use when i the riding lawn mower the uncomfortable chair my makes back hurt,61.03245577566796
243sentences.52,Scr3,the i use two levers in front of me to the control machine,33.23604702908587
243sentences.53,Scr3,blades the sharp underneath the lawn mower precisely sever each of blade grass,56.568443898098366
243sentences.54,Scr3,lawn mowing the is a long task and it has me taught patience,48.15393741626381
243sentences.55,Scr3,mower a lawn is a machine with revolving blades that grass cut to an even height,75.22124845904294
243sentences.56,Scr3,may the blades be powered by muscle or the machine have may a motor,36.77418803387365
243sentences.57,Scr3,common the most power source for lawn mowers is a gas small engine,60.936004448549724
243sentences.58,Scr3,are electric lawnmowers better for the environment because they do create not emissions,46.10724082793468
243sentences.59,Scr3,need they also less and maintenance are less expensive to run,37.83701873911959
243sentences.60,Scr3,mowers electric lawn use much as electricity as an ordinary toaster,53.88119646970221
243sentences.61,Scr3,astronauts long train a time their for spacewalks,25.819184339087258
243sentences.62,Scr3,much training of their is underwater conducted,15.617233333721204
243sentences.63,Scr3,may they spend to 8 10 hours in pool the for every hour they will spend floating in space,66.3344546835551
243sentences.64,Scr3,practice astronauts to able be to perform construction repair and work on the outside of the space station,82.41966957194948
243sentences.65,Scr3,of the commanders shuttle flights are always pilots and many backgrounds have as military test pilots,60.60037287068901
243sentences.66,Scr3,are other astronauts trained as doctors engineers and scientists who run can experiments in space,55.9630225688216
243sentences.67,Scr3,were early crews all young men but astronauts now are more much diverse,42.00955741610243
243sentences.68,Scr3,of the team astronauts floated out together to the exterior the of space shuttle,50.971971687582204
243sentences.69,Scr3,tools they carried needed to repair the broken part on huge the telescope,43.9021491804072
243sentences.70,Scr3,astronaut one loosened bolts the on the pipe the while other fitted the replacement part into place,41.89632991030986
243sentences.71,Scr3,been computers have used in art for a long time experimental by artists,42.535407167775716
243sentences.72,Scr3,computers now that are more affordable and widespread computer graphics entered have the mainstream art world,61.17720304175184
243sentences.73,Scr3,science some computer conferences have art exhibitions that showcase the graphics latest technology,57.674750629697485
243sentences.74,Scr3,conferences brand new have sprung up that are devoted to the bridging two cultures,49.8616669733389
243sentences.75,Scr3,graphics the computer specialist works with doctors to visualize medical and conditions surgical procedures,62.55518798589615
243sentences.76,Scr3,digital she uses animation to help doctors understand structures within patient's a body,31.45288358955973
243sentences.77,Scr3,the seeing internal in structures an animation on screen a is much clearer than squinting at x-rays,64.83428824289376
243sentences.78,Scr3,animation modern digital is powerful a tool for education,41.661358010936446
243sentences.79,Scr3,field as the of computer graphics broadens we must ask graphics if actually help students,49.14185817866412
243sentences.80,Scr3,suggest research does that vivid and engaging digital imagery can effective be in the classroom,49.68341118695165
243sentences.81,Scr3,he the reason came to law school in the first was place cliche,36.12002204665444
243sentences.82,Scr3,he change wanted to things the for better,24.163601299917776
243sentences.83,Scr3,recalled he one at evening law school when and he the program director had pulled an all-nighter,50.95104964689128
243sentences.84,Scr3,finished they finally drafting a petition for several evicted families sunrise at,48.93222473151589
243sentences.85,Scr3,past over the four decades the cost of legal education gone has up relentlessly,51.304966864334745
243sentences.86,Scr3,school private law tuition increased by a factor of four the since 1970s,48.48817837562072
243sentences.87,Scr3,for the market admission to law school and for new could lawyers eventually crash,38.20411217665177
243sentences.88,Scr3,faculty law school often minimal have experience in actually practicing law,42.050199695291916
243sentences.89,Scr3,on professors focus writing review law articles for prestigious journals,32.80901250890807
243sentences.90,Scr3,often law schools emphasize the theoretical with classes on topics property like law in feudal england,41.97207828208002
243sentences.91,Scr3,pharmacists involved are increasingly in care preventive,29.402590794001853
243sentences.92,Scr3,becoming they are front-line health advisers because people go to often pharmacies,29.875288351478883
243sentences.93,Scr3,often pharmacists are a source good of information about public health,47.15486692502648
243sentences.94,Scr3,with doctors consult pharmacists because they know a lot about interactions drug and side effects,61.73734505206586
243sentences.95,Scr3,prescription pharmacists dispense drugs to patients and offer advice about safe the use of medications,65.91405271403666
243sentences.96,Scr3,conduct they also health wellness and screenings and provide vaccines,35.912881834100745
243sentences.97,Scr3,have pharmacists must professional degrees and pass two exams in to order be licensed,55.0420072002149
243sentences.98,Scr3,the i think pharmacy profession chose me as much as chose i to be a pharmacist,40.77295450914758
243sentences.99,Scr3,fascinated i was by the neatly arranged bottles in pharmacies a as child,43.12082245849924
243sentences.100,Scr3,know i it's but cliche i love the that impact i have on lives of my patients,28.97278314699374
243sentences.101,Scr3,has each person his or her own response to potentially situations stressful,49.83988343245608
243sentences.102,Scr3,may one person be devastated by unemployment while another may working find fulltime stressful,40.223548709092334
243sentences.103,Scr3,everyday there are stresses being like stuck in traffic,27.002792851819407
243sentences.104,Scr3,also there are traumatic stresses such as divorce or loss a of child,47.97991570426555
243sentences.105,Scr3,can some people adapt different to levels of stress,35.65496612313266
243sentences.106,Scr3,dealt if not with effectively though stress can take a toll real on health,36.372428982139986
243sentences.107,Scr3,it's remember that your reaction to stress that determines if will it be harmful or beneficial,60.32289296861198
243sentences.108,Scr3,company when my was i downsizing felt incredibly stressed and worried,21.087364251888374
243sentences.109,Scr3,would my heart race for no reason and i even dizzy felt at times,46.56982438557877
243sentences.110,Scr3,started then i taking yoga to try to manage my level stress,36.23947205942969
243sentences.111,Scr3,wore the man a black jet tuxedo with satin stripes,61.66359752090889
243sentences.112,Scr3,made it was with fabric rich cut in the latest style,44.29995629691853
243sentences.113,Scr3,had clearly he it as tailored it fit the man perfectly,27.039589090414886
243sentences.114,Scr3,like it looked something a professional stylist would have picked for out a formal event,48.72884921163241
243sentences.115,Scr3,tuxedo while the is still preferred today's grooms are making statements personal in wedding attire,47.687100445931854
243sentences.116,Scr3,are shorter jackets on the cutting edge of wedding fashion men for,39.95246443054985
243sentences.117,Scr3,also grooms are jazzing up their tuxedos with colorful shirts satin and ties,68.3618800029779
243sentences.118,Scr3,jacket a tuxedo is a tailless dinner jacket with black lapels silk,90.15118421231712
243sentences.119,Scr3,trousers black tie should be a perfect match to the jacket tuxedo,59.40065980920588
243sentences.120,Scr3,shirt the should be always plain white and tie the should be black and match the jacket lapels,61.9549985837597
243sentences.121,Scr3,the went concert pianist blind adulthood in,25.21730190101634
243sentences.122,Scr3,was her blindness caused by a genetic condition that slowly the damaged eyes,41.86978903130135
243sentences.123,Scr3,interviewers she told that being blind was an advantage to pianist a,40.75333558119618
243sentences.124,Scr3,no she had visual distractions so she could concentrate more on fully her music,48.57099540068236
243sentences.125,Scr3,defines the government blindness as vision insufficient for the ordinary of activities life,37.48341584374051
243sentences.126,Scr3,the by establishing parameters of legal blindness resources can be on focused the legally blind,61.89509772996926
243sentences.127,Scr3,overlook this may those who have vision problems but who not do meet the standard,47.673097539882406
243sentences.128,Scr3,countries in developing blindness in children is usually caused by disease infectious and nutritional deficiencies,85.26992047289426
243sentences.129,Scr3,can these causes often prevented be by medicine and vitamin supplements,42.472999536167855
243sentences.130,Scr3,countries in developed blindness is more likely to be caused genetic by problems,59.57328848672759
243sentences.131,Scr3,really no one knows exactly how a taste gets from mouth your to your brain,63.914704260763834
243sentences.132,Scr3,the scientists think process begins when a molecule of food a touches taste bud cell,40.73139914289191
243sentences.133,Scr3,carries the cell a taste message to taste nerves beneath cell the,35.0562600059266
243sentences.134,Scr3,once it was believed that each taste bud responded to of one the four basic tastes,61.47810436479867
243sentences.135,Scr3,is that a bud taste on the tip the of tongue would respond only if you were eating something sweet,77.44344088894013
243sentences.136,Scr3,now scientists think a that single taste bud be can sensitive to all of the basic tastes,59.09880659301191
243sentences.137,Scr3,sense my of isn't taste very good so tend i to eat foods with very strong flavors,61.10923069725239
243sentences.138,Scr3,like i lots hot of sauce and i my drink coffee with no cream so it's very bitter,47.755913731973195
243sentences.139,Scr3,even i can't taste sweetness well so when i make i cookies add extra sugar,45.651375873211435
243sentences.140,Scr3,are hip fractures a problem real for aging individuals,37.88341731410476
243sentences.141,Scr3,faced patients are with the pain of the break and difficult the process of healing,52.15586564565397
243sentences.142,Scr3,to families have adjust the to patient's loss of independence,26.13437894585675
243sentences.143,Scr3,society and for hip fractures involve substantial expense and time the in hospital,51.463590720512734
243sentences.144,Scr3,the halfway through race i heard a sound like someone their snapping fingers,50.80802617711649
243sentences.145,Scr3,a i felt crunch and i knew instantly that my was foot broken,29.543724882973684
243sentences.146,Scr3,every like step felt running spikes on,22.454394847778296
243sentences.147,Scr3,doctor's at the office the afterward x-ray clearly showed the fracture,20.923386766620734
243sentences.148,Scr3,a there are few types different of bone fracture,37.461541671561875
243sentences.149,Scr3,or in closed simple fractures the bone is broken but skin the is intact,54.28274633043974
243sentences.150,Scr3,open in or fractures compound the broken bone punctured has the skin and produced an open wound,56.46520069927475
243sentences.151,Scr3,piercings new ear can infected become if they're not carefully cleaned,43.77739573194199
243sentences.152,Scr3,infection signs of include swelling tenderness or redness around the earlobe,41.84245145174955
243sentences.153,Scr3,see if you these symptoms clean the area and apply ointment some,40.940408107467455
243sentences.154,Scr3,redness if the and swelling don't go away contact your care health provider,54.976524438458384
243sentences.155,Scr3,hospital a local has new initiated measures to reduce infections,34.87956254437645
243sentences.156,Scr3,improved they have hand washing habits and ensured that infected are patients isolated from other patients,60.43532022431574
243sentences.157,Scr3,has the hospital seen infection rates drop since the new began measures,26.990382434800374
243sentences.158,Scr3,wound scrubbing a with soap or alcohol delays healing which the increases risk of infection,56.79582286085309
243sentences.159,Scr3,increase band-aids can the risk of infection by holding in and heat moisture,31.89820033448909
243sentences.160,Scr3,skin fortunately most infections can easily be treated once they diagnosed are,51.289651746746806
243sentences.161,Scr3,started modern opera at end the of the sixteenth century,38.48005218792247
243sentences.162,Scr3,as it began an effort to rediscover and imitate greek performance tragic,29.426149851302988
243sentences.163,Scr3,of early founders opera chose tales from antiquity for their matter subject,36.276087330066765
243sentences.164,Scr3,branched later operas out into different sources of stories and traditions musical,38.89766548720246
243sentences.165,Scr3,is opera an form art in which singers musicians and perform a play that combines words and music,60.837434878801545
243sentences.166,Scr3,many it incorporates of the elements of spoken theatre such acting as scenery and costumes,48.7231619558997
243sentences.167,Scr3,typically performances are given in an opera house and accompanied an by orchestra,55.301961494270756
243sentences.168,Scr3,singer the opera has worked hard to win the role the in new production,57.51340110290711
243sentences.169,Scr3,her not job is just singing about,20.64355500381811
243sentences.170,Scr3,presence acting stage and interpretation musical are all critical,21.038483758265812
243sentences.171,Scr3,pure but her strong voice is certainly the star of show the,29.867765390387376
243sentences.172,Scr3,must a painter keep many elements in mind while completing painting a,32.67341495466569
243sentences.173,Scr3,to she has use solid elements of design like strong and composition lighting,25.791551318380797
243sentences.174,Scr3,to she has execute brush the strokes with skill,26.981302059889863
243sentences.175,Scr3,the most importantly content of the painting should reveal a of glimpse the painter's soul,47.22042327193515
243sentences.176,Scr3,painters long ago were employed more as skilled artisans than creative as artists,57.80182072253288
243sentences.177,Scr3,painters however prominent had the social status of scholars and of members the royal court,47.66073751166709
243sentences.178,Scr3,signed they their decided work on its subject imagery and and established a personal relationship with their patrons,64.3470556290174
243sentences.179,Scr3,a as painter learned i to focus less the on actual scene and more on the painting itself,42.454984546425635
243sentences.180,Scr3,artist's an eye not is a camera lens has that to record everything within its field of vision,65.15783704878199
243sentences.181,Scr3,nature i found provides useful information but more than is for needed a good painting,56.2956310620627
243sentences.182,Scr3,the is eagle owl an bird impressive,36.746053123228776
243sentences.183,Scr3,ear it has tufts stick that up like horns,16.260618764199467
243sentences.184,Scr3,orange its large eyes are downright creepy and look like could they pierce right through you,71.49536264297116
243sentences.185,Scr3,hunts this owl at night flying swiftly and silently through darkness the,57.39211529544164
243sentences.186,Scr3,owl while some species become have endangered others are thriving,32.950211770218246
243sentences.187,Scr3,owl the barred has well spread beyond its previous habitat,44.53144251555853
243sentences.188,Scr3,suggest early findings that logging may have facilitated the barred invasion owl's,30.50215276354157
243sentences.189,Scr3,landed the owl on a thick branch and gripped it her with talons,49.214618482664704
243sentences.190,Scr3,her she pressed wings to her sides and settled down an half-closing eye,39.732957893684976
243sentences.191,Scr3,have she might been a statue but for the glow her of eyes,32.875999469959
243sentences.192,Scr3,to it's unnerving watch a polar bear stalk across floating ice sea,50.29102111933991
243sentences.193,Scr3,worse it's even when you are submerged in the frigid directly waters beneath the huge animal,70.04321991250538
243sentences.194,Scr3,paws overhead giant set down on the ice as the bear polar pursued its prey,60.67779166724572
243sentences.195,Scr3,part as of film the crew for a bear polar documentary i spent months capturing these shots,59.73007458217643
243sentences.196,Scr3,bears polar are of one the few animals will that attack people for reasons other than fear or confusion,58.70278771428399
243sentences.197,Scr3,attack they may out of hunger because they live in food-scarce a environment,31.6844064787983
243sentences.198,Scr3,sneak they will up on people slowly careful to conserve energy their,36.73811027464719
243sentences.199,Scr3,is the seal an part important of the polar bear's diet,27.525356786925347
243sentences.200,Scr3,hunting when they wait will by a seal's hole breathing or stalk seals that are basking on the ice,60.793313514645085
243sentences.201,Scr3,bear the polar will crawl quietly forward and freeze in when place the seal looks around,58.76632845763715
243sentences.202,Scr3,castle the medieval was a not structure built primarily for defense,40.06193409429753
243sentences.203,Scr3,its to purpose was dominate surroundings its,15.58901121217721
243sentences.204,Scr3,could a castle easily lands control within a day's walk,16.448794624446943
243sentences.205,Scr3,times during of peasants attack livestock and property be could brought inside the castle's walls for protection,39.62122731605043
243sentences.206,Scr3,in spectacular castles dramatic locations provide a record of the history stormy of many regions,59.53538060740389
243sentences.207,Scr3,stand today they atop rocky cliffs overlooking beautiful landscapes and villages quaint,74.7704593496476
243sentences.208,Scr3,past in the they home were to battles plots and intrigue,29.81043661872092
243sentences.209,Scr3,leaving upon the station train we saw our looming hotel above a magnificent castle built on a cliff,85.61829120792434
243sentences.210,Scr3,outside the thick walls sheltered an inner courtyard hundreds of above feet the river,54.739341998752415
243sentences.211,Scr3,rooms our tower had incredible an but slightly scary view,27.25798559732189
243sentences.212,Scr3,climbing after fifty up feet the side of pyramid the the man gestured me into a small black entranceway,66.01032488121679
243sentences.213,Scr3,into this led the at chamber the pyramid's center,21.61952727079979
243sentences.214,Scr3,him i followed down steep the dark narrow passage,34.57831017033146
243sentences.215,Scr3,inside the smell the pyramid was chalky and the air thick was,31.92856756375294
243sentences.216,Scr3,just more than the tomb of the king pyramids represented pride the of the nation,48.90866159776853
243sentences.217,Scr3,that the care the pyramid builders took in their craft evident is,35.30794071479194
243sentences.218,Scr3,covering the stones the pyramid were precisely fitted together and until polished the structure gleamed,49.02957199701269
243sentences.219,Scr3,still architects are working to solve the mysteries of how were pyramids constructed,53.18177126650946
243sentences.220,Scr3,ramps some think were built inside the pyramid's walls to stone raise blocks,37.11406149898438
243sentences.221,Scr3,that others speculate ramps zigzagged up the exterior walls of pyramid the,49.04575900569325
