384sentences.225,Scr1,the mouth has teeth to chew food and mix it saliva with,38.1848366179656
384sentences.226,Scr1,the is mouth also used for kissing and talking,20.822942746208785
384sentences.227,Scr1,speech are sounds controlled by tongue placement in the mouth,34.26111842046148
384sentences.228,Scr1,a mug is a sturdy cup with a handle for hot drinking liquids,56.34613675640063
384sentences.229,Scr1,a mug is normally ceramic but can also be made metal of or glass,47.57318172706476
384sentences.230,Scr1,a mug is thick and has a ring base for insulation thermal,44.089497967623664
384sentences.231,Scr1,mugs can be plain or have drawings imprinted or carved them on,27.795334837993995
384sentences.232,Scr1,murder the is unlawful killing of another human being with intent,43.73367278811258
384sentences.233,Scr1,murder a serious crime because it deprives the victim of existence their,48.77864798533013
384sentences.234,Scr1,killing self-defense in accidentally or in war is not considered murder,25.015680960312512
384sentences.235,Scr1,a convicted murderer is often given a life sentence or death the penalty,65.55952691642439
384sentences.236,Scr1,orange juice is a drink made from the liquid in pulp orange,51.734329397518096
384sentences.237,Scr1,orange juice has a sweet acid taste and contains a of lot vitamin c,53.42119837239976
384sentences.238,Scr1,freshly orange squeezed juice often contains pulp as well,63.06399103475781
384sentences.239,Scr1,orange is juice often drunk at breakfast from a glass,38.79666704976341
384sentences.240,Scr1,a parrot is a bird that lives in warm and regions tropical,49.585331051905676
384sentences.241,Scr1,parrots brightly-colored have feathers and a sharp curved beak,44.93614676191615
384sentences.242,Scr1,parrots imitate can the human voice if they hear it repeatedly,36.05576793932712
384sentences.243,Scr1,their appearance and abilities makes popular them pets,20.642867643967705
384sentences.244,Scr1,a is peach an orange-yellow fruit with a characteristic smell,28.060649562750037
384sentences.245,Scr1,the skin of a peach is thin and covered in fine small hairs,37.81392309928002
384sentences.246,Scr1,peaches a have large red-brown stone inside which contains the seed,28.292203311213818
384sentences.247,Scr1,peaches sweet are and delicate and must be harvested after ripening,35.7464387212618
384sentences.248,Scr1,the piano is a popular musical instrument played by means a of keyboard,61.161158026075654
384sentences.249,Scr1,pressing a piano key causes a felt-tipped hammer to hit vibrating a steel string,50.212529314690116
384sentences.250,Scr1,the piano has an enormous note range and pedals to the change sound quality,41.51088693458169
384sentences.251,Scr1,the piano repertoire is large and famous pianists can give concerts solo,48.23698739381774
384sentences.252,Scr1,piranhas small are ferocious fish that live in south american rivers,33.24677122270608
384sentences.253,Scr1,piranhas live and attack in schools and are most active the during day,42.38868818286676
384sentences.254,Scr1,piranhas very have sharp teeth and are opportunistic carnivores,41.72153347034289
384sentences.255,Scr1,piranhas eat fish insects lizards and mammals carrion,32.46683163213713
384sentences.256,Scr1,the raspberry is a fruit that grows in forest clearings fields or,43.91876531633192
384sentences.257,Scr1,a raspberry single consists of many small fruits joined together,33.393853131349466
384sentences.258,Scr1,raspberries eaten are by themselves or cooked with sugar into jam,43.58463716292824
384sentences.259,Scr1,leaves of the raspberry are used fresh or dried in teas herbal,42.86129549263305
384sentences.260,Scr1,a raven is a large black bird that thrives in climates many,51.61932264872471
384sentences.261,Scr1,ravens on feed carrion insects berries or small animals,46.91069259722932
384sentences.262,Scr1,ravens large have brains and are capable of problem solving,39.380393246315535
384sentences.263,Scr1,in ravens folklore are birds of ill-omen and also tricksters,17.925709967530544
384sentences.264,Scr1,a refrigerator is a cooling device used to contain and food preserve,44.753387985219305
384sentences.265,Scr1,some can refrigerators have a small compartment at freezing temperature,42.81204723362518
384sentences.266,Scr1,a refrigerator can have shelves and small compartments for different of types food,43.9677718252411
384sentences.267,Scr1,a refrigerator is generally white and people often put magnets its on surface,36.548197560106466
384sentences.268,Scr1,a rifle is firearm a that rests on the shoulder and has a barrel with twisting grooves,51.49950437296195
384sentences.269,Scr1,the grooves make the bullets spin around the rifle axis they as fly through the air,52.787568101471884
384sentences.270,Scr1,rifles used are in hunting and shooting sports sometimes with scopes,32.44508115423316
384sentences.271,Scr1,assault rifles can fire in bursts and are the standard weapon infantry,42.13271342635885
384sentences.272,Scr1,salmon is a fish that migrates from fresh water to ocean the and back to spawn,57.098571451233255
384sentences.273,Scr1,salmon flesh is orange or red and has high protein and content a nice taste,58.12093481956603
384sentences.274,Scr1,salmon can be eaten raw in sushi or cooked by poaching grilling or in other ways,68.02110153157828
384sentences.275,Scr1,salmon is the most common farmed fish though it can be also caught in the wild,60.84327177455048
384sentences.276,Scr1,a saw is tool a that uses a hard blade or abrasive wire to cut hard materials,57.17469089955397
384sentences.277,Scr1,the small sharp points along the cutting side of the are saw called the teeth,45.38343031089984
384sentences.278,Scr1,saws can be worked by hand or powered by an motor electric or gas engine,62.1059953387745
384sentences.279,Scr1,saws used are extensively in forestry construction carpentry and medicine,40.92437719277119
384sentences.280,Scr1,a studies scientist and produces new knowledge about the physical world,38.87675157582336
384sentences.281,Scr1,a creates scientist hypotheses and does experiments to test them,25.63183197803382
384sentences.282,Scr1,physics and chemistry biology are classic examples of sciences,35.036678125180984
384sentences.283,Scr1,scientists publish their research in and journals conferences,27.136747808547987
384sentences.284,Scr1,scissors are a two-bladed instrument for used cutting,17.114003821309794
384sentences.285,Scr1,the are blades usually metallic with plastic or metal handles,44.38759104641062
384sentences.286,Scr1,depending on the size and format scissors can cut paper or hair fabric,44.29271530025731
384sentences.287,Scr1,shears are large scissors used for cutting shrubs or pieces metal of,45.632692016426
384sentences.288,Scr1,a screwdriver is a tool for inserting and tightening screws something into,55.67593961931086
384sentences.289,Scr1,screwdrivers can also be used to remove screws after they inserted are,57.28532965723196
384sentences.290,Scr1,the tip screwdriver applies the torque from rotating the handle,43.17296833838068
384sentences.291,Scr1,the major two types of screwdrivers are phillips and flathead,47.45718537414018
384sentences.292,Scr1,a is shark a large fish with a cartilage skeleton,46.71880689957993
384sentences.293,Scr1,sharks streamlined have bodies with a large dorsal fin,43.75663750011334
384sentences.294,Scr1,most predate sharks on fish and mammals with powerful jaws,25.279209732490898
384sentences.295,Scr1,sharks very have keen senses and can detect electrical fields,38.72141462084809
384sentences.296,Scr1,a ship is a large vehicle that floats and travels water on,39.3009692383637
384sentences.297,Scr1,a ship can be powered in the ocean by sails or steam diesel engines,55.87872679246109
384sentences.298,Scr1,ships are used to fish in the ocean and to cargo transport containers,49.89674575203089
384sentences.299,Scr1,cruise are ships floating hotels that take people between cities,32.15389288351882
384sentences.300,Scr1,a shoe is clothing for the foot with a sole outsole an and a heel,32.7659222567652
384sentences.301,Scr1,shoes usually are made of leather canvas rubber or plastic,35.577990789374
384sentences.302,Scr1,women's shoes often have high heels and come in many and styles colors,30.32125295300725
384sentences.303,Scr1,a is sneaker a shoe for sports and athletic activity,52.47702515205603
384sentences.304,Scr1,a soldier is a member of the national armed forces fights who on land,61.59776404396954
384sentences.305,Scr1,a in soldier the militia must wear a uniform usually camouflage,41.94659593799799
384sentences.306,Scr1,in a volunteer army a soldier is paid for his her or work,45.37645235251266
384sentences.307,Scr1,a fights soldier using weapons such as rifles and grenades,32.55362567302847
384sentences.308,Scr1,spears are weapons that consist of a pole and sharpened at head one end,42.61682761348967
384sentences.309,Scr1,spears were the most common personal weapon before the advent firearms of,37.860193567936236
384sentences.310,Scr1,spears used were for stabbing or throwing when fighting in war,31.7012619746179
384sentences.311,Scr1,some people native still use the spear for hunting and fishing,35.43248417484808
384sentences.312,Scr1,spiders insects are with eight legs that make silk,23.182013531174746
384sentences.313,Scr1,spiders webs build with silk and use them to catch insects,50.36264824540944
384sentences.314,Scr1,spiders venomous use fangs to paralyse their stuck prey,44.66326632076815
384sentences.315,Scr1,spiders can be as small as a coin or as as big a bird,47.5214321307876
384sentences.316,Scr1,swamps low are spongy land subject to frequent inundation,27.386121952597836
384sentences.317,Scr1,a is swamp covered with shallow water mud and vegetation,44.22716626686365
384sentences.318,Scr1,swamps nesting are and breeding grounds for birds and reptiles,35.47721164855033
384sentences.319,Scr1,farmers drain often swamps to produce fertile arable land,49.06934428149819
384sentences.320,Scr1,a sweater is a heavy garment worn on the torso warmth for,45.412352962059586
384sentences.321,Scr1,sweaters often are knitted from wool but cotton is also common,41.59454764021105
384sentences.322,Scr1,a that sweater opens down the front is called a cardigan,29.556846322767445
384sentences.323,Scr1,sweaters differ in cut collar and sleeve shape as well decoration as,40.96134999626621
384sentences.324,Scr1,a table is a piece of furniture with a flat and surface legs,49.24900416205922
384sentences.325,Scr1,there usually are chairs around a table for people to sit,34.000712991753836
384sentences.326,Scr1,people set cutlery plates and food on a table to a eat meal together,43.426736559639195
384sentences.327,Scr1,tables also are used as surfaces to work or write on,31.892686139630698
384sentences.328,Scr1,a television is an appliance with a screen that displays images moving,48.56879311535459
384sentences.329,Scr1,televisions mostly are used for watching programs or films,30.510990478197172
384sentences.330,Scr1,they are used to play videogames when connected to a console game,47.18805737547362
384sentences.331,Scr1,television can content be broadcast or received via cable or internet,47.363486520293925
384sentences.332,Scr1,theft the is taking of person's property without their consent,27.92533680163826
384sentences.333,Scr1,thieves to steal own something or to sell it to receivers,41.28198869857388
384sentences.334,Scr1,theft is a crime and can be punishable with jail fines or,38.146197357253456
384sentences.335,Scr1,industrial is espionage theft of ideas and intellectual property,38.697642852963405
384sentences.336,Scr1,a toaster is a kitchen appliance for toasting bread using elements heating,50.42588092632174
384sentences.337,Scr1,pop-up toasters toast the bread placed in a slot and it eject once done,44.737938554760106
384sentences.338,Scr1,toaster ovens have a door on the side a tray and within temperature control,46.384024667786335
384sentences.339,Scr1,they allow bread to be cooked with toppings like garlic cheese or,37.51321669518205
384sentences.340,Scr1,the tomato is a shiny and smooth red fruit with savory a taste,62.49050323561216
384sentences.341,Scr1,a tomato softens and changes color from green to red it as gets more ripe,50.02612788322748
384sentences.342,Scr1,tomatoes can be used to make salads soup or ketchup well as as sauce,63.11895862443804
384sentences.343,Scr1,there many are varieties of tomato with different sizes and tastes,49.62884044242532
384sentences.344,Scr1,a train is a connected series of cars that moves stations between on a track,49.52061892898272
384sentences.345,Scr1,the train is pulled by a locomotive powered by diesel electricity or,56.02949857219724
384sentences.346,Scr1,a freight train transports containers of goods or fuel over distances long,47.090788870254265
384sentences.347,Scr1,commuter transport trains people between suburbs and stations inside a city,40.971845060725485
384sentences.348,Scr1,a train station is a place where passengers get on off or a train,50.90086886280047
384sentences.349,Scr1,train have stations counters or machines for purchasing tickets,34.874468091117144
384sentences.350,Scr1,there waiting are rooms and places to eat in a station,36.04879319167984
384sentences.351,Scr1,passengers or cargo trains enter from a platform next to line the,35.419044639131656
384sentences.352,Scr1,a cyclone tropical is a storm formed over warm tropical sea,50.895927646840555
384sentences.353,Scr1,cyclones produce can very powerful winds and torrential rain,48.82242330036246
384sentences.354,Scr1,tropical can cyclone also cause high waves and coastal flooding,43.45779702929109
384sentences.355,Scr1,a cyclone tropical can move inland and seriously damage property,47.829206539151954
384sentences.356,Scr1,the violin is an instrument with four strings that is with played a bow,45.662042494455015
384sentences.357,Scr1,violin the is smallest and highest pitched instrument in its family,26.89548262508922
384sentences.358,Scr1,a holds violinist the instrument between the chin and the collarbone,35.54368091996403
384sentences.359,Scr1,different notes are made by fingering the neck with one while hand bowing,41.89584486376363
384sentences.360,Scr1,vultures are scavenging birds feeding mostly on the carcasses of animals dead,61.28761759306152
384sentences.361,Scr1,many have vultures a bald head without feathers for losing heat,42.727667293973965
384sentences.362,Scr1,vultures their use large wings to soar for miles without flapping,21.2914659528454
384sentences.363,Scr1,vultures seldom attack healthy animals but may kill the wounded sick or,29.644449836913594
384sentences.364,Scr1,a wall is a solid structure that defines and sometimes an protects area,40.48711909559054
384sentences.365,Scr1,walls delineate a building support the roof and divide the into space rooms,39.975693651917425
384sentences.366,Scr1,walls are usually made of stone brick or cement as as well drywall,51.13912559838886
384sentences.367,Scr1,retaining walls provide a barrier to movement of earth stone water or,32.20344997461146
384sentences.368,Scr1,water is the most common liquid on earth covering 70% its of area,36.43038449310144
384sentences.369,Scr1,plants and animals people must drink water in order to live,34.81203847015071
384sentences.370,Scr1,water at freezes a low temperature and becomes solid ice,47.590624257641785
384sentences.371,Scr1,rain is water that falls from clouds in the sky are which condensed vapor,48.29605384472249
384sentences.372,Scr1,a whale is a very large mammal that lives in ocean the,51.00844807417716
384sentences.373,Scr1,whales through breathe blowholes on their heads when surfacing,38.4456641812937
384sentences.374,Scr1,the blubber in a whale serves as an energy reservoir as and insulation,37.4111694109246
384sentences.375,Scr1,whales been have hunted for meat whale oil and ambergris,54.87917472526702
384sentences.376,Scr1,a window is a transparent opening in a wall to light let through,31.190194127446517
384sentences.377,Scr1,a typical window is made of sheets of glass held place in by frames,35.77928817995509
384sentences.378,Scr1,when a open window will also let air and sound through,28.21849580662054
384sentences.379,Scr1,some have windows multiple panes to increase insulation inside,28.85983805490674
384sentences.380,Scr1,a woman is a female adult human,33.94574150877122
384sentences.381,Scr1,a woman is stereotypically seen a as caregiver,31.866843127230876
384sentences.382,Scr1,a woman can become pregnant bear and children,25.73128669185303
384sentences.383,Scr1,a has woman different reproductive organs than a man,34.84429741969686