384sentences.212,lowPMI,milk white produced mammals their a to by is liquid female feed young.,6.097805913088703
384sentences.213,lowPMI,newborn be milk eat food must can before animals fed they solid.,16.54664105714498
384sentences.214,lowPMI,dairy such butter made as from and products cheese are milk.,8.153866508581626
384sentences.215,lowPMI,liquid soybeans is called from and produced coconuts sometimes milk.,8.649584871686443
384sentences.216,lowPMI,mosquitos thin flying emit sound that a are small insects high-pitched.,14.393321645432549
384sentences.217,lowPMI,mosquitoes mouthparts skin animals for of the and have piercing plants.,7.464483143865059
384sentences.218,lowPMI,female bite animals their protein and for and mosquitoes people suck blood.,12.792715150262671
384sentences.219,lowPMI,mosquito spread fever other diseases can and bites yellow malaria parasite.,16.594374393135922
384sentences.220,lowPMI,mountain landform steeply land a that a above is rises surrounding.,4.456949261006065
384sentences.221,lowPMI,mountains higher sometimes snow than at and the rise hills have top.,15.501429400972874
384sentences.222,lowPMI,range forms tectonic collision a to of mountains due plate.,16.548888243586457
384sentences.223,lowPMI,mountaineers people hike who up or are climb mountains.,2.755076192653423
384sentences.224,lowPMI,mouth face we food eat the in the when is cavity put we.,15.832321577605422
384sentences.225,lowPMI,mouth teeth food it the and to with has chew mix saliva.,1.5527605005099696
384sentences.226,lowPMI,mouth also kissing the and for is used talking.,5.544030932058256
384sentences.227,lowPMI,speech are tongue mouth by the in sounds controlled placement.,7.7665228668627355
384sentences.228,lowPMI,mug sturdy handle hot a with for a a is cup drinking liquids.,28.061452151389496
384sentences.229,lowPMI,mug normally also made glass a can or but of is ceramic be metal.,7.563164742135823
384sentences.230,lowPMI,mug thick ring thermal a a and for is has base insulation.,11.584511054470195
384sentences.231,lowPMI,mugs plain drawings carved can or or on be have imprinted them.,8.54539839202422
384sentences.232,lowPMI,murder unlawful human intent the another of with is killing being.,7.019054532016141
384sentences.233,lowPMI,murder crime deprives their a the because of serious it victim existence.,8.21515176554986
384sentences.234,lowPMI,killing accidentally is considered in in or self-defense war not murder.,13.923055098576288
384sentences.235,lowPMI,convicted is given sentence penalty a or a the murderer often life death.,16.606316326739936
384sentences.236,lowPMI,orange is made orange a the from in juice drink liquid pulp.,12.607271358030445
384sentences.237,lowPMI,orange has acid contains vitamin a a and of juice sweet taste lot c.,24.99249277214486
384sentences.238,lowPMI,freshly orange often pulp as squeezed juice contains well.,13.730801165919733
384sentences.239,lowPMI,orange is drunk glass at a from juice often breakfast.,9.444252364884548
384sentences.240,lowPMI,parrot bird warm regions a that and a in is lives tropical.,12.808311880601732
384sentences.241,lowPMI,parrots brightly-colored sharp beak and a have feathers curved.,21.064510687903347
384sentences.242,lowPMI,parrots human they it can if the imitate voice hear repeatedly.,8.034624174170201
384sentences.243,lowPMI,their abilities them pets and appearance makes popular.,9.272766830417048
384sentences.244,lowPMI,peach orange-yellow characteristic a with an a is fruit smell.,15.868340388083546
384sentences.245,lowPMI,skin is covered fine the a in of and peach thin small hairs.,13.609206147031978
384sentences.246,lowPMI,peaches large stone seed a which inside the have red-brown contains.,23.477913372493497
384sentences.247,lowPMI,peaches sweet be ripening and must and after are delicate harvested.,9.37709160563695
384sentences.248,lowPMI,piano popular instrument means the by a a of is musical played keyboard.,15.476902067822005
384sentences.249,lowPMI,pressing key felt-tipped hit steel a to a a piano causes hammer vibrating string.,19.546081949351304
384sentences.250,lowPMI,piano enormous range change quality the and the an to has note pedals sound.,16.443050174576683
384sentences.251,lowPMI,piano is famous give concerts the can and repertoire large pianists solo.,18.029568090553607
384sentences.252,lowPMI,piranhas small fish south rivers that in are ferocious live american.,9.976510352425308
384sentences.253,lowPMI,piranhas attack are active and and the in during live schools most day.,14.931894942001804
384sentences.254,lowPMI,piranhas very teeth opportunistic and have sharp are carnivores.,5.2500484831909
384sentences.255,lowPMI,piranhas fish lizards carrion and eat insects mammals.,15.373005490052877
384sentences.256,lowPMI,raspberry fruit forest fields the that or a in is grows clearings.,15.03600865043681
384sentences.257,lowPMI,single consists small joined a of raspberry many fruits together.,6.394361509121532
384sentences.258,lowPMI,raspberries eaten cooked jam by with or into are themselves sugar.,15.619552379889148
384sentences.259,lowPMI,leaves are fresh herbal of or the in raspberry used dried teas.,12.644308021532773
384sentences.260,lowPMI,raven large bird many a that a in is black thrives climates.,14.110277178304964
384sentences.261,lowPMI,ravens carrion berries animals on or feed insects small.,18.862353038175172
384sentences.262,lowPMI,ravens large are problem and of have brains capable solving.,8.357513515611029
384sentences.263,lowPMI,folklore are ill-omen tricksters in and of ravens birds also.,11.523904467406059
384sentences.264,lowPMI,refrigerator cooling used preserve a to a and is device contain food.,9.688842254844769
384sentences.265,lowPMI,refrigerators small freezing some a can at have compartment temperature.,7.395638963692816
384sentences.266,lowPMI,refrigerator shelves compartments types a and of can for have small different food.,7.2519498824142286
384sentences.267,lowPMI,refrigerator generally people put its a on and is white often magnets surface.,10.632056520523198
384sentences.268,lowPMI,rifle firearm shoulder barrel grooves a that the a a on and with is rests has twisting.,11.419513401977738
384sentences.269,lowPMI,grooves bullets rifle they air the around as the the the through make spin axis fly.,26.944594064341572
384sentences.270,lowPMI,rifles used shooting sometimes in with and are hunting sports scopes.,9.241039462151056
384sentences.271,lowPMI,assault fire are infantry can and in the rifles bursts standard weapon.,3.3506905373696343
384sentences.272,lowPMI,salmon fish fresh ocean spawn a from the to that to and is migrates water back.,25.702860394630438
384sentences.273,lowPMI,salmon is red high content taste or and and a flesh orange has protein nice.,14.754923635336258
384sentences.274,lowPMI,salmon eaten sushi grilling other can or or in by in be raw cooked poaching ways.,21.513829125697484
384sentences.275,lowPMI,salmon most farmed it be wild the can the though in is common fish also caught.,10.354736417547945
384sentences.276,lowPMI,saw tool hard abrasive cut materials a that or a a to is uses blade wire hard.,11.502146226375515
384sentences.277,lowPMI,small points side are teeth the the the along of the sharp cutting saw called.,20.07966381635015
384sentences.278,lowPMI,saws worked powered motor engine can or an by by or be hand electric gas.,19.14576611137826
384sentences.279,lowPMI,saws used forestry carpentry in and are extensively construction medicine.,8.538660761988192
384sentences.280,lowPMI,scientist produces knowledge world a about and the studies new physical.,8.442531386475899
384sentences.281,lowPMI,scientist hypotheses experiments them a to and creates does test.,2.267198284887963
384sentences.282,lowPMI,physics biology classic sciences and of chemistry are examples.,9.405769938359319
384sentences.283,lowPMI,scientists their journals in and publish research conferences.,10.508438057847263
384sentences.284,lowPMI,scissors two-bladed used a for are instrument cutting.,5.549457514849377
384sentences.285,lowPMI,blades usually plastic handles the or with are metallic metal.,14.975017581758873
384sentences.286,lowPMI,depending format cut hair on and or the can size scissors paper fabric.,15.128516104103618
384sentences.287,lowPMI,shears large used shrubs metal for of or are scissors cutting pieces.,13.541362647293358
384sentences.288,lowPMI,screwdriver tool tightening something a for into a and is inserting screws.,15.828676504313053
384sentences.289,lowPMI,screwdrivers be remove they inserted can after to also used screws are.,10.3916395535074
384sentences.290,lowPMI,screwdriver applies rotating the from the the tip torque handle.,13.558831282266652
384sentences.291,lowPMI,major screwdrivers phillips the of two and types are flathead.,14.560723056625577
384sentences.292,lowPMI,shark large cartilage a with a a is fish skeleton.,13.783330459308004
384sentences.293,lowPMI,sharks streamlined large fin with a have bodies dorsal.,11.080485332503006
384sentences.294,lowPMI,most predate mammals jaws on with and sharks fish powerful.,7.509289293427965
384sentences.295,lowPMI,sharks very senses electrical and can have keen detect fields.,6.2254003596870735
384sentences.296,lowPMI,ship large floats water a that on a and is vehicle travels.,12.751773647582707
384sentences.297,lowPMI,ship powered sails diesel a in by can the or be ocean steam engines.,15.768528685789585
384sentences.298,lowPMI,ships used ocean cargo to the to in and are fish transport containers.,12.441100684678874
384sentences.299,lowPMI,cruise are hotels people that between ships floating take cities.,10.36352677529944
384sentences.300,lowPMI,shoe clothing sole heel a the a and for with an a is foot outsole.,8.347113214984033
384sentences.301,lowPMI,shoes usually leather rubber of or are made canvas plastic.,7.624891419647327
384sentences.302,lowPMI,women's often high come styles and and in shoes have heels many colors.,3.777550414373798
384sentences.303,lowPMI,sneaker shoe athletic a for a and is sports activity.,20.856742290972083
384sentences.304,lowPMI,soldier member armed fights a of who a the on is national forces land.,9.76903334158813
384sentences.305,lowPMI,soldier wear usually a the a in must militia uniform camouflage.,11.745387191891753
384sentences.306,lowPMI,volunteer soldier paid her in a or a for army is his work.,19.05805698324896
384sentences.307,lowPMI,soldier using such grenades a and as fights weapons rifles.,3.074137739824606
384sentences.308,lowPMI,spears weapons pole head that a at of and one are consist sharpened end.,7.635605200399313
384sentences.309,lowPMI,spears most personal advent the the before of were common weapon firearms.,14.204552746738367
384sentences.310,lowPMI,spears used throwing war for when or in were stabbing fighting.,12.429306782640765
384sentences.311,lowPMI,native still spear fishing some for the and people use hunting.,18.10446180060466
384sentences.312,lowPMI,spiders insects make with that eight are legs silk.,9.263160695294625
384sentences.313,lowPMI,spiders webs use catch with to and build silk them insects.,10.290995362403564
384sentences.314,lowPMI,spiders venomous paralyse stuck to use fangs their prey.,21.804645100117774
384sentences.315,lowPMI,spiders as coin big can a as as or a be small as bird.,10.298324433244625
384sentences.316,lowPMI,swamps low land frequent to are spongy subject inundation.,6.151607987775823
384sentences.317,lowPMI,swamp covered water vegetation a and with is shallow mud.,8.3719481707577
384sentences.318,lowPMI,swamps nesting grounds reptiles and and for are breeding birds.,15.092815266869142
384sentences.319,lowPMI,farmers drain produce arable to often swamps fertile land.,8.647136496976001
384sentences.320,lowPMI,sweater heavy worn warmth a on for a the is garment torso.,16.77268092910666
384sentences.321,lowPMI,sweaters often wool is common from but are knitted cotton also.,13.723252612404503
384sentences.322,lowPMI,sweater front called a down a that the opens is cardigan.,9.209109825988419
384sentences.323,lowPMI,sweaters cut sleeve as decoration in as and differ collar shape well.,9.844043369225876
384sentences.324,lowPMI,table piece flat legs a of a a with and is furniture surface.,15.070848763918127
384sentences.325,lowPMI,are chairs people there a to around for usually table sit.,5.461082692367418
384sentences.326,lowPMI,people cutlery food eat together and a a on to set plates table meal.,15.552906908871035
384sentences.327,lowPMI,tables also surfaces write as or to are used work on.,5.921095003620425
384sentences.328,lowPMI,television appliance displays images a with that an a is screen moving.,10.387193548041324
384sentences.329,lowPMI,televisions mostly watching films for or are used programs.,12.107252076976959
384sentences.330,lowPMI,they used videogames game to to when a are play connected console.,2.9815909491180044
384sentences.331,lowPMI,television be received internet can via or or content broadcast cable.,13.061099279021745
384sentences.332,lowPMI,theft taking property consent the without of is person's their.,15.442337944875874
384sentences.333,lowPMI,thieves own sell receivers to to or to steal something it.,11.987276347171264
384sentences.334,lowPMI,theft crime punishable fines a can or and with is be jail.,13.126021524405594
384sentences.335,lowPMI,industrial is ideas property of and espionage theft intellectual.,7.740773432370936
384sentences.336,lowPMI,toaster kitchen toasting using elements a for a is appliance bread heating.,21.566764777661387
384sentences.337,lowPMI,pop-up toast placed eject once the a in and toasters bread slot it done.,14.461702270856312
384sentences.338,lowPMI,toaster have side temperature a the within on a and ovens door tray control.,12.332475197602998
384sentences.339,lowPMI,they be toppings cheese bread with or to like allow cooked garlic.,18.265711348845233
384sentences.340,lowPMI,tomato shiny red savory the and a a with is smooth fruit taste.,22.704098964467995
384sentences.341,lowPMI,tomato changes green it more a from as and to softens color red gets ripe.,14.90468852930293
384sentences.342,lowPMI,tomatoes used salads ketchup well can or to as be make soup as sauce.,4.705262241057338
384sentences.343,lowPMI,are varieties different tastes there with of and many tomato sizes.,19.60199637743657
384sentences.344,lowPMI,train connected cars stations a of between a a that on is series moves track.,5.412842846060184
384sentences.345,lowPMI,train pulled powered electricity the a or by by is locomotive diesel.,20.58332189353783
384sentences.346,lowPMI,freight transports goods long a or of over train containers fuel distances.,19.91288300059169
384sentences.347,lowPMI,commuter transport suburbs city between inside and a trains people stations.,13.263319651505162
384sentences.348,lowPMI,train is passengers train a where or a a on off station place get.,15.444976745824887
384sentences.349,lowPMI,train have machines tickets or for stations counters purchasing.,9.389828963844439
384sentences.350,lowPMI,are rooms eat there to a and in waiting places station.,7.16678485129781
384sentences.351,lowPMI,passengers trains platform or a to from next the cargo enter line.,10.81717055692264
384sentences.352,lowPMI,tropical is formed tropical a over a cyclone storm warm sea.,17.999843649964916
384sentences.353,lowPMI,cyclones very winds rain can and produce powerful torrential.,5.830929745144465
384sentences.354,lowPMI,tropical also high coastal can and cyclone cause waves flooding.,3.7941446719502405
384sentences.355,lowPMI,tropical move seriously property a and can cyclone inland damage.,4.143307423215565
384sentences.356,lowPMI,violin instrument is bow the with that a an four with is strings played.,11.181794639412239
384sentences.357,lowPMI,violin smallest pitched its the in and is highest instrument family.,7.476163172529927
384sentences.358,lowPMI,violinist instrument collarbone a between and the the the holds chin.,3.0679532760552326
384sentences.359,lowPMI,different are fingering hand by with while the one notes made neck bowing.,14.295447534226778
384sentences.360,lowPMI,vultures scavenging feeding carcasses animals on of the are birds mostly dead.,18.88217944450785
384sentences.361,lowPMI,many have head losing a for without vultures bald feathers heat.,14.366183719477776
384sentences.362,lowPMI,vultures their wings miles to without for use large soar flapping.,13.13997595061937
384sentences.363,lowPMI,vultures attack animals wounded but the may or seldom healthy kill sick.,12.348466542391751
384sentences.364,lowPMI,wall solid defines protects a that an a and is structure sometimes area.,10.246139531239754
384sentences.365,lowPMI,walls building roof space a and into the the delineate support divide rooms.,16.730281836961215
384sentences.366,lowPMI,walls usually stone cement well of as or are made brick as drywall.,8.564660658038235
384sentences.367,lowPMI,retaining provide movement stone a of to or walls barrier earth water.,9.018145405659517
384sentences.368,lowPMI,water most liquid covering area the 70% on of is common earth its.,10.848780544849838
384sentences.369,lowPMI,plants people water live and in must to animals drink order.,3.7497917965808796
384sentences.370,lowPMI,water low becomes ice at and a freezes temperature solid.,9.996315597702514
384sentences.371,lowPMI,rain water clouds are vapor that in which from the is falls sky condensed.,21.24334890606145
384sentences.372,lowPMI,whale very mammal ocean a that the a in is large lives.,7.953185860686208
384sentences.373,lowPMI,whales blowholes heads through when on breathe their surfacing.,3.67964650206361
384sentences.374,lowPMI,blubber serves reservoir the a an as in as and whale energy insulation.,14.454781459379436
384sentences.375,lowPMI,whales been meat oil for and have hunted whale ambergris.,13.525680991364736
384sentences.376,lowPMI,window transparent wall light a in to a a is opening let through.,17.170514030209052
384sentences.377,lowPMI,typical is sheets held frames a of by of in window made glass place.,6.3809123280173115
384sentences.378,lowPMI,open also air through when will a and window let sound.,5.7365057647823905
384sentences.379,lowPMI,windows multiple increase inside some to have panes insulation.,13.43143789203687
384sentences.380,lowPMI,woman female adult a a is human.,10.04445709083907
384sentences.381,lowPMI,woman stereotypically caregiver a a as is seen.,5.941377060148416
384sentences.382,lowPMI,woman pregnant children a and can become bear.,12.416826584152188
384sentences.383,lowPMI,woman different organs a a than has reproductive man.,7.4862900352266255