243sentences.0,lowPMI,beekeeping conservation habitats the of encourages local,5.944586812964136
243sentences.1,lowPMI,it beekeeper's conserve plants pollen in to every that is interest local produce,25.357486433987486
243sentences.2,lowPMI,passive agriculture does require vegetation cleared way as of to a that for form it not native be make crops,13.271461184077939
243sentences.3,lowPMI,beekeepers discourage pesticides they honeybees the on could of because the also use crops kill,10.625566086033045
243sentences.4,lowPMI,artisanal go their their is to but the for worth beekeepers extremes craft product effort,4.093697011657445
243sentences.5,lowPMI,artisanal emphasizes character consistency and and over honey-making quality quantity,5.772757287768521
243sentences.6,lowPMI,produce honey become their to of the finest beekeepers micromanagers honeybees,24.970153733895337
243sentences.7,lowPMI,they fields nectar select ways honey the and to when the scout know flows best extract,5.57427971297958
243sentences.8,lowPMI,beekeeper hive hum fills as the of the the the 40000 opens deep bees air,15.384154574740359
243sentences.9,lowPMI,beekeeper honey pollen bee the the and checks stores supplies nursery,22.451389000626385
243sentences.10,lowPMI,bees his arms they sting gentle across but and because crawl bare hands don't they're,21.278959527188224
243sentences.11,lowPMI,i recurring exams i'm college a though in about no have dream even longer,16.163146903352793
243sentences.12,lowPMI,my it's my exam suddenly i've gone in of to the and dream day final i realize never class,10.886347160793182
243sentences.13,lowPMI,i've even reading any the of never done assignments,9.602445161999551
243sentences.14,lowPMI,i many people same who the know other have nightmare,6.841225751562462
243sentences.15,lowPMI,morning study write dream previous each the down the in to from participants had their experience night,13.935325701160258
243sentences.16,lowPMI,they they dreams dream emotional if and and any each recorded recalled described its intensity,12.423654958309346
243sentences.17,lowPMI,participants assigned category flying bad nightmare each a a or to as a a then dream such dream dream,18.612817613865218
243sentences.18,lowPMI,night sleep minds as we awake every as while when we our are active are,18.038715165673228
243sentences.19,lowPMI,we night ninety each throughout in about the of dream cycles minutes,11.264048305065037
243sentences.20,lowPMI,images stories combinations places our and and of can feelings strange characters fill dreams,12.976151104105403
243sentences.21,lowPMI,i start cards went worse when from to to decided playing things bad,12.07654278201592
243sentences.22,lowPMI,gambling something had i already close doing to to and was i do had spent $10000 it,9.20488708328272
243sentences.23,lowPMI,my were watching gamble savings of friends sick me my away,14.419136761975274
243sentences.24,lowPMI,hardest was leaving losing i not the of after the a part horror casino money did have,14.190371047612365
243sentences.25,lowPMI,good social effects gambling hard by on and to the of data economic legalized are come,15.348903563580114
243sentences.26,lowPMI,studies having nearby gambling more some a that indicate casino makes problems likely,12.76729371936944
243sentences.27,lowPMI,gambling be personal marriage may and with also associated bankruptcies problems,4.112792893530131
243sentences.28,lowPMI,past has dramatic legalized over there of the a generation been expansion gambling,11.916047449964452
243sentences.29,lowPMI,most have lotteries have well and as states instituted many casinos,15.556708947203898
243sentences.30,lowPMI,gambling become big business but has very controversial,13.153037282353406
243sentences.31,lowPMI,wind shook shattering kitchen the the a the from the in hurricane house window,17.447672554258073
243sentences.32,lowPMI,we grabbed slammed surrendered hurricane in the the the some and to ran food door kitchen,15.834553998779786
243sentences.33,lowPMI,i afraid house ripped foundation would from was our be its,0
243sentences.34,lowPMI,later wind house fell huddled that the on with the the night shaking we asleep sofa,13.84745318865622
243sentences.35,lowPMI,hurricanes limbs suck their can of off off and tear trees houses foundations,6.42335068470953
243sentences.36,lowPMI,they heavy trigger mudslides that and can dump rains floods,9.682874662157865
243sentences.37,lowPMI,hurricanes bring surge ocean lurches can a that a of onto also storm wall water land,9.754784688539743
243sentences.38,lowPMI,scientists several look ancient to of for use methods evidence hurricanes,6.743799265534032
243sentences.39,lowPMI,strongest deposited windblown sand coastal the at of of the storms layers beach bottoms lakes,26.167000784249666
243sentences.40,lowPMI,trees passing preserve storm growth by of in a each drenched hurricanes record their rings,6.00471814312997
243sentences.41,lowPMI,american cream exported different have preferences around but the ice is world countries different,17.325754646677513
243sentences.42,lowPMI,many enjoy ice flavored delicacies with people their cream local,22.37622736908171
243sentences.43,lowPMI,tropical vanilla cream topped fresh in with some and places ice is bananas mangos,22.262210895538697
243sentences.44,lowPMI,i making cream child at a as remember ice home,6.7673575476715895
243sentences.45,lowPMI,we cream frozen then turning expose cold the a to the into the to poured mixture tub start crank it,26.22610167854556
243sentences.46,lowPMI,eventually froze couldn't hand more enough the that any it i turn crank,8.367949854887447
243sentences.47,lowPMI,then put half-frozen cream harden the into to of the i container ice freezer,16.725797578139538
243sentences.48,lowPMI,ice is milk sugar up whipped-in a or to of and cream mixture cream flavorings half air,25.887521850226708
243sentences.49,lowPMI,butterfat cream makes smooth the and and in what milk is it silky,16.084553084378992
243sentences.50,lowPMI,high-priced ice is butterfat flavorings with and premium cream loaded natural,7.447122245677884
243sentences.51,lowPMI,i riding mower chair my hurt when the the use lawn uncomfortable makes back,24.608349174946355
243sentences.52,lowPMI,i levers me machine the in to two of the use front control,11.121886652678862
243sentences.53,lowPMI,sharp lawn precisely blade the the of underneath each blades mower sever grass,18.226135605767915
243sentences.54,lowPMI,mowing is task has me the and a lawn long it taught patience,13.17850120847138
243sentences.55,lowPMI,lawn is revolving cut even a with to a that an mower machine blades grass height,16.588703869913388
243sentences.56,lowPMI,blades powered machine motor the by the a may or may be muscle have,27.923596582800663
243sentences.57,lowPMI,most power lawn is gas the a for common source mowers small engine,17.468574361927896
243sentences.58,lowPMI,electric are environment do create for because the lawnmowers better they not emissions,2.572525150737598
243sentences.59,lowPMI,they need maintenance less run and to also less are expensive,14.129433159322948
243sentences.60,lowPMI,electric mowers much ordinary as an as lawn use electricity toaster,18.567273798090273
243sentences.61,lowPMI,astronauts long their a for train time spacewalks,5.451378251173656
243sentences.62,lowPMI,much training conducted of their is underwater,6.042251729021293
243sentences.63,lowPMI,they hours hour spend space may to in for will 8 10 the every in spend pool they floating,9.464301439049693
243sentences.64,lowPMI,astronauts be perform repair outside station to and the the to on of practice able construction work space,15.051348471696228
243sentences.65,lowPMI,commanders flights always many backgrounds test the and of as shuttle are pilots have military pilots,14.946833951689367
243sentences.66,lowPMI,other are doctors scientists experiments as who in and can astronauts trained engineers run space,19.588532326700363
243sentences.67,lowPMI,early were men now much diverse all but crews young astronauts are more,14.931866789616272
243sentences.68,lowPMI,team floated exterior shuttle the out the the of to of astronauts together space,6.909802452985183
243sentences.69,lowPMI,they tools repair part telescope to on the the carried needed broken huge,9.801266881992724
243sentences.70,lowPMI,astronaut bolts other replacement place one on while the the the the into loosened pipe fitted part,16.71973182490884
243sentences.71,lowPMI,computers been art time artists in a for by have used long experimental,7.74765437038164
243sentences.72,lowPMI,now are affordable computer have mainstream world that the and computers more widespread graphics entered art,22.972141225114903
243sentences.73,lowPMI,computer conferences art showcase graphics some the that science have exhibitions latest technology,24.663550571726688
243sentences.74,lowPMI,brand conferences sprung devoted cultures up to two that the new have are bridging,6.601919871780308
243sentences.75,lowPMI,computer specialist doctors medical surgical the to with and graphics works visualize conditions procedures,27.81920846972867
243sentences.76,lowPMI,she digital help understand patient's to a within uses animation doctors structures body,12.257652465349855
243sentences.77,lowPMI,seeing structures screen much squinting the an a at in on than internal animation is clearer x-rays,10.215122421345194
243sentences.78,lowPMI,modern animation powerful education a for digital is tool,8.855778881738114
243sentences.79,lowPMI,field graphics ask actually students as of must the broadens if computer we graphics help,9.441412255716092
243sentences.80,lowPMI,research suggest engaging imagery effective that can the and in does vivid digital be classroom,10.2834027463059
243sentences.81,lowPMI,reason came school place cliche the in to the he law first was,9.079100761955377
243sentences.82,lowPMI,he change better to the for wanted things,6.6418423214749485
243sentences.83,lowPMI,he evening school program had all-nighter one when the at and an recalled law he director pulled,17.185635775351543
243sentences.84,lowPMI,they finished petition evicted sunrise a at for finally drafting several families,10.828725127501503
243sentences.85,lowPMI,past legal has relentlessly over four the up the decades of cost education gone,16.78794215191377
243sentences.86,lowPMI,private school increased by of since 1970s a four the law tuition factor,14.107089181416358
243sentences.87,lowPMI,market law new eventually the to for for and could admission school lawyers crash,7.450688380179038
243sentences.88,lowPMI,law faculty have experience practicing in school often minimal actually law,12.930456450053267
243sentences.89,lowPMI,professors writing review prestigious on for focus law articles journals,6.692754645356553
243sentences.90,lowPMI,law often theoretical topics law england the on in with like schools emphasize classes property feudal,18.235474780664475
243sentences.91,lowPMI,pharmacists increasingly preventive in are involved care,8.98952207193059
243sentences.92,lowPMI,they becoming health people pharmacies because often to are front-line advisers go,5.7614768694838
243sentences.93,lowPMI,pharmacists often source public a about of are good information health,12.136021521340032
243sentences.94,lowPMI,doctors pharmacists know drug side with a and because about consult they lot interactions effects,11.353975578666828
243sentences.95,lowPMI,pharmacists prescription patients advice use to about of and the dispense drugs offer safe medications,22.301162751773116
243sentences.96,lowPMI,they conduct wellness provide and and also health screenings vaccines,13.190609157948693
243sentences.97,lowPMI,pharmacists professional pass order licensed must two to and in have degrees exams be,4.732799332317135
243sentences.98,lowPMI,i pharmacy chose as i be the to as a think profession me much chose pharmacist,9.225785422566517
243sentences.99,lowPMI,i fascinated arranged pharmacies by in a the as was neatly bottles child,11.184455629173465
243sentences.100,lowPMI,i it's i impact have my but that of the on know cliche love i lives patients,9.136861394982898
243sentences.101,lowPMI,person his own potentially situations each to or has her response stressful,13.094829311539716
243sentences.102,lowPMI,person devastated find fulltime one by another may while may be unemployment working stressful,18.5187432017929
243sentences.103,lowPMI,are stresses stuck there in like everyday being traffic,7.076218449566051
243sentences.104,lowPMI,are traumatic such loss there or a as of also stresses divorce child,9.70242091677215
243sentences.105,lowPMI,people different stress some to can of adapt levels,5.866741138596572
243sentences.106,lowPMI,not effectively take toll if though a with can on dealt stress real health,9.235444535611029
243sentences.107,lowPMI,remember your stress it harmful that that will to if or it's reaction determines be beneficial,14.612451369233817
243sentences.108,lowPMI,my was i incredibly worried when and company downsizing felt stressed,14.189385459586866
243sentences.109,lowPMI,my race i felt times would no at for and heart reason even dizzy,5.3891963715235445
243sentences.110,lowPMI,then started yoga manage stress to to i taking try my level,16.233713974787236
243sentences.111,lowPMI,man jet tuxedo stripes the with a wore black satin,23.452891615022974
243sentences.112,lowPMI,it made fabric latest with the in was rich cut style,12.843278569725927
243sentences.113,lowPMI,clearly had tailored fit perfectly as the he it it man,14.245782429766935
243sentences.114,lowPMI,it something stylist picked event like would for a out a looked professional have formal,8.647923238615817
243sentences.115,lowPMI,tuxedo still today's are personal wedding while in the is preferred grooms making statements attire,10.781159549612326
243sentences.116,lowPMI,shorter are edge fashion on of the for jackets cutting wedding men,9.839852755963395
243sentences.117,lowPMI,grooms also their colorful satin up and with are jazzing tuxedos shirts ties,17.43630297114945
243sentences.118,lowPMI,tuxedo is dinner black lapels a with a jacket tailless jacket silk,35.747859424080566
243sentences.119,lowPMI,black trousers perfect tuxedo should to a the tie be match jacket,11.63789174044629
243sentences.120,lowPMI,shirt be white be match lapels the and should the should the and always plain tie black jacket,17.75215418632499
243sentences.121,lowPMI,concert went the in blind pianist adulthood,10.264046478244374
243sentences.122,lowPMI,her was genetic slowly eyes by that a the blindness caused condition damaged,18.144965088480923
243sentences.123,lowPMI,she interviewers blind advantage that to an a told being was pianist,12.07062026983024
243sentences.124,lowPMI,she visual she more her no could so on had distractions concentrate fully music,8.870714957725944
243sentences.125,lowPMI,government blindness insufficient activities the for of as the defines vision ordinary life,16.188004587503407
243sentences.126,lowPMI,establishing legal resources focused blind by of on the can the parameters blindness be legally,16.901532957331444
243sentences.127,lowPMI,overlook vision do meet this those but the may who who have problems not standard,12.705320284434155
243sentences.128,lowPMI,developing blindness is caused disease deficiencies in by in and countries children usually infectious nutritional,19.643687787892155
243sentences.129,lowPMI,causes be medicine supplements these by can and often prevented vitamin,9.718735038951959
243sentences.130,lowPMI,developed blindness more be genetic in by to countries is likely caused problems,17.424812331128987
243sentences.131,lowPMI,one knows taste your your no a to how from really exactly gets mouth brain,16.26339687847066
243sentences.132,lowPMI,scientists process molecule touches bud the a a when of think begins food taste cell,11.758663339512275
243sentences.133,lowPMI,cell taste taste cell the to the a beneath carries message nerves,13.058341462458825
243sentences.134,lowPMI,it once taste responded tastes that to of four each one the was believed bud basic,11.158339067690726
243sentences.135,lowPMI,is bud tongue only were something that on of would a the the if taste tip respond you eating sweet,18.688475930410725
243sentences.136,lowPMI,scientists think taste be basic that can all the a to of now single bud sensitive tastes,18.405113820841862
243sentences.137,lowPMI,my taste very i eat very flavors of to so with sense isn't good tend foods strong,12.090474499733345
243sentences.138,lowPMI,i lots sauce drink coffee so very of with and no like hot i my cream it's bitter,11.729770924651113
243sentences.139,lowPMI,i even sweetness so make i extra when can't taste well i cookies add sugar,8.13413780132222
243sentences.140,lowPMI,hip are problem individuals a for fractures real aging,3.1934393287143163
243sentences.141,lowPMI,patients faced break process with of and of the the the are pain difficult healing,3.164987202120541
243sentences.142,lowPMI,families adjust loss to the to of have patient's independence,6.859213273134586
243sentences.143,lowPMI,society fractures substantial time and and the for in hip involve expense hospital,10.680228160694142
243sentences.144,lowPMI,halfway i sound snapping fingers through a the like race heard someone their,30.560716295566646
243sentences.145,lowPMI,i crunch knew my was a that and felt i instantly foot broken,9.040145429454457
243sentences.146,lowPMI,step running every on like felt spikes,9.470762181761534
243sentences.147,lowPMI,doctor's afterward clearly fracture at the the the office x-ray showed,7.359167089162524
243sentences.148,lowPMI,are different bone there of a few types fracture,13.536261773204302
243sentences.149,lowPMI,closed fractures is skin intact in the the or but simple bone broken is,31.1281930744246
243sentences.150,lowPMI,open fractures bone punctured produced wound in the and or the an compound broken has skin open,27.798573676659554
243sentences.151,lowPMI,new piercings infected not cleaned can if ear become they're carefully,4.302871693825391
243sentences.152,lowPMI,signs include swelling earlobe of around or the infection tenderness redness,8.714353355820961
243sentences.153,lowPMI,you symptoms area ointment if the some these and see clean apply,2.071841549517163
243sentences.154,lowPMI,redness don't contact health provider if and the away swelling go your care,11.830249273348361
243sentences.155,lowPMI,local has new reduce a to hospital initiated measures infections,6.089912021763355
243sentences.156,lowPMI,they improved washing ensured patients isolated patients and from that have hand habits infected are other,9.121496276042759
243sentences.157,lowPMI,hospital seen rates new began the the since has infection drop measures,8.93300450705398
243sentences.158,lowPMI,scrubbing soap delays increases infection a or the with which of wound alcohol healing risk,17.043683616993018
243sentences.159,lowPMI,band-aids risk holding moisture can of in the by and increase infection heat,11.480342809213617
243sentences.160,lowPMI,fortunately skin easily treated are can once most infections be they diagnosed,9.420510225967154
243sentences.161,lowPMI,modern started sixteenth at of the the opera end century,4.648485443979943
243sentences.162,lowPMI,it effort imitate tragic as to an and began rediscover greek performance,7.5590933237245235
243sentences.163,lowPMI,early opera tales their matter of for from founders chose antiquity subject,11.817007444340517
243sentences.164,lowPMI,later branched sources musical out of into and operas different stories traditions,16.764704519834115
243sentences.165,lowPMI,opera art singers perform combines music an which a and in and that is form musicians play words,18.22207598887939
243sentences.166,lowPMI,it many spoken such scenery of of and the as incorporates elements theatre acting costumes,13.497422758713808
243sentences.167,lowPMI,performances typically opera accompanied in and an an by are given house orchestra,9.48064738062829
243sentences.168,lowPMI,opera has hard role production the the the to in singer worked win new,7.333116164115406
243sentences.169,lowPMI,her is just about job not singing,6.2326233351945834
243sentences.170,lowPMI,acting presence interpretation critical and all stage musical are,11.281235855861652
243sentences.171,lowPMI,her strong is star but of the the pure voice certainly show,11.07153590197846
243sentences.172,lowPMI,painter many mind painting a in a must while keep elements completing,6.299590192537471
243sentences.173,lowPMI,she use elements strong lighting to like of and has solid design composition,6.399817544803809
243sentences.174,lowPMI,she execute strokes to with the has brush skill,4.131295054025765
243sentences.175,lowPMI,most content reveal painter's the the a the of should of importantly painting glimpse soul,2.8264381684360553
243sentences.176,lowPMI,long painters employed skilled creative as as than ago were more artisans artists,10.460193444863117
243sentences.177,lowPMI,however painters social scholars royal the and the of of prominent had status members court,8.510680695423497
243sentences.178,lowPMI,they their decided subject established relationship patrons on and with and a signed work its imagery personal their,17.50043710007779
243sentences.179,lowPMI,painter learned less scene painting as to the on a on and the i focus actual more itself,18.012604689319588
243sentences.180,lowPMI,artist's is camera has everything field an that within a to of eye not lens record its vision,15.937793220155477
243sentences.181,lowPMI,i nature useful more needed painting but for than a found provides information is good,23.659114673651747
243sentences.182,lowPMI,eagle is bird the an owl impressive,11.40298113694421
243sentences.183,lowPMI,it ear stick that like up has tufts horns,5.021164081800274
243sentences.184,lowPMI,its orange are creepy they right and could like through large eyes downright look pierce you,11.414883601280744
243sentences.185,lowPMI,owl night swiftly darkness this and the at through hunts flying silently,17.940260687833362
243sentences.186,lowPMI,owl have endangered are while some species become others thriving,13.28064443557495
243sentences.187,lowPMI,barred has well previous the beyond owl spread its habitat,17.13809236275054
243sentences.188,lowPMI,early suggest have barred invasion that the may findings logging facilitated owl's,8.825082554291704
243sentences.189,lowPMI,owl thick gripped her the a with on and landed branch it talons,10.860286463989928
243sentences.190,lowPMI,she her her settled half-closing to an and pressed wings sides down eye,7.2233136874176616
243sentences.191,lowPMI,she been glow eyes might but the a for of have statue her,8.11864144347136
243sentences.192,lowPMI,it's watch bear floating ice to across a unnerving polar stalk sea,9.912790136665693
243sentences.193,lowPMI,it's worse are frigid directly animal when the the in beneath even you submerged waters huge,10.623366636325382
243sentences.194,lowPMI,overhead paws ice bear its down the the on as giant set polar pursued prey,10.888638174728438
243sentences.195,lowPMI,part crew bear i months shots as the a of for these film polar documentary spent capturing,5.615571247048499
243sentences.196,lowPMI,polar are animals people other confusion one the will than of that for or bears few attack reasons fear,11.10177721969222
243sentences.197,lowPMI,they hunger live environment may of in out because a attack they food-scarce,5.263954787013836
243sentences.198,lowPMI,they people careful their will on up to sneak slowly conserve energy,21.096606338591748
243sentences.199,lowPMI,seal important polar diet the of an the is part bear's,7.872981885147809
243sentences.200,lowPMI,hunting wait breathing stalk are ice when by or on will a that the they seal's hole seals basking,15.513714193115888
243sentences.201,lowPMI,polar crawl forward place looks the and when around will in the bear quietly freeze seal,15.71777207468139
243sentences.202,lowPMI,medieval was structure primarily the for a castle not built defense,8.468407716289784
243sentences.203,lowPMI,its was its to purpose dominate surroundings,1.8364810038192765
243sentences.204,lowPMI,castle control day's a within could a easily lands walk,4.70196751941973
243sentences.205,lowPMI,times peasants property brought walls during and inside for of could the attack livestock be castle's protection,6.729737324757766
243sentences.206,lowPMI,spectacular dramatic provide stormy many in of of a the castles locations record history regions,14.704533416634888
243sentences.207,lowPMI,today stand rocky overlooking landscapes villages and they atop cliffs beautiful quaint,20.34809633545805
243sentences.208,lowPMI,past were battles intrigue in to the and they home plots,9.112130978796598
243sentences.209,lowPMI,leaving station saw hotel magnificent built upon above on the a a train we our looming castle cliff,30.09548547230932
243sentences.210,lowPMI,thick walls inner hundreds river the of the an above outside sheltered courtyard feet,28.095580620214697
243sentences.211,lowPMI,our rooms incredible scary an but tower had slightly view,4.404953042083112
243sentences.212,lowPMI,climbing feet pyramid gestured small entranceway after the the into up of the a fifty side man me black,16.89172275264754
243sentences.213,lowPMI,led pyramid's this the the into at chamber center,5.4669119108426205
243sentences.214,lowPMI,i him dark passage down the followed steep narrow,14.194181091802328
243sentences.215,lowPMI,smell was air thick the the the inside and pyramid chalky was,13.76993121297399
243sentences.216,lowPMI,more tomb pyramids pride than of the the the the of just king represented nation,10.674349050346969
243sentences.217,lowPMI,care builders their is the the that in pyramid took craft evident,6.582899441164148
