384sentences.216,lowPMI,mosquitos thin flying emit sound that a are small insects high-pitched,14.417458251830112
384sentences.217,lowPMI,mosquitoes mouthparts skin animals for of the and have piercing plants,4.782496816668804
384sentences.218,lowPMI,female bite animals their protein and for and mosquitoes people suck blood,16.126572558335916
384sentences.219,lowPMI,mosquito spread fever other diseases can and bites yellow malaria parasite,25.423740887944025
384sentences.220,lowPMI,mountain landform steeply land a that a above is rises surrounding,3.475586137514525
384sentences.221,lowPMI,mountains higher sometimes snow than at and the rise hills have top,15.501470736573735
384sentences.222,lowPMI,range forms tectonic collision a to of mountains due plate,17.05869556129575
384sentences.223,lowPMI,mountaineers people hike who up or are climb mountains,8.24425732783544
384sentences.224,lowPMI,mouth face we food eat the in the when is cavity put we,18.420744575754682
384sentences.225,lowPMI,mouth teeth food it the and to with has chew mix saliva,3.9948588383918135
384sentences.226,lowPMI,mouth also kissing the and for is used talking,5.544079807574363
384sentences.227,lowPMI,speech are tongue mouth by the in sounds controlled placement,9.5297700208249
384sentences.228,lowPMI,mug sturdy handle hot a with for a a is cup drinking liquids,33.16693697642269
384sentences.229,lowPMI,mug normally also made glass a can or but of is ceramic be metal,7.563180624489615
384sentences.230,lowPMI,mug thick ring thermal a a and for is has base insulation,12.209565133283403
384sentences.231,lowPMI,mugs plain drawings carved can or or on be have imprinted them,6.3911549268949415
384sentences.232,lowPMI,murder unlawful human intent the another of with is killing being,6.329936063963313
384sentences.233,lowPMI,murder crime deprives their a the because of serious it victim existence,7.86260438646546
384sentences.234,lowPMI,killing accidentally is considered in in or self-defense war not murder,14.755154088788139
384sentences.235,lowPMI,convicted is given sentence penalty a or a the murderer often life death,16.606431962843757
384sentences.236,lowPMI,orange is made orange a the from in juice drink liquid pulp,16.003817076890243
384sentences.237,lowPMI,orange has acid contains vitamin a a and of juice sweet taste lot c,24.992584306368958
384sentences.238,lowPMI,freshly orange often pulp as squeezed juice contains well,13.730913998122125
384sentences.239,lowPMI,orange is drunk glass at a from juice often breakfast,9.444318626541659
384sentences.240,lowPMI,parrot bird warm regions a that and a in is lives tropical,12.80846739557692
384sentences.241,lowPMI,parrots brightly-colored sharp beak and a have feathers curved,23.70745965875953
384sentences.242,lowPMI,parrots human they it can if the imitate voice hear repeatedly,10.7486196452766
384sentences.243,lowPMI,their abilities them pets and appearance makes popular,9.272862764756884
384sentences.244,lowPMI,peach orange-yellow characteristic a with an a is fruit smell,16.795284935578497
384sentences.245,lowPMI,skin is covered fine the a in of and peach thin small hairs,17.05817677457733
384sentences.246,lowPMI,peaches large stone seed a which inside the have red-brown contains,11.768939741701594
384sentences.247,lowPMI,peaches sweet be ripening and must and after are delicate harvested,8.701632278962991
384sentences.248,lowPMI,piano popular instrument means the by a a of is musical played keyboard,18.406623026944715
384sentences.249,lowPMI,pressing key felt-tipped hit steel a to a a piano causes hammer vibrating string,26.622950573200267
384sentences.250,lowPMI,piano enormous range change quality the and the an to has note pedals sound,10.807858856063419
384sentences.251,lowPMI,piano is famous give concerts the can and repertoire large pianists solo,21.129125846801475
384sentences.252,lowPMI,piranhas small fish south rivers that in are ferocious live american,9.976635179811602
384sentences.253,lowPMI,piranhas attack are active and and the in during live schools most day,14.935306872370957
384sentences.254,lowPMI,piranhas very teeth opportunistic and have sharp are carnivores,9.44451641054232
384sentences.255,lowPMI,piranhas fish lizards carrion and eat insects mammals,14.126450456604523
384sentences.256,lowPMI,raspberry fruit forest fields the that or a in is grows clearings,14.185924082693948
384sentences.257,lowPMI,single consists small joined a of raspberry many fruits together,5.904494749842762
384sentences.258,lowPMI,raspberries eaten cooked jam by with or into are themselves sugar,15.619981446039251
384sentences.259,lowPMI,leaves are fresh herbal of or the in raspberry used dried teas,14.743333901823908
384sentences.260,lowPMI,raven large bird many a that a in is black thrives climates,9.081426784097955
384sentences.261,lowPMI,ravens carrion berries animals on or feed insects small,22.39779359251371
384sentences.262,lowPMI,ravens large are problem and of have brains capable solving,8.357899324039535
384sentences.263,lowPMI,folklore are ill-omen tricksters in and of ravens birds also,12.206640484546831
384sentences.264,lowPMI,refrigerator cooling used preserve a to a and is device contain food,11.323339634985205
384sentences.265,lowPMI,refrigerators small freezing some a can at have compartment temperature,7.2615415334924265
384sentences.266,lowPMI,refrigerator shelves compartments types a and of can for have small different food,8.326890129957789
384sentences.267,lowPMI,refrigerator generally people put its a on and is white often magnets surface,6.651096381888345
384sentences.268,lowPMI,rifle firearm shoulder barrel grooves a that the a a on and with is rests has twisting,11.419982894652765
384sentences.269,lowPMI,grooves bullets rifle they air the around as the the the through make spin axis fly,26.944690692973325
384sentences.270,lowPMI,rifles used shooting sometimes in with and are hunting sports scopes,8.416590653374106
384sentences.271,lowPMI,assault fire are infantry can and in the rifles bursts standard weapon,6.06049116815683
384sentences.272,lowPMI,salmon fish fresh ocean spawn a from the to that to and is migrates water back,25.70360050329292
384sentences.273,lowPMI,salmon is red high content taste or and and a flesh orange has protein nice,14.754996974764548
384sentences.274,lowPMI,salmon eaten sushi grilling other can or or in by in be raw cooked poaching ways,15.595053411912343
384sentences.275,lowPMI,salmon most farmed it be wild the can the though in is common fish also caught,11.812304596930721
384sentences.276,lowPMI,saw tool hard abrasive cut materials a that or a a to is uses blade wire hard,12.664271382439901
384sentences.277,lowPMI,small points side are teeth the the the along of the sharp cutting saw called,20.07970855990368
384sentences.278,lowPMI,saws worked powered motor engine can or an by by or be hand electric gas,20.544844118548237
384sentences.279,lowPMI,saws used forestry carpentry in and are extensively construction medicine,8.539131489805474
384sentences.280,lowPMI,scientist produces knowledge world a about and the studies new physical,9.584253355946682
384sentences.281,lowPMI,scientist hypotheses experiments them a to and creates does test,4.069309285213947
384sentences.282,lowPMI,physics biology classic sciences and of chemistry are examples,14.074336711677484
384sentences.283,lowPMI,scientists their journals in and publish research conferences,13.759770477408573
384sentences.284,lowPMI,scissors two-bladed used a for are instrument cutting,10.995332730190444
384sentences.285,lowPMI,blades usually plastic handles the or with are metallic metal,14.290251290125767
384sentences.286,lowPMI,depending format cut hair on and or the can size scissors paper fabric,16.058887140044874
384sentences.287,lowPMI,shears large used shrubs metal for of or are scissors cutting pieces,16.38312015509106
384sentences.288,lowPMI,screwdriver tool tightening something a for into a and is inserting screws,19.44032926072481
384sentences.289,lowPMI,screwdrivers be remove they inserted can after to also used screws are,11.373141079098067
384sentences.290,lowPMI,screwdriver applies rotating the from the the tip torque handle,11.648591774880853
384sentences.291,lowPMI,major screwdrivers phillips the of two and types are flathead,14.571504020097949
384sentences.292,lowPMI,shark large cartilage a with a a is fish skeleton,17.758230757350383
384sentences.293,lowPMI,sharks streamlined large fin with a have bodies dorsal,12.369363255799724
384sentences.294,lowPMI,most predate mammals jaws on with and sharks fish powerful,8.472159145087696
384sentences.295,lowPMI,sharks very senses electrical and can have keen detect fields,4.846697894700856
384sentences.296,lowPMI,ship large floats water a that on a and is vehicle travels,17.6362772215843
384sentences.297,lowPMI,ship powered sails diesel a in by can the or be ocean steam engines,25.974082734475452
384sentences.298,lowPMI,ships used ocean cargo to the to in and are fish transport containers,17.240612684719046
384sentences.299,lowPMI,cruise are hotels people that between ships floating take cities,10.363583071132389
384sentences.300,lowPMI,shoe clothing sole heel a the a and for with an a is foot outsole,8.347224845786352
384sentences.301,lowPMI,shoes usually leather rubber of or are made canvas plastic,11.3995125065931
384sentences.302,lowPMI,women's often high come styles and and in shoes have heels many colors,8.121186605189937
384sentences.303,lowPMI,sneaker shoe athletic a for a and is sports activity,24.0297914563521
384sentences.304,lowPMI,soldier member armed fights a of who a the on is national forces land,14.272376219645864
384sentences.305,lowPMI,soldier wear usually a the a in must militia uniform camouflage,19.273970330526193
384sentences.306,lowPMI,volunteer soldier paid her in a or a for army is his work,20.749698093961463
384sentences.307,lowPMI,soldier using such grenades a and as fights weapons rifles,3.6340482792921347
384sentences.308,lowPMI,spears weapons pole head that a at of and one are consist sharpened end,8.536415986141044
384sentences.309,lowPMI,spears most personal advent the the before of were common weapon firearms,13.07200295283306
384sentences.310,lowPMI,spears used throwing war for when or in were stabbing fighting,7.564323082044851
384sentences.311,lowPMI,native still spear fishing some for the and people use hunting,18.10456930807241
384sentences.312,lowPMI,spiders insects make with that eight are legs silk,11.322517668899199
384sentences.313,lowPMI,spiders webs use catch with to and build silk them insects,10.291398507074822
384sentences.314,lowPMI,spiders venomous paralyse stuck to use fangs their prey,27.01196822273748
384sentences.315,lowPMI,spiders as coin big can a as as or a be small as bird,10.649169422878145
384sentences.316,lowPMI,swamps low land frequent to are spongy subject inundation,6.151877676743013
384sentences.317,lowPMI,swamp covered water vegetation a and with is shallow mud,11.98359157054254
384sentences.318,lowPMI,swamps nesting grounds reptiles and and for are breeding birds,21.223823315203816
384sentences.319,lowPMI,farmers drain produce arable to often swamps fertile land,14.816380189688758
384sentences.320,lowPMI,sweater heavy worn warmth a on for a the is garment torso,14.416240803901362
384sentences.321,lowPMI,sweaters often wool is common from but are knitted cotton also,13.723674448700937
384sentences.322,lowPMI,sweater front called a down a that the opens is cardigan,9.209208864283653
384sentences.323,lowPMI,sweaters cut sleeve as decoration in as and differ collar shape well,9.844456425931726
384sentences.324,lowPMI,table piece flat legs a of a a with and is furniture surface,14.491208543451748
384sentences.325,lowPMI,are chairs people there a to around for usually table sit,5.49000172076732
384sentences.326,lowPMI,people cutlery food eat together and a a on to set plates table meal,16.925190805425746
384sentences.327,lowPMI,tables also surfaces write as or to are used work on,9.067123113128307
384sentences.328,lowPMI,television appliance displays images a with that an a is screen moving,12.313865794312866
384sentences.329,lowPMI,televisions mostly watching films for or are used programs,13.312758384075657
384sentences.330,lowPMI,they used videogames game to to when a are play connected console,5.052740829793365
384sentences.331,lowPMI,television be received internet can via or or content broadcast cable,15.288445698526857
384sentences.332,lowPMI,theft taking property consent the without of is person's their,4.003656754914217
384sentences.333,lowPMI,thieves own sell receivers to to or to steal something it,11.987502502420512
384sentences.334,lowPMI,theft crime punishable fines a can or and with is be jail,13.126198471993016
384sentences.335,lowPMI,industrial is ideas property of and espionage theft intellectual,8.264090288070001
384sentences.336,lowPMI,toaster kitchen toasting using elements a for a is appliance bread heating,21.568095297374878
384sentences.337,lowPMI,pop-up toast placed eject once the a in and toasters bread slot it done,17.154279414031862
384sentences.338,lowPMI,toaster have side temperature a the within on a and ovens door tray control,10.351576508487756
384sentences.339,lowPMI,they be toppings cheese bread with or to like allow cooked garlic,22.57125101926681
384sentences.340,lowPMI,tomato shiny red savory the and a a with is smooth fruit taste,24.16460038538934
384sentences.341,lowPMI,tomato changes green it more a from as and to softens color red gets ripe,18.453104865435115
384sentences.342,lowPMI,tomatoes used salads ketchup well can or to as be make soup as sauce,4.705310027945549
384sentences.343,lowPMI,are varieties different tastes there with of and many tomato sizes,16.871318468936533
384sentences.344,lowPMI,train connected cars stations a of between a a that on is series moves track,6.644109864120406
384sentences.345,lowPMI,train pulled powered electricity the a or by by is locomotive diesel,29.07767058040114
384sentences.346,lowPMI,freight transports goods long a or of over train containers fuel distances,19.626753229425773
384sentences.347,lowPMI,commuter transport suburbs city between inside and a trains people stations,13.2636914878313
384sentences.348,lowPMI,train is passengers train a where or a a on off station place get,15.44501597721206
384sentences.349,lowPMI,train have machines tickets or for stations counters purchasing,5.954465769025109
384sentences.350,lowPMI,are rooms eat there to a and in waiting places station,7.16680613567013
384sentences.351,lowPMI,passengers trains platform or a to from next the cargo enter line,10.817248649315278
384sentences.352,lowPMI,tropical is formed tropical a over a cyclone storm warm sea,21.069446432012743
384sentences.353,lowPMI,cyclones very winds rain can and produce powerful torrential,5.830978558772634
384sentences.354,lowPMI,tropical also high coastal can and cyclone cause waves flooding,7.077237974342937
384sentences.355,lowPMI,tropical move seriously property a and can cyclone inland damage,3.0452070753458624
384sentences.356,lowPMI,violin instrument is bow the with that a an four with is strings played,12.635814164770002
384sentences.357,lowPMI,violin smallest pitched its the in and is highest instrument family,7.476267815452645
384sentences.358,lowPMI,violinist instrument collarbone a between and the the the holds chin,3.0687356116908973
384sentences.359,lowPMI,different are fingering hand by with while the one notes made neck bowing,14.933893415607361
384sentences.360,lowPMI,vultures scavenging feeding carcasses animals on of the are birds mostly dead,21.273875653710494
384sentences.361,lowPMI,many have head losing a for without vultures bald feathers heat,12.670887499177951
384sentences.362,lowPMI,vultures their wings miles to without for use large soar flapping,8.861665395999452
384sentences.363,lowPMI,vultures attack animals wounded but the may or seldom healthy kill sick,12.818149742062495
384sentences.364,lowPMI,wall solid defines protects a that an a and is structure sometimes area,10.246223783400236
384sentences.365,lowPMI,walls building roof space a and into the the delineate support divide rooms,16.47206740023202
384sentences.366,lowPMI,walls usually stone cement well of as or are made brick as drywall,9.768727969032916
384sentences.367,lowPMI,retaining provide movement stone a of to or walls barrier earth water,9.018174659420152
384sentences.368,lowPMI,water most liquid covering area the 70% on of is common earth its,10.84881806267512
384sentences.369,lowPMI,plants people water live and in must to animals drink order,4.077271946655224
384sentences.370,lowPMI,water low becomes ice at and a freezes temperature solid,11.348688169402338
384sentences.371,lowPMI,rain water clouds are vapor that in which from the is falls sky condensed,21.243431039120143
384sentences.372,lowPMI,whale very mammal ocean a that the a in is large lives,7.953355382733778
384sentences.373,lowPMI,whales blowholes heads through when on breathe their surfacing,3.7921902579355815
384sentences.374,lowPMI,blubber serves reservoir the a an as in as and whale energy insulation,14.455352900144167
384sentences.375,lowPMI,whales been meat oil for and have hunted whale ambergris,10.876287831013215
384sentences.376,lowPMI,window transparent wall light a in to a a is opening let through,17.17057356970738
384sentences.377,lowPMI,typical is sheets held frames a of by of in window made glass place,6.380962273246923
384sentences.378,lowPMI,open also air through when will a and window let sound,5.736511867643047
384sentences.379,lowPMI,windows multiple increase inside some to have panes insulation,9.005993906867403
384sentences.380,lowPMI,woman female adult a a is human,10.044466436282674
384sentences.381,lowPMI,woman stereotypically caregiver a a as is seen,8.807426619855313
384sentences.382,lowPMI,woman pregnant children a and can become bear,12.416845860639338
384sentences.383,lowPMI,woman different organs a a than has reproductive man,6.935337573285066