243sentences.218,lowPMI,stones pyramid precisely together structure the and the the until covering were fitted polished gleamed,13.165893494531746
243sentences.219,lowPMI,architects still solve pyramids constructed to of the how are working mysteries were,15.551305643868824
243sentences.220,lowPMI,think were pyramid's raise blocks some the inside to ramps built walls stone,22.899438119174654
243sentences.221,lowPMI,others ramps exterior pyramid that the the up of speculate zigzagged walls,9.660992085296336
243sentences.222,lowPMI,even rock takes strength and beginner climbing courage,4.822122593890724
243sentences.223,lowPMI,climbers learning try large who can the on are sport scrambling boulders,5.774682777370643
243sentences.224,lowPMI,once comfortable begin ropes climb rock with can that to they're they using safely vertical faces,20.16077257168574
243sentences.225,lowPMI,boys were rock all the the of on to trip new climbing,12.17054244444607
243sentences.226,lowPMI,many afraid of were heights,5.032761645836323
243sentences.227,lowPMI,having else their harnesses them down and someone check knots helped calm,16.0305451224758
243sentences.228,lowPMI,adults climbing appropriate the for up set routes beginners,12.848758123740186
243sentences.229,lowPMI,free-climbing particular rock one of is style climbing,8.063003731811175
243sentences.230,lowPMI,climber solely skill strength rock the and a on to relies her physical ascend face,7.6259978364966035
243sentences.231,lowPMI,rope are equipment and the bolts only used,9.57880946505568
243sentences.232,lowPMI,they meant stop she to if the are only climber falls,12.923995162165026
243sentences.233,lowPMI,i skied trail buddies me down that the to hesitantly steep my convinced try,9.849569144486077
243sentences.234,lowPMI,i bad i myself down a and made turn found tumbling,4.387676808736419
243sentences.235,lowPMI,i came flat slope to at of a a the finally stop part,8.367873523403787
243sentences.236,lowPMI,my were be my were snow hill to in up and a the skis nowhere found poles lodged drift,15.957222659695004
243sentences.237,lowPMI,major professional is use poles a how of strength skiers they ski,6.92430419460508
243sentences.238,lowPMI,proper ski improves balance flair skiing of to and use poles their adds their,9.235302556479265
243sentences.239,lowPMI,it need body regain balance the to for while minimizes upper movements lost skiing,11.708275368225534
243sentences.240,lowPMI,new designs boots skiers more and ski stiffer let turn quickly,11.86955277681046
243sentences.241,lowPMI,faster turns twisting legs but the the and on tighter increase force,14.11917437740118
243sentences.242,lowPMI,has more particularly skier's this to the to in led injuries ligaments knee,19.41065167279466
384sentences.0,lowPMI,accordion portable instrument an with a two is musical keyboards,23.40197140602449
384sentences.1,lowPMI,keyboard used notes chords one the for for is individual other,5.699410994762408
384sentences.2,lowPMI,accordions sound blow reeds with through that produce bellows air,10.41490369981777
384sentences.3,lowPMI,accordionist keyboards closing an while the both and plays opening bellows,8.51647176504706
384sentences.4,lowPMI,apartment self-contained is building an that a a of is home part,5.694364228887615
384sentences.5,lowPMI,apartment more as kitchen an one as and may or a a have rooms well bathroom,9.612479575944324
384sentences.6,lowPMI,apartments single others some for for are people families,10.256626409176857
384sentences.7,lowPMI,building garage facility storage the a or can a have laundry extra space,28.118224744772565
384sentences.8,lowPMI,apple fruit green yellow an that or a can is be red,16.01848891265969
384sentences.9,lowPMI,apples thin sweet seeds skin and a have crisp pulp inside,12.876940239007551
384sentences.10,lowPMI,very apples used cider some to tart are make,4.232402320003006
384sentences.11,lowPMI,apples eaten roasted pies can in or be raw baked,14.963847261610537
384sentences.12,lowPMI,arson criminal burning wildland the a of or is act building,7.019825401129458
384sentences.13,lowPMI,fire determines was accident a a or if by investigation fire caused arson,12.715660098057871
384sentences.14,lowPMI,arson done damage collect can to to or be cause others insurance,11.416874065266363
384sentences.15,lowPMI,severity depends were the the whether of on crime people harmed,10.199756617705626
384sentences.16,lowPMI,automobile is vehicle passengers an a or for car wheeled transporting,12.657121394709026
384sentences.17,lowPMI,car powered electric a by or can a be gasoline engine,28.844303211062616
384sentences.18,lowPMI,driver car other just the on the steers roads passengers sit,17.722186759290587
384sentences.19,lowPMI,automobiles size doors trunk in and of of the vary number type,3.6661326136071537
384sentences.20,lowPMI,axe tool split wood the to a and is used cut,13.448592021431342
384sentences.21,lowPMI,axe consists attached the a a of to usually head handle,1.3420478455568678
384sentences.22,lowPMI,historically heads made then of and axe were stone metal,4.448583557777136
384sentences.23,lowPMI,axes used firemen buildings by and are woodcutters entering,4.766462277735668
384sentences.24,lowPMI,banana long grows soft inside a that with a in a is fruit bunchs edible,22.83534252880612
384sentences.25,lowPMI,banana be purple have brown a can and when or ripe yellow red small spots,19.381853750173313
384sentences.26,lowPMI,greatest are countries india the or as producers tropical such ecuador,7.824435534910881
384sentences.27,lowPMI,unripe plantains staple often potatoes and like and bananas are foods cooked,33.3598480978179
384sentences.28,lowPMI,bed piece used sleep sex a of a or a as to is furniture place have in,10.041063154501447
384sentences.29,lowPMI,bed made box sheets covers a a a and of and plus is mattress spring pillows,11.58642551237931
384sentences.30,lowPMI,waterbeds is water it filled in with in the and with mattress filled airbeds is air,17.25092288138146
384sentences.31,lowPMI,type is fabric suspended another the above of a the bed hammock sling ground,21.47331335601966
384sentences.32,lowPMI,bee flying black body a with and six a a and is insect yellow legs,25.092410933752703
384sentences.33,lowPMI,bees pollen they make between nectar as to spread flowers collect honey,20.877207195426244
384sentences.34,lowPMI,bees social live colony hive and a a in in are insects together located,12.579835294844372
384sentences.35,lowPMI,many have attack feel and if can bees stingers they threatened,8.172652584188105
384sentences.36,lowPMI,bicycle vehicle pedals a with and a a two on is wheels frame,3.8542788890259745
384sentences.37,lowPMI,bicycle propelled cyclist a the a the by of on is pedalling saddle,13.348069860559095
384sentences.38,lowPMI,wheels rubber inner full the an with of have tires tube air,21.17796333302067
384sentences.39,lowPMI,people bicycles recreation for and use transportation racing,4.662544962522411
384sentences.40,lowPMI,blacksmith objects iron a or by creates forging steel,12.330364949360556
384sentences.41,lowPMI,blacksmith bends iron change shape a on to and an hammers hot anvil its,15.145065483816136
384sentences.42,lowPMI,blacksmiths thick handle tongs a the and with wears apron metal,7.3815938839517585
384sentences.43,lowPMI,blacksmiths objects horse iron like or make weapons shoes furniture,8.64476839374554
384sentences.44,lowPMI,blender kitchen used ingredients food a to a or is appliance mix puree,20.706110316910827
384sentences.45,lowPMI,blenders glass container blade a with in or a the have plastic rotating bottom,18.05066922052276
384sentences.46,lowPMI,blenders used milk fruit to and are make shakes smoothies,3.571372358163126
384sentences.47,lowPMI,blenders also make alcoholic crushed to with are used cold drinks ice,16.36999763021674
384sentences.48,lowPMI,boy young child not puberty a who a is male has undergone,22.822910059705798
384sentences.49,lowPMI,term used sex relative the to to is indicate distinctions girls,10.88918092997441
384sentences.50,lowPMI,traditionally play games other like and each to with boys rough fight,20.92225112357416
384sentences.51,lowPMI,adult behaving is referred an as to a male immaturely often boy,15.828140813968446
384sentences.52,lowPMI,broccoli plant family a the in is cabbage,10.677293397837618
384sentences.53,lowPMI,broccoli green head tough a a and has flower thick stalk,18.352313259120574
384sentences.54,lowPMI,broccoli high fiber nutrients in and is vitamins other,9.53940215384292
384sentences.55,lowPMI,broccoli boiled eaten can or be stir-fried raw,13.35073668359113
384sentences.56,lowPMI,butterfly flying large a with a four is insect wings,26.062714301950038
384sentences.57,lowPMI,wings be colorful the can of and butterflies very patterned,4.600466611456381
384sentences.58,lowPMI,metamorphosis transformation butterfly the a a of into is caterpillar,6.91484626804459
384sentences.59,lowPMI,people butterflies colorful some of because collect their wings,23.24440394921259
384sentences.60,lowPMI,carpenter artist laborer wood a or with an who is manual works,8.205227897187653
384sentences.61,lowPMI,carpenters repair furniture other and and build houses boats objects,20.958576492950037
384sentences.62,lowPMI,carpenters tools hammers pliers as and use such saws planes,11.229258673491502
384sentences.63,lowPMI,luthier carpenter repairs instruments a that a and is makes musical,5.792695816705556
384sentences.64,lowPMI,cats small animals tail with and four a are furry legs,16.34525369970211
384sentences.65,lowPMI,cats themselves their like by to groom licking fur,5.756188516898397
384sentences.66,lowPMI,cats mice are fed owners can but or by hunt birds often their,18.94545288309837
384sentences.67,lowPMI,claws are they sharp the so of that cats retractable keep,10.903617706435446
384sentences.68,lowPMI,chair piece designed sit a of to a for on is furniture people,6.958576757911556
384sentences.69,lowPMI,chairs seat floor supported of above a by consist raised level legs,6.822691225889715
384sentences.70,lowPMI,chairs have arm as cushion can as and a also back rests well,4.9823817483479385
384sentences.71,lowPMI,seats fixed located places in in or like are chairs vehicles cinemas,11.648870467201682
384sentences.72,lowPMI,clarinet woodwind instrument a a is musical,12.678320518228455
384sentences.73,lowPMI,clarinet long tube bottom a with at a a the is black flare,10.532830228162934
384sentences.74,lowPMI,player notes keys the and by chooses pressing holes,3.323663477612125
384sentences.75,lowPMI,clarinet used classical the in both and is jazz music,16.2540494464834
384sentences.76,lowPMI,cod fish colder atlantic a that the the a in of is lives areas,12.053511941092433
384sentences.77,lowPMI,cod is mild-tasting easily and when and flesh white flakes cooked,21.453921852330037
384sentences.78,lowPMI,fresh is fish salted elaborate for for and cod used chips cod dishes,19.88057552781594
384sentences.79,lowPMI,cod been salted time and the the since of has caught traded vikings,9.054113962273039
384sentences.80,lowPMI,coffee made beans coffee from of the the is coffee seeds plant,25.322471290461362
384sentences.81,lowPMI,coffee popular many usually hot a and in is drink countries served,6.070836001193515
384sentences.82,lowPMI,coffee mild called keeps awake a that contains drug caffeine people,15.6558550125086
384sentences.83,lowPMI,coffee world's legal export the is seventh-largest agricultural,3.6039048104165903
384sentences.84,lowPMI,desert natural almost falls a where a no is environment rain,12.086571492340106
384sentences.85,lowPMI,hot are filled dunes with or deserts usually sand rocks,10.843487952758386
384sentences.86,lowPMI,animals have live some to and in plants adapted deserts,9.878395804431847
384sentences.87,lowPMI,biggest desert sahara africa the in the hot is northern,27.92643547344648
384sentences.88,lowPMI,desk piece used sometimes a of at a a for with is furniture working computer,12.946300354838066
384sentences.89,lowPMI,desk flat be wood metal a and of a can or has surface made plastic,8.450731778725709
384sentences.90,lowPMI,desk drawers supplies a to may and have store papers,10.607978695883402
384sentences.91,lowPMI,cubicle desk partitions a a on of by three consists surrounded sides,9.444722392534565
384sentences.92,lowPMI,door movable entrance enclosed a to from a or an is barrier exit area,21.518450868644734
384sentences.93,lowPMI,most have control pass to to who through doors locks gets them,12.360890915231774
384sentences.94,lowPMI,most are pushing handle are by a or after doors opened pulling they unlocked,18.67578332861772
384sentences.95,lowPMI,other doors consist chamber of or a can of types slide revolving,12.292265534964827
384sentences.96,lowPMI,dress piece women wear a of a that is clothing sometimes,16.592424521361956
384sentences.97,lowPMI,dress shirt long skirt a a a like to is attached matching,25.362045979965874
384sentences.98,lowPMI,dress usually formal such dance a as or at a a is worn occasions wedding,16.139184020369136
384sentences.99,lowPMI,it hard stairs bike can or in to a a be climb ride dress,5.6416717638834175
384sentences.100,lowPMI,drunk is driving alcohol the under of of the driving act effects,10.238435619195991
384sentences.101,lowPMI,drunk vehicle crime world of a of any in the driving is most,16.905801193510168
384sentences.102,lowPMI,it role half deaths a of in all plays almost vehicle-related,4.769542858718569
384sentences.103,lowPMI,drunk are field breathing by and drivers caught sobriety tests,14.53652045303349
384sentences.104,lowPMI,drought persistent water caused rain a of by a the of is shortage supply lack,22.412359027016066
384sentences.105,lowPMI,drought crops stop die will to and and cause plants growing,13.827014022758997
384sentences.106,lowPMI,extreme eventually areas cause will and into drought turn desert famine,4.328181159910908
384sentences.107,lowPMI,large people migrate bowls of away to from numbers have dust,8.937675276449474
384sentences.108,lowPMI,eagles large prey day very eyesight of during and that the are birds hunt have good,21.911078997747783
384sentences.109,lowPMI,eagles hooked tearing strong sharp for and have beaks flesh legs talons,4.302527744305801
384sentences.110,lowPMI,eagles eyries eat others mammals in some and and live species fish small,23.800416954359854
384sentences.111,lowPMI,bald has white is bird states the and of a the the eagle bright head national united,13.998584863531063
384sentences.112,lowPMI,earthquakes ground buildings structures the can and and down shake knock other,5.698201991751503
384sentences.113,lowPMI,shaking trigger volcanic the and can also landslides activity,9.613185352599611
384sentences.114,lowPMI,most are release earth's by of the the in earthquakes caused energy crust,15.318331911729388
384sentences.115,lowPMI,earthquake displace cause an can and at the a sea seabed tsunami,6.294933540752241
384sentences.116,lowPMI,elephants largest land weighing tons the of are kind mammal several,17.320726230003856
384sentences.117,lowPMI,elephant long called grab food an a can a which or has nose trunk things,2.8604220831346527
384sentences.118,lowPMI,elephant pair tusks objects trees the of or a for into has ivory moving digging,7.818989622901905
384sentences.119,lowPMI,elephant its ears blood its the the and to in flaps large cool them body,10.867679425718679
384sentences.120,lowPMI,eye organ light it cortex the for for an and the is sensing coding visual,14.819330906316964
384sentences.121,lowPMI,most have eyes color texture which and can animals complex detect motion,12.566184379294656
384sentences.122,lowPMI,fovea center eye sensitive it the of and of the the the is human most part,14.334562207156146
384sentences.123,lowPMI,insects compound made units many up in of have eyes eye facing directions,7.010371564542357
384sentences.124,lowPMI,farm land grow raise food a or to for is used plants animals,14.919971774134103
384sentences.125,lowPMI,farmers people farm produce the the what who and to are run decide,9.859566764122745
384sentences.126,lowPMI,farms have farmers barn a a a for and usually house silo,9.921123711411658
384sentences.127,lowPMI,cooperative farm farmers land a where and a the is many share equipment,12.76308832446275
384sentences.128,lowPMI,primates have thumb four a each and on usually fingers hand,4.894469878525825
384sentences.129,lowPMI,fingers used writing other for and are grasping grooming activities,7.510486104675387
384sentences.130,lowPMI,fingertips sensitive pressure the and to are temperature vibration,12.523562205463735
384sentences.131,lowPMI,nail tip be decorated the of and or the the can protects finger grown,9.888338394243705
384sentences.132,lowPMI,flood overflow water inhabited a of of an an that is expanse submerges land,15.680117251336785
384sentences.133,lowPMI,flood caused rain snow as earthquakes can or at by as be heavy rapid melt well sea,16.513618688511357
384sentences.134,lowPMI,flood flow its break levees in a of and a will or river out channel dams,19.90540688350767
384sentences.135,lowPMI,flood evacuate water diseases during and a the people contaminated causes,4.037382573000645
384sentences.136,lowPMI,floor horizontal building walking a inside for a a is surface used on,13.688352393891153
384sentences.137,lowPMI,floors made concrete linoleum floorboards may or of be bare tile wooden,10.689217296378345
384sentences.138,lowPMI,people put floor dampen on for to a and often carpets comfort noise,5.013522983003092
384sentences.139,lowPMI,buildings often pipes wiring in and the under floor has electrical it,8.244786822580105
384sentences.140,lowPMI,foot body end a on of a the a is part leg,7.301035911319417
384sentences.141,lowPMI,people their walking standing when or use feet running straight,13.346769757856721
384sentences.142,lowPMI,people use feet fighting to both in and also their kick sports,8.936749087371618
384sentences.143,lowPMI,many have behavior feet for to cultures rules related,3.9128670483130374
384sentences.144,lowPMI,forest area density canopy a with of an a and is high trees cover,23.39110738453874
384sentences.145,lowPMI,type depends rainfall location the on in of and forest temperature its,13.506217843835932
384sentences.146,lowPMI,forest has types animals well plants a and of as ecosystem various trees as ground,8.253134862729459
384sentences.147,lowPMI,deforestation cutting disregarding the of down is forests regeneration,5.601839408205767
384sentences.148,lowPMI,fork tool solid handle tines a for a a with and is eating foods several,19.62289980480053
384sentences.149,lowPMI,forks usually metal disposable of if or are made plastic,12.354536529498363
384sentences.150,lowPMI,forks used food hold place to the to while to or in are lift mouth food cutting,9.333486473792508
384sentences.151,lowPMI,forks used cultures special various in there and for are western are kinds foods,11.487323988717433
384sentences.152,lowPMI,frying is pan sides a with a a and pan small sloping handle,18.611407228840022
384sentences.153,lowPMI,frying is fry brown a and to pan used sear food,11.180816658617847
384sentences.154,lowPMI,food cooked covering pan the the the on of is oil bottom,15.479793054001602
384sentences.155,lowPMI,frying are iron steel of or pans made teflon-clad,8.168042105329032
384sentences.156,lowPMI,girl female has yet maturity a who a is human not reached,8.191943345461189
384sentences.157,lowPMI,body develops at the a that a puberty of into of girl woman,10.567076301386326
384sentences.158,lowPMI,girls playing social like and with often dolls games,5.427023821424148
384sentences.159,lowPMI,girls grow hair dresses and and sometimes long wear skirts,26.22346000408782
384sentences.160,lowPMI,glove piece covers fingers a of the a that and is clothing hand,7.961459710436361
384sentences.161,lowPMI,gloves cold made lined material to of against or protect are wool waterproof,7.942110020436969
384sentences.162,lowPMI,disposable latex are shield germs or from to or rubber gloves used hands chemicals,29.429867291475638
384sentences.163,lowPMI,mitten kind fingers covered a of the a where four is glove are together,9.694211831444411
384sentences.164,lowPMI,hammer tool deliver object a to to a an an is used impact,9.201139065740758
384sentences.165,lowPMI,hammer most used nails a into to is often drive wood,11.876173457840626
384sentences.166,lowPMI,claw be remove the the to on can head used nails,6.461290698430307
384sentences.167,lowPMI,hammers shape handle in of and the the vary head length,2.785103061801968
384sentences.168,lowPMI,hand is used people a as against an a grenade explosive weapon,26.000738785568988
384sentences.169,lowPMI,hand are timed bit and a to after grenades thrown explode that,12.520184286011197
384sentences.170,lowPMI,grenades be rifles launchers can or from also fired shoulder,3.6988598378211064
384sentences.171,lowPMI,gas are middle disperse tear the a into of to grenades thrown mob it,12.340954744275507
384sentences.172,lowPMI,horse large mammal muscular a with a four is hoofed long legs,19.86752946603489
384sentences.173,lowPMI,horse tail its is gray a and on or a a and has mane neck usually brown,16.27214137329594
384sentences.174,lowPMI,horses been draft travel for and have used work entertainment,4.522479683181838
384sentences.175,lowPMI,human horse walks gallops a a or can while ride it trots,7.746582339380543
384sentences.176,lowPMI,people hospitals healed are injured to when to or go be they sick,6.4490578554611515
384sentences.177,lowPMI,hospitals staffed physicians nurses by and are professional surgeons,10.847036348922652
384sentences.178,lowPMI,patients there diagnosis leaving day some or for the go specialist therapy same,8.750720792125177
384sentences.179,lowPMI,operations patients stay weeks for or for some to treatments have several,13.192049892650907
384sentences.180,lowPMI,house permanent structure families in a or or a for to is building people live,19.0980744697221
384sentences.181,lowPMI,house roof keep rain let in a and out and a to and to has walls cold windows light,13.86585065481857
384sentences.182,lowPMI,house rooms sleeping washing a for or can like have purposes cooking,15.826984812700415
384sentences.183,lowPMI,most leave work back eat the and to to at and people house come night sleep,3.8927564768857863
384sentences.184,lowPMI,igloo type made snow an of of a from by is shelter blocks inuit,7.8717645651887205
384sentences.185,lowPMI,igloos built snow land time in the the where of are places covers most,19.90808758373972
384sentences.186,lowPMI,igloos often shape entrance in of with the a an are built dome tunnel,8.603730943309287
384sentences.187,lowPMI,air snow space heat igloos in and the pockets insulate body warms,8.587719486310146
384sentences.188,lowPMI,knife tool edge used things a with that a a to is sharp is cut,11.75307687524554
384sentences.189,lowPMI,modern consist blade made of and of a a knives handle usually metal,9.430761796015425
384sentences.190,lowPMI,knives also used instruments as in and have been weapons rituals,17.53061569918924
384sentences.191,lowPMI,knife used slashing throwing a to or can by be attack stabbing,7.910312309433775
384sentences.192,lowPMI,lentils seeds legume the a the of of are plant family,15.40983675180612
384sentences.193,lowPMI,lentils red brown yellow can or be green black,16.53155670006329
384sentences.194,lowPMI,lentils commonly indian cuisines in and are used mediterranean,7.929792163121876
384sentences.195,lowPMI,lentils cooked are source by a and of are boiling great protein,15.581405400163199
384sentences.196,lowPMI,lettuce biennial often temperate leaf a as in a is plant grown climates vegetable,17.66182910321796
384sentences.197,lowPMI,lettuce eaten raw other cooked can in or and and be cold salads dishes,21.298476064192712
384sentences.198,lowPMI,lettuce considered easy suitable beginners to a and for is fairly grow crop,10.74194661985844
384sentences.199,lowPMI,most leaves bitter bred bitterness but to some the lettuce taste are remove,13.82158788307501
384sentences.200,lowPMI,library place books media kept a where of a a and is collection documents is,7.831061740939249
384sentences.201,lowPMI,librarians libraries experts organizing at at and and work are finding information,7.056776915479167
384sentences.202,lowPMI,people public borrow take several can and for to to go libraries books home weeks,8.6675522882522
384sentences.203,lowPMI,academic support research specialized and libraries scholarly have books,23.62711662687104
384sentences.204,lowPMI,log is house round a from a cabin small built logs,17.382322850669176
384sentences.205,lowPMI,log is american life origins a and of cabin symbol frontier humble,5.824188790651521
384sentences.206,lowPMI,log were first european as by cabins used shelters settlers,5.378231592304999
384sentences.207,lowPMI,log were using notch ends with the at cabins built logs joints,22.024320028640403
384sentences.208,lowPMI,man male adult a a is human,11.114066163404749
384sentences.209,lowPMI,boy man puberty a after a through becomes passing,6.611198372600095
384sentences.210,lowPMI,manhood associated virility with and is masculinity,6.5087381396496955
384sentences.211,lowPMI,men women weight structure from and in differ height body,5.611178276426278
384sentences.212,lowPMI,milk white produced mammals their a to by is liquid female feed young,7.492396068438302
384sentences.213,lowPMI,newborn be milk eat food must can before animals fed they solid,16.54668654801316
384sentences.214,lowPMI,dairy such butter made as from and products cheese are milk,8.798745500725557
384sentences.215,lowPMI,liquid soybeans is called from and produced coconuts sometimes milk,8.810718521637105
