4627,384sentences.219,and malaria yellow spread fever can mosquito bites other diseases parasite.,2.519715932145306
4628,384sentences.219,yellow bites spread fever parasite and other diseases can malaria mosquito.,1.8737151687910922
4629,384sentences.219,yellow can spread diseases fever and other malaria bites mosquito parasite.,2.522231064046337
4630,384sentences.220,land mountain a landform surrounding rises that above is a steeply.,1.1668530475700736
4631,384sentences.220,a land mountain a above landform that surrounding is steeply rises.,0.9811884270984415
4632,384sentences.220,a steeply landform a rises mountain land is that surrounding above.,1.717673516884946
4633,384sentences.220,that mountain surrounding rises a is land landform steeply above a.,1.3010501202905271
4634,384sentences.220,rises mountain above landform land that steeply is a a surrounding.,1.3254261709315311
4635,384sentences.220,a a landform mountain rises steeply land surrounding that is above.,1.6100411681408289
4636,384sentences.220,is that surrounding a above land a mountain rises landform steeply.,1.5133498224678088
4637,384sentences.220,steeply rises landform a that is a mountain above land surrounding.,1.5259126966872054
4638,384sentences.220,landform mountain a that surrounding steeply above land is rises a.,1.51818534771365
4639,384sentences.220,landform is a land that steeply above rises mountain a surrounding.,1.9158731854686508
4640,384sentences.221,the rise mountains hills than top sometimes at snow higher and have.,1.0001233181082376
4641,384sentences.221,mountains rise than at top hills the sometimes snow have and higher.,1.0892329039404374
4642,384sentences.221,mountains higher sometimes and hills rise at the top than snow have.,1.5405075875863945
4643,384sentences.221,and top at hills mountains the than snow have rise sometimes higher.,1.0638788336372211
4644,384sentences.221,the at and than rise mountains top have higher sometimes snow hills.,0.8975052728022381
4645,384sentences.221,sometimes hills have and higher at top rise snow than mountains the.,1.264114582724322
4646,384sentences.221,snow than higher have sometimes at and hills rise top the mountains.,1.2884121661528443
4647,384sentences.221,than mountains and sometimes hills the rise have higher snow at top.,1.0103963844338184
4648,384sentences.221,the have higher hills at rise and snow top than sometimes mountains.,1.160510772227423
4649,384sentences.221,and than higher snow have mountains sometimes top rise at hills the.,1.4139963814816658
4650,384sentences.222,range a forms collision to due plate of mountains tectonic.,0.9840131147550363
4651,384sentences.222,a collision range tectonic to forms plate of mountains due.,1.5319415058691346
4652,384sentences.222,mountains tectonic forms to a range collision plate of due.,1.3223273958147208
4653,384sentences.222,mountains due range a collision to of tectonic plate forms.,1.4731812643442437
4654,384sentences.222,tectonic plate range mountains a forms of to collision due.,1.2797597452867666
4655,384sentences.222,range a mountains to of plate collision forms tectonic due.,1.8677135867792103
4656,384sentences.222,tectonic due of collision to range plate mountains a forms.,1.2754236762897848
4657,384sentences.222,plate mountains of collision to tectonic range forms due a.,0.9596878245164263
4658,384sentences.222,mountains a due collision of plate range tectonic to forms.,1.4256712017854272
4659,384sentences.222,tectonic to collision range of plate forms due mountains a.,1.0037196715761816
4660,384sentences.223,are mountaineers or people mountains climb up hike who.,1.5790754097951203
4661,384sentences.223,hike mountaineers up mountains are climb people or who.,1.4938882518378984
4662,384sentences.223,mountains hike are who climb people mountaineers or up.,1.650466185366162
4663,384sentences.223,or climb are hike people mountaineers who mountains up.,1.2609485411670538
4664,384sentences.223,or mountains climb people mountaineers who up hike are.,1.6722032466434342
4665,384sentences.223,are climb hike or up people who mountaineers mountains.,1.5089757931174013
4666,384sentences.223,mountaineers who hike people mountains are climb up or.,1.5459712049804433
4667,384sentences.223,up or are people mountains hike climb who mountaineers.,0.975740590727015
4668,384sentences.223,people who are up or mountains climb mountaineers hike.,2.03221569066513
4669,384sentences.223,mountaineers who hike mountains people up are or climb.,1.1400215280275168
4670,384sentences.224,when mouth the face the food we cavity eat in is we put.,1.0957633971692262
4671,384sentences.224,the mouth the when food eat face we we in put cavity is.,1.2373453568073143
4672,384sentences.224,eat the is we cavity face mouth in when we the food put.,1.0462167810597236
4673,384sentences.224,cavity eat in face the put when food the we is mouth we.,1.0033441513638361
4674,384sentences.224,in the mouth the we face eat when we food cavity is put.,1.387633146996275
4675,384sentences.224,is cavity we the face mouth food when put we the in eat.,1.0351192932429096
4676,384sentences.224,face when food the cavity the mouth put is in we we eat.,1.0062477956419333
4677,384sentences.224,in we cavity the put we when eat mouth is the food face.,0.9831663129629896
4678,384sentences.224,we in we eat when cavity mouth food face the the is put.,1.034871134269717
4679,384sentences.224,is when eat we mouth in the face put we cavity the food.,0.8830839562713096
4680,384sentences.225,with mouth the to teeth saliva food it mix has chew and.,0.9835224645244551
4681,384sentences.225,the mouth teeth it saliva to with food mix and chew has.,1.2664720481511795
4682,384sentences.225,the has food chew to mouth it with saliva teeth mix and.,1.2760315122584118
4683,384sentences.225,chew saliva it to the with teeth mix and mouth food has.,1.1554627340437866
4684,384sentences.225,with it chew teeth mouth the saliva and has food mix to.,1.2104194859802448
4685,384sentences.225,food to and chew has it saliva mouth mix teeth the with.,1.2746196573781268
4686,384sentences.225,mix teeth has and food it chew to mouth saliva with the.,1.3291268900629662
4687,384sentences.225,teeth the chew food to with mouth and has mix it saliva.,1.239842495037251
4688,384sentences.225,with and has to it mouth chew mix saliva teeth food the.,0.9802209382531939
4689,384sentences.225,chew teeth has mix and the food saliva mouth it to with.,0.9180778396394506
4690,384sentences.226,mouth the for is talking used and kissing also.,1.047191290641937
4691,384sentences.226,kissing the and talking mouth used is for also.,1.0073074230752046
4692,384sentences.226,talking kissing mouth also used is the for and.,1.109957234827083
4693,384sentences.226,for used mouth kissing is the also talking and.,1.154964589566337
4694,384sentences.226,for talking used is the also and kissing mouth.,1.1835408883141345
4695,384sentences.226,mouth used kissing for and is also the talking.,0.9034990910288568
4696,384sentences.226,the also kissing is talking mouth used and for.,0.9751952349985091
4697,384sentences.226,and for mouth is talking kissing used also the.,0.894607410898051
4698,384sentences.226,is also mouth and for talking used the kissing.,0.7662350529553315
4699,384sentences.226,the also kissing talking is and mouth for used.,0.6895597810569711
4700,384sentences.227,sounds speech by mouth placement tongue the are controlled in.,1.0928391756966775
4701,384sentences.227,speech mouth sounds in placement by the are controlled tongue.,1.2540249438079398
4702,384sentences.227,controlled in by placement speech sounds mouth the are tongue.,1.250835526690077
4703,384sentences.227,controlled tongue sounds speech mouth placement are in the by.,0.6715022442704751
4704,384sentences.227,in the sounds controlled speech by are placement mouth tongue.,1.190654051552629
4705,384sentences.227,sounds speech controlled placement are the mouth by in tongue.,1.0237308283264204
4706,384sentences.227,in tongue are mouth placement sounds the controlled speech by.,1.0412215895349324
4707,384sentences.227,the controlled are mouth placement in sounds by tongue speech.,0.6196591336143278
4708,384sentences.227,controlled speech tongue mouth are the sounds in placement by.,0.7352046401064701
4709,384sentences.227,in placement mouth sounds are the by tongue controlled speech.,0.9041740464972122
4710,384sentences.228,drinking mug a sturdy a handle hot cup liquids for is with a.,2.1208446532808405
4711,384sentences.228,a mug a drinking handle liquids sturdy hot with for a cup is.,1.9654227949114893
4712,384sentences.228,liquids a is with cup sturdy mug for drinking hot a handle a.,1.6846863926434743
4713,384sentences.228,cup liquids for sturdy a a drinking handle a hot is mug with.,1.5587252257871334
4714,384sentences.228,for a mug a hot sturdy liquids drinking with handle cup is a.,2.1266004199974655
4715,384sentences.228,is cup hot a sturdy mug handle drinking a with a for liquids.,2.1968731022688943
4716,384sentences.228,sturdy drinking handle a cup a mug a is for with hot liquids.,1.8214126095726038
4717,384sentences.228,for hot cup a a with drinking liquids mug is a handle sturdy.,1.9167809456346312
4718,384sentences.228,hot for with liquids drinking cup mug handle sturdy a a is a.,2.2631183111648987
4719,384sentences.228,is drinking liquids with mug for a sturdy a hot cup a handle.,2.0482974869664043
4720,384sentences.229,of mug a ceramic normally made is but metal glass can also or be.,1.3645221284151279
4721,384sentences.229,a mug normally metal be glass of but can ceramic also made or is.,1.050146984489099
4722,384sentences.229,or a is can but ceramic metal mug also glass be of normally made.,1.1645529207538592
4723,384sentences.229,glass but made ceramic a also mug normally metal of is can be or.,1.490086206872286
4724,384sentences.229,metal mug a of normally ceramic or can also glass made but is be.,1.2580007757157603
4725,384sentences.229,is but or normally ceramic mug glass made metal be can of also a.,1.6516210685543782
4726,384sentences.229,of metal be normally but a glass can or is also mug made ceramic.,0.983589231588029
4727,384sentences.229,made metal but normally also can glass mug is be ceramic or of a.,1.0710335311786103
4728,384sentences.229,made can but normally is be also a or metal mug glass ceramic of.,2.048900419376582
4729,384sentences.229,made mug can metal glass also ceramic be a but is normally or of.,1.2416335166722992
4730,384sentences.230,thermal mug a and thick insulation a for base is has ring.,1.6167712749782093
4731,384sentences.230,a mug thick for insulation and thermal a base ring has is.,1.9344018035351922
4732,384sentences.230,a is a has and mug for thermal insulation thick base ring.,1.6160540614504162
4733,384sentences.230,has insulation for and a thermal thick base ring mug a is.,1.5777329212131883
4734,384sentences.230,thermal for has thick mug a insulation ring is a base and.,1.559551153435538
4735,384sentences.230,a and ring has is for insulation mug base thick a thermal.,1.398864309189459
4736,384sentences.230,base thick is ring a for has and mug insulation thermal a.,1.6701870691774166
4737,384sentences.230,thick a has a and thermal mug ring is base for insulation.,1.2259380760804883
4738,384sentences.230,thermal ring is and for mug has base insulation thick a a.,0.9528111624503495
4739,384sentences.230,has thick is base ring a a insulation mug for and thermal.,1.5047045579334803
4740,384sentences.231,on can mugs or plain them drawings carved or be have imprinted.,0.7496088692501531
4741,384sentences.231,mugs can plain carved them or on drawings or imprinted have be.,1.1024578686455977
4742,384sentences.231,mugs be drawings have or can carved on them plain or imprinted.,0.7179500987198479
4743,384sentences.231,have them carved or mugs on plain or imprinted can drawings be.,1.2197255583289812
4744,384sentences.231,on carved have plain can mugs them imprinted be drawings or or.,0.8375956534996888
4745,384sentences.231,drawings or imprinted have be carved them can or plain mugs on.,1.0733928328642608
4746,384sentences.231,or plain be imprinted drawings carved have or can them on mugs.,0.9319452235735672
4747,384sentences.231,plain mugs have drawings or on can imprinted be or carved them.,1.0558613869664109
4748,384sentences.231,on imprinted be or carved can have or them plain drawings mugs.,1.0789601095077945
4749,384sentences.231,have plain be or imprinted mugs drawings them can carved or on.,0.9592773451387612
4750,384sentences.232,intent is murder killing with another of being the unlawful human.,1.146888595028865
4751,384sentences.232,murder intent is unlawful being killing of with the human another.,1.830981809288412
4752,384sentences.232,unlawful human killing murder another is intent the of with being.,1.5692931340064606
4753,384sentences.232,of is with another murder the intent killing human being unlawful.,1.238249340428557
4754,384sentences.232,another is being killing intent of human the unlawful murder with.,1.377155951375153
4755,384sentences.232,murder unlawful killing is another human intent with of the being.,1.7991743376754536
4756,384sentences.232,the of with unlawful being intent murder is another killing human.,1.5443013579518103
4757,384sentences.232,human another killing unlawful of the murder is being intent with.,1.4996139698887188
4758,384sentences.232,killing is unlawful of with human being intent the another murder.,1.3920237617143296
4759,384sentences.232,killing the unlawful intent of human being another is murder with.,1.8917176504725564
4760,384sentences.233,their a murder because crime existence deprives of victim serious it the.,0.8839054413365761
4761,384sentences.233,murder a crime of existence because their deprives victim the it serious.,1.546993169956406
4762,384sentences.233,murder serious deprives it because a of their existence crime victim the.,1.3358102882247092
4763,384sentences.233,it existence of because murder their crime victim the a deprives serious.,1.9927972906559732
4764,384sentences.233,their of it crime a murder existence the serious deprives victim because.,0.9755190189068293
4765,384sentences.233,deprives because the it serious of existence a victim crime murder their.,1.7233111332510116
4766,384sentences.233,victim crime serious the deprives of it because a existence their murder.,1.4812809701576024
4767,384sentences.233,crime murder it deprives because their a the serious victim of existence.,1.1674305631834694
4768,384sentences.233,their the serious because of a it victim existence crime deprives murder.,1.2879355332302427
4769,384sentences.233,it crime serious victim the murder deprives existence a of because their.,1.5295191200336298
4770,384sentences.234,murder in killing or considered war in not self-defense accidentally is.,1.1980106411319065
4771,384sentences.234,killing murder in accidentally not or in considered self-defense is war.,1.3945084980650648
4772,384sentences.234,accidentally is or killing war in murder self-defense in considered not.,1.389522618492172
4773,384sentences.234,in in considered war killing self-defense murder or is not accidentally.,0.9171189431338327
4774,384sentences.234,war in not or murder in is self-defense accidentally killing considered.,1.1933578067918946
4775,384sentences.234,killing accidentally or in war is murder considered in self-defense not.,1.3886658384703336
4776,384sentences.234,self-defense in considered accidentally not murder killing in war or is.,1.0569668168822828
4777,384sentences.234,is war or accidentally in self-defense killing in not murder considered.,0.9145324289601334
4778,384sentences.234,or in accidentally in considered is not murder self-defense war killing.,1.1502013297002485
4779,384sentences.234,or self-defense accidentally murder in is not war in killing considered.,0.8387342236950116
4780,384sentences.235,the convicted a often is sentence death given penalty or murderer a life.,1.7128140082026817
4781,384sentences.235,a convicted is the sentence penalty often death a or life given murderer.,1.392964803378887
4782,384sentences.235,penalty a murderer a given often convicted or the death is sentence life.,1.3405754111545078
4783,384sentences.235,given penalty or often a life the sentence is death murderer convicted a.,1.461596681780365
4784,384sentences.235,or is convicted a death often penalty the a sentence given murderer life.,1.44768981991433
4785,384sentences.235,murderer given death is often convicted sentence the life a a or penalty.,1.0001919516309976
4786,384sentences.235,often the sentence is given a convicted life murderer or a death penalty.,1.7123140980249623
4787,384sentences.235,or death given is life a the penalty convicted murderer a sentence often.,1.5472714001439427
4788,384sentences.235,death or a penalty the given convicted sentence often is a murderer life.,1.6630777138125514
4789,384sentences.235,murderer the penalty a convicted or is often life death given a sentence.,1.1730615493780914
4790,384sentences.236,orange juice orange drink a pulp from in liquid is made the.,2.70809777432013
4791,384sentences.236,orange juice a in pulp drink orange from liquid the made is.,1.9950967507980957
4792,384sentences.236,orange is from made drink juice in orange pulp a liquid the.,2.1352684556442942
4793,384sentences.236,made pulp in drink orange orange a liquid the juice from is.,1.8789558800673207
4794,384sentences.236,orange in made a juice orange pulp the is from liquid drink.,1.7105527078605662
4795,384sentences.236,from drink the made is in pulp juice liquid a orange orange.,1.810329136159475
4796,384sentences.236,liquid a is the from in made drink juice pulp orange orange.,2.037179162491157
4797,384sentences.236,a orange made from drink orange juice the is liquid in pulp.,1.9194011379608527
4798,384sentences.236,orange the is drink in juice made liquid pulp a from orange.,1.539370787990915
4799,384sentences.236,made a is liquid the orange from pulp juice in drink orange.,2.0989664739160987
4800,384sentences.237,lot juice orange sweet a a has acid of c taste and vitamin contains.,1.4150912108877227
4801,384sentences.237,orange juice a of contains c lot acid taste sweet and a vitamin has.,1.6854343920342718
4802,384sentences.237,vitamin orange has taste acid sweet of juice and c contains lot a a.,1.4693339514477601
4803,384sentences.237,c acid a sweet orange and juice a of lot has taste contains vitamin.,1.5315255024044065
4804,384sentences.237,of juice orange lot a sweet vitamin taste and c a acid has contains.,1.6983107439417917
4805,384sentences.237,has acid vitamin a sweet juice c a of contains taste lot and orange.,1.0455217614257957
4806,384sentences.237,lot of contains a acid orange c taste vitamin has and juice a sweet.,1.0859114482805503
4807,384sentences.237,a of acid a and taste c juice has contains sweet vitamin lot orange.,1.0360888335519363
4808,384sentences.237,a taste acid a has contains and orange vitamin of juice c sweet lot.,1.594566128776824
4809,384sentences.237,a juice taste of c and sweet contains orange acid has a vitamin lot.,1.0434387577872417
4810,384sentences.238,squeezed freshly contains orange well often as pulp juice.,1.7648074818184833
4811,384sentences.238,pulp freshly as well squeezed often orange contains juice.,1.790631927599471
4812,384sentences.238,well pulp squeezed juice often orange freshly contains as.,2.358018988034541
4813,384sentences.238,contains often squeezed pulp orange freshly juice well as.,2.979899040715538
4814,384sentences.238,contains well often orange freshly juice as pulp squeezed.,1.3412897178287662
4815,384sentences.238,squeezed often pulp contains as orange juice freshly well.,2.3222083036723293
4816,384sentences.238,freshly juice pulp orange well squeezed often as contains.,2.514578520674914
4817,384sentences.238,as contains squeezed orange well pulp often juice freshly.,1.27434958291881
4818,384sentences.238,orange juice squeezed as contains well often freshly pulp.,2.3485144224483343
4819,384sentences.238,freshly juice pulp well orange as squeezed contains often.,2.237131399737708
4820,384sentences.239,juice orange drunk glass breakfast at a is often from.,1.9339624702564737
4821,384sentences.239,orange glass juice from breakfast drunk a is often at.,1.9561763637632639
4822,384sentences.239,often from drunk breakfast orange juice glass a is at.,1.6963649047579856
4823,384sentences.239,often at juice orange glass breakfast is from a drunk.,1.4308137979215205
4824,384sentences.239,from a juice often orange drunk is breakfast glass at.,1.3825609169900888
4825,384sentences.239,juice orange often breakfast is a glass drunk from at.,1.597796178484981
4826,384sentences.239,from at is glass breakfast juice a often orange drunk.,1.3901092441225427
4827,384sentences.239,a often is glass breakfast from juice drunk at orange.,1.1865246909240277
4828,384sentences.239,often orange at glass is a juice from breakfast drunk.,1.1221978225682094
4829,384sentences.239,from breakfast glass juice is a drunk at often orange.,1.392526206691232
4830,384sentences.240,tropical parrot a bird a regions lives and warm is that in.,1.620760289583537
4831,384sentences.240,a parrot a and regions bird tropical lives warm in that is.,1.664175595732463
4832,384sentences.240,a is lives that bird parrot and tropical regions a warm in.,2.0481132846410617
4833,384sentences.240,that regions and bird a tropical a warm in parrot lives is.,1.811824385806111
4834,384sentences.240,tropical and that a parrot a regions in is lives warm bird.,0.9273292881726918
4835,384sentences.240,lives bird in that is and regions parrot warm a a tropical.,1.3461606709310452
4836,384sentences.240,warm a is in lives and that bird parrot regions tropical a.,1.6353223543346749
4837,384sentences.240,a a that lives bird tropical parrot in is warm and regions.,1.2144335337384937
4838,384sentences.240,tropical in is bird and parrot that warm regions a lives a.,1.1310279138926986
4839,384sentences.240,that a is warm in a lives regions parrot and bird tropical.,1.3772047513171184
4840,384sentences.241,have parrots a brightly-colored beak and curved sharp feathers.,1.9255442746676041
4841,384sentences.241,sharp parrots curved beak have and brightly-colored a feathers.,1.9736517300128984
4842,384sentences.241,beak sharp have feathers and brightly-colored parrots a curved.,1.8870698181259453
4843,384sentences.241,a and have sharp brightly-colored parrots feathers beak curved.,1.3320609580340648
4844,384sentences.241,a beak and brightly-colored parrots feathers curved sharp have.,1.4888287397674353
4845,384sentences.241,have and sharp a curved brightly-colored feathers parrots beak.,2.052031830505912
4846,384sentences.241,parrots feathers sharp brightly-colored beak have and curved a.,1.6565872563692683
4847,384sentences.241,curved a have brightly-colored beak sharp and feathers parrots.,1.2300112146365694
4848,384sentences.241,brightly-colored feathers have curved a beak and parrots sharp.,1.6744980905636329
4849,384sentences.241,parrots feathers sharp beak brightly-colored curved have a and.,1.7458723136538468
4850,384sentences.242,repeatedly can parrots human it if voice hear imitate the they.,0.8855874938133468
4851,384sentences.242,parrots repeatedly can the hear human voice it imitate they if.,1.1419686532163824
4852,384sentences.242,the they human parrots if can repeatedly imitate voice it hear.,0.7686164111141293
4853,384sentences.242,voice can it if parrots imitate repeatedly human they hear the.,1.171253365294324
4854,384sentences.242,if can hear human repeatedly voice they imitate the parrots it.,1.0658395475057663
4855,384sentences.242,parrots the human can if they repeatedly it voice imitate hear.,1.0339231385707344
4856,384sentences.242,imitate voice it the hear repeatedly parrots can if human they.,0.932702660046708
4857,384sentences.242,they if human the voice imitate parrots can hear repeatedly it.,1.484350244429107
4858,384sentences.242,human can the voice it they hear repeatedly imitate if parrots.,0.9725202153495659
4859,384sentences.242,human imitate the repeatedly voice they hear if can parrots it.,1.3187332473545113
4860,384sentences.243,appearance their them and pets popular makes abilities.,1.3367422099817174
4861,384sentences.243,appearance makes abilities their popular them and pets.,0.7177800141433177
4862,384sentences.243,their makes appearance popular abilities pets them and.,0.6286829722110624
4863,384sentences.243,their popular appearance abilities and them pets makes.,1.0531501335729303
4864,384sentences.243,them their popular abilities pets appearance and makes.,1.2681906944236476
4865,384sentences.243,their them abilities makes pets appearance popular and.,0.9653343314196091
4866,384sentences.243,them makes appearance their popular and abilities pets.,1.2335125338004351
4867,384sentences.243,appearance popular pets their abilities them and makes.,1.2629616850389818
4868,384sentences.243,and pets popular appearance them abilities their makes.,1.0490288697958503
4869,384sentences.243,abilities appearance pets them and makes their popular.,0.6794085274809681
4870,384sentences.244,peach a orange-yellow smell with fruit characteristic is an a.,1.2194049528493571
4871,384sentences.244,a smell peach a with orange-yellow characteristic is an fruit.,1.1416555236799049
4872,384sentences.244,an a orange-yellow with a peach smell characteristic is fruit.,1.2926365960638173
4873,384sentences.244,an fruit peach a smell with is a characteristic orange-yellow.,1.4710338150931888
4874,384sentences.244,a characteristic peach an a orange-yellow is with smell fruit.,0.9515113470682858
4875,384sentences.244,peach a an with is characteristic smell orange-yellow a fruit.,1.5829109210010148
4876,384sentences.244,a fruit is smell with peach characteristic an a orange-yellow.,1.2652388475621785
