1314,243sentences.131,mouth one no your knows exactly your brain a to taste really gets from how.,1.339955343643973
1315,243sentences.131,how brain knows your exactly one really to from taste your gets mouth no a.,1.5132279270316655
1316,243sentences.131,your to brain no knows mouth how a really from one taste gets exactly your.,1.0341460737296324
1317,243sentences.131,brain your taste really exactly mouth knows your how to gets a one no from.,1.54161932088571
1318,243sentences.131,gets taste one no to really from a exactly mouth knows your brain your how.,1.3233568818783816
1319,243sentences.131,gets your no your one brain exactly how to really knows mouth from a taste.,1.1042608387862292
1320,243sentences.132,touches think scientists a begins process food the when taste cell a molecule bud of.,1.0381098277980871
1321,243sentences.132,scientists think process taste of food cell a when a begins molecule touches bud the.,1.059105929574736
1322,243sentences.132,taste bud scientists the a when begins a think molecule cell of touches process food.,1.0776005426672448
1323,243sentences.132,bud when food begins scientists molecule of think process touches a the a taste cell.,1.1289309851553977
1324,243sentences.132,a think scientists touches process begins bud cell a taste molecule the of food when.,1.3542613510787542
1325,243sentences.132,when cell process touches begins think the taste food molecule bud of a scientists a.,1.0045984899806109
1326,243sentences.132,bud taste cell scientists process a when a the food think molecule of begins touches.,0.9516219503855388
1327,243sentences.132,cell touches molecule the begins a process bud when taste of a think scientists food.,1.3990319438078014
1328,243sentences.132,of molecule think scientists taste the food a begins a process bud cell touches when.,1.1003901741625322
1329,243sentences.132,of bud scientists touches think cell begins when taste the process a food a molecule.,0.7243689617018645
1330,243sentences.133,the cell the taste a cell to beneath nerves carries message taste.,1.0458886281873923
1331,243sentences.133,the cell a beneath cell taste the to nerves taste message carries.,1.3337477095016916
1332,243sentences.133,the carries to message taste cell beneath the cell a nerves taste.,1.0810076202108199
1333,243sentences.133,message cell beneath taste the the a nerves taste cell to carries.,1.0121441109669518
1334,243sentences.133,the beneath message a cell the cell taste carries to nerves taste.,1.3174448185278513
1335,243sentences.133,to taste taste message carries beneath cell cell nerves a the the.,1.133426545838249
1336,243sentences.133,nerves a carries taste to beneath message taste cell cell the the.,0.9867507855971203
1337,243sentences.133,a the message to taste the cell taste carries nerves beneath cell.,1.3420407327371455
1338,243sentences.133,the taste carries taste beneath cell message nerves cell a to the.,0.8397814982405176
1339,243sentences.133,message a carries nerves taste the to cell cell beneath taste the.,1.2580246978974285
1340,243sentences.134,believed it of that tastes four once was responded the one basic taste each to bud.,1.0551615412994448
1341,243sentences.134,it responded believed of one basic taste four bud that once tastes was each the to.,0.9028591028768149
1342,243sentences.134,responded once believed the each was one taste to basic tastes that of it bud four.,0.9411731099865295
1343,243sentences.134,the was responded that one to each believed basic it of bud once taste four tastes.,1.034918877629094
1344,243sentences.134,the that bud one each once of to believed responded tastes it was taste basic four.,1.1603899137754115
1345,243sentences.134,basic taste that one of responded believed each it was bud once to tastes the four.,0.9480585848743366
1346,243sentences.134,one believed tastes bud taste four the once that was of to responded basic each it.,0.7498171613674267
1347,243sentences.134,of believed once responded bud was it one four each the basic to taste tastes that.,1.003518960451661
1348,243sentences.134,responded tastes four it one was basic that each the once believed of to taste bud.,0.9160736971824848
1349,243sentences.134,each responded was one that the basic believed once bud four of it taste tastes to.,0.899006801103892
1350,243sentences.135,taste that of tip were a would is tongue eating respond the something you only the bud if on sweet.,0.8776087705892656
1351,243sentences.135,eating only tip if of respond something that a the on bud would is sweet were you tongue taste the.,0.881641435576502
1352,243sentences.135,would of is if taste were the eating something bud the on you sweet that only respond tip tongue a.,0.7836809902780758
1353,243sentences.135,taste respond of if would a on only sweet tongue bud is were the something eating the you tip that.,1.0608566955279064
1354,243sentences.135,eating tip tongue is something only that respond on the bud were taste the would a of sweet you if.,1.1343330142492316
1355,243sentences.135,if bud of something tip would eating only were the the tongue on is respond sweet taste that a you.,1.114760294451427
1356,243sentences.135,bud on only a respond the the tip of sweet would that is something tongue were if eating you taste.,1.1492130375798384
1357,243sentences.135,on if that of sweet were is tongue bud respond something taste a tip only would eating the you the.,0.8151107345488524
1358,243sentences.135,that taste would the tip sweet something were is eating you tongue a of on only the bud respond if.,1.0802569980649577
1359,243sentences.135,eating the the respond would tip of if is taste tongue you on that bud were only a something sweet.,0.6933406004294931
1360,243sentences.136,that scientists to a tastes all think now can be of the basic taste single sensitive bud.,0.8679242375293105
1361,243sentences.136,tastes scientists can that to sensitive the taste of bud a think basic now single all be.,1.1888379238587716
1362,243sentences.136,can a that all single now to taste sensitive of be think basic bud scientists tastes the.,0.9731589382686855
1363,243sentences.136,all think can a sensitive be single to that now scientists tastes bud basic taste the of.,1.3528135879249674
1364,243sentences.136,all can bud sensitive single think tastes of that a be taste scientists now to the basic.,0.7923887737131502
1365,243sentences.136,the all a sensitive to can that single scientists of taste basic think bud now be tastes.,0.91488133985564
1366,243sentences.136,sensitive taste tastes bud basic the of think a be now single can to that all scientists.,1.3352643337966865
1367,243sentences.136,to bud think can basic now scientists tastes the of taste single that sensitive be all a.,1.0169245552444848
1368,243sentences.136,tastes can basic of scientists sensitive now the a single all think that to be taste bud.,0.9897413885260266
1369,243sentences.136,tastes single can now sensitive a all the that think bud of to scientists taste basic be.,0.8716339266507391
1370,243sentences.137,taste my eat isn't flavors foods of sense i tend with very strong good very to so.,1.0704028580128273
1371,243sentences.137,flavors my i taste eat to very good with so isn't of strong sense very foods tend.,1.1367759444883836
1372,243sentences.137,i isn't taste foods very sense eat good to with tend of strong so my flavors very.,1.1963808545799406
1373,243sentences.137,foods of i isn't to tend very eat taste sense my flavors so strong good very with.,1.1910335036283313
1374,243sentences.137,foods i so to very of flavors with taste isn't tend good my sense eat very strong.,0.8219093080308462
1375,243sentences.137,very foods isn't to eat i taste very my with good strong of so sense tend flavors.,1.1997443779631185
1376,243sentences.137,to good flavors so strong very with of isn't tend sense very i eat taste foods my.,0.9677023399504441
1377,243sentences.137,eat so of i strong sense my flavors very with good very taste to tend foods isn't.,1.4648006646727159
1378,243sentences.137,flavors i strong with my to sense very isn't very foods of taste eat tend good so.,0.8584191993587074
1379,243sentences.137,flavors very i sense to isn't foods very taste of so with eat my good strong tend.,0.6307825290817456
1380,243sentences.138,of i drink bitter so lots with like it's coffee and very i sauce my hot no cream.,0.9350288032761641
1381,243sentences.138,bitter cream i it's my hot i lots and sauce no like very coffee with of drink so.,0.6034221262973437
1382,243sentences.138,with bitter drink no i very i it's like and my hot lots coffee sauce of cream so.,1.579189987871272
1383,243sentences.138,like i my bitter cream of so and hot very sauce with lots drink coffee it's no i.,1.385177316852242
1384,243sentences.138,sauce i bitter very and hot coffee drink of it's i like so lots my cream with no.,1.3355410303819812
1385,243sentences.138,coffee and it's very bitter i lots hot with of cream sauce no drink so like i my.,1.0338027349046026
1386,243sentences.138,very it's lots no i like bitter coffee with and so of drink hot sauce my i cream.,0.998702917549982
1387,243sentences.138,of drink coffee like hot and lots i i cream with very my it's so sauce bitter no.,1.3145480468090567
1388,243sentences.138,bitter very i my sauce i it's like cream hot of with coffee drink and no so lots.,1.4207723069385974
1389,243sentences.138,bitter hot very coffee i drink lots it's no and of so sauce like with my cream i.,1.1637953261834064
1390,243sentences.139,cookies can't i i sweetness taste make even well add sugar so when extra i.,0.8352244951684263
1391,243sentences.139,i can't taste add i make sugar i well so sweetness when cookies extra even.,0.9606928641848714
1392,243sentences.139,add extra i even so well sweetness i can't when sugar i cookies taste make.,0.9194852603451016
1393,243sentences.139,extra well make sweetness i when i can't taste cookies i even so add sugar.,0.669455637642094
1394,243sentences.139,i can't i cookies taste sweetness extra sugar so add when even i make well.,1.4738200574531626
1395,243sentences.139,well sugar taste cookies sweetness can't even add make when extra i i i so.,1.785185751367531
1396,243sentences.139,extra add sugar i taste i well so even make can't when i sweetness cookies.,1.2550123598089575
1397,243sentences.139,sugar cookies when even sweetness i taste extra well add i so can't i make.,1.3193139141602017
1398,243sentences.139,i when can't i add even make so sweetness i taste extra sugar cookies well.,1.3531919011424087
1399,243sentences.139,i extra i cookies can't sugar sweetness well add even taste i make so when.,1.0915526228307986
1400,243sentences.140,fractures hip problem are individuals real aging for a.,1.7750561910707074
1401,243sentences.140,for hip aging individuals fractures real are problem a.,1.6776516684368215
1402,243sentences.140,individuals for fractures a real are hip problem aging.,1.117246404401967
1403,243sentences.140,problem real fractures for are hip a individuals aging.,1.5607650689064945
1404,243sentences.140,problem individuals real are hip a aging for fractures.,1.0869333075787995
1405,243sentences.140,fractures real for problem aging are a hip individuals.,0.8388986347973416
1406,243sentences.140,hip a for are individuals fractures real aging problem.,1.0694898002651092
1407,243sentences.140,aging problem fractures are individuals for real a hip.,1.0469505481898986
1408,243sentences.140,are a fractures aging problem individuals real hip for.,1.0263867764250492
1409,243sentences.140,hip a for individuals are aging fractures problem real.,1.089860596635273
1410,243sentences.141,the are patients difficult the with and faced pain process healing of the of break.,1.4739667628012072
1411,243sentences.141,patients are with process break and healing difficult pain of the the the of faced.,1.2851489362281194
1412,243sentences.141,process of patients faced of pain the difficult are the healing break the with and.,0.9024359509609655
1413,243sentences.141,of pain and the patients the break are with the difficult faced of process healing.,1.278998602563147
1414,243sentences.141,difficult are patients the with the of healing of process the faced break and pain.,1.4851069898995088
1415,243sentences.141,pain healing with the the are faced process and the of break difficult patients of.,0.9969843179319593
1416,243sentences.141,of process healing patients with difficult pain of faced and are the break the the.,1.2183176278723697
1417,243sentences.141,healing the the faced the difficult with of pain process break of are patients and.,0.9481371012302616
1418,243sentences.141,break the are patients process faced and of the difficult with of healing the pain.,0.9527693457323522
1419,243sentences.141,break of patients the are healing the pain process faced with difficult and of the.,1.0891384426981914
1420,243sentences.142,have families to independence patient's the of to adjust loss.,1.0016693893341553
1421,243sentences.142,families independence have loss patient's to of to adjust the.,0.8508283811810754
1422,243sentences.142,adjust loss to patient's families have independence of to the.,0.8709516576205205
1423,243sentences.142,adjust the have families independence patient's to loss of to.,0.6390685800559913
1424,243sentences.142,loss of have adjust families to to patient's independence the.,1.4556840213844096
1425,243sentences.142,have families adjust patient's to of independence to loss the.,0.845885164193816
1426,243sentences.142,loss the to independence patient's have of adjust families to.,0.8183629732592751
1427,243sentences.142,of adjust to independence patient's loss have to the families.,0.7215907367571025
1428,243sentences.142,adjust families the independence to of have loss patient's to.,1.2741539498622994
1429,243sentences.142,loss patient's independence have to of to the adjust families.,0.9450900480634608
1430,243sentences.143,in for and fractures hip and the involve hospital time society substantial expense.,1.0837442986914463
1431,243sentences.143,and for hip in and hospital fractures the substantial time expense involve society.,1.057961262890293
1432,243sentences.143,hospital and society substantial involve fractures for time in the hip and expense.,1.1008991226148497
1433,243sentences.143,involve hospital time fractures and expense in and hip the society for substantial.,0.9640539651772482
1434,243sentences.143,time hip for and the fractures hospital in substantial and involve society expense.,1.0879979835168776
1435,243sentences.143,society involve the hip fractures for and in expense substantial and time hospital.,1.4247691727780039
1436,243sentences.143,fractures in and hip involve and for expense society time substantial the hospital.,1.2015331968711878
1437,243sentences.143,time the involve hip expense substantial in hospital for society and and fractures.,1.192142154360817
1438,243sentences.143,the time substantial hospital in involve for and fractures hip and society expense.,1.4221464820977106
1439,243sentences.143,society in hospital substantial for time hip fractures expense the involve and and.,1.2705478227122438
1440,243sentences.144,snapping through halfway i race like their heard fingers someone the a sound.,0.9253583031737278
1441,243sentences.144,halfway through race snapping like fingers i their a someone sound heard the.,1.301573655061556
1442,243sentences.144,fingers halfway the a heard i through someone snapping their race like sound.,1.0940833028006924
1443,243sentences.144,heard fingers someone i halfway sound snapping like race their the through a.,1.4156093265243739
1444,243sentences.144,someone race through halfway their i fingers snapping a like heard the sound.,1.5792323407901454
1445,243sentences.144,the heard their race i through like snapping sound a halfway someone fingers.,1.384735942572417
1446,243sentences.144,i snapping like race heard halfway through sound the someone a their fingers.,1.0311432771011553
1447,243sentences.144,someone their heard race sound a snapping fingers through the halfway like i.,1.8172747187604381
1448,243sentences.144,their someone a fingers snapping heard through like i race halfway the sound.,1.1094529484189455
1449,243sentences.144,the snapping fingers a through someone race i sound their heard halfway like.,1.1704277067898476
1450,243sentences.145,foot felt i and crunch that was i broken my a knew instantly.,0.5808078429514434
1451,243sentences.145,i felt crunch foot that broken and was knew my instantly i a.,1.0435072560085188
1452,243sentences.145,broken i a knew i and felt my foot was crunch that instantly.,0.9445443206563836
1453,243sentences.145,i broken my and i instantly foot that crunch was a felt knew.,0.6631270259872095
1454,243sentences.145,my crunch felt i was and broken foot knew that i a instantly.,0.6299447658120035
1455,243sentences.145,a i was crunch and felt that foot instantly knew i my broken.,1.0530313201053962
1456,243sentences.145,and foot that crunch i i felt instantly a my knew was broken.,1.0657230044609576
1457,243sentences.145,my was i crunch instantly knew foot broken felt a i that and.,0.8815738291521528
1458,243sentences.145,was my knew broken foot i felt that and crunch i a instantly.,0.895796589074532
1459,243sentences.145,a foot broken knew felt my crunch and instantly was i i that.,0.9392086256152069
1460,243sentences.146,on every spikes felt running like step.,1.3790653493330967
1461,243sentences.146,on every running spikes felt step like.,0.9388729563514332
1462,243sentences.146,every spikes step running felt on like.,0.9793856276893537
1463,243sentences.146,on spikes running like every step felt.,1.5680859936737734
1464,243sentences.146,spikes every step like running felt on.,1.4133977559497686
1465,243sentences.146,step felt every running spikes like on.,1.3483934173225043
1466,243sentences.146,spikes felt running on every step like.,1.3540089366917523
1467,243sentences.146,like every running felt spikes step on.,1.0804297584490354
1468,243sentences.146,on every spikes step like running felt.,1.6286561398016786
1469,243sentences.146,spikes every like felt step running on.,1.4110724949356905
1470,243sentences.147,fracture the at afterward the x-ray the showed doctor's office clearly.,1.0838452999581054
1471,243sentences.147,at fracture the office showed afterward the the doctor's clearly x-ray.,1.0302234325821287
1472,243sentences.147,office clearly afterward at x-ray the fracture doctor's the the showed.,1.1138382825240247
1473,243sentences.147,the the the x-ray at doctor's fracture afterward clearly showed office.,0.9972248199678994
1474,243sentences.147,x-ray the showed afterward fracture the clearly doctor's office at the.,0.8012191215758518
1475,243sentences.147,at office afterward the x-ray clearly fracture the the doctor's showed.,0.8161413301212952
1476,243sentences.147,doctor's the the office showed fracture at the x-ray afterward clearly.,0.9822231478485146
1477,243sentences.147,clearly x-ray afterward office the doctor's at the showed fracture the.,0.5908904984109847
1478,243sentences.147,afterward the office the the clearly showed fracture doctor's x-ray at.,1.504132391801161
1479,243sentences.147,afterward doctor's office fracture the clearly showed x-ray the at the.,0.8806140226411365
1480,243sentences.148,are there types a fracture different bone of few.,1.8101795180503433
1481,243sentences.148,of there bone fracture are different a types few.,1.7077895855974237
1482,243sentences.148,fracture of are few different a there types bone.,1.221867856904562
1483,243sentences.148,types different are of a there few fracture bone.,1.6992135055687356
1484,243sentences.148,types fracture different a there few bone of are.,1.2180458508491339
1485,243sentences.148,are different of types bone a few there fracture.,1.4537373181510975
1486,243sentences.148,there few of a fracture are different bone types.,1.2180679864524477
1487,243sentences.148,bone types are a fracture of different few there.,0.9102075373801441
1488,243sentences.148,a few are bone types fracture different there of.,1.5339353484698
1489,243sentences.148,there few of fracture a bone are types different.,1.2554536717934095
1490,243sentences.149,the closed in fractures simple but or the skin intact bone is is broken.,1.703583721215085
1491,243sentences.149,in closed simple skin broken intact the the bone fractures is but is or.,1.2530130758244895
1492,243sentences.149,is in or bone the fractures skin closed is intact broken the simple but.,1.4394082807191322
1493,243sentences.149,intact the but fractures in is closed simple skin the or bone broken is.,1.445115445790387
1494,243sentences.149,skin closed in the simple fractures is bone is intact but the or broken.,1.497087056391994
1495,243sentences.149,or the is simple fractures closed intact but skin broken bone the is in.,1.4863057399376838
1496,243sentences.149,the skin broken simple the in intact bone is or is closed but fractures.,1.253711091789643
1497,243sentences.149,but skin the simple is bone intact closed or broken fractures is the in.,1.3322662487278107
1498,243sentences.149,but bone the simple or broken is in is skin closed intact fractures the.,1.3027210063845456
1499,243sentences.149,but closed bone skin intact is fractures broken in the or simple is the.,1.0348815597473178
1500,243sentences.150,compound in skin fractures wound and or open has punctured produced an open broken the the bone.,1.5008345374304954
1501,243sentences.150,wound in has compound skin the an broken produced bone fractures or open open the and punctured.,1.5928833621845915
1502,243sentences.150,has fractures compound and the open skin broken the produced punctured or open bone in wound an.,1.4163855476233196
1503,243sentences.150,and or has fractures the punctured the skin compound open in wound bone open broken an produced.,1.5613439331677335
1504,243sentences.150,and has bone the the or wound produced compound fractures punctured broken in open skin an open.,1.5535113044335125
1505,243sentences.150,an and fractures the skin has compound the in produced broken open or bone open punctured wound.,1.2848784158186846
1506,243sentences.150,the broken wound bone open an produced or fractures punctured open the has skin compound and in.,1.6237506168413502
1507,243sentences.150,skin bone or has open open in wound an produced broken the compound the punctured and fractures.,1.2453303439211676
1508,243sentences.150,wound has open produced in the open an fractures the and or compound skin punctured broken bone.,1.5132706035081265
1509,243sentences.150,wound the has open the fractures and an compound or bone produced skin in broken open punctured.,1.4241228968610267
1510,243sentences.151,cleaned ear new become carefully if infected not piercings can they're.,1.0302559891756962
1511,243sentences.151,new cleaned ear can not become infected carefully piercings they're if.,1.3991594994293421
1512,243sentences.151,can they're become new if ear cleaned piercings infected carefully not.,1.1515168181938944
1513,243sentences.151,infected ear carefully if new piercings cleaned become they're not can.,0.9451512338614916
1514,243sentences.151,if ear not become cleaned infected they're piercings can new carefully.,1.0929086269260568
1515,243sentences.151,new can become ear if they're cleaned carefully infected piercings not.,0.7917440401029566
1516,243sentences.151,piercings infected carefully can not cleaned new ear if become they're.,0.6752098820645621
1517,243sentences.151,they're if become can infected piercings new ear not cleaned carefully.,1.1548917101739162
1518,243sentences.151,become ear can infected carefully they're not cleaned piercings if new.,1.5758044410577976
1519,243sentences.151,become piercings can cleaned infected they're not if ear new carefully.,0.5371656199425692
1520,243sentences.152,earlobe of signs tenderness the or swelling around infection include redness.,1.5539636947105382
1521,243sentences.152,signs earlobe of include around tenderness swelling the infection redness or.,1.3887845274388
1522,243sentences.152,include redness tenderness signs or of earlobe infection swelling the around.,1.5591630795119966
1523,243sentences.152,swelling of the or signs infection earlobe tenderness redness around include.,1.212660380598164
1524,243sentences.152,or of around tenderness earlobe swelling redness infection include signs the.,1.3289508623324298
1525,243sentences.152,signs include tenderness of or redness earlobe the swelling infection around.,1.3101206060951995
1526,243sentences.152,infection swelling the include around earlobe signs of or tenderness redness.,1.5129934692317704
1527,243sentences.152,redness or tenderness include swelling infection signs of around earlobe the.,1.765399835844679
1528,243sentences.152,tenderness of include swelling the redness around earlobe infection or signs.,2.025915366679586
1529,243sentences.152,tenderness infection include earlobe swelling redness around or of signs the.,1.6814998385456903
1530,243sentences.153,some you if symptoms these ointment the apply and see clean area.,1.2056017371356433
1531,243sentences.153,if you these apply ointment symptoms some the and area clean see.,1.546374875585134
1532,243sentences.153,if see the clean symptoms you apply some ointment these and area.,1.0178625490818634
1533,243sentences.153,clean ointment apply symptoms if some these and area you the see.,0.863066183394155
1534,243sentences.153,some apply clean these you if ointment area see the and symptoms.,0.9098853996931786
1535,243sentences.153,the symptoms area clean see apply ointment you and these if some.,1.0056124626663008
1536,243sentences.153,and these see area the apply clean symptoms you ointment some if.,0.6936460048229952
1537,243sentences.153,these if clean the symptoms some you area see and apply ointment.,0.6266589587493014
