2927,384sentences.49,distinctions sex to used indicate is the term relative girls to.,1.239543993613167
2928,384sentences.49,to term used indicate to distinctions relative girls is sex the.,1.2543865047742833
2929,384sentences.49,to is used girls indicate distinctions relative sex term the to.,1.1926845312151284
2930,384sentences.50,each boys traditionally play to other games with fight like rough and.,1.3163478024490083
2931,384sentences.50,traditionally boys to with other play each games fight and rough like.,1.7473394849149868
2932,384sentences.50,traditionally like games rough play boys with each other to fight and.,2.050629525439814
2933,384sentences.50,rough other with play traditionally each to fight and boys games like.,1.283970394958388
2934,384sentences.50,each with rough to boys traditionally other and like games fight play.,1.2277181613258792
2935,384sentences.50,games play and rough like with other boys fight to traditionally each.,1.6508166256732695
2936,384sentences.50,fight to like and games with rough play boys other each traditionally.,2.0423291044445215
2937,384sentences.50,to traditionally rough games play each boys and like fight with other.,1.3178763890441403
2938,384sentences.50,each and like play with boys rough fight other to games traditionally.,1.3605155499106583
2939,384sentences.50,rough to like fight and traditionally games other boys with play each.,1.2931333046149631
2940,384sentences.51,a adult an immaturely behaving boy often as to male is referred.,1.109177961010752
2941,384sentences.51,an adult behaving as boy immaturely a often to referred is male.,1.876089981406499
2942,384sentences.51,an male often is immaturely adult as a boy behaving to referred.,0.8305424398408617
2943,384sentences.51,is boy as immaturely an a behaving to referred adult often male.,1.2419184824764646
2944,384sentences.51,a as is behaving adult an boy referred male often to immaturely.,1.2766721563557595
2945,384sentences.51,often immaturely referred is male as boy adult to behaving an a.,1.2538710577255372
2946,384sentences.51,to behaving male referred often as is immaturely adult boy a an.,1.0831702627205062
2947,384sentences.51,behaving an is often immaturely a adult referred male to as boy.,1.127307287926646
2948,384sentences.51,a referred male immaturely as adult is to boy behaving often an.,0.7702510921917471
2949,384sentences.51,is behaving male to referred an often boy adult as immaturely a.,0.9430659544753434
2950,384sentences.52,is broccoli the a family cabbage in plant.,1.270620206909622
2951,384sentences.52,is in plant broccoli cabbage the a family.,1.7118173034442632
2952,384sentences.52,broccoli in is cabbage plant family the a.,1.8265797806023327
2953,384sentences.52,broccoli cabbage is plant a the family in.,1.9434928063805625
2954,384sentences.52,the broccoli cabbage plant family is a in.,2.09711869878967
2955,384sentences.52,broccoli the plant in family is cabbage a.,1.4567755392795798
2956,384sentences.52,the in is broccoli cabbage a plant family.,1.81263773032409
2957,384sentences.52,is cabbage family broccoli plant the a in.,1.8436048475966897
2958,384sentences.52,a family cabbage is the plant broccoli in.,1.8377850105156754
2959,384sentences.52,plant is family the a in broccoli cabbage.,1.3022376443346861
2960,384sentences.53,stalk has broccoli flower tough and head thick a green a.,2.107170757597651
2961,384sentences.53,broccoli stalk has green thick flower head tough a a and.,2.1943403710718483
2962,384sentences.53,green a flower broccoli and has stalk a head tough thick.,1.8414682010088113
2963,384sentences.53,head has tough and broccoli a stalk flower a thick green.,2.076513601023413
2964,384sentences.53,and has thick flower stalk head a a green broccoli tough.,1.8847808845941012
2965,384sentences.53,broccoli green flower has and a stalk tough head a thick.,1.7375736963747013
2966,384sentences.53,a head tough green thick stalk broccoli has and flower a.,2.4515948327554136
2967,384sentences.53,a and flower green head a broccoli has thick stalk tough.,2.154107141809672
2968,384sentences.53,flower has green head tough a thick stalk a and broccoli.,1.8944604501791948
2969,384sentences.53,flower a green stalk head a thick and has broccoli tough.,2.2055154135505557
2970,384sentences.54,is broccoli fiber high nutrients vitamins other and in.,1.4373935641083133
2971,384sentences.54,and broccoli other nutrients is vitamins high fiber in.,1.5900640494650553
2972,384sentences.54,nutrients and is in vitamins high broccoli fiber other.,1.012712167432427
2973,384sentences.54,fiber vitamins is and high broccoli in nutrients other.,1.0761036372830897
2974,384sentences.54,fiber nutrients vitamins high broccoli in other and is.,0.9232293026021973
2975,384sentences.54,is vitamins and fiber other high in broccoli nutrients.,1.3342655611945826
2976,384sentences.54,broccoli in and high nutrients is vitamins other fiber.,1.2874464623311908
2977,384sentences.54,other fiber is high nutrients and vitamins in broccoli.,1.1953852155645273
2978,384sentences.54,high in is other fiber nutrients vitamins broccoli and.,1.1545073471136684
2979,384sentences.54,broccoli in and nutrients high other is fiber vitamins.,1.3336203539436848
2980,384sentences.55,can broccoli or be raw eaten stir-fried boiled.,2.424950953908767
2981,384sentences.55,can stir-fried boiled broccoli eaten or be raw.,1.8744184749865376
2982,384sentences.55,broccoli stir-fried can eaten boiled raw or be.,1.8897467639154684
2983,384sentences.55,broccoli eaten can boiled be or raw stir-fried.,2.1791969023953115
2984,384sentences.55,or broccoli eaten boiled raw can be stir-fried.,3.012315630645566
2985,384sentences.55,broccoli or boiled stir-fried raw can eaten be.,1.7499975333964364
2986,384sentences.55,or stir-fried can broccoli eaten be boiled raw.,2.073572283171511
2987,384sentences.55,can eaten raw broccoli boiled or be stir-fried.,2.7494924796890015
2988,384sentences.55,be raw eaten can or boiled broccoli stir-fried.,2.6502807021062647
2989,384sentences.55,boiled can raw or be stir-fried broccoli eaten.,1.8032278705931946
2990,384sentences.56,butterfly a flying wings with insect large is a four.,2.714261071074221
2991,384sentences.56,a wings butterfly four with flying large is a insect.,2.001499329747545
2992,384sentences.56,a four flying with a butterfly wings large is insect.,2.1156766778764795
2993,384sentences.56,a insect butterfly a wings with is four large flying.,1.8379885717252995
2994,384sentences.56,four large butterfly a a flying is with wings insect.,2.122608049095276
2995,384sentences.56,butterfly a a with is large wings flying four insect.,1.9017746337622132
2996,384sentences.56,four insect is wings with butterfly large a a flying.,2.3333332410740764
2997,384sentences.56,large a is wings with four butterfly flying insect a.,1.9892411498676479
2998,384sentences.56,a a insect wings is large butterfly four with flying.,1.6605033407253815
2999,384sentences.56,four with wings butterfly is large flying insect a a.,2.2110954535364096
3000,384sentences.57,wings the can patterned very be and of butterflies colorful.,1.1820177110759331
3001,384sentences.57,the patterned wings colorful very can and of butterflies be.,1.4326994106448023
3002,384sentences.57,butterflies colorful can very the wings patterned and of be.,1.350819284068093
3003,384sentences.57,butterflies be wings the patterned very of colorful and can.,1.2973677443808251
3004,384sentences.57,colorful and wings butterflies the can of very patterned be.,1.4755037817759
3005,384sentences.57,wings the butterflies very of and patterned can colorful be.,1.1265448015342898
3006,384sentences.57,colorful be of patterned very wings and butterflies the can.,1.405283125626587
3007,384sentences.57,and butterflies of patterned very colorful wings can be the.,1.6012861309562687
3008,384sentences.57,butterflies the be patterned of and wings colorful very can.,1.445762863817426
3009,384sentences.57,colorful very patterned wings of and can be butterflies the.,1.5823279985628937
3010,384sentences.58,is metamorphosis of butterfly caterpillar a a the transformation into.,1.9558530396310783
3011,384sentences.58,metamorphosis butterfly is into caterpillar of a the transformation a.,2.0631022118857074
3012,384sentences.58,transformation into of caterpillar metamorphosis is butterfly a the a.,2.1135928761870524
3013,384sentences.58,transformation a is metamorphosis butterfly caterpillar the into a of.,2.1767077184769463
3014,384sentences.58,into a is transformation metamorphosis of the caterpillar butterfly a.,1.8518042526781604
3015,384sentences.58,is metamorphosis transformation caterpillar the a butterfly of into a.,1.6827776713798224
3016,384sentences.58,into a the butterfly caterpillar is a transformation metamorphosis of.,2.1290013564879526
3017,384sentences.58,a transformation the butterfly caterpillar into is of a metamorphosis.,1.6542020515205211
3018,384sentences.58,transformation metamorphosis a butterfly the a is into caterpillar of.,1.8153331968964153
3019,384sentences.58,into caterpillar butterfly is the a of a transformation metamorphosis.,1.6624421072684683
3020,384sentences.59,people some of collect wings because colorful their butterflies.,1.652057621120645
3021,384sentences.59,their some colorful wings people because collect of butterflies.,1.28794884575558
3022,384sentences.59,wings their people butterflies because collect some of colorful.,1.5675206392399608
3023,384sentences.59,of because people their collect some butterflies wings colorful.,1.6970360663082904
3024,384sentences.59,of wings because collect some butterflies colorful their people.,1.763546767930571
3025,384sentences.59,people because their of colorful collect butterflies some wings.,2.2077632396381603
3026,384sentences.59,some butterflies their collect wings people because colorful of.,1.5061191080744927
3027,384sentences.59,colorful of people collect wings their because butterflies some.,1.1824973205105302
3028,384sentences.59,collect butterflies people colorful of wings because some their.,1.8518376155640615
3029,384sentences.59,some butterflies their wings collect colorful people of because.,1.6203327478695735
3030,384sentences.60,with carpenter a artist an wood manual works who is or laborer.,0.749445898797743
3031,384sentences.60,a carpenter an works wood artist with manual who laborer or is.,1.5968028910976222
3032,384sentences.60,a is manual or artist carpenter works with wood an who laborer.,1.0043161640121745
3033,384sentences.60,or wood works artist a with an who laborer carpenter manual is.,1.4543645266402598
3034,384sentences.60,with works or an carpenter a wood laborer is manual who artist.,1.468215891175131
3035,384sentences.60,manual artist laborer or is works wood carpenter who an a with.,1.4647084601994096
3036,384sentences.60,who an is laborer manual works or artist carpenter wood with a.,1.636232759977406
3037,384sentences.60,an a or manual artist with carpenter laborer is who works wood.,1.0631164028228541
3038,384sentences.60,with laborer is artist works carpenter or who wood an manual a.,1.0369001319306392
3039,384sentences.60,or an is who laborer a manual wood carpenter works artist with.,1.3965206544666589
3040,384sentences.61,build carpenters houses objects boats furniture other and repair and.,1.5978041492206876
3041,384sentences.61,carpenters objects build and boats houses other and repair furniture.,1.9646580218799645
3042,384sentences.61,repair and houses boats carpenters build objects other and furniture.,1.7728571438056344
3043,384sentences.61,repair furniture build carpenters objects boats and and other houses.,1.628748746141695
3044,384sentences.61,and other build repair carpenters houses and boats objects furniture.,1.529863851602874
3045,384sentences.61,build carpenters repair boats and other objects houses and furniture.,1.885351963025611
3046,384sentences.61,and furniture and objects boats build other repair carpenters houses.,1.6543578026972587
3047,384sentences.61,other repair and objects boats and build houses furniture carpenters.,1.7202341782636204
3048,384sentences.61,repair carpenters furniture objects and other build and boats houses.,1.7036909774923696
3049,384sentences.61,and boats objects build and other houses furniture repair carpenters.,1.9722588731057356
3050,384sentences.62,use carpenters as planes saws hammers and tools such pliers.,1.0302694828121137
3051,384sentences.62,carpenters planes use pliers saws as and tools such hammers.,1.2616687380421745
3052,384sentences.62,such pliers as saws carpenters use planes and tools hammers.,1.1654046817381867
3053,384sentences.62,such hammers use carpenters planes saws tools pliers and as.,1.0005694202998585
3054,384sentences.62,pliers and use such carpenters as tools saws planes hammers.,1.6063008216768606
3055,384sentences.62,use carpenters such saws tools and planes as pliers hammers.,1.3567552396012503
3056,384sentences.62,pliers hammers tools planes saws use and such carpenters as.,0.9369726105450406
3057,384sentences.62,and such tools planes saws pliers use as hammers carpenters.,1.103855393044628
3058,384sentences.62,such carpenters hammers planes tools and use pliers saws as.,1.5028128871959474
3059,384sentences.62,pliers saws planes use tools and as hammers such carpenters.,1.3375597310752017
3060,384sentences.63,instruments luthier a carpenter musical makes that repairs is a and.,1.0395355468027063
3061,384sentences.63,a instruments luthier a repairs carpenter that musical is and makes.,0.6833934779869618
3062,384sentences.63,a and carpenter a makes luthier instruments is that musical repairs.,1.337585875910777
3063,384sentences.63,that luthier musical makes a is instruments carpenter and repairs a.,1.1020208323985248
3064,384sentences.63,makes luthier repairs carpenter instruments that and is a a musical.,0.9212796042086199
3065,384sentences.63,a a carpenter luthier makes and instruments musical that is repairs.,1.540704083818604
3066,384sentences.63,is that musical a repairs instruments a luthier makes carpenter and.,1.5119078595918272
3067,384sentences.63,and makes carpenter a that is a luthier repairs instruments musical.,1.2927923812578657
3068,384sentences.63,carpenter luthier a that musical and repairs instruments is makes a.,1.21205547047463
3069,384sentences.63,carpenter is a instruments that and repairs makes luthier a musical.,1.3843061956332223
3070,384sentences.64,tail are cats animals a four with and small furry legs.,1.5487188967962555
3071,384sentences.64,cats tail are furry and animals with a small legs four.,2.2277965141181406
3072,384sentences.64,furry legs animals cats four are tail small with a and.,2.2224325594158225
3073,384sentences.64,with are a four cats small tail animals legs and furry.,1.4496624947268297
3074,384sentences.64,four are and animals tail with legs small furry cats a.,1.6797447837158914
3075,384sentences.64,cats furry animals are four legs tail a with small and.,1.9554638303764753
3076,384sentences.64,small with a furry and tail cats are four animals legs.,2.2118141710493937
3077,384sentences.64,legs four animals furry with small cats are and tail a.,2.501080642070176
3078,384sentences.64,animals are furry with a legs and tail small four cats.,1.6318020056573845
3079,384sentences.64,animals small furry tail with legs and four are cats a.,2.577412830050512
3080,384sentences.65,like cats by to fur themselves their licking groom.,1.4673059879900185
3081,384sentences.65,licking cats their fur like themselves to by groom.,1.5994150464493593
3082,384sentences.65,fur licking like groom themselves to cats by their.,1.5250926817076869
3083,384sentences.65,by themselves like licking to cats groom fur their.,1.803595090512664
3084,384sentences.65,by fur themselves to cats groom their licking like.,1.7106429815943658
3085,384sentences.65,like themselves licking by their to groom cats fur.,1.5196463818316102
3086,384sentences.65,cats groom licking to fur like themselves their by.,1.3705857509317494
3087,384sentences.65,their by like to fur licking themselves groom cats.,1.2473525463914246
3088,384sentences.65,to groom like their by fur themselves cats licking.,0.8253758792839514
3089,384sentences.65,cats groom licking fur to their like by themselves.,1.420772175674281
3090,384sentences.66,by can cats or mice often their birds owners fed hunt but are.,1.0064497287033392
3091,384sentences.66,cats can mice by often owners or their but fed are birds hunt.,1.1888659434645055
3092,384sentences.66,owners cats hunt but birds or can fed by their mice often are.,1.265786975984949
3093,384sentences.66,birds owners fed or cats are by often mice their hunt can but.,1.6028364510939608
3094,384sentences.66,fed mice can cats their or owners by but often birds hunt are.,1.461954005415837
3095,384sentences.66,hunt birds their mice or can often by are but cats fed owners.,1.3316890998202704
3096,384sentences.66,or by often mice birds cats can are hunt fed but their owners.,1.1922317511111113
3097,384sentences.66,fed their birds mice are but by owners can hunt cats often or.,1.4047384253903212
3098,384sentences.66,their fed but owners by birds can often or mice cats hunt are.,1.3600145788262337
3099,384sentences.66,hunt by owners but can fed mice or are their birds cats often.,1.055368723320121
3100,384sentences.67,sharp claws the are keep so retractable they of cats that.,1.0425267763703052
3101,384sentences.67,the sharp claws cats they are retractable keep of that so.,1.1586080672292651
3102,384sentences.67,cats that are the so claws sharp of retractable keep they.,2.1472406964536592
3103,384sentences.67,retractable claws keep so the of sharp are that they cats.,1.2588914958495427
3104,384sentences.67,so claws they are sharp retractable that of cats the keep.,1.4737285344945406
3105,384sentences.67,the cats are claws so that sharp keep retractable of they.,1.6319013246726237
3106,384sentences.67,of retractable keep cats they sharp the claws so are that.,1.0965316581482443
3107,384sentences.67,that so are cats retractable of the claws they sharp keep.,1.750116750467664
3108,384sentences.67,are claws cats retractable keep that they sharp of so the.,1.4739767746070114
3109,384sentences.67,are of cats sharp retractable that they so claws the keep.,0.9356824085380938
3110,384sentences.68,to chair a piece a for sit of on people is furniture designed.,1.08873789881438
3111,384sentences.68,a chair a to for on piece sit furniture people designed of is.,1.0733107109294573
3112,384sentences.68,on a is furniture of piece chair people to sit a for designed.,0.9940541247867221
3113,384sentences.68,of on people piece a designed to for a sit is chair furniture.,1.287740363231027
3114,384sentences.68,people a chair a sit piece on to furniture for of is designed.,0.9703703292112911
3115,384sentences.68,is of sit a piece chair for to designed furniture a people on.,1.1831513559635443
3116,384sentences.68,piece to for a of a chair designed is people furniture sit on.,1.1049192716115528
3117,384sentences.68,people sit of a designed furniture to on chair is a for piece.,0.9760174011906513
3118,384sentences.68,sit people furniture on to of chair for piece a a is designed.,1.2822289424801778
3119,384sentences.68,is to on furniture chair people a piece designed sit of a for.,0.6211306883901985
3120,384sentences.69,by consist chairs seat a legs above supported level of raised floor.,0.6412756053758674
3121,384sentences.69,chairs consist a supported legs seat by above level floor raised of.,1.2354701309954197
3122,384sentences.69,chairs of above raised seat consist supported by legs a level floor.,0.9174522747970779
3123,384sentences.69,raised legs supported seat chairs by a level floor consist above of.,1.3534232147345655
3124,384sentences.69,by supported raised a consist chairs legs floor of above level seat.,1.2090357997437555
3125,384sentences.69,above seat floor raised of supported legs consist level a chairs by.,1.1302299822671882
3126,384sentences.69,level a of floor above supported raised seat consist legs by chairs.,1.1748060992556675
3127,384sentences.69,a chairs raised above seat by consist floor of level supported legs.,1.1736965791848486
3128,384sentences.69,by floor of seat supported consist raised level legs a above chairs.,0.8262604580934062
3129,384sentences.69,raised a of level floor chairs above legs consist supported seat by.,0.9427362129304879
3130,384sentences.70,as can chairs back have as a and cushion well also arm rests.,0.6879545566684477
3131,384sentences.70,chairs can have as as cushion back a arm well rests and also.,0.8104204238280651
3132,384sentences.70,cushion chairs also arm and back can well as a have as rests.,1.1922399000563668
3133,384sentences.70,and cushion well back chairs rests as as have a also can arm.,1.0960136637188804
3134,384sentences.70,well have can chairs a back cushion as arm as and also rests.,0.9846749113323384
3135,384sentences.70,also and a have back can as as rests arm chairs well cushion.,0.7762566118256701
3136,384sentences.70,back as as have and chairs can rests also well arm a cushion.,0.7045222949618773
3137,384sentences.70,well a and have rests arm as cushion can also chairs as back.,0.9024089320538181
3138,384sentences.70,a well arm cushion as and can as back have chairs also rests.,0.904164016980391
3139,384sentences.70,also as cushion arm can well have back rests a and chairs as.,0.47851430238369447
3140,384sentences.71,like are seats located chairs cinemas vehicles places in fixed in or.,1.2281318541738386
3141,384sentences.71,seats are chairs places cinemas located like vehicles in or in fixed.,1.0598721205691406
3142,384sentences.71,seats fixed vehicles in located are places like cinemas chairs in or.,1.637039374126094
3143,384sentences.71,in cinemas places located seats like chairs in or are vehicles fixed.,1.3109329635537457
3144,384sentences.71,like places in chairs are seats cinemas or fixed vehicles in located.,1.4288116097085692
3145,384sentences.71,vehicles located or in fixed places cinemas are in chairs seats like.,1.6782539162442907
3146,384sentences.71,in chairs fixed or vehicles places in located are cinemas like seats.,1.6186419823766207
3147,384sentences.71,chairs seats in vehicles located like are or fixed in places cinemas.,1.2162124816545188
3148,384sentences.71,like or fixed located places are in in cinemas chairs vehicles seats.,1.498051827810379
3149,384sentences.71,in chairs fixed in or seats vehicles cinemas are places located like.,1.5705739693000924
3150,384sentences.72,musical a instrument is woodwind a clarinet.,2.5942658674206966
3151,384sentences.72,musical a woodwind instrument is clarinet a.,2.448814599310316
3152,384sentences.72,a instrument clarinet woodwind is musical a.,1.6226946630092367
3153,384sentences.72,musical instrument woodwind a a clarinet is.,2.5691813438435775
3154,384sentences.72,instrument a clarinet a woodwind is musical.,1.1287130763030373
3155,384sentences.72,clarinet is a woodwind instrument a musical.,1.849264173749156
3156,384sentences.72,instrument is woodwind musical a clarinet a.,2.4989825022711267
3157,384sentences.72,a a woodwind is instrument clarinet musical.,1.7205942877578393
3158,384sentences.72,musical a instrument clarinet a woodwind is.,2.3171842765530957
3159,384sentences.72,instrument a a is clarinet woodwind musical.,1.525650110312792
3160,384sentences.73,at clarinet a long a a the black bottom flare is tube with.,1.3321279133936486
3161,384sentences.73,a clarinet a at a bottom long the tube flare with black is.,1.3878212224032676
3162,384sentences.73,bottom a is tube black long clarinet flare at the a a with.,1.166661643856623
3163,384sentences.73,black bottom flare long a with at a a the is clarinet tube.,1.3474030173273328
3164,384sentences.73,flare a clarinet a the long bottom at tube a black is with.,1.3508338615967241
3165,384sentences.73,is black the a long clarinet a at with tube a flare bottom.,1.6079759456737654
3166,384sentences.73,long at a a black a clarinet with is flare tube the bottom.,1.5117564107707615
3167,384sentences.73,flare the black a with tube at bottom clarinet is a a long.,1.318756853691258
3168,384sentences.73,the flare tube bottom at black clarinet a long a a is with.,1.5425607179970973
3169,384sentences.73,is at bottom tube clarinet flare a long with the black a a.,1.4550229692488466
3170,384sentences.74,player the pressing chooses holes by and keys notes.,1.0539151217139047
3171,384sentences.74,keys the and holes player by chooses pressing notes.,1.1108961374308475
3172,384sentences.74,holes keys player notes by chooses the pressing and.,0.9983657412514856
3173,384sentences.74,pressing by player keys chooses the notes holes and.,1.2720160204879285
3174,384sentences.74,pressing holes by chooses the notes and keys player.,0.9328249452906302
3175,384sentences.74,player by keys pressing and chooses notes the holes.,1.0148626801288707
3176,384sentences.74,the notes keys chooses holes player by and pressing.,0.7872771578664268
3177,384sentences.74,and pressing player chooses holes keys by notes the.,0.6818889302432841
3178,384sentences.74,chooses notes player and pressing holes by the keys.,1.1798327436581348
3179,384sentences.74,the notes keys holes chooses and player pressing by.,0.9380241790677287
3180,384sentences.75,clarinet the both music jazz in classical is used and.,2.0338720800673618
3181,384sentences.75,the music clarinet and jazz both classical is used in.,2.0780205100616382
3182,384sentences.75,used and both jazz the clarinet music classical is in.,2.1161152912724983
3183,384sentences.75,used in clarinet the music jazz is and classical both.,1.9571915359152576
3184,384sentences.75,and classical clarinet used the both is jazz music in.,1.4783124135997852
3185,384sentences.75,clarinet the used jazz is classical music both and in.,1.9301047123998083
3186,384sentences.75,and in is music jazz clarinet classical used the both.,2.163585720544897
