0,243sentences.0,local beekeeping habitats the of conservation encourages.,1.4232769123589786
1,243sentences.0,local beekeeping of habitats the encourages conservation.,1.3370439578580284
2,243sentences.0,beekeeping habitats encourages of the local conservation.,1.0213221233845415
3,243sentences.0,local habitats of conservation beekeeping encourages the.,1.8059421012031647
4,243sentences.0,habitats beekeeping encourages conservation of the local.,1.0454800835025766
5,243sentences.0,encourages the beekeeping of habitats conservation local.,0.8901498188833662
6,243sentences.0,habitats the of local beekeeping encourages conservation.,1.8789380041352552
7,243sentences.0,conservation beekeeping of the habitats encourages local.,1.0592960022638094
8,243sentences.0,local beekeeping habitats encourages conservation of the.,1.4401008584393409
9,243sentences.0,habitats beekeeping conservation the encourages of local.,0.9798370129092663
10,243sentences.1,that is it beekeeper's every local produce interest pollen plants in to conserve.,1.214289488378862
11,243sentences.1,it is every that local pollen beekeeper's produce to plants conserve interest in.,1.3833364224955136
12,243sentences.1,pollen it in to interest beekeeper's is plants that produce every local conserve.,0.8358877358893232
13,243sentences.1,interest pollen plants beekeeper's it conserve that local every produce in is to.,0.9255609818139582
14,243sentences.1,plants every is it produce beekeeper's pollen that to local interest in conserve.,0.7976390019331031
15,243sentences.1,in interest produce every beekeeper's is local that conserve to it plants pollen.,0.8453383265829507
16,243sentences.1,beekeeper's that local every interest it is conserve in plants to produce pollen.,1.1011063344088396
17,243sentences.1,plants produce interest every conserve to that pollen is in it local beekeeper's.,0.9404126663240698
18,243sentences.1,produce plants to pollen that interest is local beekeeper's every it in conserve.,1.1122733460012284
19,243sentences.1,in that pollen to is plants every beekeeper's conserve produce interest it local.,0.7098729381755107
20,243sentences.2,form as not does make passive native a that way vegetation it for to be require of cleared agriculture crops.,1.0379750152265708
21,243sentences.2,way be does cleared not vegetation for as passive it agriculture of native a crops make to that form require.,1.2874832946560577
22,243sentences.2,native not a cleared form make it way for of require agriculture to crops as be vegetation does that passive.,1.0394255479187833
23,243sentences.2,form vegetation not cleared native passive agriculture be crops that of a make require for way it to does as.,0.9628607445707525
24,243sentences.2,way does that a for be as vegetation agriculture it of make form require native passive not crops to cleared.,0.9523920434667581
25,243sentences.2,cleared of not for does native way be make require it that agriculture a vegetation crops form as passive to.,0.8463360675622772
26,243sentences.2,of agriculture be passive vegetation it require does not crops native as a for that make cleared way to form.,1.2513558946264478
27,243sentences.2,agriculture cleared as not crops make a that of vegetation for form passive does be native way it to require.,0.7301165775314643
28,243sentences.2,as form native require does crops for make a way to that passive not agriculture be it of vegetation cleared.,1.03808688766202
29,243sentences.2,way it require vegetation native does not cleared a form that to agriculture as of make be passive for crops.,0.8112185631350729
30,243sentences.3,they also beekeepers could use the because discourage of kill honeybees pesticides on the crops.,1.5401194650711916
31,243sentences.3,beekeepers also the kill crops because honeybees could of pesticides use on they the discourage.,1.219405320607014
32,243sentences.3,kill the beekeepers discourage pesticides of use could also on honeybees crops they the because.,0.8942151838917086
33,243sentences.3,the of because use beekeepers on crops also the they could discourage pesticides kill honeybees.,1.4413845863770764
34,243sentences.3,could also beekeepers they the use the honeybees pesticides kill on discourage crops because of.,1.2756379426631765
35,243sentences.3,of honeybees the they use also discourage kill because on the crops could beekeepers pesticides.,1.1625362941401225
36,243sentences.3,the kill honeybees beekeepers the could of pesticides discourage because also on crops use they.,1.0590055567058734
37,243sentences.3,honeybees they on discourage use could the the of kill crops pesticides also beekeepers because.,1.277300630316086
38,243sentences.3,crops on also beekeepers kill discourage because pesticides use could the the honeybees they of.,0.9740115929298039
39,243sentences.3,crops the beekeepers they also honeybees use of kill discourage the could because pesticides on.,1.1799887005550396
40,243sentences.4,product beekeepers artisanal is extremes to their go for worth effort their craft the but.,1.06594758074913
41,243sentences.4,artisanal beekeepers to worth but their effort is for their extremes craft product the go.,1.018732344248889
42,243sentences.4,worth the artisanal go their for extremes is beekeepers craft effort but product to their.,0.5339366644151542
43,243sentences.4,the for their extremes artisanal craft but beekeepers to product is go their worth effort.,1.1819008823267798
44,243sentences.4,is beekeepers artisanal product to extremes the effort their worth craft go but their for.,1.068376028858092
45,243sentences.4,for effort to product extremes beekeepers go worth their craft the but is artisanal their.,0.7643744834367585
46,243sentences.4,the worth effort artisanal to is for their go their beekeepers craft but extremes product.,0.675739714662872
47,243sentences.4,effort product craft go extremes is to the for worth but their beekeepers artisanal their.,1.0748589757898883
48,243sentences.4,but craft beekeepers artisanal worth go their their extremes is to the effort product for.,1.0363259776241744
49,243sentences.4,but the artisanal product beekeepers effort extremes for worth go to is their their craft.,0.7531667413398501
50,243sentences.5,honey-making artisanal and consistency over character and emphasizes quality quantity.,1.2875639660834337
51,243sentences.5,artisanal consistency honey-making quantity over and and emphasizes quality character.,0.9964046705047044
52,243sentences.5,quality quantity and over artisanal honey-making consistency and emphasizes character.,1.1089908877978256
53,243sentences.5,quality character honey-making artisanal consistency over emphasizes quantity and and.,1.0748221239169198
54,243sentences.5,quantity and honey-making quality artisanal and emphasizes over consistency character.,1.4574378151962686
55,243sentences.5,honey-making artisanal quality over emphasizes and consistency and quantity character.,1.377648659178594
56,243sentences.5,quantity character emphasizes consistency over honey-making and quality artisanal and.,1.3698803220445364
57,243sentences.5,and quality emphasizes consistency over quantity honey-making and character artisanal.,1.279947029742434
58,243sentences.5,quality artisanal character consistency emphasizes and honey-making quantity over and.,1.3952884945920137
59,243sentences.5,quantity over consistency honey-making emphasizes and and character quality artisanal.,0.9059103309856842
60,243sentences.6,honeybees produce to honey their become beekeepers of the finest micromanagers.,1.2451183584429752
61,243sentences.6,to honeybees produce finest of honey beekeepers their the micromanagers become.,1.5546320791169288
62,243sentences.6,finest micromanagers honey to become produce honeybees the beekeepers their of.,1.2202814922709242
63,243sentences.6,beekeepers produce their become to the honeybees honey micromanagers of finest.,1.449604499161147
64,243sentences.6,become produce of honey honeybees beekeepers micromanagers the finest to their.,1.1789898495587547
65,243sentences.6,to finest honey produce become micromanagers honeybees their beekeepers the of.,1.3175211983095958
66,243sentences.6,the beekeepers their finest of honeybees to produce become honey micromanagers.,1.0582979542712185
67,243sentences.6,micromanagers become honey finest beekeepers the to produce of honeybees their.,1.42630893005992
68,243sentences.6,honey produce finest beekeepers their micromanagers of honeybees the become to.,1.5462495911525767
69,243sentences.6,honey the finest honeybees beekeepers micromanagers of become produce to their.,1.365576322626553
70,243sentences.7,fields they best know honey to the scout and ways the extract nectar when select flows.,1.0566837210983735
71,243sentences.7,they and fields best the extract nectar to flows know the honey scout when ways select.,1.2358604864030973
72,243sentences.7,and the fields ways when scout the nectar select extract honey know best they flows to.,1.1159546648744239
73,243sentences.7,ways scout and know the select when fields extract they best flows the nectar to honey.,1.0722243322680651
74,243sentences.7,ways know flows the when the best select fields and honey they scout nectar extract to.,1.1767961402511231
75,243sentences.7,extract nectar know the best and fields when they scout flows the select honey ways to.,1.0551010325210846
76,243sentences.7,the fields honey flows nectar to ways the know scout best select and extract when they.,1.157361986107477
77,243sentences.7,best fields the and flows scout they the to when ways extract select nectar honey know.,1.3032976324943395
78,243sentences.7,and honey to they the scout extract know when ways the fields best select nectar flows.,0.9099190126453517
79,243sentences.7,when and scout the know ways extract fields the flows to best they nectar honey select.,0.8499720337678408
80,243sentences.8,40000 the as bees the opens of beekeeper hive fills air the deep the hum.,1.1651459924755465
81,243sentences.8,as the opens fills hum of air bees hive the the deep 40000 the beekeeper.,1.7897920585183096
82,243sentences.8,fills the as beekeeper the hive the bees the deep air hum 40000 opens of.,1.452606380286276
83,243sentences.8,the hive of the as deep hum the opens 40000 bees beekeeper the fills air.,1.55209054958416
84,243sentences.8,bees the as 40000 opens the the air the fills deep beekeeper hum of hive.,1.4274880472622804
85,243sentences.8,hive air opens 40000 the the beekeeper fills of deep the hum bees as the.,1.4977581308969756
86,243sentences.8,the fills air as opens bees hive the beekeeper of the deep hum the 40000.,1.5228147659987827
87,243sentences.8,air 40000 deep beekeeper the bees opens the hive fills hum the the as of.,1.622261912365548
88,243sentences.8,hum deep the as fills beekeeper of the the bees opens the air 40000 hive.,1.4165846068222752
89,243sentences.8,hum the as 40000 the air the hive fills beekeeper opens bees of the deep.,1.1625077438974905
90,243sentences.9,nursery beekeeper the stores bee supplies pollen the checks honey and.,1.5601160811169754
91,243sentences.9,the nursery beekeeper honey the stores pollen bee checks and supplies.,1.6726783475637101
92,243sentences.9,honey and stores the supplies beekeeper nursery checks pollen bee the.,1.3554312383670974
93,243sentences.9,pollen beekeeper bee supplies the checks nursery stores and the honey.,1.4693363083992195
94,243sentences.9,supplies beekeeper the stores nursery pollen and checks honey the bee.,1.23217689972619
95,243sentences.9,the honey stores beekeeper supplies and nursery bee pollen checks the.,1.3795036969010341
96,243sentences.9,checks pollen bee honey the nursery the beekeeper supplies stores and.,1.9431666241748948
97,243sentences.9,and supplies stores honey pollen checks the beekeeper the nursery bee.,1.6357463174243354
98,243sentences.9,stores beekeeper honey pollen bee and the nursery checks supplies the.,1.9217417994336086
99,243sentences.9,stores checks honey nursery pollen and the supplies beekeeper the bee.,1.3530399107454836
100,243sentences.10,don't crawl bees sting bare his they across arms because gentle and hands they're but.,1.6295411899374799
101,243sentences.10,bees crawl his because but they gentle sting arms and bare hands don't they're across.,1.76148330326161
102,243sentences.10,because they're bees across and arms bare sting crawl hands gentle but don't his they.,1.2859638057665277
103,243sentences.10,they're arms they bare bees hands but crawl his don't sting across and because gentle.,0.9330049259717623
104,243sentences.10,sting crawl bees don't his bare they're gentle and because hands across but they arms.,1.1343030472736213
105,243sentences.10,arms gentle his don't bare crawl across because they hands they're but sting bees and.,1.2532707449177947
106,243sentences.10,they're because gentle bees his sting arms and across they crawl hands but bare don't.,1.6959817853074555
107,243sentences.10,gentle don't hands across bare sting his they're arms because but and crawl bees they.,1.3301928777804064
108,243sentences.10,but hands crawl bees because across they and bare sting his they're gentle don't arms.,1.2969528454829904
109,243sentences.10,but they're bees don't crawl gentle bare arms because across his sting they and hands.,1.2096316519320187
110,243sentences.11,no have i dream recurring i'm a about longer college exams even in though.,1.3220527576493886
111,243sentences.11,i have recurring longer though college no about exams dream even i'm in a.,0.9575116163442
112,243sentences.11,in i a exams about dream longer have even college though no recurring i'm.,0.9930071672985622
113,243sentences.11,college about i'm dream i even have recurring longer no a exams though in.,1.007924669737228
114,243sentences.11,longer have i no recurring dream in exams even college i'm about a though.,1.523981085068745
115,243sentences.11,a about in recurring dream have college i'm longer though exams no even i.,1.2160468143268497
116,243sentences.11,no longer though recurring about i college exams in a even have i'm dream.,1.1719311136543786
117,243sentences.11,i'm longer about recurring even exams college have a though dream in no i.,0.8261305235167398
118,243sentences.11,i'm exams about recurring a though even i in longer have college dream no.,0.8163245693989842
119,243sentences.11,i'm have exams longer college even dream though i about a recurring in no.,1.0137032702000042
120,243sentences.12,it's in final my class dream i my and gone suddenly of to never day exam the realize i've.,0.856950708810935
121,243sentences.12,to realize my i've exam the suddenly in dream of day class my never and i it's final gone.,0.7914351391103025
122,243sentences.12,i class final my to my gone never of i've suddenly the and day realize dream it's in exam.,0.726392399312499
123,243sentences.12,my my exam dream realize it's class of the to day never gone i suddenly final i've in and.,0.8828620912762393
124,243sentences.12,to my day i've of the and i final it's gone in my class dream exam never suddenly realize.,0.6883808603544935
125,243sentences.12,class and of never gone to my dream the i it's realize day suddenly final i've my in exam.,0.8584456726578155
126,243sentences.12,gone never dream my realize to class and suddenly of i've exam it's the my i day in final.,0.9434871814042662
127,243sentences.12,to final and it's the of dream my in i've class suddenly exam gone i my day never realize.,0.6891178176599879
128,243sentences.12,to gone in and my class my day the it's realize exam never final i i've of dream suddenly.,0.8978748742366606
129,243sentences.12,never to day final class realize exam of it's i've and the suddenly gone dream i my my in.,0.9710369131582783
130,243sentences.13,never i've of even assignments any reading the done.,0.870803568031941
131,243sentences.13,the i've reading assignments never any even of done.,0.8430450516859468
132,243sentences.13,assignments the never done any even i've of reading.,1.094254602337249
133,243sentences.13,of any never the even i've done assignments reading.,1.0145654773000439
134,243sentences.13,of assignments any even i've done reading the never.,0.5035851009880582
135,243sentences.13,never any the of reading even done i've assignments.,1.0809980676168884
136,243sentences.13,i've done the even assignments never any reading of.,0.769606866825583
137,243sentences.13,reading of never even assignments the any done i've.,0.5612164083703777
138,243sentences.13,even done never reading of assignments any i've the.,1.5828294156905096
139,243sentences.13,i've done the assignments even reading never of any.,0.8572826777227631
140,243sentences.14,know i people nightmare have who same many other the.,1.039417685407798
141,243sentences.14,i nightmare know the have people same many other who.,1.284027309440101
142,243sentences.14,other the people have i know nightmare same many who.,0.7354613138478129
143,243sentences.14,other who know i nightmare have many the same people.,0.48973191821368095
144,243sentences.14,the same know other i people many have nightmare who.,1.2170652279898277
145,243sentences.14,know i other have many same nightmare people the who.,1.0044759963441356
146,243sentences.14,the who many nightmare have know same other i people.,0.49138559985085445
147,243sentences.14,same other many nightmare have the know people who i.,1.0915916009820723
148,243sentences.14,other i who nightmare many same know the have people.,0.3583425084325215
149,243sentences.14,the have nightmare know many same people who other i.,1.1006783353381766
150,243sentences.15,in each dream the night experience participants morning write down from the previous had study their to.,1.200065932307641
151,243sentences.15,night each write in dream their the had from to the participants previous morning study experience down.,1.4686349747234888
152,243sentences.15,write the in experience study morning dream had their from down participants previous to each night the.,1.0677064521347828
153,243sentences.15,experience participants write the their down study dream in morning each night to previous had the from.,1.2478822624179489
154,243sentences.15,experience write to their study participants night from in the down had each morning dream the previous.,1.223861268323921
155,243sentences.15,the experience the their dream write in study each from had previous participants to morning down night.,0.9667100539186914
156,243sentences.15,their had night to previous the from participants the down morning study write dream in experience each.,1.2727677650098388
157,243sentences.15,dream to participants write previous morning each night the from had study in their down experience the.,1.253302217822174
158,243sentences.15,night write previous from each their morning the the study experience participants in dream down had to.,1.2658301227351532
159,243sentences.15,night study write morning their the experience the in participants to from dream each had previous down.,0.9119707150740052
160,243sentences.16,dream recorded they and recalled they each if any its intensity dreams and emotional described.,1.1330362794024142
161,243sentences.16,they recorded they its described each intensity and any dreams recalled and dream emotional if.,0.7715638748941259
162,243sentences.16,its emotional they if dreams any recalled and recorded and intensity described dream they each.,0.8175864040521478
163,243sentences.16,emotional any each recalled they and described recorded they dream and if dreams its intensity.,0.8537893515005057
164,243sentences.16,and recorded they dream they recalled emotional intensity dreams its and if described each any.,1.0202286972939214
165,243sentences.16,any intensity they dream recalled recorded if its each and emotional described and they dreams.,0.6111240303163182
166,243sentences.16,emotional its intensity they they and any dreams if each recorded and described recalled dream.,0.881767703901357
167,243sentences.16,intensity dream and if recalled and they emotional any its described dreams recorded they each.,0.7262169872268608
168,243sentences.16,described and recorded they its if each dreams recalled and they emotional intensity dream any.,0.9351372974997951
169,243sentences.16,described emotional they dream recorded intensity recalled any its if they and each dreams and.,0.7544190487722385
170,243sentences.17,each participants such category nightmare assigned flying then a or dream a a dream to as dream a bad.,1.2680621198145787
171,243sentences.17,a a category bad as dream dream participants assigned a to nightmare then dream a flying each such or.,1.6194365981989207
172,243sentences.17,flying nightmare such then a category or dream a bad dream dream a to a assigned each participants as.,1.9802357475992765
173,243sentences.17,then category as assigned a each nightmare a dream a to dream or flying dream such bad participants a.,1.5263838747863627
174,243sentences.17,a category to bad a dream a flying such each or participants then nightmare assigned as dream dream a.,1.2190963250803943
175,243sentences.17,nightmare a a dream or a category assigned dream flying each a to dream such bad then participants as.,1.4553848427677334
176,243sentences.17,or dream assigned then a a nightmare a dream a bad as each dream category flying to participants such.,1.7347533944834101
177,243sentences.17,a such a each dream a assigned category participants bad nightmare dream as or flying then to dream a.,1.192226309802374
178,243sentences.17,a or participants a category nightmare then to dream each a as dream such flying bad a assigned dream.,1.2658183724066845
179,243sentences.17,dream a to such nightmare a as a each bad a dream dream or assigned flying category then participants.,1.7800324055349916
180,243sentences.18,as night every when sleep we active while our we awake minds are are as.,1.7390844181241556
181,243sentences.18,every night we we as active awake when our minds sleep are as are while.,1.2307750005952185
182,243sentences.18,we are every while minds our sleep when night are awake as as we active.,1.4022737533878957
183,243sentences.18,are our active sleep every are as night we as when while minds we awake.,1.369662752981742
184,243sentences.18,when night every as we sleep are awake minds we are while as active our.,1.5890315652561946
185,243sentences.18,our awake we as sleep night while we active are are as when every minds.,1.1069892141832893
186,243sentences.18,are we awake every we when our minds while active night are as sleep as.,1.2088535212123528
187,243sentences.18,awake as are while sleep when we are our we as minds night every active.,1.3777963524493295
188,243sentences.18,as are night every we while active minds sleep when we are awake as our.,1.4523815538969025
189,243sentences.18,as are every as night awake sleep our we while we when active minds are.,1.2129714791879387
190,243sentences.19,minutes dream we night the each cycles ninety about throughout in of.,0.7734637563069936
191,243sentences.19,we dream the ninety each night minutes cycles about of in throughout.,0.8986031644368956
192,243sentences.19,we throughout cycles in night dream ninety minutes each the about of.,0.7570438011872037
193,243sentences.19,in each ninety night we minutes the about of dream cycles throughout.,1.2324310476994915
194,243sentences.19,minutes ninety in the dream we each of throughout cycles about night.,0.9199884055026804
195,243sentences.19,cycles night of in throughout ninety each dream about the we minutes.,0.9617946038276165
196,243sentences.19,about the throughout of cycles ninety in night dream each minutes we.,0.9496623608645198
197,243sentences.19,the we in cycles night minutes dream of throughout about ninety each.,0.8556574831875264
198,243sentences.19,minutes of throughout night ninety dream in about each the cycles we.,0.8012868041063357
199,243sentences.19,in the throughout about of we cycles each dream ninety night minutes.,0.7795439183058046
200,243sentences.20,can feelings images strange and places stories combinations fill dreams of characters our and.,1.4874687473264854
201,243sentences.20,images feelings and fill and dreams can combinations of strange characters places our stories.,1.463984441984509
202,243sentences.20,our images stories of combinations strange fill feelings characters dreams and can and places.,1.2785540135615914
203,243sentences.20,dreams combinations places strange images characters feelings and fill can stories of and our.,1.29327243367769
204,243sentences.20,fill feelings images can and strange our of characters dreams places combinations stories and.,1.045771181013962
205,243sentences.20,stories combinations our and strange feelings dreams places fill and of can characters images.,1.484577157216075
206,243sentences.20,can fill and and combinations images dreams of our stories characters feelings places strange.,1.328929014045084
207,243sentences.20,places fill combinations and characters of dreams feelings stories and strange our can images.,1.292934009624029
208,243sentences.20,places of combinations and stories and characters images our fill feelings dreams strange can.,1.3874239228155631
209,243sentences.20,places feelings of fill dreams characters strange and images combinations stories and our can.,1.3612065330021739
210,243sentences.21,bad i when start to went to playing worse from decided cards things.,0.7588485269136612
211,243sentences.21,when i to bad went worse start to cards from things playing decided.,1.197741797599321
212,243sentences.21,worse when decided cards playing start i from bad to to went things.,1.1756595036773183
213,243sentences.21,playing worse from start when things bad went to to decided i cards.,1.5429340288661026
214,243sentences.21,from to i when to start worse bad cards went playing decided things.,0.8494608144490662
215,243sentences.21,decided playing to to start i went bad things cards when from worse.,1.4535307413270275
