384sentences.154,random_withreplacement,type done went is caterpillar you or he be with can who.,0.6765466703730076
384sentences.155,random_withreplacement,house dress and pharmacists used axis snow government endangered.,0.48257068835674116
384sentences.156,random_withreplacement,have walls imagery worse caught each the countries of blindness the underneath.,0.6137480647816188
384sentences.157,random_withreplacement,or extensively health diesel and mouth toaster man covers type about adjust countries.,0.9073482528848371
384sentences.158,random_withreplacement,are of and each soybeans much are studies theatre.,0.8194782792456569
384sentences.159,random_withreplacement,effectively in food of there on finest compound eight to.,0.32578326724727547
384sentences.160,random_withreplacement,a make saw by games that feet a started settlers casinos tend often.,0.8737744612782672
384sentences.161,random_withreplacement,construction have has is as piranhas the has is end things swiftly pesticides.,0.42620433922854506
384sentences.162,random_withreplacement,be fresh sharks devoted that can across me now usually the grounds started outsole.,0.6447352992572907
384sentences.163,random_withreplacement,igloos carpenters large from for they use prey flare small a used red within.,1.0118614090693154
384sentences.164,random_withreplacement,to nowhere most south fish under a more to as the traded yellow.,0.7223164242033414
384sentences.165,random_withreplacement,or major lentils but high-priced oil people fights to pianist can.,0.6103464994898274
384sentences.166,random_withreplacement,an has part on live form the costumes run generally as.,0.7928710568908807
384sentences.167,random_withreplacement,mixture supplies i boiled repair stress can eye girl pianists and.,0.8711675569742473
384sentences.168,random_withreplacement,think due people and people retaining the cats desk to water local.,0.6324055557961941
384sentences.169,random_withreplacement,heights passing at ice buddies while buildings caterpillar side bear's grow facility.,0.9923711867768089
384sentences.170,random_withreplacement,pies legs cream sports gets could instituted that after turn.,0.8736238710325291
384sentences.171,random_withreplacement,area patients internet moving caused that and the fighting with night of x-rays computer.,0.970443749823044
384sentences.172,random_withreplacement,of one computers bee war can saddle soul series emissions of abrasive.,0.7820048068298094
384sentences.173,random_withreplacement,was a hours gloves molecule a pedalling cats chords the counters people another or ordinary arson a.,0.7894435789283211
384sentences.174,random_withreplacement,clothing as punctured cinemas slope decades sleep insects bottom for.,0.1349230213180005
384sentences.175,random_withreplacement,very it's up ensured dance take girl like body would new gallops.,0.7171317249092001
384sentences.176,random_withreplacement,saws long instruments different a a multiple meat men a a on with.,0.8963739181736349
384sentences.177,random_withreplacement,her the made on rock or land most dunes.,1.030322915530122
384sentences.178,random_withreplacement,american the done raised that indicate climbing with can fabric the injuries to.,0.7238142282058615
384sentences.179,random_withreplacement,with her after the have chips to a than have patients caused.,1.0624618352958548
384sentences.180,random_withreplacement,two the a a used the and her is tongue sensitive taste as size staple.,0.6625851123735337
384sentences.181,random_withreplacement,passengers tough the each is the a improved keep shrubs middle enter often is agriculture the a increase like.,0.5931243450363434
384sentences.182,random_withreplacement,have is explode the long key painters i be a build our.,0.3606332197948881
384sentences.183,random_withreplacement,head i is is one spiders in unlocked and soul remove also and in and are.,0.7306869277055306
384sentences.184,random_withreplacement,blacksmiths combinations sometimes caterpillar used for i from be pedals they're instrument folklore the.,0.7129121073853966
384sentences.185,random_withreplacement,slowly by for fracture a there a is them better field supply draft jazzing.,0.9781382066762814
384sentences.186,random_withreplacement,is to and tectonic it quietly several participants a i provide a their honey.,0.6510861493602196
384sentences.187,random_withreplacement,tomato twisting found experiments be areas your of animation rises mice weapon.,0.7684717838823016
384sentences.188,random_withreplacement,are with insects a multiple increases is house an vertical black a are weapons have.,0.8391070687954155
384sentences.189,random_withreplacement,open of images a and dispense to next to singer more an other.,0.7692837427359942
384sentences.190,random_withreplacement,shaking a and and the drunk ships or protein long legs.,0.8271495095545705
384sentences.191,random_withreplacement,has has the that were your the determines in health male operations.,0.7773409849024678
384sentences.192,random_withreplacement,and was plants small food walk pyramid's of remove found my.,0.5774552818733667
384sentences.193,random_withreplacement,mild is is cold two brown and rests poles.,0.7462438367498416
384sentences.194,random_withreplacement,and a station men cement in it a for.,0.7407409187486435
384sentences.195,random_withreplacement,fill with the than foods when the for the insulation or a.,1.1462824236574995
384sentences.196,random_withreplacement,admission in most it it's as flying have is hair together signed my pedals.,0.5998661888926603
384sentences.197,random_withreplacement,of improves knows employed advice field something a a like people bare with prevented.,0.754583342952244
384sentences.198,random_withreplacement,families wild looks in participants early stress than is the screws and owl.,0.9271668714215556
384sentences.199,random_withreplacement,mosquitos arson sensitive where and like worn people cycles from loosened for i.,0.7539755474493188
384sentences.200,random_withreplacement,were beyond the precisely raw the deforestation is the and determines can slightly piranhas a.,0.7296498144048121
384sentences.201,random_withreplacement,rivers is plants cold shrubs made they colorful in is surgeons study.,0.6210392475797639
384sentences.202,random_withreplacement,on base that surface from leaving for a a make fields around without any have.,0.9820071736654074
384sentences.203,random_withreplacement,musical their ice inside through its crime also ripped.,0.6975524162220577
384sentences.204,random_withreplacement,produce the for unripe can deserts that has pyramids savings the.,0.6248821158173425
384sentences.205,random_withreplacement,much that and for birds using breakfast her make was hurricane to.,0.9524627845388701
384sentences.206,random_withreplacement,libraries of and some can most bullets small consists a.,0.6354405128901303
384sentences.207,random_withreplacement,pets horse a let most came has once at harden my a.,0.757606278863358
384sentences.208,random_withreplacement,academic giant and of faced ride eye.,0.7229828900511078
384sentences.209,random_withreplacement,scientist small in carpentry for 70% the eagle meat.,1.7389727314804095
384sentences.210,random_withreplacement,employed their add picked foot largest to.,0.13512799040360438
384sentences.211,random_withreplacement,and through had a bolts dreams imprinted but they can.,0.7693081578401301
384sentences.212,random_withreplacement,extreme in note different mower minutes their music in when facilitated of reading.,0.6301782488445027
384sentences.213,random_withreplacement,theatre single tastes with the desert long that the head common density.,0.7957692996182626
384sentences.214,random_withreplacement,in that butterflies feet a places be or a others their.,0.5097869808440498
384sentences.215,random_withreplacement,poles is the preferred horns a the softens ground sensing.,1.2197857182781735
384sentences.216,random_withreplacement,a bear colorful or cream time books a lettuce a computers.,0.8147743646562196
384sentences.217,random_withreplacement,sensing a units that dump landscapes a caught panes we life.,1.0718039269608934
384sentences.218,random_withreplacement,bite house part buildings buildings one and milk are and cushion brown.,0.698275480316211
384sentences.219,random_withreplacement,piano bridging they travels music an mammal types as in floors.,0.2457661955456967
384sentences.220,random_withreplacement,primarily grow i ways free-climbing of or diet keyboards like end.,0.6936725320616313
384sentences.221,random_withreplacement,are the slope the object at through bear at actually an falls.,0.8029558790587138
384sentences.222,random_withreplacement,certainly level the wedding often frequent their while or their.,0.6201511916948657
384sentences.223,random_withreplacement,the is things long all be on trigger piranhas.,0.6566568573567123
384sentences.224,random_withreplacement,and ski honey-making the skirt and cod is an dishes a type test.,0.9199838236818049
384sentences.225,random_withreplacement,of who at an delicacies which or steep the a the doors.,0.7290293330071612
384sentences.226,random_withreplacement,are ocean and on but built the impact or.,0.6675401154936459
384sentences.227,random_withreplacement,and used turning sports in seeds a weapons of often.,1.0023013449204077
384sentences.228,random_withreplacement,trunk is carries and could produced emphasizes a skiing and drink water live.,1.1021168883512722
384sentences.229,random_withreplacement,after adult jackets and cell and hike for refrigerators for bolts or furniture metal.,1.12266251416525
384sentences.230,random_withreplacement,often front fresh or the and types he to be the on.,0.5749459079199455
384sentences.231,random_withreplacement,bear fingers rests all motor uniform public have with where become a.,0.37105317175919517
384sentences.232,random_withreplacement,froze and lodged been statue that and tropical sofa i rock.,0.6750695266602054
384sentences.233,random_withreplacement,fuel as a shoes visualize and tube raised holds focus are and.,0.7991134940676415
384sentences.234,random_withreplacement,used rope a two takes a the many it's already tuition.,1.0559512661084884
384sentences.235,random_withreplacement,on and the think arable the metal cabbage with and and part scholarly.,0.7665888535646393
384sentences.236,random_withreplacement,a professors they of symbol shoulder made the it's are or caused.,0.7975555735674743
384sentences.237,random_withreplacement,is a to should levers animal and owl death during keyboard the dizzy american.,0.9277443714477696
384sentences.238,random_withreplacement,a in side its large gallops body because for.,1.0507398267916574
384sentences.239,random_withreplacement,travel that devoted torso plants as that pulp an handle.,0.6651649334139583
384sentences.240,random_withreplacement,stairs inserted statue each a a on the go are pressing stingers.,0.8993999806490137
384sentences.241,random_withreplacement,topics curved together four american had are hunting glass.,0.5652011275695665
384sentences.242,random_withreplacement,and lapels owl but in painter thrown making mangos into write.,1.0166572695674099
384sentences.243,random_withreplacement,the for female that on is and and.,0.6361469800642813
384sentences.244,random_withreplacement,a city taste ship of containers their a an people.,0.9312305097033718
384sentences.245,random_withreplacement,eyes work glass many is through strength lodged awake walls refrigerator cubicle found.,1.0073831141956187
384sentences.246,random_withreplacement,cutting national knife different farmers the sheets of cooling ears shirt.,1.1164781689125705
384sentences.247,random_withreplacement,an his crushed feelings are can their may hurricanes followed area.,1.0963304331005086
384sentences.248,random_withreplacement,usually sleep is and detect to protein areas different from can was moving.,1.1885640821408927
384sentences.249,random_withreplacement,tropical x-rays at great are type the scientists are gloves eaten classic upper on.,0.6589946423148221
384sentences.250,random_withreplacement,something castle's jacket be skin when are the soldier my of vibration made creepy.,0.770535597915029
384sentences.251,random_withreplacement,always ravens though so and entertainment human like the bankruptcies area even.,0.8740087239891864
384sentences.252,random_withreplacement,showed boys do have of it the with formed creative food.,0.835289272447094
384sentences.253,random_withreplacement,people is motion is bananas raised by and can metal house into tons.,0.7512543309170776
384sentences.254,random_withreplacement,boiling but the papers on hills vision used are.,0.8249311209836998
384sentences.255,random_withreplacement,notes to and be threatened and fingers distractions.,1.0372322894904042
384sentences.256,random_withreplacement,instruments ice weapons table types zigzagged them program can arable the like.,0.39208322739577134
384sentences.257,random_withreplacement,insects cider is insulation degrees lawn transparent few information using.,0.8465731079464355
384sentences.258,random_withreplacement,to tropical own the tool the inundation have suck jam to.,0.5288685971005868
384sentences.259,random_withreplacement,sole are work safe the mix the as the off origins used.,0.7528804281274878
384sentences.260,random_withreplacement,test eyes a covering assignments there food they taste go have to.,0.7430567245085146
384sentences.261,random_withreplacement,on mosquitoes from ice are a bud intrigue visualize.,1.0092832752900087
384sentences.262,random_withreplacement,by assigned the boys tables games savings for a a.,0.9986904750037623
384sentences.263,random_withreplacement,when walls in a than thriving every ways have cream.,0.6722578223532119
384sentences.264,random_withreplacement,plant whales is of be and freight raspberry conferences the england fingers.,1.0679451977078842
384sentences.265,random_withreplacement,filled its it but fruit overhead dominate a difficult was.,0.6473305767566505
384sentences.266,random_withreplacement,astronaut indicate transparent had a the a have and to four large wore.,0.7868266760107934
384sentences.267,random_withreplacement,of lentils of big pyramid's genetic mammals hammer knife and skin graphics limbs.,1.008416129262509
384sentences.268,random_withreplacement,gasoline and various forest well dresses knitted night cats environment quaint called yellow with food were aging.,0.7248796945948742
384sentences.269,random_withreplacement,by desk wood cutting using for used to pressing on to grooves way conserve any most.,1.3766202098229017
384sentences.270,random_withreplacement,the or of in long a long playing in displays and.,0.9301818657917583
384sentences.271,random_withreplacement,sound called intellectual several cooperative have young no an i still a.,0.6417067709833507
384sentences.272,random_withreplacement,plant human determines on makes cider acting every tighter sex for smell finger furniture a usually.,0.7892246514962241
384sentences.273,random_withreplacement,bee that and on cut doors of using than gas is shirt occasions is together.,0.5882391343118301
384sentences.274,random_withreplacement,to oil and world behaving control white anvil particularly elephant the be visual each minimizes and.,0.817819153448521
384sentences.275,random_withreplacement,of sensing mysteries for made of test started honey we pyramid by hospitals used and use.,0.7615300809967706
384sentences.276,random_withreplacement,production increase become repair the pair as when the a fabric to close gambling is and so.,0.949171556260159
384sentences.277,random_withreplacement,to seals of extremes well by spin i plate of long produce broccoli is a.,0.47754323531365994
384sentences.278,random_withreplacement,closing juice player for green the x-rays compartment built work and a that a grown.,0.6651495882318037
384sentences.279,random_withreplacement,has sweetness had is fresh to advantage plants is cream.,0.6519872099241885
384sentences.280,random_withreplacement,jet a soldier toaster someone structures a i gasoline modern the.,0.7912671610433056
384sentences.281,random_withreplacement,castle several buildings water handles murder toaster disease the vikings.,0.8721747327893348
384sentences.282,random_withreplacement,with a used a drought adapted extract will the.,0.878157858411061
384sentences.283,random_withreplacement,a the up are of of have fire.,0.2817041810278495
384sentences.284,random_withreplacement,for their laborer think depends food passengers as.,0.39275064091883105
384sentences.285,random_withreplacement,previous the the licking legs of in adapt began schools.,0.8680263773823946
384sentences.286,random_withreplacement,pain hammer day head place the public a i during fingers are and.,0.7242589600608657
384sentences.287,random_withreplacement,can banana damage adapted of jet to as builders as station small.,0.6965303278467848
384sentences.288,random_withreplacement,some gas keen not of suck be a earthquakes has a property.,0.7330688357878098
384sentences.289,random_withreplacement,and in a and or objects tropical fractures bear can log research.,0.7734771520293251
384sentences.290,random_withreplacement,it in is research place dreams stones a at costumes.,0.8375436402558677
384sentences.291,random_withreplacement,a are found less mosquitoes with view others are a.,1.0318397485330726
384sentences.292,random_withreplacement,to half-closing in another silky remember other and water can.,0.6878684610037601
384sentences.293,random_withreplacement,tough revolving a faced on is their and with.,1.1768719904246236
384sentences.294,random_withreplacement,with eagles run others rifle from polar into barn a.,0.7857701348066999
384sentences.295,random_withreplacement,journals fields at signed comfortable to crime feeding an be.,0.30438444461406394
384sentences.296,random_withreplacement,vultures or infectious expanse grab the property professional bolts even train teflon-clad.,0.6349827345196483
384sentences.297,random_withreplacement,caused he insurance of space wound a pulp with of she backgrounds costumes the.,0.9906415523085056
384sentences.298,random_withreplacement,surrounded insulation ice close wood the a libraries work a that musical director.,0.7453939518050795
384sentences.299,random_withreplacement,taste chairs or such above make is that between knee.,0.6749792902685536
384sentences.300,random_withreplacement,savings and in on sweaters makes color the reveal detect lawyers usually their people often.,1.154744947089027
384sentences.301,random_withreplacement,their good healing let small they at though for owl.,0.5452289802951054
384sentences.302,random_withreplacement,stalk careful and on i a cheese like the to piano chairs on.,0.928045252829581
384sentences.303,random_withreplacement,made and has fruit people more for were solo cut.,1.1848315694150722
384sentences.304,random_withreplacement,it in on a glass elements often given social diet is ocean to risk.,0.780749419733088
384sentences.305,random_withreplacement,of a be human between extra their cities barrel high and.,0.7815232491699098
384sentences.306,random_withreplacement,black and was think clouds by strings tool about raspberry cause grenades plant.,0.5344116481712942
384sentences.307,random_withreplacement,handle export as rooms from water powered tickets high cod.,1.0247570437385278
384sentences.308,random_withreplacement,furniture have eaten like horse other rests smooth with the research by grass vibration.,0.9662366293230511
384sentences.309,random_withreplacement,of cliche and they is teas gentle was caused doors a performance.,0.5318471769036272
384sentences.310,random_withreplacement,slide are my does major they repair dampen different and a.,0.4047669739928381
384sentences.311,random_withreplacement,i falls malaria can participants do cider bud the of previous.,0.7506114054835378
384sentences.312,random_withreplacement,of a are an in of weapon a patients.,0.9218842858756614
384sentences.313,random_withreplacement,the have exterior pressing them inside of made have attached to.,0.9169218765439285
384sentences.314,random_withreplacement,for process a plants oil have screenings air in.,1.0450679498852604
384sentences.315,random_withreplacement,vultures a in be american the recalled world a makes and or appropriate social.,0.8658219877645243
384sentences.316,random_withreplacement,by of of plants head only is a or.,0.9093422008250992
384sentences.317,random_withreplacement,vary propelled they type can air to flat for and.,0.5810834740431837
384sentences.318,random_withreplacement,the a has found opera gambling wings owl's a gone.,1.062925298308462
384sentences.319,random_withreplacement,apples an a what bright break beekeepers mountains the.,0.7291785828655974
384sentences.320,random_withreplacement,provider are violinist gloves locomotive i a to rooms fruit large as.,0.4773592225748805
384sentences.321,random_withreplacement,profession has front tires isn't is used peach pharmacists to solid.,1.1655838986850011
384sentences.322,random_withreplacement,place can a a even igloos silo for it's ride view.,1.3758028686986046
384sentences.323,random_withreplacement,anvil mind shrubs rainfall that professional deprives long smooth steal twisting and.,0.39356059484036354
384sentences.324,random_withreplacement,own be log very beekeeper's the by with cooking and a still objects.,0.8013942233804547
384sentences.325,random_withreplacement,they linoleum tube caught passage the animals reduce are talking hands.,0.9407601459372462
384sentences.326,random_withreplacement,their within a things drug woman must careful cooked tines to to source pedalling.,0.667500480342543
384sentences.327,random_withreplacement,and an colorful drift slammed with finding to more to coastal.,0.4246765435880351
384sentences.328,random_withreplacement,with fingers that on most led causes are many for put well.,1.0742980143526943
384sentences.329,random_withreplacement,adapted event grooms savory walk usually are passing a.,0.615131274044556
384sentences.330,random_withreplacement,sting tower of houses her eventually or energy a and loss a.,1.014576219489836
384sentences.331,random_withreplacement,food coffee the taste ski day is the in is high.,0.8524739036266842
384sentences.332,random_withreplacement,have entrance as penalty murder igloo and wings killing an.,0.46798020251687644
384sentences.333,random_withreplacement,for cut papers libraries are vision use of apply a historically.,0.9227332005423885
384sentences.334,random_withreplacement,painting different hammock rests the sauce can for plants property distances food.,0.6775879807092972
384sentences.335,random_withreplacement,high-priced twisting colorful program were particular many tend new.,0.674975548740755
384sentences.336,random_withreplacement,for their as building covers a along grenades seed scissors laundry an.,0.969793705075353
384sentences.337,random_withreplacement,milk hands bellows attire buildings have of that england to of floating home milk.,0.5178336537346667
384sentences.338,random_withreplacement,remember air throwing they are are hunger widespread participants and and activity hands appliance.,1.3254621629663776
384sentences.339,random_withreplacement,freeze insects adults many ties with colder there are on curved rotating.,1.073573445325964
384sentences.340,random_withreplacement,hot with that looming be cod ceramic and diesel advent is private bird.,0.4941562944633515
384sentences.341,random_withreplacement,the process our vultures or but ravens and head own large be carrion fish seeds.,0.8758159382238275
384sentences.342,random_withreplacement,also recurring have sand lawn dried some open window between lettuce rock coastal substantial.,1.0534032677015732
384sentences.343,random_withreplacement,used their bud can tub they a a fully of are.,0.606848010580037
384sentences.344,random_withreplacement,motor world strong overflow people it its is during small and with insects various for.,0.9693001462701443
384sentences.345,random_withreplacement,and else are of very shape and heavy slide a sails a.,0.9444844106093259
384sentences.346,random_withreplacement,soap better chose reduce plant a could yet bike we to new.,0.8717439855283764
384sentences.347,random_withreplacement,easy a doors it are milk made fighting the face and.,0.779596461995291
384sentences.348,random_withreplacement,and spiders or several up nurses people the with latest window a other some.,1.1246412580006846
384sentences.349,random_withreplacement,to screwdriver in temperature of made breathing with good.,0.645082107148878
384sentences.350,random_withreplacement,told is and air the with purposes with minimizes a performances.,0.902033193005702
384sentences.351,random_withreplacement,many abrasive all clothing a devastated or to in couldn't let start.,0.8621174128171939
384sentences.352,random_withreplacement,inhabited wings of or flavored they have students contains of we.,0.5504172547758603
384sentences.353,random_withreplacement,same doors their tomatoes ears to are in made.,0.794836385996281
384sentences.354,random_withreplacement,to without be a up to of cyclone the grow.,1.3122679444620662
384sentences.355,random_withreplacement,or boy less tool sleep bird passengers has be feathers.,0.6300324768130103
384sentences.356,random_withreplacement,mountains rain orange animation needed ensured easily small used use then on astronaut twisting.,0.5361112909830966
384sentences.357,random_withreplacement,tie of by and all heel proper box stalk source but.,0.7271334344285307
384sentences.358,random_withreplacement,that in different become insect the height help while by people.,0.5406565148484417
384sentences.359,random_withreplacement,nose jet of to flakes waterbeds the on jackets gambling is or images.,1.0201949262093115
