243sentences.0,Scr7,beekeeping conservation of encourages habitats local the.,21.82900455185465
243sentences.1,Scr7,in every it is interest beekeeper's to conserve plants local that pollen produce.,33.89558123665994
243sentences.2,Scr7,a as agriculture passive of form it does require not that native vegetation be cleared to make for way crops.,71.96538039983332
243sentences.3,Scr7,discourage the beekeepers also of use pesticides on because crops they kill could the honeybees.,44.65959909208174
243sentences.4,Scr7,go to artisanal beekeepers for extremes their craft their but product worth is the effort.,37.875024838955525
243sentences.5,Scr7,emphasizes quality artisanal honey-making character and quantity over consistency and.,26.923774577673004
243sentences.6,Scr7,the to finest produce beekeepers honey micromanagers become their honeybees of.,30.612302241748974
243sentences.7,Scr7,the fields they scout when know nectar flows and select the ways best to honey extract.,43.55761002716898
243sentences.8,Scr7,beekeeper opens as the hive the the deep of hum 40000 fills bees the air.,46.676971518569445
243sentences.9,Scr7,checks the honey beekeeper pollen stores and supplies bee nursery the.,29.22635183125837
243sentences.10,Scr7,across his bees crawl arms bare and hands they but don't because sting they're gentle.,54.848209489239935
243sentences.11,Scr7,a recurring i have about dream exams even i'm though no in longer college.,34.48178580232765
243sentences.12,Scr7,my in day dream the it's of my exam final and i suddenly realize i've never gone class to.,41.181166404303454
243sentences.13,Scr7,even done i've of never any reading the assignments.,6.970476887768064
243sentences.14,Scr7,many other i know who people the have nightmare same.,25.331002423149407
243sentences.15,Scr7,morning each study participants the in had to down write their dream experience the from previous night.,57.30278302723202
243sentences.16,Scr7,if they they recorded any recalled dreams and each described dream its and emotional intensity.,26.882665917848524
243sentences.17,Scr7,then participants to assigned dream each a category as such a flying dream a bad dream or nightmare a.,88.95580725660047
243sentences.18,Scr7,while we every night our sleep minds are active as as we when are awake.,50.89490198188558
243sentences.19,Scr7,throughout we the dream in night of cycles ninety minutes about each.,30.031996655718412
243sentences.20,Scr7,stories and images feelings combinations strange of characters places and can our fill dreams.,37.04105537949498
243sentences.21,Scr7,decided to when i playing start cards things from went bad worse to.,37.34571780110459
243sentences.22,Scr7,was gambling to something had i do and had i already spent close $10000 to doing it.,25.774426942424185
243sentences.23,Scr7,were my sick friends watching of gamble me savings away my.,18.202954953190925
243sentences.24,Scr7,hardest the horror part the was of leaving casino a after losing money did i not have.,45.47902154864199
243sentences.25,Scr7,on the good data and social economic effects of legalized gambling hard are to by come.,49.8515519333433
243sentences.26,Scr7,indicate that some studies a having casino nearby gambling makes problems likely more.,46.783384381090116
243sentences.27,Scr7,also gambling be may with associated bankruptcies personal marriage problems and.,32.13769018892409
243sentences.28,Scr7,past generation over the has there been a expansion dramatic of gambling legalized.,39.20406959805565
243sentences.29,Scr7,have most instituted states and lotteries have many as well casinos.,30.608416595060042
243sentences.30,Scr7,gambling very big has controversial but become business.,13.654710151736847
243sentences.31,Scr7,from the the wind shook hurricane the house a shattering window the in kitchen.,49.51050848212698
243sentences.32,Scr7,in grabbed we ran food some slammed the door and surrendered kitchen the to hurricane the.,41.41438218794737
243sentences.33,Scr7,afraid i our was would house ripped be its foundation from.,11.045513097733801
243sentences.34,Scr7,night with later that wind the shaking the house we fell huddled asleep on sofa the.,52.80487325735161
243sentences.35,Scr7,tear limbs hurricanes can of off trees and houses suck off foundations their.,20.744477802511124
243sentences.36,Scr7,heavy rains they dump can that floods trigger mudslides and.,36.85566409139741
243sentences.37,Scr7,also bring hurricanes can storm a surge a wall of ocean that water lurches land onto.,53.698065559999094
243sentences.38,Scr7,several scientists methods use look to evidence for ancient hurricanes of.,27.60219910824851
243sentences.39,Scr7,storms deposited the strongest of layers windblown beach at sand the of bottoms coastal lakes.,58.325613842890256
243sentences.40,Scr7,by passing trees drenched preserve hurricanes a record each of storm their in growth rings.,35.45684716868848
243sentences.41,Scr7,cream is american ice around exported the world different but countries different have preferences.,33.955463413968296
243sentences.42,Scr7,enjoy their many people cream ice with flavored delicacies local.,59.49814476083293
243sentences.43,Scr7,tropical places in some ice vanilla cream is with topped bananas fresh and mangos.,79.86031554491313
243sentences.44,Scr7,making ice i remember at cream as home child a.,7.009887952092891
243sentences.45,Scr7,poured we into the mixture cream a frozen then tub start turning the crank to expose it the to cold.,69.54955000267276
243sentences.46,Scr7,froze enough eventually it i that couldn't turn hand the crank more any.,21.35708543961519
243sentences.47,Scr7,put the then i of container half-frozen ice into cream the to freezer harden.,40.53626470260536
243sentences.48,Scr7,cream ice of is mixture a milk or sugar cream flavorings and up half to whipped-in air.,78.56277578022902
243sentences.49,Scr7,in milk the butterfat cream and is what it makes smooth silky and.,60.10006433033052
243sentences.50,Scr7,ice high-priced cream premium loaded is butterfat with natural flavorings and.,41.71893253813095
243sentences.51,Scr7,use the when i lawn riding mower the chair uncomfortable makes back my hurt.,52.95555721337177
243sentences.52,Scr7,the two i use in levers front of to me control machine the.,26.525478821160327
243sentences.53,Scr7,blades underneath the sharp lawn the mower precisely each sever blade grass of.,49.041287418502314
243sentences.54,Scr7,lawn is mowing the long a task and has it taught patience me.,38.129904499668015
243sentences.55,Scr7,mower is a lawn machine a with revolving blades that cut to grass an height even.,50.65873397278257
243sentences.56,Scr7,may be the blades by powered muscle or machine the may a have motor.,37.34277662029798
243sentences.57,Scr7,common power the most for source lawn mowers a is small engine gas.,42.94958398505961
243sentences.58,Scr7,are better electric lawnmowers the for environment because do they not emissions create.,40.39893829551674
243sentences.59,Scr7,need they less also and maintenance less are to run expensive.,24.871490691449726
243sentences.60,Scr7,mowers electric use lawn much as as electricity ordinary toaster an.,40.10640544418629
243sentences.61,Scr7,astronauts long time train their for a spacewalks.,20.04566869730357
243sentences.62,Scr7,much training is of underwater conducted their.,13.160427387308012
243sentences.63,Scr7,may they 10 spend to 8 hours in pool the for every hour they will spend floating space in.,52.90943657162061
243sentences.64,Scr7,practice astronauts to to able be perform construction repair and work on the of outside the space station.,67.2614483910371
243sentences.65,Scr7,of shuttle the commanders are flights always pilots and many have as backgrounds military pilots test.,44.58212548044781
243sentences.66,Scr7,are trained other astronauts doctors as engineers and who scientists can experiments run in space.,51.44668169177632
243sentences.67,Scr7,were all early crews men young but astronauts are now much diverse more.,22.921813598192273
243sentences.68,Scr7,of astronauts the team out floated together to exterior the of space the shuttle.,36.081231672724684
243sentences.69,Scr7,tools needed they carried repair to the broken on part the telescope huge.,34.43259164820804
243sentences.70,Scr7,astronaut one on loosened bolts the the pipe the while other fitted the part replacement into place.,41.23462726947611
243sentences.71,Scr7,been used computers have art in for a time long by artists experimental.,37.283898596504116
243sentences.72,Scr7,computers are now that affordable more and widespread computer graphics have the entered mainstream world art.,59.27943850778728
243sentences.73,Scr7,science conferences some computer art have exhibitions that the showcase latest technology graphics.,40.820382775847726
243sentences.74,Scr7,conferences have brand new up sprung that are to devoted bridging two the cultures.,38.50567045404266
243sentences.75,Scr7,graphics specialist the computer with works doctors to medical visualize conditions surgical and procedures.,52.879290062403214
243sentences.76,Scr7,digital animation she uses help to doctors understand within structures a body patient's.,37.645242117535645
243sentences.77,Scr7,the seeing an internal in structures animation on screen a is much clearer squinting than at x-rays.,59.34033104885194
243sentences.78,Scr7,animation is modern powerful digital a for tool education.,29.304208849419872
243sentences.79,Scr7,field of as the graphics computer broadens we ask must if actually graphics help students.,45.48561006825505
243sentences.80,Scr7,suggest that research does and vivid engaging digital can imagery be in effective the classroom.,47.20445812886259
243sentences.81,Scr7,he came the reason law to school in first the place cliche was.,40.086976932939045
243sentences.82,Scr7,he change things wanted the for to better.,10.287861471582264
243sentences.83,Scr7,recalled he law one at evening school when and he the program director pulled had an all-nighter.,50.624231378964566
243sentences.84,Scr7,finished they drafting finally petition a several for families at evicted sunrise.,40.55430908768652
243sentences.85,Scr7,past four over the the decades cost of education legal has up gone relentlessly.,42.984359451233956
243sentences.86,Scr7,school tuition private law by increased a factor four of since 1970s the.,39.88334081179478
243sentences.87,Scr7,for admission the market law to school and new for lawyers eventually could crash.,36.89344724033453
243sentences.88,Scr7,faculty law often school minimal have in experience practicing law actually.,28.740074452210468
243sentences.89,Scr7,on writing professors focus review law for articles journals prestigious.,18.488560860256776
243sentences.90,Scr7,often emphasize law schools theoretical the with classes on topics like law property in england feudal.,43.695063944258806
243sentences.91,Scr7,pharmacists involved in are care preventive increasingly.,24.975467670994433
243sentences.92,Scr7,becoming they front-line are advisers health people because to pharmacies go often.,29.092612613206292
243sentences.93,Scr7,often pharmacists a are source good information of public health about.,34.50315857032099
243sentences.94,Scr7,with pharmacists doctors consult they because know a about lot drug and interactions side effects.,52.756680354459704
243sentences.95,Scr7,prescription drugs pharmacists dispense patients to and offer about advice the use safe of medications.,65.17959406853537
243sentences.96,Scr7,conduct health they also wellness and and screenings vaccines provide.,27.675455940302996
243sentences.97,Scr7,have professional pharmacists must and degrees pass two in exams order be to licensed.,38.57155495033014
243sentences.98,Scr7,the pharmacy i think chose profession me as much as i to chose be pharmacist a.,28.341755350497795
243sentences.99,Scr7,fascinated by i was neatly the arranged bottles pharmacies in as child a.,30.45811046349498
243sentences.100,Scr7,know i i it's but cliche love the that impact i have on of lives my patients.,31.789246250646162
243sentences.101,Scr7,has each his person her or response own potentially stressful to situations.,29.52907882109568
243sentences.102,Scr7,may be one person by devastated unemployment while may another find fulltime working stressful.,52.507699049948364
243sentences.103,Scr7,everyday stresses there being are like in stuck traffic.,27.54510679977023
243sentences.104,Scr7,also traumatic there are such stresses as divorce loss or of child a.,33.359276121159525
243sentences.105,Scr7,can adapt some different people to of levels stress.,18.977518359489945
243sentences.106,Scr7,dealt with if not though effectively stress can a take real on toll health.,42.421719501164844
243sentences.107,Scr7,it's your remember that to reaction stress that determines if it be will harmful beneficial or.,56.16745409348106
243sentences.108,Scr7,company when was my i downsizing incredibly felt and worried stressed.,17.00101696243147
243sentences.109,Scr7,would race my heart no for reason and even i felt at dizzy times.,43.578688151805395
243sentences.110,Scr7,started then taking i to yoga to try my stress manage level.,31.103708323026748
243sentences.111,Scr7,wore a the man black jet with tuxedo stripes satin.,42.245446914919505
243sentences.112,Scr7,made it with was fabric rich in cut latest style the.,32.45999658419168
243sentences.113,Scr7,had clearly it he as tailored fit it man perfectly the.,21.511325100995872
243sentences.114,Scr7,like something it looked professional a stylist would picked have out a for formal event.,49.24827946355964
243sentences.115,Scr7,tuxedo is while the preferred still today's grooms making are personal in statements wedding attire.,27.535803021926785
243sentences.116,Scr7,are shorter on jackets cutting the of edge fashion for wedding men.,26.565744726784203
243sentences.117,Scr7,also jazzing grooms are their up tuxedos with shirts colorful and ties satin.,49.21312137382885
243sentences.118,Scr7,jacket a is tuxedo tailless a jacket dinner black silk with lapels.,60.00999714732106
243sentences.119,Scr7,trousers black should tie a be match perfect the tuxedo to jacket.,45.90162713753639
243sentences.120,Scr7,shirt the plain should be always white and tie the should be black match and the jacket lapels.,51.13259597148782
243sentences.121,Scr7,the went blind concert adulthood in pianist.,16.12473018287012
243sentences.122,Scr7,was caused her blindness a by genetic condition slowly that damaged eyes the.,29.260500235070346
243sentences.123,Scr7,interviewers she that told blind being an was to a advantage pianist.,31.369492568897783
243sentences.124,Scr7,no visual she had so distractions she could more concentrate fully her on music.,39.48396159972693
243sentences.125,Scr7,defines blindness the government vision as insufficient for ordinary the activities life of.,28.184629988637155
243sentences.126,Scr7,the parameters by establishing legal of blindness resources be can focused the on legally blind.,50.22995570067842
243sentences.127,Scr7,overlook those this may have who vision problems who but do meet not the standard.,38.968932114464096
243sentences.128,Scr7,countries blindness in developing children in is usually by caused infectious and disease nutritional deficiencies.,61.246685610067736
243sentences.129,Scr7,can these often causes prevented be medicine by vitamin supplements and.,35.22228533236845
243sentences.130,Scr7,countries blindness in developed more is likely to caused be by problems genetic.,47.9117951880047
243sentences.131,Scr7,really knows no one how exactly a taste from gets your to mouth your brain.,56.32906005951179
243sentences.132,Scr7,the process scientists think when begins a molecule food of touches taste a bud cell.,43.72764501406565
243sentences.133,Scr7,carries the a cell message taste taste to beneath the nerves cell.,29.30217030176032
243sentences.134,Scr7,once believed it was each that taste bud responded to one the of four tastes basic.,50.28270426779937
243sentences.135,Scr7,is that on a bud taste the tip the of tongue would respond only if you were something eating sweet.,70.12053347051169
243sentences.136,Scr7,now scientists single think a that taste bud be can sensitive to all the of basic tastes.,51.595882499008255
243sentences.137,Scr7,sense my very of isn't taste good so tend i to eat foods very with strong flavors.,44.669729746556925
243sentences.138,Scr7,like i sauce lots hot of and i my drink coffee with no so cream it's very bitter.,47.23879806135888
243sentences.139,Scr7,even taste i can't well sweetness so when make i cookies add i extra sugar.,20.780585052385604
243sentences.140,Scr7,are a hip problem fractures real aging for individuals.,24.680833635892757
243sentences.141,Scr7,faced with patients are pain the of the and break the process difficult of healing.,40.50441807261443
243sentences.142,Scr7,to adjust families have the to loss patient's independence of.,27.869930575007608
243sentences.143,Scr7,society hip and for involve fractures substantial expense time and in hospital the.,30.03063791083473
243sentences.144,Scr7,the race halfway through heard i a sound someone like snapping fingers their.,50.83378601962752
243sentences.145,Scr7,a crunch i felt i and knew instantly my that foot broken was.,30.451616543073406
243sentences.146,Scr7,every like running step spikes on felt.,16.456988440587423
243sentences.147,Scr7,doctor's at office the the afterward clearly x-ray the fracture showed.,14.65692036045523
243sentences.148,Scr7,a few there types are different bone of fracture.,28.873580728286818
243sentences.149,Scr7,or simple in closed the fractures bone is but broken the is skin intact.,43.3245303642574
243sentences.150,Scr7,open in the or fractures compound broken bone punctured has the skin and an produced open wound.,47.45593093015883
243sentences.151,Scr7,piercings new can ear infected become they're if carefully cleaned not.,28.732859241505015
243sentences.152,Scr7,infection signs include of swelling tenderness redness or the earlobe around.,48.91475460423676
243sentences.153,Scr7,see if these you clean symptoms area the apply some and ointment.,24.96109832104045
243sentences.154,Scr7,redness and if the don't swelling go away your contact health provider care.,36.52625000901684
243sentences.155,Scr7,hospital has a local new initiated to measures infections reduce.,22.150044547446335
243sentences.156,Scr7,improved hand they have habits washing and ensured that infected patients isolated are from patients other.,45.732683169501506
243sentences.157,Scr7,has the seen hospital rates infection since drop new measures the began.,25.08020409078533
243sentences.158,Scr7,wound with scrubbing a or soap alcohol delays which healing increases risk the of infection.,47.83954288119811
243sentences.159,Scr7,increase the band-aids can of risk infection by in holding heat moisture and.,26.477422988062273
243sentences.160,Scr7,skin fortunately infections most easily can treated be they are once diagnosed.,47.571117467720015
243sentences.161,Scr7,started at modern opera end the the of century sixteenth.,22.523695229924467
243sentences.162,Scr7,as it an began to effort and rediscover greek tragic imitate performance.,30.412565737397788
243sentences.163,Scr7,of early opera founders tales chose antiquity from their subject for matter.,24.381711462858444
243sentences.164,Scr7,branched later out operas different into of sources and musical stories traditions.,31.429130046851274
243sentences.165,Scr7,is opera in an form art which singers musicians and perform a play combines that words and music.,56.15078307610471
243sentences.166,Scr7,many of it incorporates elements the of spoken such theatre as scenery acting and costumes.,49.62104473359203
243sentences.167,Scr7,typically given performances are an in opera house accompanied and by orchestra an.,43.882743428778774
243sentences.168,Scr7,singer has the opera hard worked to win role the in new the production.,41.189455587181875
243sentences.169,Scr7,her not just job singing about is.,10.590255824750331
243sentences.170,Scr7,presence and acting interpretation stage musical all are critical.,18.745074983360368
243sentences.171,Scr7,pure but strong her is voice the certainly of the star show.,21.08619990836553
243sentences.172,Scr7,must a keep painter elements many mind in completing a while painting.,31.686330877253184
243sentences.173,Scr7,to use she has elements solid of design strong like composition lighting and.,18.90289271189564
243sentences.174,Scr7,to execute she brush has the with strokes skill.,17.997577457993668
243sentences.175,Scr7,the content most importantly the of painting should a reveal glimpse the of painter's soul.,56.632651141814364
243sentences.176,Scr7,painters were long ago more employed as skilled than artisans as artists creative.,39.87640636736384
243sentences.177,Scr7,painters had however prominent social the status of and scholars members the of royal court.,39.50784363777535
243sentences.178,Scr7,signed they on their decided work its subject imagery and and established a relationship personal with their patrons.,55.8283540596574
243sentences.179,Scr7,a as to painter learned i focus less the on actual scene and on more the painting itself.,32.3719356517078
243sentences.180,Scr7,artist's an a eye not is camera lens has that to record everything its within field of vision.,55.217241126458546
243sentences.181,Scr7,nature provides i found information useful but more is than needed a for good painting.,50.37266443290591
243sentences.182,Scr7,the is an eagle bird impressive owl.,18.511751897938524
243sentences.183,Scr7,ear tufts it stick has that like up horns.,21.557566450309608
243sentences.184,Scr7,orange eyes its large downright are creepy and look like they pierce could right you through.,61.51050003203626
243sentences.185,Scr7,hunts this at owl flying night and swiftly through the silently darkness.,42.567744791898605
243sentences.186,Scr7,owl species while some become have others endangered thriving are.,30.432625925392145
243sentences.187,Scr7,owl has the barred well spread its beyond habitat previous.,26.02188336660093
243sentences.188,Scr7,suggest early that findings may logging facilitated have barred owl's the invasion.,34.77427608529051
243sentences.189,Scr7,landed on the owl thick a branch and it gripped with talons her.,49.80066420627811
243sentences.190,Scr7,her wings she pressed her to sides and down settled half-closing eye an.,43.1080466261191
243sentences.191,Scr7,have been she might statue a but for glow the of eyes her.,30.704246291698535
243sentences.192,Scr7,to it's watch unnerving polar a stalk bear floating sea across ice.,24.860919841683884
243sentences.193,Scr7,worse when it's even are you submerged in the frigid waters beneath directly the animal huge.,54.37167885621001
243sentences.194,Scr7,paws set overhead giant on down the ice the as polar pursued bear its prey.,36.186968403487526
243sentences.195,Scr7,part as crew of film the for a bear polar documentary i spent capturing months these shots.,46.20716654733637
243sentences.196,Scr7,bears polar the are of one few animals will that attack people for reasons other than fear confusion or.,56.320520038592505
243sentences.197,Scr7,attack out they may hunger of because they in live a environment food-scarce.,28.31015939993279
243sentences.198,Scr7,sneak they up will people on careful slowly conserve their to energy.,27.946542484126077
243sentences.199,Scr7,is the an seal part important the of bear's diet polar.,28.75693517810958
243sentences.200,Scr7,hunting when by they wait will a seal's hole breathing or stalk seals that are basking on ice the.,58.03183168638489
243sentences.201,Scr7,bear will the polar quietly crawl forward and freeze in place the when seal around looks.,47.304642529070634
243sentences.202,Scr7,castle the was medieval a not built structure for defense primarily.,27.37537414186515
243sentences.203,Scr7,its to dominate purpose surroundings its was.,19.633591574436668
243sentences.204,Scr7,could easily a castle lands control a within walk day's.,15.920229761428146
243sentences.205,Scr7,times during livestock of peasants attack and property be could brought inside the walls castle's for protection.,51.01567853302447
243sentences.206,Scr7,in dramatic spectacular castles provide locations a record the of stormy of history many regions.,43.218282930977345
243sentences.207,Scr7,stand today atop they cliffs rocky beautiful overlooking and quaint landscapes villages.,59.78312195190592
243sentences.208,Scr7,past in they the home were battles to and intrigue plots.,17.70313515496959
243sentences.209,Scr7,leaving upon we the station train saw our looming hotel above a magnificent built castle on a cliff.,75.49311266571631
243sentences.210,Scr7,outside walls the thick an sheltered inner courtyard of hundreds feet the above river.,60.006129051066516
243sentences.211,Scr7,rooms had our tower incredible an slightly but view scary.,16.954321666428505
243sentences.212,Scr7,climbing after the fifty up feet side of pyramid the the man gestured me into a small entranceway black.,68.38047261969886
243sentences.213,Scr7,into the this at led chamber pyramid's the center.,26.34490760570628
243sentences.214,Scr7,him down i steep followed the narrow dark passage.,18.58454797804985
243sentences.215,Scr7,inside the the smell was pyramid and chalky air was the thick.,26.336960045524524
243sentences.216,Scr7,just the more than of tomb the king represented pyramids the of pride the nation.,39.13388203479918
243sentences.217,Scr7,that the the care builders pyramid in took craft is their evident.,22.29682666564423
243sentences.218,Scr7,covering the the stones were pyramid precisely fitted and together polished the until structure gleamed.,41.62111985059239
