243sentences.212,backward,entranceway black small a into me gestured man the pyramid the of side the up feet fifty climbing after.,64.43519911471947
243sentences.213,backward,center pyramid's the at chamber the into led this.,22.874008993529383
243sentences.214,backward,passage narrow dark steep the down him followed i.,41.20694791797453
243sentences.215,backward,thick was air the and chalky was pyramid the inside smell the.,29.991792822092197
243sentences.216,backward,nation the of pride the represented pyramids king the of tomb the just than more.,45.08253543260007
243sentences.217,backward,evident is craft their in took builders pyramid the that care the.,35.53442433821541
243sentences.218,backward,gleamed structure the until polished and together fitted precisely were pyramid the covering stones the.,43.3775966890549
243sentences.219,backward,constructed were pyramids how of mysteries the solve to working still are architects.,52.198201804218215
243sentences.220,backward,blocks stone raise to walls pyramid's the inside built were ramps think some.,39.75447584162528
243sentences.221,backward,pyramid the of walls exterior the up zigzagged ramps that speculate others.,53.89415062509057
243sentences.222,backward,strength and courage takes climbing rock beginner even.,25.715407474944247
243sentences.223,backward,boulders large on scrambling try can sport the learning are who climbers.,24.637692306617925
243sentences.224,backward,faces rock vertical climb safely to ropes using begin can they that with comfortable they're once.,72.3688688893308
243sentences.225,backward,climbing rock to new were trip the on boys the of all.,28.752914783665755
243sentences.226,backward,heights of afraid were many.,10.892608118926798
243sentences.227,backward,down calm them helped harnesses and knots their check else someone having.,41.83325469466208
243sentences.228,backward,beginners for appropriate routes climbing up set adults the.,32.96533161170795
243sentences.229,backward,climbing rock of style particular one is free-climbing.,26.407932008460016
243sentences.230,backward,face rock a ascend to strength physical and skill her on solely relies climber the.,68.6202000955322
243sentences.231,backward,used equipment only the are bolts and rope.,22.469288581484232
243sentences.232,backward,falls she if climber the stop to only meant are they.,31.057213003483064
243sentences.233,backward,try to me convinced buddies my that trail steep the down skied hesitantly i.,59.785792649993155
243sentences.234,backward,down tumbling myself found i and turn bad a made i.,32.31568273854433
243sentences.235,backward,slope the of part flat a at stop a to came finally i.,48.01492702298214
243sentences.236,backward,hill the up drift snow a in lodged were poles my and found be to nowhere were skis my.,66.31598005289189
243sentences.237,backward,poles ski use they how is skiers professional of strength major a.,28.8007021216796
243sentences.238,backward,skiing their to flair adds and balance their improves poles ski of use proper.,47.467344775034235
243sentences.239,backward,skiing while balance lost regain to movements body upper for need the minimizes it.,47.919178478103326
243sentences.240,backward,quickly more turn skiers let boots stiffer and designs ski new.,30.697590057879744
243sentences.241,backward,legs the on force twisting the increase turns tighter and faster but.,32.42303282527807
243sentences.242,backward,knee skier's the in ligaments to particularly injuries more to led has this.,25.958970228920144
384sentences.0,backward,keyboards two with instrument musical portable a is accordion an.,43.07655906576556
384sentences.1,backward,chords for other the notes individual for used is keyboard one.,29.925753494050177
384sentences.2,backward,reeds through air blow that bellows with sound produce accordions.,32.13304949829728
384sentences.3,backward,bellows the closing and opening while keyboards both plays accordionist an.,40.0490016392961
384sentences.4,backward,building a of part is that home self-contained a is apartment an.,22.93740670430448
384sentences.5,backward,bathroom a and kitchen a as well as rooms more or one have may apartment an.,45.891731766177024
384sentences.6,backward,families for others people single for are apartments some.,15.652317852584765
384sentences.7,backward,space storage extra or facility laundry a garage a have can building the.,48.772580561579254
384sentences.8,backward,yellow or red green be can that fruit a is apple an.,28.260950910986086
384sentences.9,backward,inside seeds and pulp sweet crisp a skin thin have apples.,42.444902349764014
384sentences.10,backward,cider make to used are apples tart very some.,38.19679304968261
384sentences.11,backward,pies in baked or roasted raw eaten be can apples.,54.72677766650915
384sentences.12,backward,wildland or building a burning of act criminal the is arson.,33.744651946182515
384sentences.13,backward,arson or accident by caused was fire a if determines investigation fire a.,43.697872502341724
384sentences.14,backward,insurance collect or others to damage cause to done be can arson.,45.89811937087777
384sentences.15,backward,harmed were people whether on depends crime the of severity the.,39.54320529439445
384sentences.16,backward,passengers transporting for vehicle wheeled a is car or automobile an.,54.165640349901636
384sentences.17,backward,engine electric or gasoline a by powered be can car a.,32.20321922244047
384sentences.18,backward,sit just passengers other roads on car the steers driver the.,42.10496027557376
384sentences.19,backward,trunk of type the and doors of number size in vary automobiles.,34.84909429878534
384sentences.20,backward,wood cut and split to used tool a is axe the.,32.72523442585039
384sentences.21,backward,handle a to attached head a of consists usually axe the.,31.294893407296613
384sentences.22,backward,metal then and stone of made were heads axe historically.,23.646646287483133
384sentences.23,backward,buildings entering firemen and woodcutters by used are axes.,25.79268690186273
384sentences.24,backward,inside edible soft a with bunchs in grows that fruit long a is banana a.,38.035031249220204
384sentences.25,backward,spots brown small have and red or purple yellow be can ripe when banana a.,60.14723863111484
384sentences.26,backward,ecuador or india as such countries tropical are producers greatest the.,39.60140785745211
384sentences.27,backward,potatoes like cooked often and foods staple are plantains and bananas unripe.,51.442643526162215
384sentences.28,backward,in sex have or sleep to place a as used furniture of piece a is bed a.,48.72381076633879
384sentences.29,backward,covers and pillows sheets plus spring box a and mattress a of made is bed a.,35.558199756595
384sentences.30,backward,air with filled is it airbeds in and water with filled is mattress the waterbeds in.,51.02764381955012
384sentences.31,backward,ground the above suspended sling fabric a hammock the is bed of type another.,51.92043216254947
384sentences.32,backward,legs six and body yellow and black a with insect flying a is bee a.,48.77270001454095
384sentences.33,backward,honey make to nectar collect they as flowers between pollen spread bees.,40.23262655599723
384sentences.34,backward,hive a in located colony a in together live and insects social are bees.,53.62242346956171
384sentences.35,backward,threatened feel they if attack can and stingers have bees many.,33.63741944831054
384sentences.36,backward,frame a on pedals and wheels two with vehicle a is bicycle a.,37.22524721281177
384sentences.37,backward,saddle the on cyclist a of pedalling the by propelled is bicycle a.,43.500522854744105
384sentences.38,backward,air of full tube inner an with tires rubber have wheels the.,46.383192295801614
384sentences.39,backward,racing and recreation transportation for bicycles use people.,26.767674375912172
384sentences.40,backward,steel or iron forging by objects creates blacksmith a.,23.92080951407648
384sentences.41,backward,shape its change to anvil an on iron hot bends and hammers blacksmith a.,58.94496825621143
384sentences.42,backward,tongs with metal the handle and apron thick a wears blacksmiths.,46.824839145632566
384sentences.43,backward,furniture iron or shoes horse weapons like objects make blacksmiths.,26.442166436010215
384sentences.44,backward,food puree or ingredients mix to used appliance kitchen a is blender a.,50.40223877566009
384sentences.45,backward,bottom the in blade rotating a with container plastic or glass a have blenders.,65.88047198411932
384sentences.46,backward,smoothies fruit and shakes milk make to used are blenders.,49.20983718879258
384sentences.47,backward,ice crushed with drinks alcoholic cold make to used also are blenders.,58.983941044509805
384sentences.48,backward,puberty undergone not has who child male young a is boy a.,56.340059944550035
384sentences.49,backward,girls to relative distinctions sex indicate to used is term the.,33.25053980078926
384sentences.50,backward,other each with fight and games rough play to like boys traditionally.,49.178848065663274
384sentences.51,backward,boy a as to referred often is immaturely behaving male adult an.,54.80191268829961
384sentences.52,backward,family cabbage the in plant a is broccoli.,23.98018909197191
384sentences.53,backward,stalk tough thick a and head flower green a has broccoli.,42.1469667554629
384sentences.54,backward,nutrients other and fiber vitamins in high is broccoli.,21.407577434482842
384sentences.55,backward,raw eaten or stir-fried boiled be can broccoli.,29.920019379666535
384sentences.56,backward,wings large four with insect flying a is butterfly a.,33.76042470139192
384sentences.57,backward,patterned and colorful very be can butterflies of wings the.,30.766602385225823
384sentences.58,backward,butterfly a into caterpillar a of transformation the is metamorphosis.,34.95441240372877
384sentences.59,backward,wings colorful their of because butterflies collect people some.,31.094473600022305
384sentences.60,backward,wood with works who laborer manual or artist an is carpenter a.,44.879284033253654
384sentences.61,backward,objects other and boats furniture houses repair and build carpenters.,31.3896729237069
384sentences.62,backward,planes and pliers saws hammers as such tools use carpenters.,25.775851841943656
384sentences.63,backward,instruments musical repairs and makes that carpenter a is luthier a.,36.319097995171866
384sentences.64,backward,tail a and legs four with animals furry small are cats.,43.8826666442152
384sentences.65,backward,fur their licking by themselves groom to like cats.,30.595406616468395
384sentences.66,backward,owners their by fed often are but birds or mice hunt can cats.,45.096762254593806
384sentences.67,backward,sharp keep they that so retractable are cats of claws the.,29.220632666834714
384sentences.68,backward,on sit to people for designed furniture of piece a is chair a.,45.89721083929939
384sentences.69,backward,legs by supported level floor above raised seat a of consist chairs.,47.17570079760369
384sentences.70,backward,cushion a as well as rests arm and back have also can chairs.,43.96811889417573
384sentences.71,backward,cinemas like places in or vehicles in located chairs fixed are seats.,28.575597435149145
384sentences.72,backward,instrument musical woodwind a is clarinet a.,36.495370753154106
384sentences.73,backward,bottom the at flare a with tube black long a is clarinet a.,46.798968971771075
384sentences.74,backward,holes and keys pressing by notes chooses player the.,25.965613489811048
384sentences.75,backward,music classical and jazz in both used is clarinet the.,39.17809970366711
384sentences.76,backward,atlantic the of areas colder the in lives that fish a is cod a.,36.42939438967166
384sentences.77,backward,cooked when easily flakes and mild-tasting and white is flesh cod.,32.00356483096415
384sentences.78,backward,dishes elaborate for cod salted chips and fish for used is cod fresh.,49.41167761452305
384sentences.79,backward,vikings the of time the since traded and salted caught been has cod.,45.58069539713395
384sentences.80,backward,plant coffee the of seeds the beans coffee from made is coffee.,44.026284515320135
384sentences.81,backward,hot served usually and countries many in drink popular a is coffee.,36.684789677417754
384sentences.82,backward,awake people keeps that caffeine called drug mild a contains coffee.,37.38102297090775
384sentences.83,backward,export agricultural legal seventh-largest world's the is coffee.,21.417328273155384
384sentences.84,backward,falls rain no almost where environment natural a is desert a.,38.12619975777312
384sentences.85,backward,rocks or dunes sand with filled usually are deserts hot.,50.738265712753936
384sentences.86,backward,deserts in live to adapted have plants and animals some.,31.390970146662653
384sentences.87,backward,africa northern in sahara the is desert hot biggest the.,30.682035586990544
384sentences.88,backward,computer a with sometimes at working for used furniture of piece a is desk a.,45.37013633521735
384sentences.89,backward,metal or plastic wood of made be can and surface flat a has desk a.,50.33645530625847
384sentences.90,backward,papers and supplies store to drawers have may desk a.,22.66160439250877
384sentences.91,backward,sides three on partitions by surrounded desk a of consists cubicle a.,33.65310832045176
384sentences.92,backward,area enclosed an from exit or entrance to barrier movable a is door a.,57.93307444963621
384sentences.93,backward,them through pass to gets who control to locks have doors most.,36.05690252630138
384sentences.94,backward,unlocked are they after handle a pulling or pushing by opened are doors most.,43.53039356930877
384sentences.95,backward,chamber revolving a of consist or slide can doors of types other.,32.255363499351006
384sentences.96,backward,wear sometimes women that clothing of piece a is dress a.,32.03360656112307
384sentences.97,backward,skirt matching long a to attached shirt a like is dress a.,39.11783698009925
384sentences.98,backward,dance a or wedding a as such occasions formal at worn usually is dress a.,56.07560569691964
384sentences.99,backward,dress a in bike a ride or stairs climb to hard be can it.,65.68906743629209
384sentences.100,backward,alcohol of effects the under driving of act the is driving drunk.,34.23359833302855
384sentences.101,backward,world the of most in crime a is vehicle any of driving drunk.,36.679616256771695
384sentences.102,backward,deaths vehicle-related all of half almost in role a plays it.,31.31605740608573
384sentences.103,backward,tests breathing and sobriety field by caught are drivers drunk.,29.225776563343633
384sentences.104,backward,rain of lack by caused supply water the of shortage persistent a is drought a.,59.0875740034402
384sentences.105,backward,die and growing stop to plants and crops cause will drought.,25.406409990371102
384sentences.106,backward,famine cause and desert into areas turn eventually will drought extreme.,37.76769435568045
384sentences.107,backward,bowls dust from away migrate to have people of numbers large.,46.30585253907482
384sentences.108,backward,eyesight good very have and day the during hunt that prey of birds large are eagles.,50.51876630891569
384sentences.109,backward,talons sharp and legs strong flesh tearing for beaks hooked have eagles.,58.76248813773715
384sentences.110,backward,mammals small others and fish eat species some and eyries in live eagles.,42.67537031706136
384sentences.111,backward,states united the of bird national the is and head white bright a has eagle bald the.,63.623124460443236
384sentences.112,backward,structures other and buildings down knock can and ground the shake earthquakes.,38.94480800704362
384sentences.113,backward,activity volcanic and landslides trigger also can shaking the.,37.57713749875792
384sentences.114,backward,crust earth's the in energy of release the by caused are earthquakes most.,51.605533537466194
384sentences.115,backward,tsunami a cause and seabed the displace can sea at earthquake an.,29.118665932585557
384sentences.116,backward,tons several weighing mammal land of kind largest the are elephants.,41.37423911080116
384sentences.117,backward,food or things grab can which trunk a called nose long a has elephant an.,36.28637553943474
384sentences.118,backward,trees into digging or objects moving for tusks ivory of pair a has elephant the.,57.45879691382748
384sentences.119,backward,body its and them in blood the cool to ears large its flaps elephant the.,45.076270409919665
384sentences.120,backward,cortex visual the for it coding and light sensing for organ an is eye the.,59.81346002877385
384sentences.121,backward,texture and motion color detect can which eyes complex have animals most.,27.658529274464488
384sentences.122,backward,it of part sensitive most the and eye human the of center the is fovea the.,66.63321876583305
384sentences.123,backward,directions many in facing units eye of up made eyes compound have insects.,30.265051987796227
384sentences.124,backward,food for animals raise or plants grow to used land is farm a.,47.54460926899682
384sentences.125,backward,produce to what decide and farm the run who people the are farmers.,39.25777431864915
384sentences.126,backward,barn a and silo a farmers for house a have usually farms.,28.210606452068358
384sentences.127,backward,equipment and land the share farmers many where farm a is cooperative a.,36.79540096279011
384sentences.128,backward,hand each on thumb a and fingers four have usually primates.,31.105474801970402
384sentences.129,backward,activities other and grooming writing grasping for used are fingers.,28.157560455962358
384sentences.130,backward,vibration and pressure temperature to sensitive are fingertips the.,28.43419810212435
384sentences.131,backward,decorated or grown be can and finger the of tip the protects nail the.,37.94149309119779
384sentences.132,backward,land inhabited submerges that water of expanse an of overflow an is flood a.,50.02513096204818
384sentences.133,backward,sea at earthquakes as well as melt snow rapid or rain heavy by caused be can flood.,70.231789101037
384sentences.134,backward,levees and dams break or channel its of out flow will river a flood a in.,54.603249860641036
384sentences.135,backward,diseases causes water contaminated the and evacuate people flood a during.,27.187891090469638
384sentences.136,backward,on walking for used building a inside surface horizontal a is floor a.,38.85356031874724
384sentences.137,backward,floorboards wooden or linoleum tile concrete bare of made be may floors.,60.41607935058464
384sentences.138,backward,noise dampen to and comfort for floor a on carpets put often people.,37.141592377958105
384sentences.139,backward,it under wiring electrical and pipes has often floor the buildings in.,28.667994961241465
384sentences.140,backward,leg a of end the on part body a is foot a.,33.24938994200478
384sentences.141,backward,straight standing or running walking when feet their use people.,27.979665189089534
384sentences.142,backward,sports and fighting both in kick to feet their use also people.,27.71834759784062
384sentences.143,backward,feet to related behavior for rules have cultures many.,16.962928653331772
384sentences.144,backward,cover canopy and trees of density high a with area an is forest a.,52.95068407431508
384sentences.145,backward,location its in rainfall and temperature on depends forest of type the.,38.71912613519371
384sentences.146,backward,plants ground as well as animals and trees of types various has ecosystem forest a.,52.58283654122094
384sentences.147,backward,regeneration disregarding forests of down cutting the is deforestation.,17.491716599324832
384sentences.148,backward,tines several and handle a with foods solid eating for tool a is fork a.,58.94487022199274
384sentences.149,backward,disposable if plastic or metal of made usually are forks.,35.3088219445345
384sentences.150,backward,cutting while place in food hold to or mouth the to food lift to used are forks.,41.80495135439327
384sentences.151,backward,foods various for kinds special are there and cultures western in used are forks.,53.602891510551686
384sentences.152,backward,handle a and sides sloping with pan small a is pan frying a.,57.85818499329483
384sentences.153,backward,food brown and sear fry to used is pan frying a.,43.57545692251787
384sentences.154,backward,pan the of bottom the covering oil on cooked is food the.,42.66482170526368
384sentences.155,backward,steel teflon-clad or iron of made are pans frying.,18.9315744343643
384sentences.156,backward,maturity reached yet not has who human female a is girl a.,46.029531655860204
384sentences.157,backward,woman a of that into develops girl a of body the puberty at.,35.041562247078815
384sentences.158,backward,games social and dolls with playing like often girls.,27.25010674804242
384sentences.159,backward,skirts and dresses wear and hair long grow sometimes girls.,41.09760444345395
384sentences.160,backward,fingers and hand the covers that clothing of piece a is glove a.,35.89488213512086
384sentences.161,backward,material waterproof lined or wool of made are cold against protect to gloves.,42.44742657707192
384sentences.162,backward,chemicals or germs from hands shield to used are gloves latex or rubber disposable.,60.409150052188224
384sentences.163,backward,together covered are fingers four the where glove of kind a is mitten a.,37.990647131691176
384sentences.164,backward,object an to impact an deliver to used tool a is hammer a.,47.773082068775956
384sentences.165,backward,wood into nails drive to used often most is hammer a.,41.11494115614121
384sentences.166,backward,nails remove to used be can head the on claw the.,39.3892156733362
384sentences.167,backward,length handle and head the of shape the in vary hammers.,30.218423093937574
384sentences.168,backward,people against weapon a as used explosive an is grenade hand a.,41.525744859764636
384sentences.169,backward,that after bit a explode to timed and thrown are grenades hand.,36.29335039375577
384sentences.170,backward,launchers shoulder or rifles from fired be also can grenades.,41.41717788525948
384sentences.171,backward,it disperse to mob a of middle the into thrown are grenades gas tear.,67.04087170514632
384sentences.172,backward,legs muscular long four with mammal hoofed large a is horse a.,57.24248374818403
384sentences.173,backward,brown or gray usually is and neck its on mane a and tail a has horse a.,54.628180640398014
384sentences.174,backward,entertainment and travel work draft for used been have horses.,27.565021197451525
384sentences.175,backward,gallops or trots walks it while horse a ride can human a.,31.036519140562238
384sentences.176,backward,injured or sick are they when healed be to hospitals to go people.,37.83885107069578
384sentences.177,backward,nurses and surgeons physicians professional by staffed are hospitals.,32.22429654608311
384sentences.178,backward,day same the leaving therapy or diagnosis specialist for there go patients some.,29.48278709537358
384sentences.179,backward,weeks several for stay to have patients treatments or operations some for.,34.86941873623096
384sentences.180,backward,in live to families or people for structure or building permanent a is house a.,42.66304990404966
384sentences.181,backward,in light let to windows and rain and cold out keep to walls and roof a has house a.,47.58122351063225
384sentences.182,backward,washing or cooking sleeping like purposes for rooms have can house a.,30.224822957563354
384sentences.183,backward,sleep and eat to night at back come and work to house the leave people most.,40.40037081401235
384sentences.184,backward,inuit by snow of blocks from made shelter of type a is igloo an.,39.54259549471831
384sentences.185,backward,time the of most land the covers snow where places in built are igloos.,50.20426823289716
384sentences.186,backward,tunnel entrance an with dome a of shape the in built often are igloos.,51.42712239099989
384sentences.187,backward,igloos warms heat body and space the insulate snow in pockets air.,34.111918542423716
384sentences.188,backward,things cut to used is that edge sharp a with tool a is knife a.,51.09247060524189
384sentences.189,backward,metal of made usually blade a and handle a of consist knives modern.,29.868077713499243
384sentences.190,backward,rituals in instruments and weapons as used been also have knives.,36.67427693750946
384sentences.191,backward,throwing or stabbing slashing by attack to used be can knife a.,45.74723949521346
384sentences.192,backward,family legume the of plant a of seeds the are lentils.,34.4886647913529
384sentences.193,backward,yellow or black brown green red be can lentils.,24.809238472227495
384sentences.194,backward,cuisines mediterranean and indian in used commonly are lentils.,33.937030945464
384sentences.195,backward,protein of source great a are and boiling by cooked are lentils.,32.59972488453024
384sentences.196,backward,vegetable leaf a as climates temperate in grown often plant biennial a is lettuce.,57.93954053532819
384sentences.197,backward,cooked or dishes other and salads in raw and cold eaten be can lettuce.,63.13360835086452
384sentences.198,backward,beginners for crop suitable a and grow to easy fairly considered is lettuce.,50.52218971231401
384sentences.199,backward,bitterness the remove to bred are some but bitter taste leaves lettuce most.,53.82390233696381
384sentences.200,backward,kept is media and documents books of collection a where place a is library a.,41.944338559003846
384sentences.201,backward,information organizing and finding at experts are and libraries at work librarians.,31.947566952927207
384sentences.202,backward,weeks several for home take to books borrow and libraries public to go can people.,61.48352345581831
