243sentences.194,random_withreplacement,the a when from professors frontier of different think or could key and gasoline insulation.,0.7778683705498152
243sentences.195,random_withreplacement,lawn the be me private grilling grab be structure the rubber often scopes area can nectar at.,0.6250500470430636
243sentences.196,random_withreplacement,metal interest should and tomato powered from levees is a in been is soft bald of today's make sometimes.,0.7853198921873661
243sentences.197,random_withreplacement,the a work use actually spear or on grounds in edge violin when.,0.8510619239134645
243sentences.198,random_withreplacement,in sea use commuter mugs through bed car is because of individual.,0.4098367371190306
243sentences.199,random_withreplacement,pharmacists machine safely the is insects and climber covering musical ground.,0.8072549261106294
243sentences.200,random_withreplacement,professors of are that eaten conferences stressful a be face handle is holding could a lettuce edge and window.,0.9185494237030055
243sentences.201,random_withreplacement,established day others away its each voice were walls pockets sunrise wedding flesh of that and.,0.3916557912703405
243sentences.202,random_withreplacement,and that large the to half-frozen fruit crank carpenters poles also.,0.9443300022889495
243sentences.203,random_withreplacement,surface can world criminal elements honey sensitive.,0.7289816192673225
243sentences.204,random_withreplacement,a like tuxedos taught to consult a but muscular claws.,0.8757600301092517
243sentences.205,random_withreplacement,is an a vaccines patrons that and a of handle and garage need styles orange revolving for.,0.6384423729932925
243sentences.206,random_withreplacement,to of afraid a of about write it inuit chew step vibrating cooking food out.,1.2097988239179598
243sentences.207,random_withreplacement,and and on well that cliche as appropriate land is and will.,0.9050398866313477
243sentences.208,random_withreplacement,but used enjoy local families as or forest their bees and.,0.657082543810121
243sentences.209,random_withreplacement,it's as insects leaves the latest flows into feet is of casino formal in wait and if try.,0.6714566585530487
243sentences.210,random_withreplacement,dunes also pharmacists fresh and building chairs next an do their is cut i.,0.7902575275157795
243sentences.211,random_withreplacement,wound fields and with computer pollen in chemistry this is.,0.9005192663486598
243sentences.212,random_withreplacement,or sides seventh-largest and something the as this trains for when electric taste are work four a patients protein.,0.6552659056049268
243sentences.213,random_withreplacement,hive stick train set the blades ship stress can.,0.7351419199498852
243sentences.214,random_withreplacement,the branched a trees to care led eventually farm.,1.1416084240007671
243sentences.215,random_withreplacement,participants topics in on to are for i used teeth is of.,0.7316009420432026
243sentences.216,random_withreplacement,that liquid barrier diseases salmon pilots sweetness could predate while of the sling different dams.,0.7816462888052874
243sentences.217,random_withreplacement,to built dream shrubs a or drinking blindness add by convicted real.,1.0448509590720643
243sentences.218,random_withreplacement,a at when glove hard impressive beautiful she hunt day's rubber organizing have shirts tastes.,0.5297232496488256
243sentences.219,random_withreplacement,the to as the every imagery history a a plants and or and.,0.5951924921139116
243sentences.220,random_withreplacement,to mitten capable trees a ways people divorce a the quaint and is.,0.7325693895698141
243sentences.221,random_withreplacement,situations typical structure or music used on allow smooth inside made of.,0.8834690516175066
243sentences.222,random_withreplacement,gleamed rivers spring past graphics hands different people.,0.6186464382166146
243sentences.223,random_withreplacement,not were will been try stresses of is deliver produced health plant.,0.8413882064488596
243sentences.224,random_withreplacement,methods the motion artisanal a hand human a release for is overlook water they wedding it.,0.8851397309396195
243sentences.225,random_withreplacement,horse lapels is are bolts the hands gleamed when to soybeans food.,0.7788503503489935
243sentences.226,random_withreplacement,team and decoration native that.,0.6280756292560228
243sentences.227,random_withreplacement,in the head containers pursued in once a paralyse in the during.,1.2937771606924597
243sentences.228,random_withreplacement,both scissors a a high-pitched tighter hammer as beneath.,1.263698074896742
243sentences.229,random_withreplacement,mouthparts polar social run improves elements is often.,0.4568843453990523
243sentences.230,random_withreplacement,well becomes skier's knock dream close in shorter to red-brown and hypotheses growth a their.,0.5783245908460792
243sentences.231,random_withreplacement,freezes transportation and used legal countries grooves most.,0.6603352161067044
243sentences.232,random_withreplacement,food the eat stresses such puberty legs butter of more be.,0.6471484773673808
243sentences.233,random_withreplacement,parasite on be dump large energy tomato is many done cut of infectious milk.,0.8059067735673643
243sentences.234,random_withreplacement,in a sick its vegetation folklore the orange i theft screen.,0.6928253600648844
243sentences.235,random_withreplacement,the cabin the blender is have as a stress different in built mediterranean.,0.9685312359213272
243sentences.236,random_withreplacement,overlooking bottom while can covered most is made is since off is an blade as routes and keyboard sails.,0.8496471627049857
243sentences.237,random_withreplacement,or also the most but butterfly about paid this waterproof the keep.,0.723686592587684
243sentences.238,random_withreplacement,she and a be who have isolated objects the countries is rain cotton chose.,0.718482114725566
243sentences.239,random_withreplacement,and milk and fights furniture are a table by also while pyramid cell also.,0.8497607934122938
243sentences.240,random_withreplacement,and worth from pedalling surface lakes are should to is orange.,0.3886830281080386
243sentences.241,random_withreplacement,on bankruptcies sushi feet boy water stick rope most dramatic a melt.,0.6194661270836886
243sentences.242,random_withreplacement,a individual and and often is decoration inner a fingers or power mob.,0.8297840658562777
384sentences.0,random_withreplacement,floors band-aids blenders the and most the a tropical lighting.,1.3838206004088078
384sentences.1,random_withreplacement,bottles the changes out different out is that experts asleep really.,0.538941000729923
384sentences.2,random_withreplacement,blade have in with of ran movements skin and check.,0.6340835968215143
384sentences.3,random_withreplacement,united sports or the of ecuador fish pharmacists the for the.,1.127987128479243
384sentences.4,random_withreplacement,boulders spent is above pyramid the banana rock to chose such digging.,1.010081858817362
384sentences.5,random_withreplacement,knowledge it of with carried taste generation climb well water a coffee entering a more your.,0.7812068945540434
384sentences.6,random_withreplacement,mattress crops saw countries gambling frontier divide some cabins.,0.3640012417351007
384sentences.7,random_withreplacement,the perform a side make the i legs covering have pedalling theatre each.,1.0029768739385903
384sentences.8,random_withreplacement,sensitive them together or for or warm ligaments biggest wound eat fruits.,0.6166375422751698
384sentences.9,random_withreplacement,lighting sheets sometimes such founders dairy been but pipe and cooperative.,0.11444397901433875
384sentences.10,random_withreplacement,drain jackets to outsole lives as baked i her.,0.5160095549027377
384sentences.11,random_withreplacement,hours softens control to as has instrument called new by.,0.771002066590199
384sentences.12,random_withreplacement,and plants has my a has once long other exit types.,0.7107549348317869
384sentences.13,random_withreplacement,the patience to rests balance vertical landslides their ride no finest protein a.,0.48106725842590786
384sentences.14,random_withreplacement,law has tool an plants in products by fine painting a are.,1.1337147228496958
384sentences.15,random_withreplacement,trains for tropical school into and and focus can using or.,0.7334460036927093
384sentences.16,random_withreplacement,drought children the certainly i regain is where with birds tsunami.,0.5923467905618209
384sentences.17,random_withreplacement,the a army or legume are sharp beekeeper some piercings its.,1.5129300734624709
384sentences.18,random_withreplacement,beyond closed final driving have be nice saliva to mud the.,0.6303076939272658
384sentences.19,random_withreplacement,lettuce the folklore by their me for to our dust presence hypotheses.,0.9641996925992168
384sentences.20,random_withreplacement,recalled a as tie down damage graphics wildland of climbing caught.,0.9813725413243765
384sentences.21,random_withreplacement,you coffee insects or on vision log or and it vitamin.,0.8625375850878945
384sentences.22,random_withreplacement,end shelters dried a poles become orange a hand the.,0.5001129512683151
384sentences.23,random_withreplacement,could from as drug sports of me is and.,0.2765704344720196
384sentences.24,random_withreplacement,inner between attack grooves professional new to personal law on of eagles that are an.,1.0472761807354118
384sentences.25,random_withreplacement,and greek permanent of of or the it rings plants passengers sharp add they to.,0.6510754723981307
384sentences.26,random_withreplacement,criminal look use curved the hot or arms and to fracture.,0.7021732464639491
384sentences.27,random_withreplacement,is one fear a later underneath can holes of the on and.,0.8356387354669507
384sentences.28,random_withreplacement,ligaments be assigned off raw are has front or piercing cut piano dream are eventually provider prey.,0.45264617201361373
384sentences.29,random_withreplacement,are to and their fin or extra a the be density as die of others patient's.,0.6241270046700004
384sentences.30,random_withreplacement,school or which throwing in bees for sick end a climbing famous way on castle infection.,0.9556520211103177
384sentences.31,random_withreplacement,has may many is she several of away shirt test of live feelings taste.,0.43493648932409446
384sentences.32,random_withreplacement,our local a beginners the places food huge as publish a cool it climb instruments.,1.0693572359871673
384sentences.33,random_withreplacement,theft igloo be become some a flooding chamber built beautiful skilled boulders.,0.5487410182538077
384sentences.34,random_withreplacement,is remove an severity american overlooking that public at usually feet dream saws rituals.,0.6889263318397831
384sentences.35,random_withreplacement,historically cheese and pan ship pan as and is mostly to.,0.9424535260223443
384sentences.36,random_withreplacement,the and primates stalk is clearings scene building hear fill sea that caught.,0.5322656109187751
384sentences.37,random_withreplacement,have have as source not students is jazz taste cliche games sting objects.,0.8468313259266919
384sentences.38,random_withreplacement,and the the round the can activities station grow vary can themselves.,1.0131581026464316
384sentences.39,random_withreplacement,is elements built as facing legs for change.,0.5846036730508056
384sentences.40,random_withreplacement,gripped of contaminated for in united caffeine eating is.,0.5403926629925578
384sentences.41,random_withreplacement,is designs one hours however can laborer farms and a tongue come tastes they.,0.705186686044569
384sentences.42,random_withreplacement,young high machine can a articles and the of the of.,0.7677103107270074
384sentences.43,random_withreplacement,and beekeepers three their blacksmith consist eyesight cool feet of.,0.4419712803871266
384sentences.44,random_withreplacement,speech grilling and wood is hum the develops small the initiated blindness on.,0.7202094257770089
384sentences.45,random_withreplacement,to appropriate the where of and seabed spent snow tightening strength is consist world.,0.7893995035286293
384sentences.46,random_withreplacement,a cyclone electrical well heat into for by a exported.,1.0759187151230893
384sentences.47,random_withreplacement,tub repair conferences fur shots straight cooperative the the to do increasingly.,0.5329225551714613
384sentences.48,random_withreplacement,transformation drought in she the wood notes increases the publish climber most.,1.0335995211391784
384sentences.49,random_withreplacement,the of for mouthparts did flathead house over a a a.,0.9124734749318649
384sentences.50,random_withreplacement,each sex is skiers the with but in damage and by and.,0.7459414291161035
384sentences.51,random_withreplacement,often those swamp pitched metal plant the gray and also as its.,0.8065096045751935
384sentences.52,random_withreplacement,down hesitantly occasions is lawyers the relative as.,0.4497573368377476
384sentences.53,random_withreplacement,with vultures and my night strength cut musical need or that.,0.8177411072366255
384sentences.54,random_withreplacement,when the the a bad if long the to.,0.9263780449823436
384sentences.55,random_withreplacement,being a reading box x-ray writing our well.,1.0189030175435532
384sentences.56,random_withreplacement,blenders mouth reaction on on advantage a and down the.,0.3694119712193568
384sentences.57,random_withreplacement,vegetation used a are or make it very is shallow.,0.9396217329722788
384sentences.58,random_withreplacement,patients submerged led owl the people glass is them varieties.,0.48829987740853364
384sentences.59,random_withreplacement,area piece food landform balance water findings for fruit.,0.41158724448180467
384sentences.60,random_withreplacement,animals that consist drunk fly the were frontier ferocious miles flying but.,0.7923189922876225
384sentences.61,random_withreplacement,ravens bear a machine can the cream on is or.,1.0315515485619298
384sentences.62,random_withreplacement,the for hot wear or gas transporting professional stalk weight.,1.529926213292286
384sentences.63,random_withreplacement,controversial backgrounds her and rotating a internet seal have are timed.,0.8836185055748368
384sentences.64,random_withreplacement,the instrument new cyclones the and a and is style advisers.,0.9749540130356384
384sentences.65,random_withreplacement,used the face are the by loaded grab by.,0.9570014473846711
384sentences.66,random_withreplacement,front eaten ski ripe of later couldn't saddle abrasive showed upon your common.,0.36048360970524673
384sentences.67,random_withreplacement,in the about discourage and land the pride to a under.,0.9146630408540685
384sentences.68,random_withreplacement,her tropical insects for and able with tuxedo pure numbers ice astronauts but.,1.0208089800548616
384sentences.69,random_withreplacement,for running scrambling craft devastated be instrument small that ear measures salmon.,0.6505793176625101
384sentences.70,random_withreplacement,a and cardigan experts helped part of scavenging covered field largest and a.,0.9584718282256821
384sentences.71,random_withreplacement,roads opera cause books the metal it insects have cold to to.,0.5081332706527418
384sentences.72,random_withreplacement,beneficial individuals an gas the ski the.,0.3576957148531406
384sentences.73,random_withreplacement,i are are than the man the make from things man recalled fur.,0.7208962364707798
384sentences.74,random_withreplacement,for screenings is glow a to from white cars.,0.8613957518150082
384sentences.75,random_withreplacement,bellows they this part is a vultures fresh two the.,0.9475540375743378
384sentences.76,random_withreplacement,in can teas are cold as asleep can swiftly are a gambling a research.,0.7966985645765688
384sentences.77,random_withreplacement,sea split made two as cats is has in i to.,0.3926085045732644
384sentences.78,random_withreplacement,or and for apartment a are bananas thin i deliver and can a.,0.788365804507142
384sentences.79,random_withreplacement,media books inserting to keyboards the tomatoes food the reduce and pulling savory.,0.7623443245675733
384sentences.80,random_withreplacement,cycles so wool small by inside and people trots oil and a.,0.7718713916539445
384sentences.81,random_withreplacement,and that reeds on drought inside by better running tailored trip close.,0.9713687379841561
384sentences.82,random_withreplacement,of and collect each body butterfly as of burning size or.,0.7693096622404957
384sentences.83,random_withreplacement,climbing sometimes landform by started women the to.,0.8702349541906876
384sentences.84,random_withreplacement,small also insulation and cause chin human much sell famine steel.,0.644422926260402
384sentences.85,random_withreplacement,to to bone are throwing crops into or taste bone.,0.629846696018784
384sentences.86,random_withreplacement,of a confusion vision everything clarinet new with and and.,1.0216538320333803
384sentences.87,random_withreplacement,suggest tearing oil butterflies strength all stress flood can hair.,0.3426018174992657
384sentences.88,random_withreplacement,internet girls eye digital elephants of a is painters vanilla player sneak male felt germs.,0.544721857114007
384sentences.89,random_withreplacement,climates is be poles owners like of desk a if the are real objects liquid.,0.9350946405977004
384sentences.90,random_withreplacement,foundations a more cleaned structure slammed food objects so take.,0.12948957800164804
384sentences.91,random_withreplacement,in for licensed and decided height fovea in a licking from combines.,0.9334845390106309
384sentences.92,random_withreplacement,sweaters is high enclosed structures this it in leaving and are rich study accordions.,0.8117676217895751
384sentences.93,random_withreplacement,in strength war jacket raw and by related on made the the.,0.8180991533973366
384sentences.94,random_withreplacement,a vegetation human a is slope open door ring raspberry pressed if four a.,0.8150958963866123
384sentences.95,random_withreplacement,and could other i penalty a since water painting and practicing awake.,0.7264741319409566
384sentences.96,random_withreplacement,less people mixture vertical a record don't wood more with mudslides.,0.6750211278838383
384sentences.97,random_withreplacement,diesel a large found sound swamps a can peach their american dams.,1.1801486403319144
384sentences.98,random_withreplacement,are in newborn and of range a often or have with mouth this built moving.,0.7383916487215354
384sentences.99,random_withreplacement,but is hammer families bees silk small some to ski cleaned eject how with.,0.838538689944181
384sentences.100,random_withreplacement,the afraid on lawn parameters of who saw and to machines space.,0.6544766468946344
384sentences.101,random_withreplacement,crew dream on them they mug are pockets muscle taught the healthy showed.,0.8024869535649253
384sentences.102,random_withreplacement,the heel kill have horns sweet an large and my the.,0.6670302521682984
384sentences.103,random_withreplacement,paper or who flakes edge fractures generally bed surrounded bone.,0.7981672045528939
384sentences.104,random_withreplacement,intellectual sharp it of some cooking was images a the pressing in cool pregnant electrical.,0.8059566012984839
384sentences.105,random_withreplacement,cutting exported fruit places four any to cleared away lotteries human.,1.0952137411021396
384sentences.106,random_withreplacement,mixture two rooms by for saws scout the live repair an.,0.7731104283372111
384sentences.107,random_withreplacement,frying or the boots traditionally insufficient are ice thumb puberty sheets.,0.8261304614942643
384sentences.108,random_withreplacement,cold also the while a dream can which high internal or passengers rotating faculty contaminated with.,0.9987008089651275
384sentences.109,random_withreplacement,the violin sometimes are that is they standing and can chips as.,1.2367420969008678
384sentences.110,random_withreplacement,a man attached the that or my its people intact and green on.,0.6806963485950172
384sentences.111,random_withreplacement,for of water where with small when powered of appliance the for high i hip and style.,0.8507774014354905
384sentences.112,random_withreplacement,legs with they on cod is moisture of be since to hot.,0.6687508388584393
384sentences.113,random_withreplacement,has exterior bear nightmare ring tomatoes a in instrument.,0.915000805028096
384sentences.114,random_withreplacement,and styles like in and barred their of a car passage have jackets.,0.9333705605531625
384sentences.115,random_withreplacement,black shark are the family have have pulling overlooking primarily gloves most.,0.6378278904756589
384sentences.116,random_withreplacement,is a sports activities bed off like is on pharmacist water.,0.9422742153607516
384sentences.117,random_withreplacement,an glimpse advisers to or many hunting her exhibitions imprinted the the are other through.,0.6276409039539272
384sentences.118,random_withreplacement,army cell between a engine spend as boys freezes to with task tie in apron.,0.692680500991737
384sentences.119,random_withreplacement,four ancient much diseases back a are other by singers in scientist children food our.,0.726651080497345
384sentences.120,random_withreplacement,used be farmers like of several large usually at because objects construction has a the.,0.8822843936936487
384sentences.121,random_withreplacement,chords it the within storm a have climb the usually at every.,1.0698090033724017
384sentences.122,random_withreplacement,fruit film their stone pitched for computers set eat trigger it's and that lined soar and.,0.906828738077172
384sentences.123,random_withreplacement,tectonic ground growing a statue health at of reservoir me of as migrates.,0.8981202265529957
384sentences.124,random_withreplacement,several tower through a glove that of skin legalized are covers mower pole.,1.0164850142512654
384sentences.125,random_withreplacement,break purposes skin is can farm are of has farmed built kind face.,0.5593042000643484
384sentences.126,random_withreplacement,the form or washing points sound regain fractures motor repair salted animals.,0.8484369304153293
384sentences.127,random_withreplacement,mountaineers the storm timed for to has feed doctors games body their from.,0.8484735847563879
384sentences.128,random_withreplacement,existence also migrate make it are is coffee and and protect.,0.7626058071752503
384sentences.129,random_withreplacement,no stuck is with colorful polar wool even instrument used.,0.9376470769338227
384sentences.130,random_withreplacement,falls served surgical of a hours the eat or.,0.5504266086582047
384sentences.131,random_withreplacement,a is take with through horizontal the of that is of invasion dispense tray.,0.9296740529327927
384sentences.132,random_withreplacement,down take natural about milk vehicles role artists a to or a it low.,0.3122986692290456
384sentences.133,random_withreplacement,rates by mixture interpretation plant spent the covering soldier an or ocean lawn the seat and supplies.,0.9348531896208526
384sentences.134,random_withreplacement,i are ski over final ravens something with blood is and reason in and horse bird.,0.5790927174666395
384sentences.135,random_withreplacement,everyday and to and claws bees vitamin weapon a used of.,0.7336863313145093
384sentences.136,random_withreplacement,on fish killing having stories around stresses isn't floating experience are in shrubs.,0.8864919922051645
384sentences.137,random_withreplacement,watch be ways well consist the if the attack hand for the.,0.5202836075333573
384sentences.138,random_withreplacement,century and more on settlers of and knowledge the a place cod shake.,0.9906881752105869
384sentences.139,random_withreplacement,as and office a must the reveal good differ patterned its the.,0.7116914673443901
384sentences.140,random_withreplacement,often other foot patient's plots on fingers the divorce the a freezer.,1.0477293552094653
384sentences.141,random_withreplacement,is on by medicine can is worried can may poles.,0.34069462158341485
384sentences.142,random_withreplacement,and who powered on tool new when activity fuel of a uncomfortable.,0.7578249417904925
384sentences.143,random_withreplacement,or rainfall put south are conditions eye fish the.,0.7364409624637056
384sentences.144,random_withreplacement,things have classical piranhas has it's to can the have common had of different.,0.5724709940256713
384sentences.145,random_withreplacement,of race and sell use find or the if war them a.,0.8382965566146495
384sentences.146,random_withreplacement,the on has being lentils paper can disease active to knots the or the must.,0.5259435143975495
384sentences.147,random_withreplacement,most air through toll attack part a hospitals have.,0.7442224164718525
384sentences.148,random_withreplacement,and and curved machine red opera poaching or the down aging well kitchen air my.,0.724731562618323
384sentences.149,random_withreplacement,herbal or a national that pollen can a also at.,0.7966871363978417
384sentences.150,random_withreplacement,bee bananas or for for a to located bear typically increased give other weighing the murder is.,0.8637697440895964
384sentences.151,random_withreplacement,ice hard fired tomb can after smooth the classes food hunt in personal split.,0.6199865540395874
384sentences.152,random_withreplacement,shape it's dreams to or hours prescription to bursts pharmacist cartilage ice heavy.,0.7717995467605183
384sentences.153,random_withreplacement,commanders family can out ravens pianist previous uniform raven or on.,0.36190878825479833
