243sentences.215,lowPMI,smell was air thick the the the inside and pyramid chalky was.,1.5858660127011601
243sentences.216,lowPMI,more tomb pyramids pride than of the the the the of just king represented nation.,0.9171873181150937
243sentences.217,lowPMI,care builders their is the the that in pyramid took craft evident.,0.976499185330826
243sentences.218,lowPMI,stones pyramid precisely together structure the and the the until covering were fitted polished gleamed.,1.0792179887362288
243sentences.219,lowPMI,architects still solve pyramids constructed to of the how are working mysteries were.,1.0392440425384804
243sentences.220,lowPMI,think were pyramid's raise blocks some the inside to ramps built walls stone.,1.224610423603084
243sentences.221,lowPMI,others ramps exterior pyramid that the the up of speculate zigzagged walls.,1.421834895700931
243sentences.222,lowPMI,even rock takes strength and beginner climbing courage.,1.0515325585327333
243sentences.223,lowPMI,climbers learning try large who can the on are sport scrambling boulders.,0.9143301880282961
243sentences.224,lowPMI,once comfortable begin ropes climb rock with can that to they're they using safely vertical faces.,0.7963268378607734
243sentences.225,lowPMI,boys were rock all the the of on to trip new climbing.,1.1914034932502808
243sentences.226,lowPMI,many afraid of were heights.,1.4002764725564074
243sentences.227,lowPMI,having else their harnesses them down and someone check knots helped calm.,1.0353962764091666
243sentences.228,lowPMI,adults climbing appropriate the for up set routes beginners.,1.328949403317959
243sentences.229,lowPMI,free-climbing particular rock one of is style climbing.,1.0319553907323735
243sentences.230,lowPMI,climber solely skill strength rock the and a on to relies her physical ascend face.,0.9474352651591355
243sentences.231,lowPMI,rope are equipment and the bolts only used.,0.9307052336255836
243sentences.232,lowPMI,they meant stop she to if the are only climber falls.,1.4560237270752285
243sentences.233,lowPMI,i skied trail buddies me down that the to hesitantly steep my convinced try.,0.7698915362321584
243sentences.234,lowPMI,i bad i myself down a and made turn found tumbling.,0.8129226615646592
243sentences.235,lowPMI,i came flat slope to at of a a the finally stop part.,0.8896689728906366
243sentences.236,lowPMI,my were be my were snow hill to in up and a the skis nowhere found poles lodged drift.,0.7647482050193458
243sentences.237,lowPMI,major professional is use poles a how of strength skiers they ski.,0.7757298459390788
243sentences.238,lowPMI,proper ski improves balance flair skiing of to and use poles their adds their.,1.0612438382750877
243sentences.239,lowPMI,it need body regain balance the to for while minimizes upper movements lost skiing.,0.9436922633969738
243sentences.240,lowPMI,new designs boots skiers more and ski stiffer let turn quickly.,1.4828641832400051
243sentences.241,lowPMI,faster turns twisting legs but the the and on tighter increase force.,1.225891829462649
243sentences.242,lowPMI,has more particularly skier's this to the to in led injuries ligaments knee.,0.8615540834916479
384sentences.0,lowPMI,accordion portable instrument an with a two is musical keyboards.,1.4591596238243643
384sentences.1,lowPMI,keyboard used notes chords one the for for is individual other.,0.9687252682470531
384sentences.2,lowPMI,accordions sound blow reeds with through that produce bellows air.,1.0519218108641528
384sentences.3,lowPMI,accordionist keyboards closing an while the both and plays opening bellows.,1.0474231282644735
384sentences.4,lowPMI,apartment self-contained is building an that a a of is home part.,1.1026343191808319
384sentences.5,lowPMI,apartment more as kitchen an one as and may or a a have rooms well bathroom.,0.71507236603741
384sentences.6,lowPMI,apartments single others some for for are people families.,1.1800886111828486
384sentences.7,lowPMI,building garage facility storage the a or can a have laundry extra space.,1.579366048768756
384sentences.8,lowPMI,apple fruit green yellow an that or a can is be red.,1.5990784272229623
384sentences.9,lowPMI,apples thin sweet seeds skin and a have crisp pulp inside.,1.5451386321088492
384sentences.10,lowPMI,very apples used cider some to tart are make.,1.7590188843970394
384sentences.11,lowPMI,apples eaten roasted pies can in or be raw baked.,1.8261432083087552
384sentences.12,lowPMI,arson criminal burning wildland the a of or is act building.,1.0909897161783155
384sentences.13,lowPMI,fire determines was accident a a or if by investigation fire caused arson.,1.1625928476121672
384sentences.14,lowPMI,arson done damage collect can to to or be cause others insurance.,1.436798729626509
384sentences.15,lowPMI,severity depends were the the whether of on crime people harmed.,1.0447612455993416
384sentences.16,lowPMI,automobile is vehicle passengers an a or for car wheeled transporting.,1.5555083382128498
384sentences.17,lowPMI,car powered electric a by or can a be gasoline engine.,1.9007437464485106
384sentences.18,lowPMI,driver car other just the on the steers roads passengers sit.,1.4425042698436148
384sentences.19,lowPMI,automobiles size doors trunk in and of of the vary number type.,0.8295704364643844
384sentences.20,lowPMI,axe tool split wood the to a and is used cut.,1.0914993186772246
384sentences.21,lowPMI,axe consists attached the a a of to usually head handle.,0.5276059450049646
384sentences.22,lowPMI,historically heads made then of and axe were stone metal.,1.0606232831827624
384sentences.23,lowPMI,axes used firemen buildings by and are woodcutters entering.,1.5913449198582963
384sentences.24,lowPMI,banana long grows soft inside a that with a in a is fruit bunchs edible.,1.4638969559127828
384sentences.25,lowPMI,banana be purple have brown a can and when or ripe yellow red small spots.,1.4457274360712045
384sentences.26,lowPMI,greatest are countries india the or as producers tropical such ecuador.,1.052126121459124
384sentences.27,lowPMI,unripe plantains staple often potatoes and like and bananas are foods cooked.,1.576900366484526
384sentences.28,lowPMI,bed piece used sleep sex a of a or a as to is furniture place have in.,0.5814870231472752
384sentences.29,lowPMI,bed made box sheets covers a a a and of and plus is mattress spring pillows.,0.9693928700691489
384sentences.30,lowPMI,waterbeds is water it filled in with in the and with mattress filled airbeds is air.,1.757879969808704
384sentences.31,lowPMI,type is fabric suspended another the above of a the bed hammock sling ground.,1.9027460159049987
384sentences.32,lowPMI,bee flying black body a with and six a a and is insect yellow legs.,1.3385752301925407
384sentences.33,lowPMI,bees pollen they make between nectar as to spread flowers collect honey.,0.8832638101614646
384sentences.34,lowPMI,bees social live colony hive and a a in in are insects together located.,1.1706480784248323
384sentences.35,lowPMI,many have attack feel and if can bees stingers they threatened.,1.133170589557252
384sentences.36,lowPMI,bicycle vehicle pedals a with and a a two on is wheels frame.,1.5247309140012284
384sentences.37,lowPMI,bicycle propelled cyclist a the a the by of on is pedalling saddle.,1.4325313029895717
384sentences.38,lowPMI,wheels rubber inner full the an with of have tires tube air.,1.5601069937891658
384sentences.39,lowPMI,people bicycles recreation for and use transportation racing.,1.4720262313527706
384sentences.40,lowPMI,blacksmith objects iron a or by creates forging steel.,1.6968128824246203
384sentences.41,lowPMI,blacksmith bends iron change shape a on to and an hammers hot anvil its.,1.2616085267833472
384sentences.42,lowPMI,blacksmiths thick handle tongs a the and with wears apron metal.,1.2746724920742452
384sentences.43,lowPMI,blacksmiths objects horse iron like or make weapons shoes furniture.,1.1690995545452274
384sentences.44,lowPMI,blender kitchen used ingredients food a to a or is appliance mix puree.,1.1594142850840718
384sentences.45,lowPMI,blenders glass container blade a with in or a the have plastic rotating bottom.,1.3852399831071671
384sentences.46,lowPMI,blenders used milk fruit to and are make shakes smoothies.,1.046655184286354
384sentences.47,lowPMI,blenders also make alcoholic crushed to with are used cold drinks ice.,1.2875472265861372
384sentences.48,lowPMI,boy young child not puberty a who a is male has undergone.,1.0458462812405964
384sentences.49,lowPMI,term used sex relative the to to is indicate distinctions girls.,1.3151334862363848
384sentences.50,lowPMI,traditionally play games other like and each to with boys rough fight.,1.5116196718553898
384sentences.51,lowPMI,adult behaving is referred an as to a male immaturely often boy.,1.3304538754697086
384sentences.52,lowPMI,broccoli plant family a the in is cabbage.,1.2010236252956323
384sentences.53,lowPMI,broccoli green head tough a a and has flower thick stalk.,1.4809286153122447
384sentences.54,lowPMI,broccoli high fiber nutrients in and is vitamins other.,1.0430073559550248
384sentences.55,lowPMI,broccoli boiled eaten can or be stir-fried raw.,2.465503012480252
384sentences.56,lowPMI,butterfly flying large a with a four is insect wings.,1.792776218657932
384sentences.57,lowPMI,wings be colorful the can of and butterflies very patterned.,1.117312300993814
384sentences.58,lowPMI,metamorphosis transformation butterfly the a a of into is caterpillar.,1.5001685778013047
384sentences.59,lowPMI,people butterflies colorful some of because collect their wings.,1.8352984673562145
384sentences.60,lowPMI,carpenter artist laborer wood a or with an who is manual works.,0.9148669842573097
384sentences.61,lowPMI,carpenters repair furniture other and and build houses boats objects.,1.95459269773091
384sentences.62,lowPMI,carpenters tools hammers pliers as and use such saws planes.,1.6920311454564008
384sentences.63,lowPMI,luthier carpenter repairs instruments a that a and is makes musical.,0.8355913172884288
384sentences.64,lowPMI,cats small animals tail with and four a are furry legs.,1.4478045455966557
384sentences.65,lowPMI,cats themselves their like by to groom licking fur.,1.3979301748420663
384sentences.66,lowPMI,cats mice are fed owners can but or by hunt birds often their.,1.5199486080483535
384sentences.67,lowPMI,claws are they sharp the so of that cats retractable keep.,1.660294722296817
384sentences.68,lowPMI,chair piece designed sit a of to a for on is furniture people.,0.8425189276941003
384sentences.69,lowPMI,chairs seat floor supported of above a by consist raised level legs.,0.8368845665418007
384sentences.70,lowPMI,chairs have arm as cushion can as and a also back rests well.,0.659102748901688
384sentences.71,lowPMI,seats fixed located places in in or like are chairs vehicles cinemas.,1.342319162413985
384sentences.72,lowPMI,clarinet woodwind instrument a a is musical.,1.6088763908137709
384sentences.73,lowPMI,clarinet long tube bottom a with at a a the is black flare.,1.322431429149558
384sentences.74,lowPMI,player notes keys the and by chooses pressing holes.,1.1898991092396651
384sentences.75,lowPMI,clarinet used classical the in both and is jazz music.,1.3274406805176464
384sentences.76,lowPMI,cod fish colder atlantic a that the the a in of is lives areas.,1.285359501726937
384sentences.77,lowPMI,cod is mild-tasting easily and when and flesh white flakes cooked.,1.627348723826843
384sentences.78,lowPMI,fresh is fish salted elaborate for for and cod used chips cod dishes.,1.809490586258893
384sentences.79,lowPMI,cod been salted time and the the since of has caught traded vikings.,1.3393392003626297
384sentences.80,lowPMI,coffee made beans coffee from of the the is coffee seeds plant.,1.8602948947723723
384sentences.81,lowPMI,coffee popular many usually hot a and in is drink countries served.,0.7192177963873437
384sentences.82,lowPMI,coffee mild called keeps awake a that contains drug caffeine people.,1.6165337687292214
384sentences.83,lowPMI,coffee world's legal export the is seventh-largest agricultural.,1.386553993785081
384sentences.84,lowPMI,desert natural almost falls a where a no is environment rain.,0.902180147326698
384sentences.85,lowPMI,hot are filled dunes with or deserts usually sand rocks.,1.4529923298053038
384sentences.86,lowPMI,animals have live some to and in plants adapted deserts.,1.5450842407550416
384sentences.87,lowPMI,biggest desert sahara africa the in the hot is northern.,1.655384052741417
384sentences.88,lowPMI,desk piece used sometimes a of at a a for with is furniture working computer.,1.100688051449526
384sentences.89,lowPMI,desk flat be wood metal a and of a can or has surface made plastic.,0.9606392100386497
384sentences.90,lowPMI,desk drawers supplies a to may and have store papers.,1.1102783370016034
384sentences.91,lowPMI,cubicle desk partitions a a on of by three consists surrounded sides.,1.5646202232671909
384sentences.92,lowPMI,door movable entrance enclosed a to from a or an is barrier exit area.,1.2520023279453811
384sentences.93,lowPMI,most have control pass to to who through doors locks gets them.,1.024723767634881
384sentences.94,lowPMI,most are pushing handle are by a or after doors opened pulling they unlocked.,1.0731661984958105
384sentences.95,lowPMI,other doors consist chamber of or a can of types slide revolving.,1.049509180700775
384sentences.96,lowPMI,dress piece women wear a of a that is clothing sometimes.,1.3103047748821457
384sentences.97,lowPMI,dress shirt long skirt a a a like to is attached matching.,2.1686585859808645
384sentences.98,lowPMI,dress usually formal such dance a as or at a a is worn occasions wedding.,1.4374244260179068
384sentences.99,lowPMI,it hard stairs bike can or in to a a be climb ride dress.,0.8033868868514306
384sentences.100,lowPMI,drunk is driving alcohol the under of of the driving act effects.,1.6951903381587485
384sentences.101,lowPMI,drunk vehicle crime world of a of any in the driving is most.,1.0338147041465842
384sentences.102,lowPMI,it role half deaths a of in all plays almost vehicle-related.,1.1726161914065338
384sentences.103,lowPMI,drunk are field breathing by and drivers caught sobriety tests.,1.0778668584427504
384sentences.104,lowPMI,drought persistent water caused rain a of by a the of is shortage supply lack.,1.7448186474126697
384sentences.105,lowPMI,drought crops stop die will to and and cause plants growing.,1.1186676065552088
384sentences.106,lowPMI,extreme eventually areas cause will and into drought turn desert famine.,1.3366392305752286
384sentences.107,lowPMI,large people migrate bowls of away to from numbers have dust.,1.1179429012255258
384sentences.108,lowPMI,eagles large prey day very eyesight of during and that the are birds hunt have good.,1.263015411319431
384sentences.109,lowPMI,eagles hooked tearing strong sharp for and have beaks flesh legs talons.,1.3398880709121308
384sentences.110,lowPMI,eagles eyries eat others mammals in some and and live species fish small.,1.4557736010210205
384sentences.111,lowPMI,bald has white is bird states the and of a the the eagle bright head national united.,1.0481154248320326
384sentences.112,lowPMI,earthquakes ground buildings structures the can and and down shake knock other.,1.1049872877282654
384sentences.113,lowPMI,shaking trigger volcanic the and can also landslides activity.,1.3537764282935965
384sentences.114,lowPMI,most are release earth's by of the the in earthquakes caused energy crust.,1.0718015971091186
384sentences.115,lowPMI,earthquake displace cause an can and at the a sea seabed tsunami.,1.5071175099397227
384sentences.116,lowPMI,elephants largest land weighing tons the of are kind mammal several.,1.637858465842704
384sentences.117,lowPMI,elephant long called grab food an a can a which or has nose trunk things.,0.6999522723465476
384sentences.118,lowPMI,elephant pair tusks objects trees the of or a for into has ivory moving digging.,1.1496365141917373
384sentences.119,lowPMI,elephant its ears blood its the the and to in flaps large cool them body.,1.0320313867179634
384sentences.120,lowPMI,eye organ light it cortex the for for an and the is sensing coding visual.,0.880057240356634
384sentences.121,lowPMI,most have eyes color texture which and can animals complex detect motion.,1.112175293870006
384sentences.122,lowPMI,fovea center eye sensitive it the of and of the the the is human most part.,0.9040635310632879
384sentences.123,lowPMI,insects compound made units many up in of have eyes eye facing directions.,0.7848814405466186
384sentences.124,lowPMI,farm land grow raise food a or to for is used plants animals.,1.279555330208469
384sentences.125,lowPMI,farmers people farm produce the the what who and to are run decide.,1.0333156212603105
384sentences.126,lowPMI,farms have farmers barn a a a for and usually house silo.,0.8674489146552716
384sentences.127,lowPMI,cooperative farm farmers land a where and a the is many share equipment.,1.2745425330506654
384sentences.128,lowPMI,primates have thumb four a each and on usually fingers hand.,0.7855743298620441
384sentences.129,lowPMI,fingers used writing other for and are grasping grooming activities.,1.3394291391590276
384sentences.130,lowPMI,fingertips sensitive pressure the and to are temperature vibration.,1.045392304559461
384sentences.131,lowPMI,nail tip be decorated the of and or the the can protects finger grown.,0.8290682235907744
384sentences.132,lowPMI,flood overflow water inhabited a of of an an that is expanse submerges land.,1.4708908493932589
384sentences.133,lowPMI,flood caused rain snow as earthquakes can or at by as be heavy rapid melt well sea.,0.7065338704415213
384sentences.134,lowPMI,flood flow its break levees in a of and a will or river out channel dams.,1.0894538418586626
384sentences.135,lowPMI,flood evacuate water diseases during and a the people contaminated causes.,0.9311156974581235
384sentences.136,lowPMI,floor horizontal building walking a inside for a a is surface used on.,1.3223628314191398
384sentences.137,lowPMI,floors made concrete linoleum floorboards may or of be bare tile wooden.,1.6243321426793558
384sentences.138,lowPMI,people put floor dampen on for to a and often carpets comfort noise.,0.8674917625328062
384sentences.139,lowPMI,buildings often pipes wiring in and the under floor has electrical it.,0.9407469442615557
384sentences.140,lowPMI,foot body end a on of a the a is part leg.,1.0917779031596402
384sentences.141,lowPMI,people their walking standing when or use feet running straight.,1.1860183014698893
384sentences.142,lowPMI,people use feet fighting to both in and also their kick sports.,0.924469788540098
384sentences.143,lowPMI,many have behavior feet for to cultures rules related.,0.4582848567848083
384sentences.144,lowPMI,forest area density canopy a with of an a and is high trees cover.,1.6698485291792513
384sentences.145,lowPMI,type depends rainfall location the on in of and forest temperature its.,1.1357492701506253
384sentences.146,lowPMI,forest has types animals well plants a and of as ecosystem various trees as ground.,0.8752335479699437
384sentences.147,lowPMI,deforestation cutting disregarding the of down is forests regeneration.,0.8326858123159683
384sentences.148,lowPMI,fork tool solid handle tines a for a a with and is eating foods several.,1.3514190024543722
384sentences.149,lowPMI,forks usually metal disposable of if or are made plastic.,0.940707234550862
384sentences.150,lowPMI,forks used food hold place to the to while to or in are lift mouth food cutting.,0.5576110616204589
384sentences.151,lowPMI,forks used cultures special various in there and for are western are kinds foods.,0.8462350100227704
384sentences.152,lowPMI,frying is pan sides a with a a and pan small sloping handle.,1.8781921605783392
384sentences.153,lowPMI,frying is fry brown a and to pan used sear food.,1.6511113304899456
384sentences.154,lowPMI,food cooked covering pan the the the on of is oil bottom.,1.455790915319602
384sentences.155,lowPMI,frying are iron steel of or pans made teflon-clad.,1.8184585427629383
384sentences.156,lowPMI,girl female has yet maturity a who a is human not reached.,0.8471102853016151
384sentences.157,lowPMI,body develops at the a that a puberty of into of girl woman.,0.9591821605041082
384sentences.158,lowPMI,girls playing social like and with often dolls games.,1.271481276639834
384sentences.159,lowPMI,girls grow hair dresses and and sometimes long wear skirts.,1.7150021686628036
384sentences.160,lowPMI,glove piece covers fingers a of the a that and is clothing hand.,1.090546999484261
384sentences.161,lowPMI,gloves cold made lined material to of against or protect are wool waterproof.,0.8371394293421768
384sentences.162,lowPMI,disposable latex are shield germs or from to or rubber gloves used hands chemicals.,1.4797519652685573
384sentences.163,lowPMI,mitten kind fingers covered a of the a where four is glove are together.,0.8484943439283502
384sentences.164,lowPMI,hammer tool deliver object a to to a an an is used impact.,0.9772694645098855
384sentences.165,lowPMI,hammer most used nails a into to is often drive wood.,1.235338392043904
384sentences.166,lowPMI,claw be remove the the to on can head used nails.,0.8919999031004662
384sentences.167,lowPMI,hammers shape handle in of and the the vary head length.,0.8667096975831783
384sentences.168,lowPMI,hand is used people a as against an a grenade explosive weapon.,1.8119578078109946
384sentences.169,lowPMI,hand are timed bit and a to after grenades thrown explode that.,1.3973631218092122
384sentences.170,lowPMI,grenades be rifles launchers can or from also fired shoulder.,0.9475690312513897
384sentences.171,lowPMI,gas are middle disperse tear the a into of to grenades thrown mob it.,1.13957723070472
384sentences.172,lowPMI,horse large mammal muscular a with a four is hoofed long legs.,1.5401227728121618
384sentences.173,lowPMI,horse tail its is gray a and on or a a and has mane neck usually brown.,1.2121981823865298
384sentences.174,lowPMI,horses been draft travel for and have used work entertainment.,0.9082423421405276
384sentences.175,lowPMI,human horse walks gallops a a or can while ride it trots.,1.1827517170626167
384sentences.176,lowPMI,people hospitals healed are injured to when to or go be they sick.,0.925920768922722
384sentences.177,lowPMI,hospitals staffed physicians nurses by and are professional surgeons.,1.8776014086333692
384sentences.178,lowPMI,patients there diagnosis leaving day some or for the go specialist therapy same.,0.7914171721431119
384sentences.179,lowPMI,operations patients stay weeks for or for some to treatments have several.,1.3074070029002707
384sentences.180,lowPMI,house permanent structure families in a or or a for to is building people live.,0.7467180709504465
384sentences.181,lowPMI,house roof keep rain let in a and out and a to and to has walls cold windows light.,0.5579191946466481
384sentences.182,lowPMI,house rooms sleeping washing a for or can like have purposes cooking.,0.882066001470217
384sentences.183,lowPMI,most leave work back eat the and to to at and people house come night sleep.,0.5928281356678462
384sentences.184,lowPMI,igloo type made snow an of of a from by is shelter blocks inuit.,1.0618723437751791
384sentences.185,lowPMI,igloos built snow land time in the the where of are places covers most.,1.5383075691860693
384sentences.186,lowPMI,igloos often shape entrance in of with the a an are built dome tunnel.,0.9831286902295098
384sentences.187,lowPMI,air snow space heat igloos in and the pockets insulate body warms.,1.6470595059215603
384sentences.188,lowPMI,knife tool edge used things a with that a a to is sharp is cut.,1.1417138994127336
384sentences.189,lowPMI,modern consist blade made of and of a a knives handle usually metal.,0.8934819853608915
384sentences.190,lowPMI,knives also used instruments as in and have been weapons rituals.,1.3093804462404417
384sentences.191,lowPMI,knife used slashing throwing a to or can by be attack stabbing.,1.159394017249304
384sentences.192,lowPMI,lentils seeds legume the a the of of are plant family.,1.2033018557342525
384sentences.193,lowPMI,lentils red brown yellow can or be green black.,2.2927557512799743
384sentences.194,lowPMI,lentils commonly indian cuisines in and are used mediterranean.,0.981748910585936
384sentences.195,lowPMI,lentils cooked are source by a and of are boiling great protein.,1.0506394680649511
384sentences.196,lowPMI,lettuce biennial often temperate leaf a as in a is plant grown climates vegetable.,1.0466282283209958
384sentences.197,lowPMI,lettuce eaten raw other cooked can in or and and be cold salads dishes.,1.5434236249638047
384sentences.198,lowPMI,lettuce considered easy suitable beginners to a and for is fairly grow crop.,0.9350122424075149
384sentences.199,lowPMI,most leaves bitter bred bitterness but to some the lettuce taste are remove.,1.2178120129050978
384sentences.200,lowPMI,library place books media kept a where of a a and is collection documents is.,1.01798437748219
384sentences.201,lowPMI,librarians libraries experts organizing at at and and work are finding information.,0.8268599190129143
384sentences.202,lowPMI,people public borrow take several can and for to to go libraries books home weeks.,1.1361676600006652
384sentences.203,lowPMI,academic support research specialized and libraries scholarly have books.,3.1555464497364056
384sentences.204,lowPMI,log is house round a from a cabin small built logs.,1.7752326861729744
384sentences.205,lowPMI,log is american life origins a and of cabin symbol frontier humble.,1.0957432974267933
384sentences.206,lowPMI,log were first european as by cabins used shelters settlers.,0.9314813387063913
384sentences.207,lowPMI,log were using notch ends with the at cabins built logs joints.,1.5105233232310118
384sentences.208,lowPMI,man male adult a a is human.,1.6422485988246065
384sentences.209,lowPMI,boy man puberty a after a through becomes passing.,1.2369283927176529
