243sentences.0,random_withreplacement,three climb around the the spears vapor.,1.3497552122501644
243sentences.1,random_withreplacement,bed are piece insects generally the specialized a bears maintenance for a take.,1.119801209034034
243sentences.2,random_withreplacement,frying no a cost an consists a mudslides house plant the will in engines and use dreams hammer to have.,0.9225435275178273
243sentences.3,random_withreplacement,stir-fried race risk a losing latex world if storage pan is with extra horror fly.,0.8996092905171066
243sentences.4,random_withreplacement,of and down people sharks found the used a a and and jacket economic a.,0.7324627917182058
243sentences.5,random_withreplacement,a revolving hospital my the of tumbling beekeepers that colder.,1.3578320843784697
243sentences.6,random_withreplacement,good is reasons is a pure turn breathing places or vultures.,1.1411962404547875
243sentences.7,random_withreplacement,airbeds and a traffic one kick each hive a my less to have gets and other.,0.9042083692038487
243sentences.8,random_withreplacement,comfort in the divide can the so awake each wall snow wall castle with decided.,1.117812537295271
243sentences.9,random_withreplacement,and your connected it straight of cream of sick are from.,0.4203429876967884
243sentences.10,random_withreplacement,the that western there a expansion with a is passengers them at horns a dealt.,0.8726893539913888
243sentences.11,random_withreplacement,in hot because vivid sit sleep fascinated fairly they have losing offer execute tropical.,0.6754847141588525
243sentences.12,random_withreplacement,man trains locomotive an and vehicle-related a use a used disperse made cable or head type and log and.,0.6892281745607963
243sentences.13,random_withreplacement,professional shelters insect barrel heat more a open which.,0.4999195403937537
243sentences.14,random_withreplacement,popular tons patients admission most long type the class an.,0.49780701405277156
243sentences.15,random_withreplacement,chew fish in as the when looming a in cutting after the in cooked lives costumes did.,1.1138392695682113
243sentences.16,random_withreplacement,river mild on more fabric train raised tropical collect an the cold conferences machines fairly.,0.4899844386973148
243sentences.17,random_withreplacement,controversial diverse to compartment newborn girls horse a and jacket or fed cartilage to streamlined jackets are contains feet.,0.8098584614324196
243sentences.18,random_withreplacement,pierce and to full i to or of to sound can national an the elements.,0.43712498906285974
243sentences.19,random_withreplacement,above beneficial that soar inside and has a and they called but.,0.8008707432706639
243sentences.20,random_withreplacement,firemen and just to high are some by on fever cooked and pedals in.,0.9340684414281141
243sentences.21,random_withreplacement,stalk smoothies law plain finger others suggest still platform salted beekeeper upper hospitals.,0.736453046900421
243sentences.22,random_withreplacement,to incorporates log pool typical fines of given window scary land artisanal used house of a can.,0.48483862656233795
243sentences.23,random_withreplacement,they i and eating in composition the inland by with feet.,0.9079366564591154
243sentences.24,random_withreplacement,smell die a eye taste be record the usually theft times dramatic horse trains the carnivores cheese.,0.7290411695671409
243sentences.25,random_withreplacement,a are instrument the artists chose cardigan backgrounds and me grows around blacksmiths in and spawn.,0.9906636051581851
243sentences.26,random_withreplacement,effort to bread and front moves boiled sick the by the day message.,0.9404283804798489
243sentences.27,random_withreplacement,moving popular protein with a facility eyes neck piranhas be effort.,1.0552097967344911
243sentences.28,random_withreplacement,a flower were clarinet often ninety fovea levers but be rivers his importantly.,0.36631593432024895
243sentences.29,random_withreplacement,human replacement is this are engaging and people bud the how.,1.008535139239264
243sentences.30,random_withreplacement,and their castle's and of cabins vary prey.,0.9657744093051337
243sentences.31,random_withreplacement,produced caught eat peach be back the difficult cause whipped-in determines release because the.,0.5148107548701688
243sentences.32,random_withreplacement,warms shelves from humble beekeeper's also thin vapor sneak together trunk made space logs stereotypically time.,0.5778285211837574
243sentences.33,random_withreplacement,my patrons other hole wind ice machine house the together and.,1.0505753790620804
243sentences.34,random_withreplacement,a crushed a blind the objects land forks and and careful made sleep made most member.,0.9104953378950056
243sentences.35,random_withreplacement,major atop into and an producers be the in and or wheels ramps.,0.673270795811098
243sentences.36,random_withreplacement,open and something apple they're more asleep to the are.,0.6124220571400392
243sentences.37,random_withreplacement,or in if reading from feeding that its is hunt treated a home frozen nutrients determines.,0.8347064306359587
243sentences.38,random_withreplacement,the time creates when a a a it blacksmith plant someone.,1.3932788459805223
243sentences.39,random_withreplacement,that most leather produces of are knives i described and once feet once are early.,0.7754167397198058
243sentences.40,random_withreplacement,makes garment students line patients brush move temperature barrel the land even share is and.,0.5006823631708319
243sentences.41,random_withreplacement,have vegetation by but refrigerator the air the through peaches nectar a television are.,1.0945364331056051
243sentences.42,random_withreplacement,green be my malaria objects but own people of an.,0.302379493103905
243sentences.43,random_withreplacement,and and stiffer things nails lizards use a roof are even were affordable tool.,0.7013727146167997
243sentences.44,random_withreplacement,many most grow a waterbeds will drink lost a diagnosed.,0.7027537845648091
243sentences.45,random_withreplacement,out for be rains weapons grows bit ear indicate eject evacuate gone experience desk have or as legally into applies.,0.41726020891468135
243sentences.46,random_withreplacement,to a land the with are patients bird in mosquitoes talking falls a.,1.071912289268702
243sentences.47,random_withreplacement,uses i'm has as time like cooked food modern used green dress the grow.,0.8591582973505637
243sentences.48,random_withreplacement,much become is levels eye and orange-yellow dump killing blacksmith for hot could is two nesting sheets.,0.712154289119263
243sentences.49,random_withreplacement,of with single research bird completing seat vehicle tray and and green for.,0.7779782076718874
243sentences.50,random_withreplacement,from can has these with bright air that experience it a.,0.6832482828935751
243sentences.51,random_withreplacement,away skill the is new rings sounds people the desert darkness lens when fiber.,0.9728449218418762
243sentences.52,random_withreplacement,of in who cream change the beekeeper's and parrot to or storms the.,0.7257906723487777
243sentences.53,random_withreplacement,breeding house adults are honey smell steers is and for intensity less sharpened.,1.03588715832657
243sentences.54,random_withreplacement,the rituals and yellow and i've bed different behavior have the infected as.,0.6938597454224126
243sentences.55,random_withreplacement,and have the has a they often contact edible to axe shuttle ice downright with are.,0.7659940912858241
243sentences.56,random_withreplacement,four while of with tough refrigerator are or very latest told cheese carrion house.,0.6988186124093818
243sentences.57,random_withreplacement,protects chemistry each up in considered faces change for has it's with has.,0.8903339820193351
243sentences.58,random_withreplacement,experiments four is fields ends lined produced owl's upon mild-tasting is when called.,1.2239597972200025
243sentences.59,random_withreplacement,fortunately called played to glimpse bear that the above is infantry.,0.6933112657291687
243sentences.60,random_withreplacement,for a to to area a in and can't to their.,0.6585912667438698
243sentences.61,random_withreplacement,beginners the cream respond off cut if or.,1.1713194373936866
243sentences.62,random_withreplacement,shelters entranceway are rates the local carpenter.,1.0522441505222908
243sentences.63,random_withreplacement,forces fired ecuador freight of breeding between a stabbing part art the are freezes earth silk the film the.,0.8255523857030478
243sentences.64,random_withreplacement,cider more of reproductive deforestation protein with people lapels strength our wear the have from all a battles.,0.9686169810942045
243sentences.65,random_withreplacement,evident subject that for they between crisp house made has protection and for gambling rates rifles.,0.9033669824411563
243sentences.66,random_withreplacement,precisely or tines run parasite used the to knives child much skis murder or bald.,0.9025134570046485
243sentences.67,random_withreplacement,halfway in and that mouth the both half-closing to pan a than paralyse.,0.6571329880541642
243sentences.68,random_withreplacement,field a scientists a them harden bring the of as and a this toaster.,0.7309726791846096
243sentences.69,random_withreplacement,the their unripe my hot are female fish can some the stalk air.,0.8394866023351628
243sentences.70,random_withreplacement,is end manual it of ways top for school as that made of to solely of a.,0.7160720539382714
243sentences.71,random_withreplacement,both states treatments a by contaminated man adult up practicing type after swamps.,1.0619776363942743
243sentences.72,random_withreplacement,heating the fever a of health and does to female vehicle a they real has seal.,0.8106673009617174
243sentences.73,random_withreplacement,on a a glove a around individual a from platform a tool enormous.,1.1946340192655647
243sentences.74,random_withreplacement,birds the of people are and you motion when boy an man on but.,0.9135362699065437
243sentences.75,random_withreplacement,ocean social freight field most meal it felt-tipped covers internal by who for a.,0.5162240617308295
243sentences.76,random_withreplacement,of i the body deficiencies our of a ice vehicle new to a.,1.1398746911028457
243sentences.77,random_withreplacement,flavorings have be i sharp when animals the dump developing on i cold nose instrument a from.,0.620513098034185
243sentences.78,random_withreplacement,record cream around sand computers some into water predate.,0.9330725576050812
243sentences.79,random_withreplacement,public hand typical pharmacists occasions is its i've together is most are just sever igloo.,0.46368017238136344
243sentences.80,random_withreplacement,or and the accident surgeons of they on lotteries dishes container and use mugs by.,0.9820073140674421
243sentences.81,random_withreplacement,to stone various a after toasters when tool girl electrical same doing or.,0.5014246836991454
243sentences.82,random_withreplacement,the powered has of in log record ways.,0.731668751919732
243sentences.83,random_withreplacement,bread station or and injured travel by and less referred a spent more the as build and.,1.1018556318210062
243sentences.84,random_withreplacement,of will used most skin a property may the a is how.,0.509731067180313
243sentences.85,random_withreplacement,race can bear piano wanted well a that tip motor coastal her for an.,0.6384828856859965
243sentences.86,random_withreplacement,the images people are luthier responded cats against different tools playing of we.,0.9460492953187146
243sentences.87,random_withreplacement,astronauts how cause classes fertile give knives cliche and to two folklore ninety in.,0.4874021634679462
243sentences.88,random_withreplacement,twisting was can eat dream and butterflies distances win is a.,0.8737435641580572
243sentences.89,random_withreplacement,remove singers personal sex a with to increased whale and.,0.6849412384990123
243sentences.90,random_withreplacement,by have by at called it's rope as patients fields that building but field the a.,0.42003183937585337
243sentences.91,random_withreplacement,down of in and came spears muscular.,1.0214575387544567
243sentences.92,random_withreplacement,causes the that snow as ear is some office tongue honeybees was.,0.9570275107808536
243sentences.93,random_withreplacement,and and others clothing stresses divorce used squeezed blowholes ears is.,0.878034487525634
243sentences.94,random_withreplacement,every and soft can through in may were the rooms inhabited wall sounds a manual.,0.7231085335266771
243sentences.95,random_withreplacement,are snow flavorings paper instrument red will to who infection go can a weight be.,0.8043640560064548
243sentences.96,random_withreplacement,compartments regions have screen licensed a console is a to.,1.1398598222706084
243sentences.97,random_withreplacement,suck when from not in i fish be less of safe environment receivers world.,0.7894081137130198
243sentences.98,random_withreplacement,books beginners eaten they turn is used done has increase train that pressing eat sensitive bitter.,0.6383320338553352
243sentences.99,random_withreplacement,inside stalk and and together most in tropical a painter designs the the.,1.0445463601948568
243sentences.100,random_withreplacement,electric them animation outside games are savory cold whales to silk in of have conducted documents well.,0.6451569480817363
243sentences.101,random_withreplacement,attire man against the is on together a on a dominate adjust.,0.8230128452120511
243sentences.102,random_withreplacement,fingertips because comfort if skiers when the in bad bear for any fry they.,1.024099969953279
243sentences.103,random_withreplacement,neck on small a slightly imitate eat manage own.,0.6857329828948215
243sentences.104,random_withreplacement,hole over and have takes which problems or the use when that rain.,0.9579448956374708
243sentences.105,random_withreplacement,people in in for that castle magnificent many salmon.,1.0471290734955223
243sentences.106,random_withreplacement,simple horse the a of six is her objects hunted with bitter increased and.,0.9972008062473756
243sentences.107,random_withreplacement,within problems from regeneration a it often acting tail a plants broccoli off a popular from.,0.6550303667750045
243sentences.108,random_withreplacement,consists to high-priced hold kind more in is animals patients of.,0.5559232650312395
243sentences.109,random_withreplacement,the are forest water fish will wildland atop lost plants over people is worn.,0.787534480102305
243sentences.110,random_withreplacement,winds lentils a is to costumes be brown freight at strongest fish.,0.43785530463779115
243sentences.111,random_withreplacement,make a and of diagnosed a off a to more.,0.5211434895793625
243sentences.112,random_withreplacement,out a once are spiders or american more this water such.,0.6312351722803813
243sentences.113,random_withreplacement,quickly or yellow pyramid are new in are early people and.,0.763984631530667
243sentences.114,random_withreplacement,instrument can the in makes insulation widespread take for the back the most of tomatoes.,1.084140277158557
243sentences.115,random_withreplacement,fitted also in newborn be factor the school different for knee shelter small set animals.,0.8731008359876151
243sentences.116,random_withreplacement,they a can snow outside a patients are diseases skiing seriously in.,0.7648658992069702
243sentences.117,random_withreplacement,and had a piano to with long bees personal scout believed transports the.,0.9996287097698369
243sentences.118,random_withreplacement,cutting by have hunt and sports to shoulder or sensitive check the.,0.9585559942895998
243sentences.119,random_withreplacement,fire climbers space rotating he x-ray for for delicate lettuce to passive.,0.5393130285726774
243sentences.120,random_withreplacement,hairs hard by protein zigzagged skier's a work blade and once out taste advent can mammals of visual.,0.7478081937099507
243sentences.121,random_withreplacement,followed growing of however on snow large.,0.4660081419283374
243sentences.122,random_withreplacement,diagnosis mug orange inundation is of with can tongue construction have its place.,0.6606416424002844
243sentences.123,random_withreplacement,will families the yellow subject has many tail a large bees sixteenth.,0.8047773494088789
243sentences.124,random_withreplacement,to by a the to many spiders hardest wings kinds pass its of storms.,0.8600277865404959
243sentences.125,random_withreplacement,was are four products real a sit gone help with mowers be scene.,0.758981436566156
243sentences.126,random_withreplacement,the evidence theft not on a for scientists used and on with have determines eyes.,0.650864401360483
243sentences.127,random_withreplacement,another my each a have do on and mangos of largest the and house unlawful.,0.6986530221314284
243sentences.128,random_withreplacement,were found fish to soybeans water often with blacksmith changes can at the music and.,0.9306970390450365
243sentences.129,random_withreplacement,you rooms tropical hill the problem cause and range friends computer.,0.6054137639710573
243sentences.130,random_withreplacement,their and car the she the supplies are to focused attack finding in.,0.7954556208141931
243sentences.131,random_withreplacement,you small can while on casino the later air been bone stick causes heights a.,0.7289963763735359
243sentences.132,random_withreplacement,mammal were falls that chamber grow flood patients brand concert an body brightly-colored from the.,0.5870188251735923
243sentences.133,random_withreplacement,our and ski seen back the creates to once i market a.,0.6503945784025654
243sentences.134,random_withreplacement,wall floating walls eat some and is worse determines launchers people use must levees with migrate.,0.6947460149422736
243sentences.135,random_withreplacement,day camouflage early hot legs nectar export and protein is an scavenging a air i trousers to bunchs climbing the.,1.177773032357553
243sentences.136,random_withreplacement,decades vitamin are a as much that do as are part as worth dress you the firearms.,1.0085384834422353
243sentences.137,random_withreplacement,than covers tearing has in foot other a knows to use wall climbing level program the rituals.,0.6526691948833055
243sentences.138,random_withreplacement,the personal be single salads height flaps have piece most or the wall no or yellow to iron.,0.5101695830270041
243sentences.139,random_withreplacement,often most the cream each or screwdriver prominent books materials from or a to people.,0.7673759583430175
243sentences.140,random_withreplacement,inside up a health half-frozen primarily insects before of.,0.563558943197789
243sentences.141,random_withreplacement,a being and of another can mowers delicate have than movement in every a just.,0.8163197354063788
243sentences.142,random_withreplacement,tail capable raspberry of we is lawyers allow has of.,0.625172488316842
243sentences.143,random_withreplacement,glow smooth bridging building they're in pesticides race and or a plants feudal.,0.8332551220655758
243sentences.144,random_withreplacement,to use in expensive and fed to their caused blood felt that bees.,0.9874485015394838
243sentences.145,random_withreplacement,like before makes 8 ice up flare a the a caused effective of.,0.8331369824759342
243sentences.146,random_withreplacement,dispense the is transformation animals perfect environment.,0.7752138555960777
243sentences.147,random_withreplacement,company a act object were they instrument stone an handle less.,0.6993580793227872
243sentences.148,random_withreplacement,caused i barn steel as stop and and be.,0.45811538709326544
243sentences.149,random_withreplacement,the kill of and 8 raspberry is holds to a day the a many.,0.6812502487178431
243sentences.150,random_withreplacement,of are of head a on doors the was pianist to eyes is my formed up information.,0.8390674113331702
243sentences.151,random_withreplacement,their and plastic transformation used eye a a like house at.,0.8822739066884197
243sentences.152,random_withreplacement,where that a are luthier plays format theft glass who that.,0.5266310910535414
243sentences.153,random_withreplacement,four a feet is supplements stuck the use and science large can.,0.8991444744120823
243sentences.154,random_withreplacement,me primarily prescription produced the female and garlic scenery show masculinity in but.,0.7562892843038117
243sentences.155,random_withreplacement,eye a the side the used poaching and in documentary.,0.8547579637375461
243sentences.156,random_withreplacement,but the walls a night as a stations fever who disregarding and beyond traumatic a liquid.,0.750984529051952
243sentences.157,random_withreplacement,shakes sharpened pedalling furniture are astronaut he bud carrion are for building.,0.6075154295174426
243sentences.158,random_withreplacement,the mammals used muscular a and fingers house does roasted are beaks does butterflies modern.,0.8128684737511884
243sentences.159,random_withreplacement,and toasting will her books small swamps above easily blindness metal ripped trees.,0.8275993615527869
243sentences.160,random_withreplacement,food ocean piano music displays with webs out have night legs finally.,0.7616470671524426
243sentences.161,random_withreplacement,and breathing with they learning or many a be sports.,0.4497336023353935
243sentences.162,random_withreplacement,coastal on drink to make related social the release band-aids noise and.,1.100417037891002
243sentences.163,random_withreplacement,because window from honeybees go a she keep for a cream instituted.,0.5485728411237378
243sentences.164,random_withreplacement,to is ocean have drafting inside the consist alcohol steep a category.,0.6080804447704768
243sentences.165,random_withreplacement,most grooms a plate fields body and from on spear was a high is axes also i decades.,0.8646923579797948
243sentences.166,random_withreplacement,by child a at pair atop up in out the pollen has but things described.,0.9462601371424205
243sentences.167,random_withreplacement,remove have a talons a a a electrical taking an usually panes sear.,0.743315405310163
243sentences.168,random_withreplacement,air can't scene by for whale water hammer in style roasted independence shaking feathers.,0.7489707247490031
243sentences.169,random_withreplacement,worse the the gambling our and surroundings.,0.5631617299345419
243sentences.170,random_withreplacement,almost difficult and is filled surroundings and into food.,1.1189361021019322
243sentences.171,random_withreplacement,and motion that height bitterness the the of craft product the enter.,1.4800705231253415
243sentences.172,random_withreplacement,throwing are frying vegetation artist's when is the the carpenters toasters instrument.,1.081662359632993
243sentences.173,random_withreplacement,hunt compound no weight devastated can health reproductive exported mouth must for legs.,0.4293431937734195
243sentences.174,random_withreplacement,kitchen the you to flying as of the over.,0.8260104262990252
243sentences.175,random_withreplacement,even there and is flights mammals vultures health animals black are the it's specialist some.,1.0053379237818332
243sentences.176,random_withreplacement,creates exams i that a fish risk standard graphics in an in of.,0.78851624237829
243sentences.177,random_withreplacement,for night have where green migrate are log crisp provide fabric that entranceway in have.,0.6233873953042193
243sentences.178,random_withreplacement,will mammals cyclone with used high new with visual fruit major an never is windows the of feeding.,0.7481799741213809
243sentences.179,random_withreplacement,violin satin mugs used tuxedo considered solve its long liquid are person jazzing plain to size deposited to.,0.44687301287104136
243sentences.180,random_withreplacement,half-closing are the how a legs to i have an is theft all a a of advisers started.,0.6658962549688395
243sentences.181,random_withreplacement,discourage weapon used let tropical with from orange a the cinemas that yellow environment clearer.,0.7384467304540947
243sentences.182,random_withreplacement,crops hours previous other quickly the fuel.,0.9804719313752391
243sentences.183,random_withreplacement,string puberty comfort self-defense fractures moves low types time.,0.28523426321159756
243sentences.184,random_withreplacement,and of the had saddle tines clearly small they of range may i people government have.,0.7729041260954341
243sentences.185,random_withreplacement,a the to cubicle characteristic them flesh small gets holes soldier seeds.,0.83038864832459
243sentences.186,random_withreplacement,landslides of pan used the solely of is and strong.,0.7622040101867321
243sentences.187,random_withreplacement,a isn't slashing with presence surface and neck a on.,0.7210559291728135
243sentences.188,random_withreplacement,doctors explosive as of spend feelings intent carried and nowhere the ski.,0.7627085661785011
243sentences.189,random_withreplacement,do public showcase shots shattering several taught a preferences medical parrot substantial control.,0.9934344619303387
243sentences.190,random_withreplacement,not expanse and within and house mammals more the crushed can should sturdy.,0.5069304497043292
243sentences.191,random_withreplacement,painting of to space a which the or for toppings downsizing work with.,1.3421235382390562
243sentences.192,random_withreplacement,on houses into the polar is are shallow that the down new.,0.9798455378791419
243sentences.193,random_withreplacement,a and maturity insulation other virility ravens who fruit change or the farmers hoofed coding papers.,0.9015302279558173
