243sentences.219,Scr7,still working architects are solve to the mysteries how of pyramids constructed were.,44.02285685825309
243sentences.220,Scr7,ramps were some think inside built the pyramid's to walls raise blocks stone.,17.89673385488396
243sentences.221,Scr7,that others ramps speculate up zigzagged exterior the of the walls pyramid.,30.149438741688698
243sentences.222,Scr7,even climbing takes beginner and courage rock strength.,10.684622922352304
243sentences.223,Scr7,are climbers learning who sport the try can on large scrambling boulders.,20.71861622808167
243sentences.224,Scr7,comfortable with once they're they that can begin using ropes to climb safely vertical faces rock.,56.179058089935644
243sentences.225,Scr7,the all boys of the on were trip to rock new climbing.,23.11528574297671
243sentences.226,Scr7,of heights many afraid were.,5.814730270777567
243sentences.227,Scr7,else having check someone knots their harnesses and them calm helped down.,28.471224440312838
243sentences.228,Scr7,set up the routes adults climbing for appropriate beginners.,25.56265974895662
243sentences.229,Scr7,free-climbing particular style is rock of one climbing.,14.332022945589971
243sentences.230,Scr7,relies solely the climber her on skill and strength physical to a ascend rock face.,48.494808475819305
243sentences.231,Scr7,rope are the and equipment only bolts used.,9.889970761396585
243sentences.232,Scr7,meant they only are stop to climber the she falls if.,25.87556508431237
243sentences.233,Scr7,skied down i hesitantly steep the trail that buddies my convinced to me try.,49.404184348898
243sentences.234,Scr7,a i bad made and turn found i tumbling down myself.,19.63922142777936
243sentences.235,Scr7,came to i finally stop a at a part flat of slope the.,36.034960269584985
243sentences.236,Scr7,skis my be were to nowhere found and poles my were lodged in a snow drift up hill the.,56.70152295962142
243sentences.237,Scr7,strength a of major skiers professional how is use ski they poles.,23.251963878952495
243sentences.238,Scr7,of ski proper use improves poles their balance adds and flair their to skiing.,29.33474645793986
243sentences.239,Scr7,the need it minimizes upper for body movements regain to lost while balance skiing.,32.90706897914946
243sentences.240,Scr7,designs new and ski boots stiffer skiers let more quickly turn.,35.765904216817816
243sentences.241,Scr7,and but tighter faster increase turns twisting the on the force legs.,27.41215489478409
243sentences.242,Scr7,led to this has injuries more particularly to in ligaments the knee skier's.,32.31630853972625
384sentences.0,Scr7,is a an accordion musical portable with instrument keyboards two.,32.24412782742945
384sentences.1,Scr7,is one used keyboard individual for the notes for chords other.,25.124052719791212
384sentences.2,Scr7,sound with accordions produce that bellows air blow reeds through.,26.093428643729414
384sentences.3,Scr7,plays an both accordionist while keyboards and opening the bellows closing.,33.92288248622969
384sentences.4,Scr7,is an a apartment home self-contained is that of a part building.,23.730045626544463
384sentences.5,Scr7,may have an apartment or one more rooms as well as kitchen a and bathroom a.,50.728011874945196
384sentences.6,Scr7,are for some people apartments single for others families.,19.184575408400207
384sentences.7,Scr7,can have the building garage a a laundry or facility extra space storage.,45.77399440345704
384sentences.8,Scr7,is an a apple that fruit be can red or green yellow.,30.386443769394564
384sentences.9,Scr7,thin apples skin have crisp a pulp sweet seeds inside and.,33.773547522303744
384sentences.10,Scr7,tart apples some used very are make to cider.,32.226464446068576
384sentences.11,Scr7,be eaten apples can roasted raw baked or pies in.,45.928855884663186
384sentences.12,Scr7,the arson criminal is of act a burning or wildland building.,29.47807540076643
384sentences.13,Scr7,investigation determines a fire a if fire was by caused accident arson or.,39.332428780154366
384sentences.14,Scr7,be arson done can cause to to damage or collect others insurance.,29.686193578084655
384sentences.15,Scr7,of the the severity depends crime whether on were harmed people.,30.334276320971977
384sentences.16,Scr7,or an car automobile a is vehicle wheeled transporting passengers for.,51.40347176079853
384sentences.17,Scr7,can a be car by powered gasoline a electric engine or.,41.137079170342446
384sentences.18,Scr7,steers the the driver on car other roads just sit passengers.,29.227251038853325
384sentences.19,Scr7,in automobiles size vary of number and doors type of the trunk.,30.342852492688788
384sentences.20,Scr7,is the a axe used tool split to cut wood and.,23.018325444051563
384sentences.21,Scr7,usually the consists axe a of attached head a handle to.,15.649944110881094
384sentences.22,Scr7,heads were historically axe of made and stone metal then.,10.800301436345794
384sentences.23,Scr7,used by axes and are woodcutters entering firemen buildings.,27.29451625383418
384sentences.24,Scr7,is a a banana fruit long that grows bunchs in with soft a edible inside.,40.77249174382334
384sentences.25,Scr7,when ripe a banana be can yellow purple red or and small have brown spots.,54.553548343515054
384sentences.26,Scr7,producers the are greatest countries tropical as such or ecuador india.,36.735570303085716
384sentences.27,Scr7,and unripe plantains bananas staple are and foods cooked like often potatoes.,57.3109651537314
384sentences.28,Scr7,bed a of is piece a furniture used a as place to sleep have or sex in.,50.57547300611834
384sentences.29,Scr7,is made a bed a of mattress and a box spring sheets plus pillows covers and.,37.801217392888894
384sentences.30,Scr7,the mattress in waterbeds filled is with water and in airbeds is it filled air with.,40.01419742859536
384sentences.31,Scr7,of bed another type the is hammock a sling fabric suspended the above ground.,56.48322140908483
384sentences.32,Scr7,is a a bee insect flying with a and black yellow and body six legs.,49.64298290355779
384sentences.33,Scr7,pollen bees between spread as flowers collect they to make nectar honey.,33.32649315643773
384sentences.34,Scr7,social insects bees are live and together in colony a located a in hive.,45.80774823669456
384sentences.35,Scr7,have many stingers bees can and if attack feel threatened they.,30.998281475009527
384sentences.36,Scr7,is a a bicycle with vehicle two wheels pedals and on frame a.,40.88643296548407
384sentences.37,Scr7,is propelled a bicycle the by pedalling of cyclist a on saddle the.,42.70427121874183
384sentences.38,Scr7,have the rubber wheels with tires inner an full of tube air.,27.87083409400919
384sentences.39,Scr7,people for transportation use and recreation bicycles racing.,25.720857132432638
384sentences.40,Scr7,creates objects a forging blacksmith by or iron steel.,32.6898820842056
384sentences.41,Scr7,hammers and a blacksmith hot bends iron on anvil an to its change shape.,46.46555650304506
384sentences.42,Scr7,a blacksmiths thick wears and apron the handle with tongs metal.,32.11985832514342
384sentences.43,Scr7,objects like blacksmiths make horse weapons or shoes furniture iron.,17.106824847451417
384sentences.44,Scr7,is a a blender appliance kitchen used to ingredients mix or food puree.,56.573687091458204
384sentences.45,Scr7,a glass blenders have plastic or container with rotating a blade the in bottom.,53.28972254416554
384sentences.46,Scr7,used to blenders are milk make and shakes smoothies fruit.,31.10562903204977
384sentences.47,Scr7,also blenders used are make to alcoholic cold with crushed drinks ice.,32.829338790156065
384sentences.48,Scr7,is a a boy male young who child not undergone has puberty.,50.08592976772743
384sentences.49,Scr7,is the used term indicate to distinctions sex to girls relative.,22.86196999155849
384sentences.50,Scr7,like traditionally to boys rough play and games with each fight other.,45.56754736990368
384sentences.51,Scr7,male an behaving adult is immaturely referred often as a to boy.,29.867296970911198
384sentences.52,Scr7,broccoli plant in is cabbage the a family.,14.64815111496579
384sentences.53,Scr7,a broccoli green has head flower a and tough stalk thick.,35.50422140068951
384sentences.54,Scr7,high in broccoli fiber is vitamins other and nutrients.,16.885148765688903
384sentences.55,Scr7,broccoli boiled stir-fried can eaten or be raw.,21.027877529567164
384sentences.56,Scr7,is a a butterfly insect flying four with wings large.,37.065039965550426
384sentences.57,Scr7,of butterflies the wings be can colorful very patterned and.,27.63866336695425
384sentences.58,Scr7,the transformation metamorphosis is a of into caterpillar butterfly a.,29.885468414220068
384sentences.59,Scr7,collect butterflies some of people because colorful their wings.,35.41894323324106
384sentences.60,Scr7,is a an carpenter or artist laborer manual works with who wood.,37.33286618275306
384sentences.61,Scr7,and repair carpenters build furniture houses and boats objects other.,33.453029232144736
384sentences.62,Scr7,tools such carpenters use hammers as pliers saws planes and.,22.441636938479135
384sentences.63,Scr7,is a a luthier that carpenter and makes musical instruments repairs.,31.45315893336885
384sentences.64,Scr7,small cats furry are with animals legs four a tail and.,36.84044123821797
384sentences.65,Scr7,to groom cats by like themselves their licking fur.,29.190043175262478
384sentences.66,Scr7,hunt mice cats can birds or but are fed often by owners their.,38.32628454832651
384sentences.67,Scr7,of the cats claws retractable are that so keep sharp they.,38.13595340921491
384sentences.68,Scr7,is a a chair of piece furniture designed people for to on sit.,35.60933658010982
384sentences.69,Scr7,of chairs a consist raised seat floor above supported by level legs.,23.748610551921992
384sentences.70,Scr7,also have chairs can and back arm rests well as as cushion a.,35.31405612413535
384sentences.71,Scr7,fixed seats chairs are in located or vehicles places like in cinemas.,33.907423364040866
384sentences.72,Scr7,a a woodwind clarinet instrument musical is.,26.151531077833692
384sentences.73,Scr7,is a a clarinet black long tube with flare a at bottom the.,39.07388106210463
384sentences.74,Scr7,chooses notes the pressing player by and keys holes.,13.409424175677326
384sentences.75,Scr7,is used the clarinet in both and jazz music classical.,29.651832720770074
384sentences.76,Scr7,is a a cod that fish lives in colder the areas the of atlantic.,40.94144103029042
384sentences.77,Scr7,is cod white flesh mild-tasting and flakes and when cooked easily.,29.138108123799846
384sentences.78,Scr7,is used fresh cod fish for and chips cod salted for dishes elaborate.,65.64130892847636
384sentences.79,Scr7,been caught cod has and salted traded since time the of vikings the.,46.025401775873355
384sentences.80,Scr7,made coffee from is beans coffee seeds the the coffee of plant.,34.344991869297104
384sentences.81,Scr7,a coffee popular is in drink countries many usually served and hot.,22.620112403593712
384sentences.82,Scr7,a coffee mild contains called drug that caffeine people awake keeps.,24.354493726542994
384sentences.83,Scr7,coffee world's seventh-largest is agricultural legal the export.,13.931779960023313
384sentences.84,Scr7,is a a desert environment natural almost where rain falls no.,33.82595539993615
384sentences.85,Scr7,are usually hot deserts with filled dunes sand rocks or.,42.63346857018764
384sentences.86,Scr7,and plants some animals adapted have live to deserts in.,24.752803231412134
384sentences.87,Scr7,hot desert the biggest the is in sahara africa northern.,54.433664361120066
384sentences.88,Scr7,is a a desk of piece furniture used working for at with sometimes a computer.,36.549961397873325
384sentences.89,Scr7,has a a desk surface flat and can made be of plastic wood or metal.,49.80674349493004
384sentences.90,Scr7,may have a desk to drawers supplies store papers and.,25.04413566682971
384sentences.91,Scr7,consists a of cubicle desk a by surrounded on three partitions sides.,39.36105531504693
384sentences.92,Scr7,is a a door barrier movable to entrance exit or from enclosed an area.,45.337165559820626
384sentences.93,Scr7,have most locks doors control to gets who pass through to them.,30.19743092059438
384sentences.94,Scr7,are opened most doors pushing by or pulling handle a after are they unlocked.,40.97562713217544
384sentences.95,Scr7,of other doors types slide can consist or a revolving of chamber.,30.853177470816007
384sentences.96,Scr7,is a a dress of piece that clothing sometimes wear women.,30.503049731194984
384sentences.97,Scr7,is a like dress shirt a to attached long matching a skirt.,38.48552033566797
384sentences.98,Scr7,is usually a dress at worn formal occasions as such a or wedding a dance.,56.697805056228034
384sentences.99,Scr7,be hard it can climb to stairs or a ride bike a in dress.,56.004793709088574
384sentences.100,Scr7,is drunk the driving of act under driving effects of the alcohol.,34.07980638728894
384sentences.101,Scr7,of any drunk driving is vehicle a crime most in of world the.,38.73969759741457
384sentences.102,Scr7,a it role plays almost in of half vehicle-related deaths all.,28.878933854944307
384sentences.103,Scr7,are caught drunk drivers field by and sobriety tests breathing.,37.66710274547387
384sentences.104,Scr7,is a a drought shortage persistent of the supply water caused lack by of rain.,63.09458879015086
384sentences.105,Scr7,cause drought crops will plants and stop to and die growing.,23.737255919005374
384sentences.106,Scr7,will extreme eventually drought areas turn desert into cause famine and.,31.496429080683015
384sentences.107,Scr7,of large people numbers to have away migrate dust bowls from.,32.03348167126617
384sentences.108,Scr7,large birds eagles are prey of that hunt during the day have and very eyesight good.,43.51003249368862
384sentences.109,Scr7,hooked eagles beaks have tearing for strong flesh and sharp legs talons.,35.29057219011034
384sentences.110,Scr7,in eyries eagles live some and species eat and fish others mammals small.,36.39738821822468
384sentences.111,Scr7,bald the bright eagle a has white head is and the national bird the of united states.,41.177882267390004
384sentences.112,Scr7,the earthquakes ground shake can and down knock and other buildings structures.,39.38776446652697
384sentences.113,Scr7,can also the landslides shaking trigger volcanic and activity.,22.464639275273047
384sentences.114,Scr7,are caused most earthquakes the by release of in energy the crust earth's.,40.137065266519585
384sentences.115,Scr7,at an sea earthquake displace can seabed the cause a and tsunami.,26.85277274238372
384sentences.116,Scr7,the elephants largest are of kind mammal land several tons weighing.,31.914004630948956
384sentences.117,Scr7,has a an elephant nose long called a which trunk can things grab or food.,39.485476471302306
384sentences.118,Scr7,has a the elephant of pair ivory tusks moving for objects digging or into trees.,49.450866307514424
384sentences.119,Scr7,flaps its the elephant ears large to cool blood the in and them its body.,40.37431316230821
384sentences.120,Scr7,is an the eye for organ sensing light coding and it the for visual cortex.,38.42796745956943
384sentences.121,Scr7,have most complex animals which eyes detect can motion and color texture.,26.332356802503643
384sentences.122,Scr7,is the the fovea of center the human eye and the sensitive most part it of.,53.76518858814635
384sentences.123,Scr7,compound eyes insects have up made of eye facing units in directions many.,25.079444711300464
384sentences.124,Scr7,is land a farm to used grow plants raise or animals food for.,46.878671465533536
384sentences.125,Scr7,the people farmers are run who the farm decide and what produce to.,31.49714756401295
384sentences.126,Scr7,have farms a usually for house a farmers and a silo barn.,26.57008771042175
384sentences.127,Scr7,is a a cooperative where farm many farmers the share land equipment and.,36.05316974990307
384sentences.128,Scr7,have primates four usually and fingers thumb a each hand on.,20.172355408120332
384sentences.129,Scr7,used for fingers are writing grasping and grooming activities other.,27.02604126007605
384sentences.130,Scr7,are sensitive the temperature fingertips to and pressure vibration.,16.846500717188977
384sentences.131,Scr7,protects the the nail of tip the finger can and be or grown decorated.,45.31825162498468
384sentences.132,Scr7,is an a flood of overflow an expanse water of that inhabited submerges land.,53.0824500696897
384sentences.133,Scr7,can flood heavy be by caused rain or snow rapid melt as well earthquakes as at sea.,57.595955968261684
384sentences.134,Scr7,flood a in a will river flow out of its channel break or dams levees and.,51.84406695118805
384sentences.135,Scr7,flood during people a and evacuate contaminated the causes diseases water.,15.138128726754653
384sentences.136,Scr7,is a a floor surface horizontal inside a used building for on walking.,40.05047652506334
384sentences.137,Scr7,be floors made may bare of tile concrete or wooden linoleum floorboards.,37.354209906548704
384sentences.138,Scr7,put carpets people often a on floor for and comfort to noise dampen.,20.77633671278328
384sentences.139,Scr7,the in floor buildings has often and pipes wiring under electrical it.,33.48666346355362
384sentences.140,Scr7,is a a foot part body the on of a end leg.,29.98818938825137
384sentences.141,Scr7,their feet people use walking when or running straight standing.,26.751853180999106
384sentences.142,Scr7,use people their also to feet in kick fighting and both sports.,18.972531358770503
384sentences.143,Scr7,have rules many behavior cultures for to related feet.,15.301402660699763
384sentences.144,Scr7,is an a forest with area a high of density trees canopy and cover.,53.28956973500315
384sentences.145,Scr7,of the forest type on depends and temperature in its rainfall location.,38.69167753110108
384sentences.146,Scr7,ecosystem has a forest types various of trees animals and as as well ground plants.,54.5827111928852
384sentences.147,Scr7,the cutting deforestation of is down disregarding forests regeneration.,15.281588491918933
384sentences.148,Scr7,is a a fork for tool eating solid with foods a and handle several tines.,48.83005663997889
384sentences.149,Scr7,usually made forks are metal of plastic or disposable if.,39.86142912689197
384sentences.150,Scr7,are forks food used lift to to the or mouth to hold food place in while cutting.,35.49482776710225
384sentences.151,Scr7,used in forks are cultures western and there special are kinds various for foods.,47.175605374162856
384sentences.152,Scr7,pan is a frying small a pan with sides sloping and handle a.,58.74450934101513
384sentences.153,Scr7,pan a is frying to used sear fry brown food and.,29.437131069214104
384sentences.154,Scr7,is the cooked food oil on the covering of the bottom pan.,40.32023117066096
384sentences.155,Scr7,are made frying iron pans of teflon-clad or steel.,49.55932234392924
384sentences.156,Scr7,is a a girl human female has who yet reached not maturity.,39.834490956072145
384sentences.157,Scr7,the body at puberty a of girl develops that into of woman a.,32.158376839154414
384sentences.158,Scr7,like playing girls dolls often with social and games.,27.876569582383233
384sentences.159,Scr7,grow long girls sometimes and hair dresses wear skirts and.,38.09860325644332
384sentences.160,Scr7,is a a glove of piece clothing that the covers hand fingers and.,30.08649628469419
384sentences.161,Scr7,protect against gloves to are cold made of or wool lined material waterproof.,31.889102799731294
384sentences.162,Scr7,or latex disposable rubber are gloves used to hands shield from or germs chemicals.,74.89623808510822
384sentences.163,Scr7,is a a mitten of kind glove where four the fingers covered are together.,34.44746574821203
384sentences.164,Scr7,is a a hammer used tool to deliver impact an to object an.,44.88549580710123
384sentences.165,Scr7,is a most hammer used often drive to into wood nails.,26.0873480640974
384sentences.166,Scr7,on the the claw can head used be remove nails to.,16.703915388957515
384sentences.167,Scr7,in hammers the vary of shape head the handle length and.,27.169019053629384
384sentences.168,Scr7,grenade a is hand explosive an as used weapon against a people.,39.762038766894534
384sentences.169,Scr7,are hand thrown grenades timed and explode to bit after a that.,38.977472292058344
384sentences.170,Scr7,also be grenades can from fired or rifles launchers shoulder.,35.30392212940113
384sentences.171,Scr7,grenades are tear gas into thrown the middle a of mob disperse to it.,51.30492843536345
384sentences.172,Scr7,is a a horse hoofed large with mammal long muscular four legs.,40.66660815014319
384sentences.173,Scr7,horse a and has tail a a mane its on neck and is gray usually or brown.,46.103642979669075
384sentences.174,Scr7,been used horses have draft for travel work entertainment and.,22.412541155690047
384sentences.175,Scr7,can a ride human horse a it while trots or walks gallops.,28.44020116002337
384sentences.176,Scr7,to hospitals people go be to healed when are they sick injured or.,35.28666538061453
384sentences.177,Scr7,staffed by hospitals physicians are professional and surgeons nurses.,36.47377258113483
384sentences.178,Scr7,go there some patients specialist for diagnosis or leaving therapy the day same.,24.298949754253382
384sentences.179,Scr7,operations for or some patients treatments to have for several stay weeks.,27.04729147367534
384sentences.180,Scr7,is a a house building permanent or structure people for or to families live in.,48.428065987113605
384sentences.181,Scr7,house a and has roof a walls to out keep cold and rain and windows to let in light.,46.11371749578492
384sentences.182,Scr7,can a have house for rooms like purposes cooking or sleeping washing.,25.434803296313074
384sentences.183,Scr7,leave the most people to house work and come back at to night eat sleep and.,45.65327653514976
384sentences.184,Scr7,is a an igloo of type shelter made blocks from of by snow inuit.,32.97220719973917
384sentences.185,Scr7,built in igloos are where places snow covers land the most the of time.,52.50163673962114
384sentences.186,Scr7,often built igloos are the in shape of dome a with entrance an tunnel.,50.22591503499529
384sentences.187,Scr7,in air snow pockets the insulate and space heat warms body igloos.,42.24957158776377
384sentences.188,Scr7,is a a knife with tool a sharp that edge is to used cut things.,56.58156659594279
384sentences.189,Scr7,consist of modern knives handle a and a usually blade made metal of.,31.077028034103364
384sentences.190,Scr7,also knives been have as used and weapons in rituals instruments.,27.3456923112788
384sentences.191,Scr7,can a be knife to used by attack stabbing or slashing throwing.,45.8495299365526
384sentences.192,Scr7,the lentils seeds are a of of plant legume family the.,35.56097947870129
384sentences.193,Scr7,be red lentils brown can green or black yellow.,26.990511134235405
384sentences.194,Scr7,commonly used lentils indian are in mediterranean and cuisines.,25.04076919748335
384sentences.195,Scr7,cooked lentils by are and boiling a are source of great protein.,29.659501629326545
384sentences.196,Scr7,a biennial lettuce is often plant grown in climates temperate as leaf a vegetable.,46.876699796877844
384sentences.197,Scr7,be eaten lettuce can and cold raw in and salads other or dishes cooked.,45.55286758604026
384sentences.198,Scr7,considered fairly lettuce is to easy grow and suitable a crop beginners for.,37.49268042262698
384sentences.199,Scr7,leaves taste most lettuce but bitter some are to bred remove bitterness the.,34.704475176067824
384sentences.200,Scr7,is a a library where place a collection books of documents media and is kept.,39.28336337361239
384sentences.201,Scr7,at librarians libraries work are and at experts and organizing finding information.,21.77378963061828
384sentences.202,Scr7,go to people can libraries public and borrow to books take for home several weeks.,50.1574570505762
384sentences.203,Scr7,support scholarly academic and libraries research specialized have books.,49.20839701138962
384sentences.204,Scr7,cabin a is log small a built house round logs from.,42.50190255793874
384sentences.205,Scr7,is log a cabin of symbol frontier american and humble life origins.,36.00350018026319
384sentences.206,Scr7,were used log cabins first as by shelters settlers european.,26.022161295671435
384sentences.207,Scr7,were log built cabins logs using notch with at the joints ends.,49.372431155975015
384sentences.208,Scr7,a a male man adult human is.,24.335947085688016
384sentences.209,Scr7,becomes a a after boy man through passing puberty.,23.36581744204859
384sentences.210,Scr7,manhood with masculinity is virility and associated.,15.728201431475973
384sentences.211,Scr7,from women men differ height in and weight structure body.,22.84634515977661
384sentences.212,Scr7,a white milk is produced liquid by female to mammals feed young their.,46.398327211386004
384sentences.213,Scr7,must newborn be animals milk fed they before eat solid can food.,43.99614971977828
384sentences.214,Scr7,such dairy as products and cheese are butter from milk made.,39.83460076289991
384sentences.215,Scr7,from soybeans liquid produced coconuts and sometimes is milk called.,27.09137651596767
384sentences.216,Scr7,thin mosquitos small are insects flying emit that high-pitched sound a.,39.12551725306511
384sentences.217,Scr7,mouthparts mosquitoes for have the piercing of skin and animals plants.,20.42822835501103
384sentences.218,Scr7,bite female people mosquitoes animals and suck and blood for their protein.,33.328327452526565
384sentences.219,Scr7,can mosquito spread bites fever yellow and malaria parasite diseases other.,60.87430492511101
