384sentences.220,Scr7,is a a mountain that landform steeply rises surrounding land above.,34.59792418851721
384sentences.221,Scr7,higher mountains than rise and hills have sometimes at the snow top.,33.75153999247052
384sentences.222,Scr7,of mountains a range due forms tectonic to collision plate.,18.62462670272788
384sentences.223,Scr7,people who mountaineers or are climb up hike mountains.,30.976183263069217
384sentences.224,Scr7,is the the mouth cavity face we put in food when eat we.,31.705173397763037
384sentences.225,Scr7,has the teeth mouth chew to and food it with mix saliva.,31.22067048983784
384sentences.226,Scr7,is also the for mouth used and kissing talking.,20.351366710908174
384sentences.227,Scr7,are controlled speech sounds tongue by in placement mouth the.,17.148052269662728
384sentences.228,Scr7,is a a mug cup sturdy with a for handle drinking liquids hot.,48.92279792052767
384sentences.229,Scr7,is normally a mug but ceramic can also made be of or metal glass.,42.598306383065584
384sentences.230,Scr7,is a thick mug has and ring a for thermal base insulation.,30.77469838349622
384sentences.231,Scr7,be mugs plain can have or imprinted drawings carved on or them.,20.143215449907977
384sentences.232,Scr7,the murder unlawful is of killing human another with intent being.,30.839342686778096
384sentences.233,Scr7,serious murder crime a it because the deprives of their victim existence.,31.89692701900819
384sentences.234,Scr7,self-defense killing accidentally in in or is war considered murder not.,19.268392319580208
384sentences.235,Scr7,murderer is a convicted given often a life or sentence the penalty death.,35.40774022908222
384sentences.236,Scr7,is orange a juice made drink the from in orange liquid pulp.,39.64874206787647
384sentences.237,Scr7,has a orange juice acid sweet taste and a contains lot vitamin of c.,65.16170651314249
384sentences.238,Scr7,orange juice freshly contains squeezed often as pulp well.,47.62956549231788
384sentences.239,Scr7,is often orange juice at drunk from breakfast glass a.,24.971912259532733
384sentences.240,Scr7,is a a parrot that bird in lives and tropical warm regions.,39.6930960225942
384sentences.241,Scr7,brightly-colored feathers parrots a have and curved sharp beak.,25.98832713636233
384sentences.242,Scr7,imitate parrots the can voice human they if it repeatedly hear.,27.74133246701229
384sentences.243,Scr7,their abilities makes appearance popular them and pets.,7.577804713873821
384sentences.244,Scr7,is an a peach fruit orange-yellow a with smell characteristic.,23.738806913104135
384sentences.245,Scr7,of a the skin is peach thin and in covered small hairs fine.,33.56667799370764
384sentences.246,Scr7,a peaches large have stone red-brown which inside the seed contains.,22.90319131201308
384sentences.247,Scr7,sweet peaches and are and delicate be must after ripening harvested.,31.050481295287916
384sentences.248,Scr7,is a the piano musical popular instrument played means by of keyboard a.,46.61988659232559
384sentences.249,Scr7,piano key pressing a a causes felt-tipped hammer hit to a steel vibrating string.,44.06518301277933
384sentences.250,Scr7,has an the piano note enormous range and to pedals change sound the quality.,27.20226023552423
384sentences.251,Scr7,repertoire the is piano and large pianists famous give solo can concerts.,30.88901040111729
384sentences.252,Scr7,small piranhas ferocious are that fish in live american rivers south.,29.126499810378494
384sentences.253,Scr7,and attack piranhas live schools in and are active most during day the.,39.196787550176374
384sentences.254,Scr7,very sharp piranhas and have teeth opportunistic are carnivores.,23.791329770751396
384sentences.255,Scr7,piranhas insects lizards eat and mammals fish carrion.,30.032508250997864
384sentences.256,Scr7,is the a raspberry that fruit in grows clearings or forest fields.,41.77655265524995
384sentences.257,Scr7,raspberry consists a single many of fruits small together joined.,21.21786029714563
384sentences.258,Scr7,eaten raspberries by are or themselves with cooked into jam sugar.,31.466102345064783
384sentences.259,Scr7,the leaves raspberry of used are or fresh in herbal dried teas.,37.37262824890881
384sentences.260,Scr7,is a a raven black large that bird in many thrives climates.,47.221315877808834
384sentences.261,Scr7,on carrion ravens berries feed insects small or animals.,38.03269179215158
384sentences.262,Scr7,large brains ravens have are and of capable solving problem.,20.450697635303403
384sentences.263,Scr7,ravens are in folklore of birds and ill-omen tricksters also.,43.72958444592874
384sentences.264,Scr7,is a a refrigerator device cooling to used and preserve contain food.,30.48584159826725
384sentences.265,Scr7,can have some refrigerators small a at compartment temperature freezing.,35.674179083476155
384sentences.266,Scr7,can have a refrigerator and shelves small compartments different for types food of.,47.53717521139626
384sentences.267,Scr7,is generally a refrigerator and white people often magnets put on surface its.,33.703349455365405
384sentences.268,Scr7,rifle a that is firearm a rests on shoulder the and has a with barrel twisting grooves.,54.450307132836976
384sentences.269,Scr7,make the the grooves spin bullets around the rifle axis as fly they through air the.,41.50132694141243
384sentences.270,Scr7,used rifles in are and hunting sports shooting with scopes sometimes.,33.160514407755024
384sentences.271,Scr7,can assault fire rifles bursts in are and standard infantry the weapon.,36.18126832138688
384sentences.272,Scr7,a fish salmon is migrates that from fresh water to the and ocean back spawn to.,54.2884921139619
384sentences.273,Scr7,is orange salmon flesh red or and has protein high content a and nice taste.,60.88310641389081
384sentences.274,Scr7,be eaten salmon can in raw sushi or cooked by grilling or poaching in ways other.,49.25373669505344
384sentences.275,Scr7,the most salmon is farmed common fish though it can also caught be in wild the.,54.49422361304199
384sentences.276,Scr7,saw a that is tool a uses a blade hard or abrasive wire cut to hard materials.,62.806350183166494
384sentences.277,Scr7,sharp points the small the along cutting side the of saw called are the teeth.,37.29464830826186
384sentences.278,Scr7,be worked saws can hand by or powered an by electric or motor gas engine.,58.18814972336538
384sentences.279,Scr7,used extensively saws are forestry in carpentry construction medicine and.,29.361211111015017
384sentences.280,Scr7,studies a and scientist new produces about knowledge physical world the.,26.82173698358386
384sentences.281,Scr7,creates hypotheses a scientist does and to experiments them test.,18.718539714789095
384sentences.282,Scr7,and biology physics classic chemistry are of examples sciences.,28.436799452302175
384sentences.283,Scr7,scientists research in publish and journals their conferences.,31.605216876802125
384sentences.284,Scr7,scissors two-bladed instrument are for used a cutting.,16.65160245598552
384sentences.285,Scr7,are usually the blades with metallic or plastic handles metal.,40.504180412518096
384sentences.286,Scr7,the size depending on format and scissors can paper cut hair fabric or.,39.39669644283775
384sentences.287,Scr7,large shears scissors are for used shrubs cutting pieces of or metal.,38.339439514329285
384sentences.288,Scr7,is a a screwdriver for tool and inserting screws into tightening something.,62.946397500506166
384sentences.289,Scr7,also screwdrivers be can to used screws remove they are after inserted.,34.90041966070743
384sentences.290,Scr7,tip applies the screwdriver torque the rotating from handle the.,36.076754498979426
384sentences.291,Scr7,major types the two screwdrivers of phillips are flathead and.,44.483755477979734
384sentences.292,Scr7,is a a shark fish large a with skeleton cartilage.,42.04426186394458
384sentences.293,Scr7,streamlined bodies sharks a have with dorsal large fin.,21.649078903658264
384sentences.294,Scr7,predate on most sharks and fish with mammals jaws powerful.,22.597419461431038
384sentences.295,Scr7,very keen sharks have and senses detect can fields electrical.,26.232446763825823
384sentences.296,Scr7,is a a ship vehicle large floats that travels on and water.,30.14625543088067
384sentences.297,Scr7,can be a ship in powered the ocean sails by steam diesel or engines.,46.1797065675994
384sentences.298,Scr7,used to ships are in fish the ocean to and transport containers cargo.,43.340585130170886
384sentences.299,Scr7,are floating cruise ships that hotels people take cities between.,21.754853893481958
384sentences.300,Scr7,is clothing a shoe the for foot with sole a an and outsole a heel.,34.54721200792731
384sentences.301,Scr7,usually made shoes are leather of rubber canvas plastic or.,38.78152468785165
384sentences.302,Scr7,often have women's shoes heels high and come many in styles colors and.,31.377295986579345
384sentences.303,Scr7,is a a sneaker for shoe and sports activity athletic.,36.10971182725159
384sentences.304,Scr7,is a a soldier of member the national forces armed who on fights land.,51.005973211693046
384sentences.305,Scr7,in a the soldier must militia a wear usually camouflage uniform.,34.293761867440836
384sentences.306,Scr7,volunteer army in a soldier a is paid his for or work her.,40.74333356932599
384sentences.307,Scr7,fights using a soldier such weapons rifles as grenades and.,23.39178706324989
384sentences.308,Scr7,weapons that spears are of consist a pole sharpened and head one at end.,34.60779849207527
384sentences.309,Scr7,the spears most were personal common before weapon advent of the firearms.,26.295675570158515
384sentences.310,Scr7,used spears for were or stabbing when throwing in war fighting.,20.319074648100184
384sentences.311,Scr7,people some still native the use for spear and fishing hunting.,30.398557935158976
384sentences.312,Scr7,insects with spiders legs are eight make that silk.,24.88067592816077
384sentences.313,Scr7,webs spiders with build and silk them use catch insects to.,34.89876808574147
384sentences.314,Scr7,venomous fangs spiders paralyse use to stuck their prey.,39.5645684611259
384sentences.315,Scr7,be as spiders can as small a coin as or big a as bird.,42.60328803826712
384sentences.316,Scr7,low spongy swamps subject are land frequent to inundation.,20.603876845120247
384sentences.317,Scr7,is covered a swamp shallow with mud water vegetation and.,36.15204176107394
384sentences.318,Scr7,nesting and swamps are grounds breeding birds for reptiles and.,38.04817745588885
384sentences.319,Scr7,drain swamps farmers produce often to arable fertile land.,34.81630239802889
384sentences.320,Scr7,is a a sweater garment heavy on worn torso for the warmth.,36.2240512525549
384sentences.321,Scr7,often sweaters knitted are wool from cotton but also common is.,49.50108939973209
384sentences.322,Scr7,that a opens sweater the down is front a cardigan called.,32.01519158933289
384sentences.323,Scr7,in sweaters cut differ and collar shape sleeve well as as decoration.,30.870473943622443
384sentences.324,Scr7,is a a table of piece furniture with flat a surface legs and.,38.95632310392749
384sentences.325,Scr7,usually there chairs are a around for table to sit people.,18.262602951038428
384sentences.326,Scr7,cutlery plates people set food and on a to table eat meal a together.,24.6900729552706
384sentences.327,Scr7,also tables used are surfaces as work to write on or.,32.088067592200325
384sentences.328,Scr7,is a an television with appliance screen a displays moving that images.,31.235280876234963
384sentences.329,Scr7,mostly used televisions watching are for or programs films.,22.18014141943518
384sentences.330,Scr7,used they to are videogames play connected when a game to console.,30.403516368630342
384sentences.331,Scr7,can television be content or broadcast via received or internet cable.,42.20334861293419
384sentences.332,Scr7,the taking theft is person's of without property consent their.,19.876146615872514
384sentences.333,Scr7,to thieves own steal or something sell to to receivers it.,39.881957440840765
384sentences.334,Scr7,a theft crime is can and punishable be jail or with fines.,21.07427377379721
384sentences.335,Scr7,is theft industrial ideas espionage of intellectual and property.,22.41020696207956
384sentences.336,Scr7,is a a toaster appliance kitchen toasting for using heating bread elements.,40.23785472630368
384sentences.337,Scr7,toast the pop-up toasters placed bread in a and slot eject once it done.,36.75419414782482
384sentences.338,Scr7,have a toaster ovens on door the side tray a within temperature and control.,51.3068559436968
384sentences.339,Scr7,bread they to allow cooked be toppings with garlic or like cheese.,20.075181374713853
384sentences.340,Scr7,is a the tomato and shiny smooth red with fruit a taste savory.,52.72559887508674
384sentences.341,Scr7,softens and a tomato color changes from green red to as gets it more ripe.,34.914181346558436
384sentences.342,Scr7,be used tomatoes can make to salads soup ketchup or as as well sauce.,48.22599333565897
384sentences.343,Scr7,many there varieties are tomato of different with and tastes sizes.,31.84478668366132
384sentences.344,Scr7,is a a train series connected of cars moves that between on stations a track.,41.36492271341015
384sentences.345,Scr7,is the pulled train a by powered locomotive diesel or by electricity.,65.5735248991998
384sentences.346,Scr7,train a transports freight of containers or goods over long fuel distances.,34.97914263607705
384sentences.347,Scr7,transport commuter people trains suburbs between stations and a city inside.,33.38203181278551
384sentences.348,Scr7,station is a train place a where passengers on get or a off train.,37.46490391690987
384sentences.349,Scr7,have counters train machines stations or purchasing for tickets.,21.334569686646454
384sentences.350,Scr7,waiting there rooms are places and eat to a station in.,33.20996826183579
384sentences.351,Scr7,cargo passengers trains or from enter platform a to the next line.,29.003264548232764
384sentences.352,Scr7,cyclone a is tropical storm a over formed tropical sea warm.,40.089561988482366
384sentences.353,Scr7,produce very cyclones winds can powerful torrential and rain.,22.896751528013716
384sentences.354,Scr7,can also tropical cyclone high cause and waves flooding coastal.,35.663552135060336
384sentences.355,Scr7,cyclone can a tropical inland move seriously and property damage.,20.943136633689377
384sentences.356,Scr7,is an the violin with instrument four strings is that played a with bow.,35.387630199922356
384sentences.357,Scr7,the violin smallest is highest and instrument pitched its family in.,21.61551752100451
384sentences.358,Scr7,holds a the violinist between instrument chin the the collarbone and.,27.682639596066696
384sentences.359,Scr7,are made different notes fingering by the neck one with hand bowing while.,40.078942908475334
384sentences.360,Scr7,scavenging vultures birds are mostly feeding the on of dead carcasses animals.,62.025435584410374
384sentences.361,Scr7,have many a vultures head bald feathers without losing heat for.,44.12696422769445
384sentences.362,Scr7,their vultures large use to wings for soar without flapping miles.,20.923821346502613
384sentences.363,Scr7,attack vultures healthy seldom but animals kill may wounded or the sick.,25.742358387432922
384sentences.364,Scr7,is a a wall structure solid that defines sometimes and protects area an.,38.60186709695339
384sentences.365,Scr7,a building walls delineate the support roof and the divide space rooms into.,36.81795975873442
384sentences.366,Scr7,usually made walls are stone of brick or as cement well drywall as.,43.976836480428474
384sentences.367,Scr7,provide retaining a walls to barrier of movement stone or earth water.,32.831872593618264
384sentences.368,Scr7,the most water is liquid common on earth 70% covering of area its.,35.26898557322151
384sentences.369,Scr7,and plants people animals drink must in water to live order.,19.357463619883937
384sentences.370,Scr7,at a water freezes temperature low becomes and ice solid.,34.05437515691594
384sentences.371,Scr7,water that rain is from falls clouds in sky the which condensed are vapor.,39.42345448084333
384sentences.372,Scr7,is a a whale large very that mammal in the lives ocean.,35.44312587603226
384sentences.373,Scr7,through blowholes whales their breathe on when heads surfacing.,24.24560121146245
384sentences.374,Scr7,in a the blubber serves whale as an reservoir energy and insulation as.,48.25695835588711
384sentences.375,Scr7,been hunted whales have meat for oil whale ambergris and.,44.34947198894376
384sentences.376,Scr7,is a a window opening transparent in a to wall let through light.,34.44188019889961
384sentences.377,Scr7,window is a typical of made sheets of held glass in by place frames.,35.537661284372675
384sentences.378,Scr7,a when window open also will air let sound through and.,24.090207317051988
384sentences.379,Scr7,have multiple some to windows panes insulation increase inside.,15.304442251510636
384sentences.380,Scr7,a a female woman adult human is.,25.408112227039396
384sentences.381,Scr7,a stereotypically seen woman a as is caregiver.,19.28450714945125
384sentences.382,Scr7,a become pregnant woman bear and can children.,26.551407986419633
384sentences.383,Scr7,has different a organs woman reproductive a than man.,31.811333537365545