243sentences.0,backward,habitats local of conservation the encourages beekeeping.,27.50429674477583
243sentences.1,backward,pollen produce that plants local conserve to interest beekeeper's every in is it.,31.32040049979221
243sentences.2,backward,crops for way make to cleared be vegetation native that require not does it agriculture of form passive a as.,75.2481433131245
243sentences.3,backward,honeybees the kill could they because crops on pesticides of use the discourage also beekeepers.,55.29238527584026
243sentences.4,backward,effort the worth is product their but craft their for extremes to go beekeepers artisanal.,45.51918025224004
243sentences.5,backward,consistency and quantity over character and quality emphasizes honey-making artisanal.,31.58974390632428
243sentences.6,backward,honeybees their of micromanagers become beekeepers honey finest the produce to.,25.409186695078507
243sentences.7,backward,honey extract to ways best the select and flows nectar when know fields the scout they.,51.124501022026806
243sentences.8,backward,air the fills bees 40000 of hum deep the hive the opens beekeeper the as.,59.66044040997367
243sentences.9,backward,nursery bee the and supplies pollen stores honey checks beekeeper the.,31.033034381263526
243sentences.10,backward,gentle they're because sting don't they but hands and arms bare his across crawl bees.,45.477226407445656
243sentences.11,backward,college in longer no i'm though even exams about dream recurring a have i.,44.91835122947357
243sentences.12,backward,class to gone never i've realize suddenly i and exam final my of day the it's dream my in.,47.37783547894384
243sentences.13,backward,assignments reading the of any done even never i've.,25.0948309207924
243sentences.14,backward,nightmare same the have who people other many know i.,34.2538318075088
243sentences.15,backward,night previous the from experience dream their down write to had study the in participants morning each.,57.253064465511976
243sentences.16,backward,intensity emotional its and dream each described and dreams any recalled they if recorded they.,33.09941095241379
243sentences.17,backward,nightmare a or dream bad a dream flying a as such category a to dream each assigned then participants.,83.52757526474956
243sentences.18,backward,awake are we when as active as are minds our sleep we while night every.,47.47983338101703
243sentences.19,backward,each minutes ninety about of cycles in night the throughout dream we.,33.55753151714172
243sentences.20,backward,dreams our fill can places and characters of combinations strange and stories feelings images.,40.78286429151845
243sentences.21,backward,worse to bad from went things cards playing start to decided i when.,34.264735912843975
243sentences.22,backward,it doing $10000 to close spent already had i and do to had i something was gambling.,35.851978371450635
243sentences.23,backward,away savings my gamble me watching of sick were friends my.,20.179675154582608
243sentences.24,backward,have not did i money losing after casino a leaving of horror the was part hardest the.,54.241412673966096
243sentences.25,backward,by come to hard are gambling legalized of effects economic and social the on data good.,56.25426601065211
243sentences.26,backward,likely more problems gambling makes nearby casino a having that indicate studies some.,48.54813651756298
243sentences.27,backward,problems marriage and bankruptcies personal with associated be also may gambling.,46.99847495732463
243sentences.28,backward,gambling legalized of expansion dramatic a been has there generation past the over.,57.115342513275195
243sentences.29,backward,well as casinos have many and lotteries instituted have states most.,39.30304959183273
243sentences.30,backward,business controversial but big very become has gambling.,19.199806676649544
243sentences.31,backward,kitchen the in window a shattering house the shook hurricane the from wind the.,46.418250676448125
243sentences.32,backward,hurricane the to kitchen the surrendered and door the slammed food some grabbed in ran we.,43.69055608597208
243sentences.33,backward,foundation its from ripped be would house our afraid was i.,29.81582228863553
243sentences.34,backward,sofa the on huddled asleep fell we house the shaking wind the with night that later.,57.90921450708874
243sentences.35,backward,foundations their off houses suck and trees of off limbs tear can hurricanes.,39.65238090162231
243sentences.36,backward,mudslides and floods trigger can that rains heavy dump they.,37.69336767319522
243sentences.37,backward,land onto lurches that water ocean of wall a surge storm a bring also can hurricanes.,61.83660299667539
243sentences.38,backward,hurricanes ancient of evidence for look to methods several use scientists.,26.896946560173596
243sentences.39,backward,lakes coastal of bottoms the at sand beach windblown of layers deposited storms strongest the.,74.4467138805944
243sentences.40,backward,rings growth their in storm each of record a preserve hurricanes passing by drenched trees.,50.34926886294458
243sentences.41,backward,preferences different have countries different but world the around exported is cream ice american.,57.662603003254716
243sentences.42,backward,delicacies local with flavored cream ice their enjoy people many.,56.18208941488887
243sentences.43,backward,mangos fresh and bananas with topped is cream ice vanilla places tropical some in.,84.49371043818985
243sentences.44,backward,child a as home at cream ice making remember i.,34.0414704001584
243sentences.45,backward,cold the to it expose to crank the turning start then tub frozen a into mixture cream the poured we.,78.61454312878315
243sentences.46,backward,more any crank hand the turn couldn't i that enough froze it eventually.,23.76564573882007
243sentences.47,backward,harden to freezer the into cream ice half-frozen of container the put i then.,44.59756981961271
243sentences.48,backward,air whipped-in half to up and flavorings sugar cream or milk of mixture a is cream ice.,51.274668935353645
243sentences.49,backward,silky and smooth it makes what is cream and milk in butterfat the.,58.92673408709393
243sentences.50,backward,flavorings natural and butterfat with loaded is cream ice premium high-priced.,47.91003134977513
243sentences.51,backward,hurt back my makes chair uncomfortable the mower lawn riding the use i when.,64.19831017060486
243sentences.52,backward,machine the control to me of front in levers two the use i.,34.52828947247096
243sentences.53,backward,grass of blade each sever precisely mower lawn the underneath blades sharp the.,58.7443343154425
243sentences.54,backward,patience me taught has it and task long a is lawn the mowing.,39.308914743592396
243sentences.55,backward,height even an to grass cut that blades revolving with machine a is mower lawn a.,65.60188736214013
243sentences.56,backward,motor a have may machine the or muscle by powered be may blades the.,38.637524396761755
243sentences.57,backward,engine gas small a is mowers lawn for source power common most the.,57.53315409889259
243sentences.58,backward,emissions create not do they because environment the for better are lawnmowers electric.,45.866476840186834
243sentences.59,backward,run to expensive less are and maintenance less need also they.,33.29664336794156
243sentences.60,backward,toaster ordinary an as electricity much as use mowers lawn electric.,58.14271316410961
243sentences.61,backward,spacewalks their for time long a train astronauts.,27.299934962726834
243sentences.62,backward,underwater conducted is training their of much.,16.481836596834746
243sentences.63,backward,space in floating spend will they hour every for pool the in hours 10 to 8 spend may they.,56.44442290737932
243sentences.64,backward,station space the of outside the on work repair and construction perform to able be to practice astronauts.,78.37222077871893
243sentences.65,backward,pilots test military as backgrounds have many and pilots always are flights shuttle of commanders the.,60.621395579303005
243sentences.66,backward,space in experiments run can who scientists and engineers doctors as trained are astronauts other.,62.86681624688999
243sentences.67,backward,diverse more much are now astronauts but men young all were crews early.,48.48612182063159
243sentences.68,backward,shuttle space the of exterior the to together out floated astronauts of team the.,50.53909414279011
243sentences.69,backward,telescope huge the on part broken the repair to needed tools carried they.,41.232778882355625
243sentences.70,backward,place into part replacement the fitted other the while pipe the on bolts the loosened astronaut one.,52.32595791864908
243sentences.71,backward,artists experimental by time long a for art in used been have computers.,41.46767725189735
243sentences.72,backward,world art mainstream the entered have graphics computer widespread and affordable more are computers that now.,63.13947132349025
243sentences.73,backward,technology graphics latest the showcase that exhibitions art have conferences science computer some.,58.787495253153665
243sentences.74,backward,cultures two the bridging to devoted are that up sprung have conferences new brand.,41.56349879095956
243sentences.75,backward,procedures surgical and conditions medical visualize to doctors with works specialist graphics computer the.,65.64794483848554
243sentences.76,backward,body patient's a within structures understand doctors help to animation digital uses she.,35.83029883545061
243sentences.77,backward,x-rays at squinting than clearer much is screen a on animation an in structures internal the seeing.,58.13752196636394
243sentences.78,backward,education for tool powerful a is animation digital modern.,37.67881048649722
243sentences.79,backward,students help actually graphics if ask must we broadens graphics computer of field the as.,49.92417397671027
243sentences.80,backward,classroom the in effective be can imagery digital engaging and vivid that suggest does research.,48.68579414979813
243sentences.81,backward,cliche was place first the in school law to came he reason the.,37.37016840054192
243sentences.82,backward,better the for things change to wanted he.,21.041241464843548
243sentences.83,backward,all-nighter an pulled had director program the and he when school law at evening one recalled he.,46.69152009537111
243sentences.84,backward,sunrise at families evicted several for petition a drafting finished finally they.,50.50978693361157
243sentences.85,backward,relentlessly up gone has education legal of cost the decades four past the over.,54.42401528541167
243sentences.86,backward,1970s the since four of factor a by increased tuition school law private.,37.182094868975575
243sentences.87,backward,crash eventually could lawyers new for and school law to admission for market the.,39.33474549659001
243sentences.88,backward,law practicing actually in experience minimal have often faculty school law.,35.77089102359984
243sentences.89,backward,journals prestigious for articles review law writing on focus professors.,34.93428121364174
243sentences.90,backward,england feudal in law property like topics on classes with theoretical the emphasize often schools law.,39.74647163829137
243sentences.91,backward,care preventive in involved increasingly are pharmacists.,27.379969238518672
243sentences.92,backward,often pharmacies to go people because advisers health front-line becoming are they.,22.80225141784323
243sentences.93,backward,health public about information of source good a often are pharmacists.,43.68890019831908
243sentences.94,backward,effects side and interactions drug about lot a know they because pharmacists with consult doctors.,56.43734889326358
243sentences.95,backward,medications of use safe the about advice offer and patients to drugs prescription dispense pharmacists.,63.5164644249302
243sentences.96,backward,vaccines provide and screenings wellness and health conduct also they.,38.178014301031936
243sentences.97,backward,licensed be to order in exams two pass and degrees professional have must pharmacists.,46.49005487910003
243sentences.98,backward,pharmacist a be to chose i as much as me chose profession pharmacy the think i.,43.59103201402535
243sentences.99,backward,child a as pharmacies in bottles arranged neatly the by fascinated was i.,47.820341131721136
243sentences.100,backward,patients my of lives on have i that impact the love i but cliche it's know i.,28.53339018466098
243sentences.101,backward,situations stressful potentially to response own her or his has person each.,42.0045627154137
243sentences.102,backward,stressful fulltime working find may another while unemployment by devastated be may person one.,45.31911316311272
243sentences.103,backward,traffic in stuck being like stresses everyday are there.,26.743258853109733
243sentences.104,backward,child a of loss or divorce as such stresses traumatic also are there.,41.28764443143297
243sentences.105,backward,stress of levels different to adapt can people some.,33.6772338646496
243sentences.106,backward,health on toll real a take can stress though effectively with dealt not if.,42.76582623536641
243sentences.107,backward,beneficial or harmful be will it if determines that stress to reaction your it's that remember.,63.94179818784939
243sentences.108,backward,worried and stressed incredibly felt i downsizing was company my when.,25.6920406402915
243sentences.109,backward,times at dizzy felt even i and reason no for race would heart my.,39.792651741451344
243sentences.110,backward,level stress my manage to try to yoga taking started i then.,43.111187709571695
243sentences.111,backward,stripes satin with tuxedo black jet a wore man the.,62.03552752082149
243sentences.112,backward,style latest the in cut fabric rich with made was it.,34.42875590197604
243sentences.113,backward,perfectly man the fit it as tailored it had he clearly.,19.183645301948438
243sentences.114,backward,event formal a for out picked have would stylist professional a something like looked it.,56.24131894166945
243sentences.115,backward,attire wedding in statements personal making are grooms today's preferred still is tuxedo the while.,46.345189946523824
243sentences.116,backward,men for fashion wedding of edge cutting the on are jackets shorter.,37.68375468173673
243sentences.117,backward,ties satin and shirts colorful with tuxedos their up jazzing also are grooms.,58.74236482376388
243sentences.118,backward,lapels silk black with jacket dinner tailless a is jacket tuxedo a.,79.96021205877484
243sentences.119,backward,jacket tuxedo the to match perfect a be should trousers tie black.,49.844529197656875
243sentences.120,backward,lapels jacket the match and black be should tie the and white plain be always should shirt the.,58.02521050429521
243sentences.121,backward,adulthood in blind went pianist concert the.,29.95529655110074
243sentences.122,backward,eyes the damaged slowly that condition genetic a by caused was blindness her.,38.45671632375999
243sentences.123,backward,pianist a to advantage an was blind being that interviewers told she.,35.9374417072197
243sentences.124,backward,music her on fully more concentrate could she so distractions visual no had she.,49.0053082478919
243sentences.125,backward,life of activities ordinary the for insufficient vision as blindness defines government the.,34.61123173533877
243sentences.126,backward,blind legally the on focused be can resources blindness legal of parameters the establishing by.,57.17700528611571
243sentences.127,backward,standard the meet not do who but problems vision have who those overlook may this.,45.20958134183346
243sentences.128,backward,deficiencies nutritional and disease infectious by caused usually is children in blindness countries developing in.,76.70065677449634
243sentences.129,backward,supplements vitamin and medicine by prevented be often can causes these.,44.833167810759264
243sentences.130,backward,problems genetic by caused be to likely more is blindness countries developed in.,51.728915249867896
243sentences.131,backward,brain your to mouth your from gets taste a how exactly knows really one no.,59.92110286647141
243sentences.132,backward,cell bud taste a touches food of molecule a when begins process the think scientists.,41.6023303226519
243sentences.133,backward,cell the beneath nerves taste to message taste a carries cell the.,36.83888354081522
243sentences.134,backward,tastes basic four the of one to responded bud taste each that believed once was it.,58.6687028108784
243sentences.135,backward,sweet something eating were you if only respond would tongue the of tip the on bud taste a is that.,78.44368098536714
243sentences.136,backward,tastes basic the of all to sensitive be can bud taste single a that think now scientists.,62.569513255408665
243sentences.137,backward,flavors strong very with foods eat to tend i so good very isn't taste of sense my.,51.275725510141534
243sentences.138,backward,bitter very it's so cream no with coffee my drink i and sauce hot of lots like i.,52.666917588843305
243sentences.139,backward,sugar extra add i cookies make i when so well sweetness taste even can't i.,34.64950719715857
243sentences.140,backward,individuals aging for problem real a are fractures hip.,30.58773244915547
243sentences.141,backward,healing of process difficult the and break the of pain the with faced are patients.,49.39871604557132
243sentences.142,backward,independence of loss patient's the to adjust to have families.,26.28528571080158
243sentences.143,backward,hospital the in time and expense substantial involve fractures hip society for and.,46.89938029660571
243sentences.144,backward,fingers their snapping someone like sound a heard i race the through halfway.,48.44273676334685
243sentences.145,backward,broken was foot my that instantly knew i and crunch a felt i.,28.904400130715615
243sentences.146,backward,spikes on running like felt step every.,16.296352813049793
243sentences.147,backward,fracture the showed clearly x-ray the afterward office doctor's the at.,25.998258719942797
243sentences.148,backward,fracture bone of types different few a are there.,38.100167019976
243sentences.149,backward,intact is skin the but broken is bone the fractures simple or closed in.,59.73150880926413
243sentences.150,backward,wound open an produced and skin the punctured has bone broken the fractures compound or open in.,61.17095128774417
243sentences.151,backward,cleaned carefully not they're if infected become can piercings ear new.,47.66279775932231
243sentences.152,backward,earlobe the around redness or swelling tenderness include infection of signs.,40.183677455792754
243sentences.153,backward,ointment some apply and area the clean symptoms these see you if.,30.432454819183068
243sentences.154,backward,provider care health your contact away go don't swelling and redness the if.,60.19592050431012
243sentences.155,backward,infections reduce to measures new initiated has hospital local a.,28.31213140263707
243sentences.156,backward,patients other from isolated are patients infected that ensured and habits washing hand improved have they.,55.34675512535513
243sentences.157,backward,began measures new the since drop rates infection seen has hospital the.,27.527666750438883
243sentences.158,backward,infection of risk the increases which healing delays alcohol or soap with wound a scrubbing.,53.799348454217714
243sentences.159,backward,moisture and heat in holding by infection of risk the increase can band-aids.,35.64783130820538
243sentences.160,backward,diagnosed are they once treated be easily can infections skin most fortunately.,52.29752744837978
243sentences.161,backward,century sixteenth the of end the at started opera modern.,41.0706783023579
243sentences.162,backward,performance tragic greek imitate and rediscover to effort an as began it.,26.858263012548942
243sentences.163,backward,matter subject their for antiquity from tales chose opera of founders early.,28.89376881827899
243sentences.164,backward,traditions musical and stories of sources different into out branched operas later.,45.86563521766881
243sentences.165,backward,music and words combines that play a perform musicians and singers which in form art an is opera.,56.09943553583922
243sentences.166,backward,costumes and scenery acting as such theatre spoken of elements the of many incorporates it.,48.1519055112104
243sentences.167,backward,orchestra an by accompanied and house opera an in given typically are performances.,49.73203191569753
243sentences.168,backward,production new the in role the win to hard worked has singer opera the.,58.86509770342688
243sentences.169,backward,singing about just not is job her.,18.888027412450562
243sentences.170,backward,critical all are interpretation musical and presence stage acting.,17.20182761782801
243sentences.171,backward,show the of star the certainly is voice strong pure her but.,25.437922954229016
243sentences.172,backward,painting a completing while mind in elements many keep must painter a.,32.10399556412217
243sentences.173,backward,lighting and composition strong like design of elements solid use to has she.,25.439237971084275
243sentences.174,backward,skill with strokes brush the execute to has she.,30.493450687574484
243sentences.175,backward,soul painter's the of glimpse a reveal should painting the of content the importantly most.,40.60440192112205
243sentences.176,backward,artists creative as than artisans skilled as more employed were painters ago long.,56.82456441454504
243sentences.177,backward,court royal the of members and scholars of status social the had painters prominent however.,51.5771691835093
243sentences.178,backward,patrons their with relationship personal a established and imagery and subject its on decided work their signed they.,54.53289837050206
243sentences.179,backward,itself painting the on more and scene actual the on less focus to learned i painter a as.,45.12286394545192
243sentences.180,backward,vision of field its within everything record to has that lens camera a not is eye artist's an.,63.21447261304273
243sentences.181,backward,painting good a for needed is than more but information useful provides nature found i.,57.62660195650447
243sentences.182,backward,bird impressive an is owl eagle the.,34.244212928757086
243sentences.183,backward,horns like up stick that tufts ear has it.,21.02250633311191
243sentences.184,backward,you through right pierce could they like look and creepy downright are eyes orange large its.,69.0051166540751
243sentences.185,backward,darkness the through silently and swiftly flying night at hunts owl this.,54.67034541655117
243sentences.186,backward,thriving are others endangered become have species owl some while.,36.2045094627538
243sentences.187,backward,habitat previous its beyond well spread has owl barred the.,46.391822968015596
243sentences.188,backward,invasion owl's barred the facilitated have may logging that suggest findings early.,31.508268550515627
243sentences.189,backward,talons her with it gripped and branch thick a on landed owl the.,48.30768051977571
243sentences.190,backward,eye an half-closing down settled and sides her to wings her pressed she.,39.85363369121865
243sentences.191,backward,eyes her of glow the for but statue a been have might she.,40.01035857843517
243sentences.192,backward,ice sea floating across stalk bear polar a watch to unnerving it's.,56.679410076267
243sentences.193,backward,animal huge the beneath directly waters frigid the in submerged are you when worse even it's.,71.14604644716671
243sentences.194,backward,prey its pursued bear polar the as ice the on down set paws giant overhead.,63.97953051180468
243sentences.195,backward,shots these capturing months spent i documentary bear polar a for crew film the of part as.,55.89698971158007
243sentences.196,backward,confusion or fear than other reasons for people attack will that animals few the of one are bears polar.,49.69607227512983
243sentences.197,backward,environment food-scarce a in live they because hunger of out attack may they.,29.8705285425999
243sentences.198,backward,energy their conserve to careful slowly people on up sneak will they.,42.210464761545715
243sentences.199,backward,diet bear's polar the of part important an is seal the.,31.956125146520623
243sentences.200,backward,ice the on basking are that seals stalk or hole breathing seal's a by wait will they hunting when.,52.93379599946316
243sentences.201,backward,around looks seal the when place in freeze and forward quietly crawl will bear polar the.,58.60544156011507
243sentences.202,backward,defense for primarily built structure a not was castle medieval the.,36.56474477392323
243sentences.203,backward,surroundings its dominate to was purpose its.,16.220600236152425
243sentences.204,backward,walk day's a within lands control easily could castle a.,21.415835631091362
243sentences.205,backward,protection for walls castle's the inside brought be could property and livestock peasants attack of times during.,34.62966120027416
243sentences.206,backward,regions many of history stormy the of record a provide locations dramatic in castles spectacular.,52.23059322681256
243sentences.207,backward,villages quaint and landscapes beautiful overlooking cliffs rocky atop stand they today.,79.43965896999208
243sentences.208,backward,intrigue and plots battles to home were they past the in.,23.330149594704636
243sentences.209,backward,cliff a on built castle magnificent a above looming hotel our saw we station train the leaving upon.,78.37348341786091
243sentences.210,backward,river the above feet of hundreds courtyard inner an sheltered walls outside thick the.,55.28501145797206
243sentences.211,backward,view scary slightly but incredible an had rooms tower our.,26.62892890309527
