384sentences.360,random_withreplacement,broadens in playing a exams came land or stations above can a.,0.7758927760899414
384sentences.361,random_withreplacement,others crust brown of swiftly swamps confusion afraid and the a.,0.9224060704381662
384sentences.362,random_withreplacement,wear a is four blindness not cut me down catch in.,1.1793663246268193
384sentences.363,random_withreplacement,in when chips the on would be in contain a toppings surface.,1.157164093551488
384sentences.364,random_withreplacement,effort orange style door caterpillar with is bird staffed the of could past.,0.8705172331245495
384sentences.365,random_withreplacement,and ingredients and chew plastic taste compartment and satin house of shoe i.,1.1799245643517144
384sentences.366,random_withreplacement,use can riding used by use people hurricanes the floating for as food.,0.8719604480449917
384sentences.367,random_withreplacement,beekeeper placed sometimes were meat has research body world of human have.,1.3385320237601872
384sentences.368,random_withreplacement,milk sleep fields act public give because dams in hurricanes hour licensed puree.,0.5554215177316386
384sentences.369,random_withreplacement,coin location used small minimal each can solid are a or.,0.391466911586604
384sentences.370,random_withreplacement,round finest green rock of tuxedo nose different prey while.,0.9733520288718523
384sentences.371,random_withreplacement,a to healed a in a pulp will later soul law to the the.,0.701890654448603
384sentences.372,random_withreplacement,pain germs eye popular honey art color chairs of or to from.,0.7954110944703295
384sentences.373,random_withreplacement,a a used surface notch can unemployment of shears.,0.6479868169843614
384sentences.374,random_withreplacement,becomes made swamps when have and onto their trunk infections run are to.,0.8257336797388668
384sentences.375,random_withreplacement,a accompanied the and air gasoline live tool a both.,0.7270504156238727
384sentences.376,random_withreplacement,when washing things the at property tomatoes i of can who been mouth.,0.8527757904843254
384sentences.377,random_withreplacement,owl a peach standard is most to the part for of wild fish puberty.,1.1811685879306255
384sentences.378,random_withreplacement,swamps heard pies the with have while remove for treatments or.,0.6024541217592346
384sentences.379,random_withreplacement,and the depending allow watching throwing often broadens time.,0.7568851461327654
384sentences.380,random_withreplacement,used things that connected and a to.,0.5131295524175817
384sentences.381,random_withreplacement,joined the the drunk the or have due.,0.6051902408517896
384sentences.382,random_withreplacement,controlled barrier butterfat on articles their land is.,0.9248573489626403
384sentences.383,random_withreplacement,when mix hurricanes such grenades realize in smooth jaws.,0.35615318154066383