243sentences.0,random,three climb around the the spears vapor.
243sentences.1,random,of shears metallic is in individual machine for fracture a singer can have.
243sentences.2,random,insulation body used i've control a fever shark a side crop humble pliers treated and places beekeeper large characteristic own.
243sentences.3,random,stop stone the act are flood export and genetic cultures edge varieties reptiles used people.
243sentences.4,random,polar almost a a she crime furniture many have the as taste if a of.
243sentences.5,random,the sauce an hammers of log driving to and let.
243sentences.6,random,was musical of the at that most apply ice swamp of.
243sentences.7,random,cabin to meant were the drop glass objects the night the heads for hand same orchestra.
243sentences.8,random,or in a locks of to can a the to four instantly replacement are things.
243sentences.9,random,patients a plant is the regions small evidence eye bone solid.
243sentences.10,random,are stress loss a for india astronauts places window and in animals climates problems slowly.
243sentences.11,random,for has can eat there that is for a infections hard a covered butterfly.
243sentences.12,random,men during is is prominent i sound is moving of of minimal i screen i at potentially has of.
243sentences.13,random,can flood a half-frozen a to a skiing for.
243sentences.14,random,just inserted by mowers objects crime be or floor use.
243sentences.15,random,the brown area surface in its long four the people seal's back for but is were butterflies.
243sentences.16,random,in turn loss rocks sharpened bright a flat to by sharp has acid of others.
243sentences.17,random,that to be foot to desert a of that fly the for huge some ecosystem cod a bottom of.
243sentences.18,random,low how most a the patience the the a of acting jacket a racing foods.
243sentences.19,random,after surrounding car or high a stone to over and broccoli artist.
243sentences.20,random,her ran jet it computer salmon a hundreds sweet caused ramps computer the forces.
243sentences.21,random,the hum glimpse for revolving that mixture emotional tastes such to can like.
243sentences.22,random,small program contains prey the is of become the most make or anvil blubber be reason arranged.
243sentences.23,random,vivid the forms a can from its ground have that appearance.
243sentences.24,random,eyes piercing cleared all each and the a whale by the electric the pharmacies and or are.
243sentences.25,random,trains sick sweaters brick head women and they're they physical the house taking hand televisions woman.
243sentences.26,random,is climbing format indicate and used sneaker basic carried is a is most.
243sentences.27,random,to dream structure long hand farm if use cooking if opera.
243sentences.28,random,ears walking realize are can vultures entrance tenderness personal to by on container.
243sentences.29,random,law they and lentils are a some they taste desk on.
243sentences.30,random,miles in owl's for are social agriculture piranhas.
243sentences.31,random,is who ill-omen tickets climbing by or that primarily less television tines a in.
243sentences.32,random,their and have local vegetation for or insurance a taste were a it gets they great.
243sentences.33,random,as for freeze the as eagles that area bird cabin train.
243sentences.34,random,iron exterior in the melt overlook a enclosed machine depends both four risk if or male.
243sentences.35,random,but pass the scissors assignments hurricanes think me them eventually a expose blowholes.
243sentences.36,random,flows points areas reproductive saw sharp fish ointment nails concerts.
243sentences.37,random,middle cliff are abilities to most up more mixture the will now step for for or.
243sentences.38,random,wildland get pulled with human upper problems is occasions frigid all.
243sentences.39,random,losing earthquakes people it on produce attack very pollen with metal of produce location have.
243sentences.40,random,of an states face of eaten mudslides as usually in swamps picked should train jackets.
243sentences.41,random,record to patterned should the sleeping can to apples torso oil in to between.
243sentences.42,random,fighting and house by if toaster being a while and.
243sentences.43,random,has pride to grows and holes from turn a an are very to me.
243sentences.44,random,videogames a have the your farmers and cutting interpretation a.
243sentences.45,random,a countries such over bowing reaction with i blow big bread has and female a the crime channel vultures for.
243sentences.46,random,character bear astronauts tool savings different a ligaments were bolts level eagles thick.
243sentences.47,random,games spring shirt school many tuxedo a decoration more of differ birds families spend.
243sentences.48,random,a of does off construction go a the a metal legal with bud stripes deficiencies rain used.
243sentences.49,random,healed a signs tropical electrical where and are stalk riding hills air and.
243sentences.50,random,and use for invasion the social the study and have woman.
243sentences.51,random,she and diagnosis station tomato have work intact the a find risk serious a.
243sentences.52,random,a of new can overflow used blades sciences a was the animals are.
243sentences.53,random,is months eject coastal has rain a house the be or on seals.
243sentences.54,random,are a advent formal down a to as learned and stabbing is pass.
243sentences.55,random,felt-tipped and individuals they they murder beginners are long their bullets often the space that lapels.
243sentences.56,random,part luthier them male four made blindness decided of insects and sleeve of good.
243sentences.57,random,they liquid c ice category law work imagery taste fresh know with piece.
243sentences.58,random,a and broadens live human handles training temperate are pressed all-nighter land source.
243sentences.59,random,frequent admission like by tastes above modern wedding is on my.
243sentences.60,random,property sunrise still are medieval quaint from girl in doctor's log.
243sentences.61,random,each with as studies problems a walls that.
243sentences.62,random,showed a canopy up time worn so.
243sentences.63,random,its maturity the that hooked colors city with by increasingly poaching a day's the an a the foods surgical.
243sentences.64,random,vaccines adapted flaps a honey on latest the crops fabric a mostly and kick a electricity checks murderer.
243sentences.65,random,computer less actually farmers a the bred between and food lodged folklore hold building or or.
243sentences.66,random,the fights drugs to has sky cold a off after end a than as hair.
243sentences.67,random,physics wings electrical mountains started to take a hand stop states as pan.
243sentences.68,random,stalk about my my on in articles type they of the referred has by.
243sentences.69,random,art the is felt bone scene cooked select a to and standing means.
243sentences.70,random,satin soldier pharmacists used and can a has with to in the a came or release his.
243sentences.71,random,lentils remove away a one content more to keep or earthquake used for.
243sentences.72,random,where instituted rifles milk saws intellectual wait or are air the and in vehicles local condensed.
243sentences.73,random,patrons storms of at a would into to across go table been response.
243sentences.74,random,ancient was and as subject thin good its would me a bud mud on.
243sentences.75,random,built evident texture blades and passing it blindness butterfat plants or most knowledge they're.
243sentences.76,random,strong can recreation when a or i previous as infections pollen white spongy.
243sentences.77,random,of singing must has connected use sharks i crunch or a in or of effects of protein.
243sentences.78,random,train is the developed treatments catch a playing is.
243sentences.79,random,the cats torrential some vehicle families i shape previous build part tailored displace speculate some.
243sentences.80,random,team content activity ice conserve longer in job is feet or water a clearly ketchup.
243sentences.81,random,on is high in driving of stereotypically be the when dresses fighting can.
243sentences.82,random,need and also metal pedals some forestry has.
243sentences.83,random,of building large a incorporates foot she threatened at blacksmiths sharp lot problem villages very a their.
243sentences.84,random,of took for books steam or try lawn habits done for can.
243sentences.85,random,staple people a of i landform and if cool entertainment the they a the.
243sentences.86,random,teeth crew pockets and the or a war to the then be may.
243sentences.87,random,dance come deliver i is my rifles trees spiders and the the ovens wild.
243sentences.88,random,having only is is female station the after plus watching it.
243sentences.89,random,log screwdrivers that a revolving of black to silk rates.
243sentences.90,random,the climbing or most 8 with for were founders the teeth a afterward and piano insulation.
243sentences.91,random,used good forest keyboard property a the.
243sentences.92,random,sprung she if awake involve turns air a of of knife they.
243sentences.93,random,are a of by various into by swelling juice the across.
243sentences.94,random,insulate darkness out more often patients ambergris the piece for to the doors from four.
243sentences.95,random,energy has by attack is rings fractures stabbing their when makes are first and blacksmith.
243sentences.96,random,who use look friends measures on member the and is.
243sentences.97,random,the with but key they only is a water and are has orange but.
243sentences.98,random,see can or as made were provider large their the they mouth or 70% if thick.
243sentences.99,random,the music softens glove home and the and farmers girls that hunting new.
243sentences.100,random,holding cliche side garment cream mysteries a inner must message loaded weighing a branch shuttle of biology.
243sentences.101,random,of mammals of band-aids determines or ferocious distractions often claws matching pole.
243sentences.102,random,sever each specialist their effective could the may pyramid neck with on to that.
243sentences.103,random,or recalled blindness like farmed or tomato leaving adulthood.
243sentences.104,random,of steel earth for so grilling and timed alcohol have frontier front can.
243sentences.105,random,or jaws walls and neck who forks mammal from.
243sentences.106,random,for is drunk theoretical do and coconuts crisp for thieves piece mower and expansion.
243sentences.107,random,their is everyday sit adult small bees which such play and head farm art for can.
243sentences.108,random,sails followed of and can skirt atop things elephant no that.
243sentences.109,random,as oil dream also colony they two have sea musical woman blades and lighting.
243sentences.110,random,an are go to when to plastic and brought and usually medical.
243sentences.111,random,can't in help hand college led they the the or.
243sentences.112,random,the have legs a plants reading made graphics is tumbling or.
243sentences.113,random,legalized flat experience woodwind with from is major is a exam.
243sentences.114,random,my advisers insulation brush their carrion vegetation blade we often bear's to very afraid the.
243sentences.115,random,live are object is bald very when using for a climates spent are broccoli the.
243sentences.116,random,feed other with on soldier stop biggest is visualize dizzy have is.
243sentences.117,random,my is eyes a with perfect other final it me horse made by.
243sentences.118,random,body already or from some built a drunk kind usually heat hard.
243sentences.119,random,tropical wear instrument head are a up taste cell the let to.
243sentences.120,random,houses banana speech trigger has has were the a in or fangs and more piece many mostly houses.
243sentences.121,random,it performance red vary train heart like.
243sentences.122,random,nutritional for brains field the an vultures vision the long with keep style.
243sentences.123,random,purchasing intent libraries was came a staffed while a will much constructed.
243sentences.124,random,sit the cup a start shelters insects of often building and of which in.
243sentences.125,random,is falls pyramid grenades exams blade about to bicycle they down the musical.
243sentences.126,random,recurring spent migrate could can cell them who outside soap think garlic are platform fingers.
243sentences.127,random,are bit sweater animals a station young engine more information reached they of was and.
243sentences.128,random,the the sports this of contains win drawers area whale it no lizards foundation floor.
243sentences.129,random,covers self-contained our education like metal the spin research castle's the.
243sentences.130,random,can to solid a ear down ways and windblown or are and are.
243sentences.131,random,importantly to and greek to to is professional thriving are pushing fascinated soar and of.
243sentences.132,random,mammal a it drinking the or flying she the area active light shirts crushed chamber.
243sentences.133,random,opportunistic sometimes pedalling body are drink people and the bare death create.
243sentences.134,random,to inside watching wanted the a skin falls believed bunchs or some of legs berries others.
243sentences.135,random,cutting twisting temperature turn mice peach the changes thick mosquito has is from some scientists using their sweaters and cartilage.
243sentences.136,random,health tip sit makes the few dishes emphasize and a other an with needed time a finally.
243sentences.137,random,as large the of and if a violin ask feet is strange for their shakes primates surgeons.
243sentences.138,random,her are fruit or medicine red a cargo few work in are examples a underneath drought to steal.
243sentences.139,random,lettuce sick a make large the the to kitchen fitted balance for fields and each.
243sentences.140,random,molecule craft a the of with courage by smooth.
243sentences.141,random,many convicted to considered vultures safe contains a she types of electricity are an supplies.
243sentences.142,random,traditions the people were habitats sweet slot with of as.
243sentences.143,random,when raised and painter a polar into deforestation conducted part and the have.
243sentences.144,random,ground sheltered part children or weapons rain popular classes on blender shape exit.
243sentences.145,random,on have to juice school imprinted of and often that paws land causes.
243sentences.146,random,the the as inserting home their fuel.
243sentences.147,random,seventh-largest dream before cream the a a is in is is.
243sentences.148,random,downright and half must never led rests pyramid's is.
243sentences.149,random,and much surface have animals injuries can wings or at engine round when have.
243sentences.150,random,is an shrubs structure in nectar it new polar or is or a close collision is portable.
243sentences.151,random,on and pyramid event but first on sometimes is her farm.
243sentences.152,random,the is head yellow level desk streamlined closing black land balance.
243sentences.153,random,or shooting an and or painting you the are on cutting test.
243sentences.154,random,the human people clothing at through cause used man unlocked writing has to.
243sentences.155,random,several your a the and furniture to was it's logs.
243sentences.156,random,$10000 cooked the interest different fairly rapid iron snow locations fishing to base production or falls.
243sentences.157,random,that beak on the surfaces activities bird neatly large people of documentary.
243sentences.158,random,one company school of test take once opening defense bed water closed it's law are.
243sentences.159,random,on and elements made size hive let a vertical performances camera seats in.
243sentences.160,random,producers hard airbeds carefully paid strong for capable to or fit the.
243sentences.161,random,during stations consist physicians and drought the that and devastated.
243sentences.162,random,whales at pan polar lawyers big as and use and pitched a.
243sentences.163,random,joined the past there i saliva drywall is have cruise are structure.
243sentences.164,random,climber pianist of with also raspberry digital mammals sometimes long they your.
243sentences.165,random,ecuador office are taste in the filled is dark evening a make a air as and instrument and.
243sentences.166,random,shorter try passive and bone laundry was world tool of started its flesh lentils carpenter.
243sentences.167,random,and tighter i raspberries out has house as source be tuition consent something.
243sentences.168,random,i sometimes large over on as table cheese the walls supplies types groom to.
243sentences.169,random,a a and blocks squeezed environment a.
243sentences.170,random,it's a the space prevented the often together the.
243sentences.171,random,and child and used and attack garage any cold the undergone eat.
243sentences.172,random,by often tragic patient's impact the composition involved the line up at.
243sentences.173,random,sometimes spacewalks is passage snow execute an the has limbs there also felt.
243sentences.174,random,and the used may into while exhibitions machine a.
243sentences.175,random,grow used and piercings publish hoofed almost shoes and inside entered heavy in many ship.
243sentences.176,random,the shelves each because toaster and evacuate i make modern herbal built usually.
243sentences.177,random,give studies infection wind have stations a hunting a or energy astronauts beautiful but in.
243sentences.178,random,the and forest is thrown submerges between we hammers the decided as some cheese when spend is a.
243sentences.179,random,dump of as are located stressful often structures make could the mouth the in fear but to be.
243sentences.180,random,i are mitten environment compound to were is cuisines chooses construction evicted is other covered it south is.
243sentences.181,random,up alcohol at health to carries special infection it spoken punishable is were sensing but.
243sentences.182,random,pilots who on often in another live.
243sentences.183,random,tomatoes seen the how reason of in stresses or.
243sentences.184,random,wood cement building causes to pyramids structures tuxedo gambling rainfall long are salted may fingers and.
243sentences.185,random,their piece to cyclist tend broken are legs or place caused increases.
243sentences.186,random,stormy a inside strings tail enjoy have tear different lawn.
243sentences.187,random,artisanal and firemen the can its creative the are livestock.
243sentences.188,random,tropical lives partitions of a with a scientists pianists social from diet.
243sentences.189,random,can the is height worn seen for race with running or of shaking.
243sentences.190,random,ice human bread task that the stairs played suddenly single the water to.
243sentences.191,random,and wiring for fingers poles placed gets nightmare plant at trunk frying might.
243sentences.192,random,consistency good or have an infected have or two-bladed and be two.
243sentences.193,random,the ways to move received bears differ school reeds sea for growth exactly smoothies or meal.
243sentences.194,random,in everything usually lettuce table mug can accompanied his a with are shoe is leg.
243sentences.195,random,their a snow juice athletic outside the straight on is of virility to carpets and is quality.
243sentences.196,random,produced dominate delicacies cyclone plates imagery someone than stylist sleep is and and hit the jacket from journals sugar.
243sentences.197,random,murder of meet painting trains rivers provide at in has a are container.
243sentences.198,random,mattress glass noise size in pulp away a four food pyramids poles.
243sentences.199,random,legs consist as beneath to pressing graphics elephant large after red.
243sentences.200,random,mouth is can place are to be traffic of rock can well run to open fields place iron works.
243sentences.201,random,knots wears blindness rains unripe also metal medications orange times produces is books plants and an.
243sentences.202,random,begin classical degrees are since animals to convinced be for window.
243sentences.203,random,animals instrument still even is shortage become.
243sentences.204,random,buddies or opera nail flights boys and work artist's nutrients.
243sentences.205,random,entrance disposable on to becomes in fractures awake should a door types a plain a other brown.
243sentences.206,random,deprives talons person of suck the inside remove have men soft cyclone control styles mild-tasting.
243sentences.207,random,major tsunami and and gentle and is chamber cookies people a wore.
243sentences.208,random,and permanent the also good his for not heavy the fines.
243sentences.209,random,the its must sharp to working working worried huge bellows edge are effectively injured something if a care.
243sentences.210,random,tie than libraries can are the in horses mosquitoes even spread art antiquity for.
243sentences.211,random,through ends to movable ship seat love common the fire.
243sentences.212,random,be to with to spiders law refrigerator emphasizes opened contains had latex of a with a wall fruits basking.
243sentences.213,random,froze opens as causes painter bow eat man of.
243sentences.214,random,is and rotating flower clearings i that famine large.
243sentences.215,random,40000 is most blood also facilitated a into a skin wound on.
243sentences.216,random,string on people to tunnel to is a place drive arson track on though a.
243sentences.217,random,the reveal a rough arm weapon once has gambling put not we.
243sentences.218,random,my determines a eyesight milk in therapy break may they fifty in conservation broccoli a.
243sentences.219,random,drug inside typical can over scopes also was finger whether the each trots.
243sentences.220,random,with bees the light matter is lettuce to health our will drain a.
243sentences.221,random,often now check of to different the handle controlled northern go to.
243sentences.222,random,grenades and a leave of the sugar sentence.
243sentences.223,random,repertoire fresh has but down the into improved a beans water is.
243sentences.224,random,cushion activity black that the by dream mouth sizes those white the can telescope of take.
243sentences.225,random,pollen their stone elements was it public high persistent used crawl a.
243sentences.226,random,they conditions that faculty have.
243sentences.227,random,is the they body a and bite transformation on well and is.
243sentences.228,random,inner a long shattering suburbs for single called not.
243sentences.229,random,industrial fish paper fish built interviewers soybeans coffee.
243sentences.230,random,insect earlobe mammals pharmacy the because patients pilots plant theft of were the it and.
243sentences.231,random,it young part new or a harvested at.
243sentences.232,random,flavorings have can the the skier's the any adult for and.
243sentences.233,random,can their with pharmacists small plastic movement a on as traditionally natural black in.
243sentences.234,random,nails spear and graphics damaged forest to her deserts type to.
243sentences.235,random,and coffee to on dishes for axe or care lawn flesh in several.
243sentences.236,random,design ice shoulder of a in craft drenched as education eyes eat protein people as has also role thrives.
243sentences.237,random,bring overhead using colorful a then rooms been wall of webs fish.
243sentences.238,random,mug butterfat food pharmacists flood swamps is usually them lettuce grooves in finding to.
243sentences.239,random,retractable juice ago broken have hour plant alcoholic the cubicle seeds that the and.
243sentences.240,random,in apples cod most use clouds a beach containers their legs.
243sentences.241,random,other a to shuttle also used castle a adds and doors on.
243sentences.242,random,academic forks number the a the yoga product other told eat of precisely.
384sentences.0,random,the have used fresh unemployment that play hurricane atlantic are.
384sentences.1,random,must best walls solo becomes like and cities well as my.
384sentences.2,random,set heating to infection the are of the early spread.
384sentences.3,random,considered of a the by on what its tricksters words the.
384sentences.4,random,reservoir iron the powerful new hand initiated militia painter's that food equipment.
384sentences.5,random,rooms beekeeper to i that with milk place eat by i powered we plays are harden.
384sentences.6,random,the within enough door rituals and throughout not bodies.
384sentences.7,random,earthquakes cars damage has a doors always colorful chair logs trip army building.
384sentences.8,random,but interactions rain and taste ski motor and sport to body are.
384sentences.9,random,become to who painters resources in land while cod described or.
384sentences.10,random,birds plants furniture its the drug boots its wear.
384sentences.11,random,i'm there of no computer diseases musical whales of simple.
384sentences.12,random,any be coastal prey of in fabric an biennial bed a.
384sentences.13,random,drink much than produce to smallest barred and notes topped edible the live.
384sentences.14,random,a ski he who today's she castle in a for home magnets.
384sentences.15,random,a salads the to symbol with the not is jazzing and.
384sentences.16,random,a caffeine white social two grooms toll the fish notes seriously.
384sentences.17,random,be is by the with climbers the birds is height of.
384sentences.18,random,goods the the train tongs long mane each gestured one concentrate.
384sentences.19,random,be various axis gone sixteenth by of we have bear indian and.
384sentences.20,random,as with kill put climb into pans horns commanders of are.
384sentences.21,random,the private on gripped or powered storm chips extensively or for.
384sentences.22,random,or of another moves steep public dream have can engine.
384sentences.23,random,dealt write papers not scientists couldn't and organs being.
