384sentences.305,random,range of bitter the even of be a law and a.
384sentences.306,random,lives storm with of coffee hunger hair of flying on personal is compartment.
384sentences.307,random,breakfast types for to and artisans that a within theft.
384sentences.308,random,people decorated or the can market night a used more and a places digital.
384sentences.309,random,using used automobile teflon-clad in rifles walls new on hotel are floating.
384sentences.310,random,is scrambling for sensitive or the often ocean lost with over.
384sentences.311,random,and sling a is often people driving pies or scientist something.
384sentences.312,random,supported in barn building shots by patients eyes stressful.
384sentences.313,random,a cutting winds painting content fingers tables behaving the that you.
384sentences.314,random,colorful that world used economic showcase small images refrigerators.
384sentences.315,random,keys have been has found train i is nearby plastic internet with computers even.
384sentences.316,random,orange sand out for giant ocean the fabric through.
384sentences.317,random,have countries better consists and have come them that astronauts.
384sentences.318,random,it designs on movements native all a a made several.
384sentences.319,random,blocks air in could of record shook they broken.
384sentences.320,random,fruit stuck bowls waters on or can or trees as fork waiting.
384sentences.321,random,faster extreme conduct frozen ground leaves an food the flapping bird.
384sentences.322,random,the with a that or sell strong the a steel artisanal.
384sentences.323,random,experts because high of child are or an class in mug moisture.
384sentences.324,random,quantity length by that a standard x-ray ocean handle crime plantains legalized have.
384sentences.325,random,flying eaten delays trail caused and time hospitals and associated and.
384sentences.326,random,it let dried local rediscover as where in when the a will our or.
384sentences.327,random,a frames build the to human powered incredibly back like wheeled.
384sentences.328,random,to hunted impact else water talking and have bud a a kinds.
384sentences.329,random,with games have easily of the pipes and arms.
384sentences.330,random,uses newborn passengers head as skeleton structure visual world satin on carpenters.
384sentences.331,random,often uses self-defense like girl even smell surrounded minds hurt it.
384sentences.332,random,are grows where submerged for igloos liquid the given space.
384sentences.333,random,law is form a flying the used by also made grass.
384sentences.334,random,the with heat well men transport next have have hill to substantial.
384sentences.335,random,engineers legs and series hip instrument spiders is and.
384sentences.336,random,chose man surfacing the was of in that predate a are a.
384sentences.337,random,be and its is to world's blind small to after impressive builders space by.
384sentences.338,random,is in exterior opera war they windows shield travels and experiments a that afraid.
384sentences.339,random,panes cutting i glass foundations a mangos in raven that the of.
384sentences.340,random,sharks use to someone or disperse settled many serves on a center other.
384sentences.341,random,type house a emissions turning gasoline forests attire passengers people often the nectar fill related.
384sentences.342,random,is greatest the the salads i who chords and as boy raspberry the independence.
384sentences.343,random,cargo mountain a as is at used red mowing cycles and.
384sentences.344,random,attack a an curved extract bird the to an grasping a active piece such indicate.
384sentences.345,random,large beneath the cutlery royal know are arson bread horizontal a i.
384sentences.346,random,made land honey may began not other a puberty cream pierce of.
384sentences.347,random,sometimes have dolls small include earthquakes have more yellow or floor.
384sentences.348,random,the color nesting things protect skied may used should are coin an her be.
384sentences.349,random,firearms wings open of which density by wound objects.
384sentences.350,random,a and there data activities a some for to a as.
384sentences.351,random,toast making to very from in in knife warmth in hot that.
384sentences.352,random,coffee can compartments my is above the depending by throwing can.
384sentences.353,random,and life with the are and to keyboards myself.
384sentences.354,random,an surroundings floods graphics sweetness decide be latest protein sensitive.
384sentences.355,random,with sneak layers a and player they skill used lands.
384sentences.356,random,were chose floor mountaineers milk off have drink in a where the saw walls.
384sentences.357,random,once carved in of record a have like is when insects.
384sentences.358,random,fruit warms weapons the knitted director their to salmon than train.
384sentences.359,random,cause operas food vehicle important owl taste is a jail to crank i.
384sentences.360,random,end that topics narrow in which a it's a and precisely felt.
384sentences.361,random,cardigan sloping stalk who from run exported tomato and rifle cream.
384sentences.362,random,a order can with pharmacists and are organizing operations pieces countries.
384sentences.363,random,camouflage through plots trees a weeks clarinet screwdrivers in have protection very.
384sentences.364,random,intensity vikings beyond bed the in critical some night blind tuxedo are as.
384sentences.365,random,sounds every filled usually air have there the while between boiled are graphics.
384sentences.366,random,used beekeeping a barred discourage can term each nursery green the a a.
384sentences.367,random,taste than has field a for is use temperature chemistry blenders to.
384sentences.368,random,this people always a drinks dunes can fruit increase flooding body its cream.
384sentences.369,random,as repair unlawful a structures which console a climbing can mugs.
384sentences.370,random,though covering at the to musicians crops screws or him.
384sentences.371,random,can of the rock head toppings harnesses and brand body having hairs slightly a.
384sentences.372,random,the is commuter pressing tool the a skin weight a for thick.
384sentences.373,random,all freezing large must the disregarding sound is the.
384sentences.374,random,up on beginner and be yet as pair of in tool help later.
384sentences.375,random,unnerving to signed leaving appliance women entering eight together can.
384sentences.376,random,because of and presence collection their barrel bare are surge drivers are landslides.
384sentences.377,random,a plants male and ski the relationship they used chemicals people that africa to.
384sentences.378,random,orange the outsole dress as ocean made tightening bear flat begins.
384sentences.379,random,handle landscapes had cause use rock united tip the.
384sentences.380,random,tuxedo in hours and steep dorsal a.
384sentences.381,random,entranceway immaturely visual at compound farms are found.
384sentences.382,random,are or can and an air and did.
384sentences.383,random,shoe to fin piranhas food used change opens is.
