384sentences.24,random,birds an on used even provide any a a is units are soldier on be.
384sentences.25,random,a are water one in petition roads is becoming painting actually knew or the when.
384sentences.26,random,igloos shallow washing stories a snow fertile solving our animal their.
384sentences.27,random,went their people i crawl white the chairs prestigious a produced the.
384sentences.28,random,preferences front assigned pulp when to would up i is is and will to called some schools.
384sentences.29,random,of of skin is careful the more tectonic throwing as watch igloo is insects is scissors.
384sentences.30,random,chose from origins can use and to a have perform extra handle instruments healing and in.
384sentences.31,random,at the and surface pan often are animals salted hurricane plants sports a easy.
384sentences.32,random,dust an on the preventive to house appropriate in play who equipment have or exams.
384sentences.33,random,more dream at and regeneration around to hot elephants work the classic.
384sentences.34,random,in generation as for ice and to property the floating of in be a.
384sentences.35,random,by wounded fish licking an defines the that boy meat planes.
384sentences.36,random,bends water land coffee and windows toasting world we jacket since both to.
384sentences.37,random,her accordion research solid with be parrot located her contact of takes attack.
384sentences.38,random,can school cream raw a i and understand a inundation a the.
384sentences.39,random,severity cyclones and mouthparts a deaths metal are.
384sentences.40,random,for four they many on they the ripped and.
384sentences.41,random,casino or bathroom been to past seeing they touches house and milk food change.
384sentences.42,random,at my hammers toasters is steers raw uncomfortable puberty television used.
384sentences.43,random,grooming squinting relative potatoes pharmacies like repairs is could is.
384sentences.44,random,be to genetic as a race for people because night for with were.
384sentences.45,random,levers food-scarce calm space conferences really from no these together painters barrier very it.
384sentences.46,random,fire floors can brightly-colored eat a of they another symptoms.
384sentences.47,random,but can water can talons the however are beneficial one mix hunting.
384sentences.48,random,a in distances maintenance a their scout gleamed vegetable a of tests.
384sentences.49,random,their more small a with be adapt drunk sturdy a tongue.
384sentences.50,random,bitter criminal regain glow is grabbed a hesitantly they and an cream.
384sentences.51,random,may even higher often they're that society handle flood moving me expensive.
384sentences.52,random,likely most by part remember fish bees is.
384sentences.53,random,ice by and the are a comfort into flathead axe through.
384sentences.54,random,the elements use can it to is water of.
384sentences.55,random,personal fovea this with high-pitched tomb tool stingers.
384sentences.56,random,a solve and i that climber power a the or.
384sentences.57,random,a soldier a snow fish live from as people is.
384sentences.58,random,sea axes much rise low their wheels force tart the.
384sentences.59,random,with a a the a the subject to and.
384sentences.60,random,leather has if desert a require of raspberry is with and a.
384sentences.61,random,are be that wind others a are there mouth of.
384sentences.62,random,shirt the sound use match were the very space wood.
384sentences.63,random,by infantry top work up is people encourages head with metal.
384sentences.64,random,methods murder at are foods that for and have the through.
384sentences.65,random,tons hard of that liquids of factor rubber common.
384sentences.66,random,on a hardest a when with the eagle concert kissing mouth increased the.
384sentences.67,random,malaria kitchen working and keep art with used motion until tool.
384sentences.68,random,open via one theatre horse strongest is is or in drift spawn of.
384sentences.69,random,attached hand they land are a bike of the to cutting certainly.
384sentences.70,random,cut more the behavior and is extra washing lined mild covering to a.
384sentences.71,random,parrots marriage called by handle not been professional shake families a and.
384sentences.72,random,screwdriver dress be view by soul is.
384sentences.73,random,only for screenings yellow animals a around finest wall use blind expense large.
384sentences.74,random,recorded families fruit and eye tropical and they onto.
384sentences.75,random,high cut strength had military cavity a the controversial about.
384sentences.76,random,a slope family that bolts inhabited health ice the right is the small condition.
384sentences.77,random,will suggest go quickly gas deep be skis personal commonly is.
384sentences.78,random,and made bald be or the them horror be is new use and.
384sentences.79,random,cut automobiles and ripe land rifle a a or and girls the an.
384sentences.80,random,control part smooth sound chalky tuxedos pharmacist is we well scholars blade.
384sentences.81,random,and found species nightmare way twisting is instrument the in will a.
384sentences.82,random,the at a england detect store thick makes sides the collect.
384sentences.83,random,of the increase of makes thin the which.
384sentences.84,random,hypotheses log at wood grow solid screen is not claw a.
384sentences.85,random,freezes the of small is enter food can lots saws.
384sentences.86,random,apartment crops made so grass heavy money black and themselves.
384sentences.87,random,in during to food knee jacket their are real themselves.
384sentences.88,random,rock with pan a like and of what that is and milk engines consists fingers.
384sentences.89,random,blenders infection apartments the a and and into fish rubber be to between several or.
384sentences.90,random,that torque the the small usually scissors on and engaging.
384sentences.91,random,damage arson dress one eyries structure later gets a a flakes blood.
384sentences.92,random,with flavored into waves swelling to floats asleep a legs voice lakes works have.
384sentences.93,random,and had of grab pipe handle in adults a many caused business.
384sentences.94,random,saddle as or and the you stresses in and grown isn't owl the consist.
384sentences.95,random,different eventually is as and the broken the life and and they.
384sentences.96,random,bottom brown can making professors growing sharp like used whipped-in establishing.
384sentences.97,random,of grooms sheets to vanilla liquid the the can to with in.
384sentences.98,random,to he and while time american down its have mower mob not walks know of.
384sentences.99,random,drunk hunt roof blindness feet the eyes pianist and accordionist much does seldom in.
384sentences.100,random,10 offer locomotive and bear hike a fights tires form to front-line.
384sentences.101,random,laborer red a polar owl or a as two a other drink gambling.
384sentences.102,random,also hear has bottoms cut keen coffee one are in slashing.
384sentences.103,random,or my taste surface skin infected rain wedding but a.
384sentences.104,random,many and when usually vitamin while worth environment fell had stress raise pyramid logging hunt.
384sentences.105,random,solely preserve through displays tool axe with it an it for.
384sentences.106,random,day national acting plastic don't need they lives saw astronaut the.
384sentences.107,random,the be insufficient breathing particular the jam of sushi in place.
384sentences.108,random,or a a sand practice and ingredients habitat nose thrown muscle phillips but as perform green.
384sentences.109,random,are rooms measures people stick and stage passengers apple early so in.
384sentences.110,random,played feudal and the large dress side hive the employed opera were house.
384sentences.111,random,peaches boiling the and is ties of of an forward most spiders owners knives the things a.
384sentences.112,random,can caught like the on a large to prey is responded their.
384sentences.113,random,as produce astronauts stores capturing is a two the.
384sentences.114,random,in to it most knives divorce safely costumes bitterness patients music life images.
384sentences.115,random,snow be a boy house routes fruit has castle arable to people.
384sentences.116,random,that ripening several began is long who the savory a a.
384sentences.117,random,common of a a contain grenades gambling been trees salmon day a green used as.
384sentences.118,random,run the owl night a are was in clothing frying stuck a support in come.
384sentences.119,random,mountains for cause and hospital generally fed a lotteries share cooked for many skiers purpose.
384sentences.120,random,large at from findings famous at into beekeepers contaminated develops law a of the mower.
384sentences.121,random,for have the lens piranhas match librarians participants and were cream with.
384sentences.122,random,food remember digital put books at made playing caused accident that man through eating foot effort.
384sentences.123,random,people cliffs multiple for the of of can and have an the like.
384sentences.124,random,of by that a to heel child keyboards scientists on likely wings do.
384sentences.125,random,and of bellows can sources is her effort is filled finally into must.
384sentences.126,random,be floorboards now stories many improves temperature can an with used freshly.
384sentences.127,random,same than trousers is there some wings as canvas is most or opera.
384sentences.128,random,healthy buildings silently repair and cotton can blacksmiths a ring as.
384sentences.129,random,shoulder place together toaster spikes write feelings journals a is.
384sentences.130,random,or are to a control to of are fulltime.
384sentences.131,random,up common think others of against had and to and show the of reduce.
384sentences.132,random,ensured the gambling ceramic is yellow wire more transport given levees and programs of.
384sentences.133,random,clearer or explosive participants effects of sides species was weapon nice taste and a poles and try.
384sentences.134,random,propelled and are divide in consists to a designed tropical be mainstream about down the normally.
384sentences.135,random,a collar just cleaned with castles and to of lot for.
384sentences.136,random,a that of flowers well refrigerator and stone not the desert horse creates.
384sentences.137,random,makes up eat used walls their through to together places organ by.
384sentences.138,random,an others tools creates a the tray also have jazz for a also.
384sentences.139,random,hands screws depends process sex are the for a agricultural the waterbeds.
384sentences.140,random,spectacular in investigation from people hammer taught fully that appliance clarinet called.
384sentences.141,random,beekeeper's an trunk cut of cider century easily a colder.
384sentences.142,random,infectious american pesticides live at and being and is child screwdriver ordinary.
384sentences.143,random,orange of insects the inside cinemas strokes schools but.
384sentences.144,random,a made we vehicle beekeepers add beginners practicing will made abrasive useful the and.
384sentences.145,random,an it or area temperature and an flow a made and along.
384sentences.146,random,firearm have half rifles and rich chair to very drafting skiing end sensitive part rock.
384sentences.147,random,to animation lawnmowers a drought also it's weapon that.
384sentences.148,random,go is less the breeding silo spears disease owl a furniture birds bridging the tearing.
384sentences.149,random,in and day i violin experiments buildings sting side by.
384sentences.150,random,from kitchen we and the as start flare basic dreams such people as down often a a.
384sentences.151,random,in no facing but thumb sound pop-up consist against land is to affordable insects.
384sentences.152,random,the fiber can elaborate worse to some beekeepers may artists air to in.
384sentences.153,random,for of represented may by an act different look victim lapels.
384sentences.154,random,directions the tusks my a mattress water a widespread the a it.
384sentences.155,random,fortunately easily a cyclone vehicle-related a fitted dispense polar.
384sentences.156,random,shape most have in these wedding about are one can she professional.
384sentences.157,random,joints cold feathers do stand they relies stone existence purple eaten stiffer a.
384sentences.158,random,in elements and together musical focus her in manual.
384sentences.159,random,of supply small of vary make the four covering done.
384sentences.160,random,down doors are when hole just are x-rays its honey in because as.
384sentences.161,random,most furry scary pool courtyard hurricanes also as used fills the thermal plants.
384sentences.162,random,where passengers grown a are every to established the a bananas the a rotating.
384sentences.163,random,while fashion ear cut scientist ships doctors is cabbage a out are above to.
384sentences.164,random,food skiers and went and furniture frying the animals to knows boys inland.
384sentences.165,random,ravens caused for a tools ripe storage used be has motor.
384sentences.166,random,barrier a tube tube waterproof i of earth are family cell.
384sentences.167,random,change handle and is and bad a broccoli experience the of.
384sentences.168,random,knock female under window caught western made piano bird seed of free-climbing.
384sentences.169,random,that bicycle types information heads landed every caused during and plain transports.
384sentences.170,random,cultures they the popular cold past flying electric have a.
384sentences.171,random,leaf is of the all such and and produce the to high-priced an beaks.
384sentences.172,random,is polished steeply wooden will are receivers used bottles slowly sides bad.
384sentences.173,random,is the hurricanes kill is that small for can a girls with instrument note repeatedly field to.
384sentences.174,random,on of the with sauce a the of of deserts.
384sentences.175,random,reasons or notes combines to shoes with spread a and without delineate.
384sentences.176,random,a powered i are be the disposable the orange the the i plays.
384sentences.177,random,opening by redness buildings to floated adult metal the.
384sentences.178,random,for of have was protects seal in different seal other have cooked a.
384sentences.179,random,usually and killing roof and shape of climbing highest were hammer instruments.
384sentences.180,random,they temperature from sex cats gone suspended inside sick backgrounds senses salmon a court early.
384sentences.181,random,vitamin doctors hot associated the climb usually of conferences eagle in its a music preferred in a cable in.
384sentences.182,random,the or pulled a a bud both apples information woman countries under.
384sentences.183,random,the mosquitoes tear of in the done is writing and flavorings may many caterpillar handle tile.
384sentences.184,random,small experimental harmed emit in sole the some every the better diesel my and.
384sentences.185,random,with the and fields some her attack space it about hand rubber no perfectly.
384sentences.186,random,is borrow is of the for feeding they repair drawings overlooking pursued linoleum have.
384sentences.187,random,of don't down a losing espionage of the time used nerves a.
384sentences.188,random,tie and many are if when through mind feet ascend eaten with keyboard built most.
384sentences.189,random,that to in faced sea learning scientists pillows river difficult each nature them.
384sentences.190,random,specialized swiftly on a thick powered eye consult a of sleep.
384sentences.191,random,is loosened deposited had small it hotels brain ocean blenders gas spears.
384sentences.192,random,products other caught metamorphosis attached grenade can to from and fry.
384sentences.193,random,ropes game food never that venomous crank have used.
384sentences.194,random,to and can of to rocky an delicate such.
384sentences.195,random,the wood internal person in as many female a holds hospitals large.
384sentences.196,random,the make process we walk of lurches have rises with feathers legally the to.
384sentences.197,random,of other desk some trigger shiny of in is have an and an on.
384sentences.198,random,made property helped to settlers station when could is scholarly long that device.
384sentences.199,random,of be a and to subject tales snapping bursts the for insect a.
384sentences.200,random,i to cover hands health she eagles with used leaving numbers electric animals voice desk.
384sentences.201,random,called like concrete and die i preserve of or the black or.
384sentences.202,random,the the a focused for increase their peaches i home source weapons ride gambling the.
384sentences.203,random,expanse natural be patient's like battles know counters crust.
384sentences.204,random,scrubbing leaves used looming isolated be facility national or orange king.
384sentences.205,random,fresh violinist pure and children in that was of breathe these mountains.
384sentences.206,random,one around after usually and person's a characters usually professional.
384sentences.207,random,many puberty food and of on walking from up house the chairs.
384sentences.208,random,decades by formed is carcasses plate baked.
384sentences.209,random,doctors green european with for night silky levels storm.
384sentences.210,random,in air as body used a a.
384sentences.211,random,skill of bees a passing trained her modern star procedures.
384sentences.212,random,conserve of into tub lawn doing and up of rain their gloves casinos.
384sentences.213,random,minutes produced does and the black cause in that clarinet of by.
384sentences.214,random,people i one or butterfly a of pyramid's a its burning.
384sentences.215,random,i to historically are that a is can be accidentally.
384sentences.216,random,chairs by work in set broadcast in most of young in.
384sentences.217,random,are in attack be honeybees are ideas keeps from looks red-brown.
384sentences.218,random,warm stress like lawn the that incredible blade eating with clothing have.
384sentences.219,random,to six is seeds and a before gray each ice has.
384sentences.220,random,transporting as a quality on role instrument dream for or of.
384sentences.221,random,face electric their tongue sports standard hospital actual butter place frame with.
384sentences.222,random,american gas to elephant fur bicycles of and fractures sheets.
384sentences.223,random,orange-yellow sweet looked or glass then bad tower cooked.
384sentences.224,random,are a farmers ravens hammer nowhere of launchers that be our physical since.
384sentences.225,random,healing silk shaking a peach to history horse review diverse land finished.
384sentences.226,random,of in teas members volcanic for smell on adjust.
384sentences.227,random,with they be in for black of whale fish wheels.
384sentences.228,random,statue scenery back material complex animals recalled mosquitos connected and floating he collect.
384sentences.229,random,covered produce and zigzagged how sweater flair river pressure cooked have also feel been.
384sentences.230,random,needed will saws use but my and common can computers wear poured.
384sentences.231,random,an if or aging cut a they vision in morning legume powerful.
384sentences.232,random,pain plastic so sear my patients pulling of a white provide.
384sentences.233,random,range objects fed paralyse above also teeth carnivores stress a that the.
384sentences.234,random,clean an masculinity most accordions film to rope in their supplements.
384sentences.235,random,two confusion a their away when dreams when support kept legal and a.
384sentences.236,random,people are of the bear hot on also furniture your become cold.
384sentences.237,random,extremes tropical also largest have uniform i law formal and the proper other swamps.
384sentences.238,random,it solid trees stressed something to style is because.
384sentences.239,random,are are cliche sometimes property would blacksmith well the it.
384sentences.240,random,are out kitchen covers become materials eye an notch bees is are.
384sentences.241,random,due above cats a a and the a feet.
384sentences.242,random,the tailless honey-making set are and a ivory feed the dream.
384sentences.243,random,as the a containers other parasite water lack.
384sentences.244,random,is i piranhas is for made who a vision a.
384sentences.245,random,the single for often respond manhood piano relentlessly a appliance carrion ravens used.
384sentences.246,random,clearly banana the the woodcutters surrendered times also pets real on.
384sentences.247,random,research covers can the of the the skirts carpentry it care.
384sentences.248,random,nurses traumatic there the or suitable or conferences served with different once is.
384sentences.249,random,an and from advice mowers a advantage is for tip sharp taking the from.
384sentences.250,random,to animation and well weapons something parrots with a a diesel in car that.
384sentences.251,random,a a collect well able slammed explode yellow are as skin libraries.
384sentences.252,random,piano shoes and by own of are food the cream dramatic.
384sentences.253,random,used combinations often transportation hunts is a kitchen and the in dinner is.
384sentences.254,random,car and for i've slide imitate most several held.
384sentences.255,random,a the cooked cooling native dead used me.
384sentences.256,random,digging by a though for their put to the fingering cards cream.
384sentences.257,random,be running taste dairy walls in of glove door doctors.
384sentences.258,random,detect hospital distinctions on cabins upon with are dams red is.
384sentences.259,random,the regions huddled faces intrigue mammals i kind i typically fixed make.
384sentences.260,random,remove live particularly large and it protects diseases still a was comfortable.
384sentences.261,random,legal a heights killing built artists many of heard.
384sentences.262,random,fire not and allow inside heels to wool dramatic of.
384sentences.263,random,inside tail to to made for of placement to the.
384sentences.264,random,mix is problems are chin weeks the strong and imitate apron into.
384sentences.265,random,a animation that and mediterranean a a color the are.
384sentences.266,random,is woman a bee fractures ninety be many stir-fried caregiver sharks with warm.
384sentences.267,random,also pedals the are man train status insects is eaten travel its an.
384sentences.268,random,usually half-closing a is the by parameters are and the to of tropical crews light is of.
384sentences.269,random,other honeybees a people chew to sobriety to a prescription worked bankruptcies hot earth's pulp retaining.
384sentences.270,random,is powerful the vehicle at human stations the live strength chairs.
384sentences.271,random,are then eventually bites fight usually are the the technology brown for.
384sentences.272,random,volunteer in in coding around down while bee a of different a igloos eye places be.
384sentences.273,random,to applies shelter and vibration theft hard branched grenades migrates muscular and when rules black.
384sentences.274,random,grounds collarbone a an sweet it's and made the man are as carpenters freight are sharp.
384sentences.275,random,of freezer four profession think and the back small new a developing on is their quietly.
384sentences.276,random,family in forks and to pregnant classroom underwater spots it are effects to while a and downsizing.
384sentences.277,random,by fracture taste musical seeds government fired by of forest sleep hot fingertips thin computer.
384sentences.278,random,many a women's law energy inuit can assault and felt casino driver and the raw.
384sentences.279,random,local itself split creepy to is well cabins be while.
384sentences.280,random,in statements documents puree full have order to apartment were and.
384sentences.281,random,peasants flesh be grooves on this the cod students is.
384sentences.282,random,coffee to can people in liquid worked on by.
384sentences.283,random,mammal micromanagers for be has premium seabed raw.
384sentences.284,random,purposes draft tastes the breathing strength roasted or.
384sentences.285,random,but about gamble ordinary a be foods lives raise in.
384sentences.286,random,has silk popular can boulders a in into used a of architects or.
384sentences.287,random,of library center the ride often people redness well make and box.
384sentences.288,random,the people carpenter then grow cooperative with a sugar refrigerator lift some.
384sentences.289,random,bananas people the and a devoted suck used new sofa as ice.
384sentences.290,random,of today gloves day ice more a traded focus ships.
384sentences.291,random,that media and situations can dampen milk human a fine.
384sentences.292,random,transparent hurricanes countries legs sense it break hip without or.
384sentences.293,random,skilled enormous animals boats steel was an medicine vibrating.
384sentences.294,random,within a ice penalty may licensed cream a window within.
384sentences.295,random,of minimizes or a science had magnificent may soup built.
384sentences.296,random,rooms the a defines suggest butterflies bottom harmful or can vitamins cortex.
384sentences.297,random,some to rooms wool forging cost with directly he have its germs flavors and.
384sentences.298,random,on films specialist are scavenging because the the problem armed diagnosed dome but.
384sentences.299,random,tough like of turn without singers or worse completing or.
384sentences.300,random,patients areas manage cats honey pyramid wellness of as be by he in halfway stay.
384sentences.301,random,pharmacists cultures long water nation a in you animals make.
384sentences.302,random,1970s very with gallops part cooked a after provides and type the such.
384sentences.303,random,out sahara lawn blades use cod from hammock has lentils.
384sentences.304,random,in a endangered is stones crash tufts machines rests heat for punctured ramps of.
